[
    {
        "doc1_Currency": "JPY",
        "doc1_Items": [
            {
                "_source": "14FEB\n13FEB\nIFS PAYMENT - THANK YOU\n30,361.52CR",
                "Date": "14FEB"
            },
            {
                "_source": "28JAN",
                "Date": "28JAN"
            },
            {
                "_source": "31JAN\n30JAN\nPAYPAL *ORANGEMONKI\n4029357733\nHK\n1,791.14",
                "Date": "1931-01-30T00:00:00.000Z",
                "Description": "PAYPAL *ORANGEMONKI",
                "TotalPrice": 1791.14
            },
            {
                "_source": "31JAN\n30JAN\nAPPLE. COM/BILL\n85221120099\nIE\n398.00",
                "Date": "1931-01-30T00:00:00.000Z",
                "Description": "APPLE. COM/BILL",
                "TotalPrice": 398
            },
            {
                "_source": "408.00",
                "TotalPrice": 408
            },
            {
                "_source": "31JAN\n30JAN\nAdobe . com\nDublin\nIE",
                "Category": "Credit",
                "Date": "1931-01-30T00:00:00.000Z",
                "Description": "Adobe . com"
            },
            {
                "_source": "31JAN\n30JAN\nDATYLON\nANTWERPEN\nBE\nUSD\n19.95\n158.54\n*EXCHANGE RATE: 7.94687",
                "Category": "Credit",
                "Date": "1931-01-30T00:00:00.000Z",
                "Description": "DATYLON",
                "TotalPrice": 158.54
            },
            {
                "_source": "04FEB\n01FEB\nSTACK* ZEROSSL\nWIEN\nAT\nUSD\n10.00\n79.50\n*EXCHANGE RATE: 7.95000",
                "Category": "Other",
                "Date": "2004-02-01T00:00:00.000Z",
                "Description": "STACK* ZEROSSL",
                "TotalPrice": 79.5
            },
            {
                "_source": "04FEB\n30JAN\nMPJ MOBILE APPS THE DA\nQuarry Bay\nHK\n680.41",
                "Category": "Credit",
                "Date": "1930-02-04T00:00:00.000Z",
                "Description": "MPJ MOBILE APPS",
                "TotalPrice": 680.41
            },
            {
                "_source": "04FEB\n01FEB\nAPPLE. COM/BILL\nITUNES . COM\nIE\n78.00",
                "Category": "Other",
                "Date": "2004-02-01T00:00:00.000Z",
                "Description": "APPLE. COM/BILL",
                "TotalPrice": 78
            },
            {
                "_source": "04FEB\n01FEB\nOPEN SOURCE COLLECTIVE\nWALNUT\nUS\nUSD\n5.00\n39.76\n*EXCHANGE RATE: 7.95200",
                "Category": "Other",
                "Date": "2004-02-01T00:00:00.000Z",
                "Description": "OPEN SOURCE"
            },
            {
                "_source": "04FEB\n02FEB\nPOSTABLE . COM\nNEW YORK CITY\nUS\nUSD\n4.57\n36.33\n* EXCHANGE RATE: 7.94967",
                "Date": "2004-02-02T00:00:00.000Z",
                "Description": "POSTABLE . COM",
                "TotalPrice": 36.33
            },
            {
                "_source": "04FEB\n01FEB\nMAILGUN TECHNOLOGIES,\nSAN ANTONIO\nUS\nUSD\n2.78\n22.10\n*EXCHANGE RATE: 7.94964",
                "Date": "2004-02-01T00:00:00.000Z",
                "Description": "MAILGUN TECHNOLOGIES,",
                "TotalPrice": 22.1
            },
            {
                "_source": "04FEB\n01FEB\nPAYPAL *PATREON\nMEMBE\n4029357733\nUS\n16.25",
                "Category": "Meals",
                "Date": "04FEB",
                "Description": "PAYPAL *PATREON\nMEMBE",
                "TotalPrice": 16.25
            },
            {
                "_source": "04FEB\n03FEB\nNRI*NEW RELIC\n888-643-8776\nUS\nUSD\n251.75\n2,001.24\n* EXCHANGE RATE: 7.94931",
                "Category": "Credit",
                "Date": "04FEB",
                "Description": "NRI*NEW RELIC"
            },
            {
                "_source": "04FEB\n03FEB\nMPJ MOBILE APPS THE DA\nQuarry Bay\nHK\n865.70",
                "Description": "MPJ MOBILE APPS"
            },
            {
                "_source": "04FEB\n02FEB\nPAYPAL *1800FLOWERS\n4029357733\nUS\n1,282.61",
                "Date": "04FEB",
                "Description": "PAYPAL *1800FLOWERS"
            },
            {
                "_source": "04FEB\n01FEB\nAPPLE. COM/BILL\nITUNES . COM\nIE\n101.00",
                "Category": "Credit",
                "Date": "2004-02-01T00:00:00.000Z",
                "Description": "APPLE. COM/BILL",
                "TotalPrice": 101
            }
        ],
        "doc1_MerchantAddress": {
            "_source": "PO BOX\nNO. 73730, KOWLOON CENTRAL POST OFFICE HK.",
            "poBox": "PO BOX\nNO. 73730",
            "streetAddress": "PO BOX\nNO. 73730",
            "house": "KOWLOON CENTRAL POST OFFICE HK."
        },
        "doc1_MerchantAliases": [
            "HSBC.",
            "The Hongkong and Shanghai Limited",
            "HSBC\n滙豐"
        ],
        "doc1_MerchantName": "香港上海滙豐銀行有限公司",
        "doc1_MerchantPhoneNumber": "+8185227488288",
        "doc2_Currency": "USD",
        "doc2_Items": [
            {
                "_source": "04FEB\n03FEB\nAmazon web services\naws. amazon. co\nUS\nUSD\n162.61\n1,292.63\n*EXCHANGE RATE: 7.94927",
                "Category": "Credit",
                "Date": "04FEB",
                "Description": "Amazon web services\naws."
            },
            {
                "_source": "04FEB\n02FEB\nPAYPAL *CARDLY CARDLY\n4029357733\nHK\n110.86",
                "Category": "Credit",
                "Date": "2002-02-04T00:00:00.000Z",
                "Description": "PAYPAL *CARDLY CARDLY",
                "TotalPrice": 110.86
            },
            {
                "_source": "04FEB\n02FEB\nBLS*REDIS LABS\n14085242916\nIL\nUSD\n248.00\n1,971.72\n* EXCHANGE RATE: 7.95048",
                "Category": "Meals",
                "Date": "04FEB",
                "Description": "BLS*REDIS LABS"
            },
            {
                "_source": "04FEB\n01FEB\nLINODE\n8554546633\nUS\nUSD\n387.29\n3,080.08\n*EXCHANGE RATE: 7.95290",
                "Category": "Meals",
                "Date": "04FEB",
                "Description": "LINODE"
            },
            {
                "_source": "04FEB\n02FEB\nBROWSERSTACK. COM\nLEWES\nUS\nUSD\n19.00\n151.06\n*EXCHANGE RATE: 7.95053",
                "Category": "Meals",
                "Date": "04FEB",
                "Description": "BROWSERSTACK. COM",
                "TotalPrice": 151.06
            },
            {
                "_source": "04FEB\n01FEB\nCLOUDFLARE\nSAN FRANCISCO\nUS\nUSD\n67.55\n537.22\n*EXCHANGE RATE: 7.95292",
                "Category": "Credit",
                "Date": "04FEB",
                "Description": "CLOUDFLARE"
            },
            {
                "_source": "05FEB\n04FEB\nAPPLE. COM/BILL\nITUNES . COM\nIE\n25.00",
                "Category": "Credit",
                "Date": "05FEB",
                "Description": "APPLE. COM/BILL",
                "TotalPrice": 25
            },
            {
                "_source": "05FEB\n04FEB\nHUTCHISON TELECOM 3CC\nHONG KONG\nHK\n136.00",
                "Category": "Credit",
                "Description": "HUTCHISON TELECOM",
                "TotalPrice": 136
            },
            {
                "_source": "05FEB\n04FEB\nPAYPAL *FONTAWESOME\n4029357733\nUS\n804.02",
                "Category": "Credit",
                "Date": "05FEB",
                "Description": "PAYPAL *FONTAWESOME",
                "TotalPrice": 804.02
            },
            {
                "_source": "05FEB\n04FEB\nLINODE\n8554546633\nUS\nUSD\n132.08\n1,050.04\n*EXCHANGE RATE: 7.95003",
                "Date": "05FEB",
                "Description": "LINODE",
                "TotalPrice": 1050.04
            },
            {
                "_source": "07FEB\n06FEB\nLINODE\n8554546633\nUS\nUSD\n501.53\n3,985.46\n*EXCHANGE RATE: 7.94660",
                "Date": "07FEB",
                "Description": "LINODE"
            },
            {
                "_source": "07FEB\n05FEB\nMPJ MOBILE APPS THE DA\nQuarry Bay\nHK\n522.83",
                "Category": "Tax",
                "Date": "07FEB",
                "Description": "MPJ MOBILE APPS THE DA"
            },
            {
                "_source": "08FEB\n07FEB\nPAYPAL *OREILLYMEDI\n4029357733\nUS\n316.61",
                "Description": "PAYPAL *OREILLYMEDI",
                "TotalPrice": 316.61
            },
            {
                "_source": "08FEB\n07FEB\nPAYPAL *PADDLE. COM\n35314369001\nGB\n779.00",
                "Description": "PAYPAL *PADDLE. COM",
                "TotalPrice": 779
            },
            {
                "_source": "09FEB\n08FEB\nMPJ MOBILE APPS THE DA\nQuarry Bay\nHK\n284.46",
                "Category": "Credit",
                "Date": "09FEB",
                "Description": "MPJ MOBILE APPS THE",
                "TotalPrice": 284.46
            },
            {
                "_source": "09FEB\n08FEB\nDROPBOX*62DS3FXCBFS5\nD02FD79\nIE\nUSD\n199.00\n1,581.42\n*EXCHANGE RATE: 7.94683",
                "Category": "Room",
                "Date": "09FEB",
                "Description": "DROPBOX*62DS3FXCBFS5",
                "TotalPrice": 1581.42
            },
            {
                "_source": "09FEB\n08FEB\nSMARTONE AUTOPAY\nKWUN TONG\nHK\n220.00",
                "Category": "Meals",
                "Date": "2008-02-09T00:00:00.000Z",
                "Description": "SMARTONE AUTOPAY",
                "TotalPrice": 220
            },
            {
                "_source": "09FEB\n08FEB\nMPJ MOBILE APPS THE DA\nQuarry Bay\nHK\n278.00",
                "Date": "09FEB",
                "Description": "MPJ MOBILE APPS",
                "TotalPrice": 278
            },
            {
                "_source": "09FEB\n08FEB\nAPPLE. COM/BILL\nITUNES . COM\nIE\n436.00",
                "Date": "09FEB",
                "Description": "APPLE. COM/BILL",
                "TotalPrice": 436
            },
            {
                "_source": "10FEB\n09FEB\nLINODE\n8554546633\nUS\nUSD\n501.53\n3,986.64\n*EXCHANGE RATE: 7.94896",
                "Date": "10FEB",
                "Description": "LINODE"
            },
            {
                "_source": "11FEB\n10FEB\nJetBrains\nPrague\nCZ\nUSD\n71.00\n564.37\n*EXCHANGE RATE: 7.94887",
                "Category": "Meals",
                "Date": "11FEB",
                "Description": "JetBrains"
            },
            {
                "_source": "11FEB\n09FEB\nMPJ MOBILE APPS THE DA\nQuarry Bay\nHK\n211.50",
                "Date": "11FEB",
                "Description": "MPJ MOBILE APPS",
                "TotalPrice": 211.5
            },
            {
                "_source": "12FEB\n11FEB\nAPPLE. COM/BILL\nITUNES. COM\nIE\n78.00",
                "Category": "Meals",
                "Date": "12FEB",
                "Description": "APPLE. COM/BILL",
                "TotalPrice": 78
            },
            {
                "_source": "14FEB\n12FEB\nPAYPAL *TIDAL HIFI\n35314369001\nSE\n96.00",
                "Category": "Credit",
                "Description": "PAYPAL *TIDAL HIFI",
                "TotalPrice": 96
            },
            {
                "_source": "14FEB\n11FEB\n7-Eleven, HK (0824)\nMA ON SHAN\nHK\n2,043.00",
                "Category": "Meals",
                "Date": "14FEB",
                "Description": "7-Eleven, HK (0824)",
                "TotalPrice": 2043
            },
            {
                "_source": "14FEB\n11FEB\n7-Eleven, HK (0434)\nMA ON SHAN\nHK\n1,474.00",
                "Category": "Meals",
                "Date": "14FEB",
                "Description": "7-Eleven, HK (0434)",
                "TotalPrice": 1474
            },
            {
                "_source": "14FEB\n12FEB\nLINODE\n8554546633\nUS\nUSD\n501.53\n3,990.65\n*EXCHANGE RATE : 7.95695",
                "Date": "14FEB",
                "Description": "LINODE",
                "TotalPrice": 3990.65
            },
            {
                "_source": "14FEB\n12FEB\nMPJ MOBILE APPS THE DA\nQuarry Bay\nHK\n444.63",
                "Date": "14FEB",
                "Description": "MPJ MOBILE APPS THE",
                "TotalPrice": 444.63
            },
            {
                "_source": "15FEB\n14FEB\nMPJ MOBILE APPS THE DA\nQuarry Bay\nHK\n266.90",
                "Date": "15FEB",
                "Description": "MPJ MOBILE APPS THE",
                "TotalPrice": 266.9
            },
            {
                "_source": "16FEB\n15FEB\nMPJ MOBILE APPS THE DA\nQuarry Bay\nHK\n406.64",
                "Date": "16FEB",
                "Description": "MPJ MOBILE APPS THE",
                "TotalPrice": 406.64
            },
            {
                "_source": "16FEB\n15FEB\nLINODE\n8554546633\nUS\nUSD\n508.90\n4,049.03\n*EXCHANGE RATE: 7.95644",
                "Category": "Room",
                "Description": "LINODE"
            },
            {
                "_source": "16FEB\n14FEB\nMPJ MOBILE APPS THE DA\nQuarry Bay\nHK\n304.17",
                "Category": "Other",
                "Date": "16FEB",
                "Description": "MPJ MOBILE APPS THE",
                "TotalPrice": 304.17
            },
            {
                "_source": "17FEB\n16FEB\nAPPLE. COM/BILL\nITUNES . COM\nIE\n101.00",
                "Date": "17FEB",
                "Description": "APPLE. COM/BILL",
                "TotalPrice": 101
            },
            {
                "_source": "17FEB\n16FEB\nDR. IP CHI MAN DENTAL\nN.T.\nHK\n2,860.00",
                "Category": "Room",
                "Date": "2016-02-17T00:00:00.000Z",
                "Description": "DR. IP CHI MAN DENTAL\nN.T.",
                "TotalPrice": 2860
            },
            {
                "_source": "18FEB\n16FEB\nMPJ MOBILE APPS THE DA\nQuarry Bay\nHK\n102.87",
                "Category": "Meals",
                "Date": "18FEB",
                "Description": "MPJ MOBILE APPS THE",
                "TotalPrice": 102.87
            },
            {
                "_source": "18FEB\n17FEB\nMPJ MOBILE APPS THE DA\nQuarry Bay\nHK\n83.26",
                "Category": "Tax",
                "Date": "18FEB",
                "Description": "MPJ MOBILE APPS THE",
                "TotalPrice": 83.26
            },
            {
                "_source": "18FEB\n17FEB\nLINODE\n8554546633\nUS\nUSD\n501.59\n3,990.10\n*EXCHANGE RATE: 7.95490",
                "Date": "18FEB",
                "Description": "LINODE",
                "TotalPrice": 3990.1
            },
            {
                "_source": "18FEB\n17FEB\nPAYPAL *OUTPUT\n4029357733\nUS\n81.27",
                "Category": "Credit",
                "Date": "18FEB",
                "Description": "PAYPAL *OUTPUT",
                "TotalPrice": 81.27
            },
            {
                "_source": "18FEB\n17FEB\nIFTTT PRO (LEGACY)\nSAN FRANCISCO\nUS\nUSD\n1.99\n15.83\n*EXCHANGE RATE: 7.95477",
                "Category": "Other",
                "Date": "18FEB",
                "Description": "IFTTT PRO (LEGACY)",
                "TotalPrice": 15.83
            },
            {
                "_source": "18FEB\n18FEB\nCITY SUPER LIMITED\nTSIM SHA TSUI\nHK\n1,050.00",
                "Date": "18FEB",
                "Description": "CITY SUPER LIMITED"
            },
            {
                "_source": "19FEB\n18FEB\nMPJ MOBILE APPS THE DA\nQuarry Bay\nHK\n633.90",
                "Category": "Tax",
                "Date": "19FEB",
                "Description": "MPJ MOBILE APPS THE",
                "TotalPrice": 633.9
            },
            {
                "_source": "19FEB\n18FEB\nMPJ MOBILE APPS THE DA\nQuarry Bay\nHK\n253.00",
                "Category": "Credit",
                "Date": "19FEB",
                "Description": "MPJ MOBILE APPS THE",
                "TotalPrice": 253
            },
            {
                "_source": "21FEB\n19FEB\nNetflix.com\nSINGAPORE\nSG\n78.00",
                "Category": "Credit",
                "Date": "21FEB",
                "Description": "Netflix.com",
                "TotalPrice": 78
            },
            {
                "_source": "21FEB\n20FEB\nLINODE\n8554546633\nUS\nUSD\n508.90\n4,047.63\n*EXCHANGE RATE: 7.95368",
                "Date": "21FEB",
                "Description": "LINODE",
                "TotalPrice": 4047.63
            },
            {
                "_source": "22FEB\n21FEB\nFLICKR. COM\nMOUNTAIN VIEW\nUS\nUSD\n79.99\n636.22\n*EXCHANGE RATE: 7.95374",
                "Category": "Credit",
                "Date": "22FEB",
                "Description": "FLICKR. COM",
                "TotalPrice": 636.22
            },
            {
                "_source": "23FEB\n22FEB\nMPJ MOBILE APPS THE DA\nQuarry Bay\nHK\n250.58",
                "Category": "Credit",
                "Date": "23FEB",
                "Description": "MPJ MOBILE APPS THE",
                "TotalPrice": 250.58
            },
            {
                "_source": "23FEB\n21FEB\nPAYPAL *GITHUB INC\n4029357733\nUS\n73.13",
                "Category": "Credit",
                "Date": "2021-02-23T00:00:00.000Z",
                "Description": "PAYPAL *GITHUB INC",
                "TotalPrice": 73.13
            },
            {
                "_source": "24FEB\n23FEB\nPAYPAL *WAKATIME\n4029357733\nHK\n73.15",
                "Category": "Credit",
                "Date": "2023-02-24T00:00:00.000Z",
                "Description": "PAYPAL *WAKATIME",
                "TotalPrice": 73.15
            }
        ],
        "doc2_MerchantAliases": [
            "The Hongkong and Limited",
            "HSBC\n滙豐"
        ],
        "doc2_MerchantName": "香港上海滙豐銀行有限公司",
        "doc3_Currency": "USD",
        "doc3_Items": [
            {
                "_source": "24FEB\n23FEB\nNYTimes*NYTimes\n800-698-4637\nUS\nUSD\n12.00\n95.50\n*EXCHANGE RATE: 7.95833",
                "Date": "2023-02-24T00:00:00.000Z",
                "Description": "NYTimes*NYTimes",
                "TotalPrice": 95.5
            },
            {
                "_source": "24FEB\n23FEB\nLINODE\n8554546633\nUS\nUSD\n502.17\n3,995.38",
                "Date": "2023-02-24T00:00:00.000Z",
                "Description": "LINODE"
            },
            {
                "_source": "25FEB\n25FEB\nCREDIT REWARD CASH REBATE\n248.00CR",
                "Category": "Credit",
                "Date": "1925-02-25T00:00:00.000Z",
                "Description": "CREDIT REWARD CASH REBATE"
            }
        ],
        "doc3_MerchantAliases": [
            "The Hongkong and Shanghai Banking Corporation Limited",
            "HSBC"
        ],
        "doc3_MerchantName": "香港上海滙豐銀行有限公司",
        "doc4_MerchantName": "香港上海滙豐銀行有限公司",
        "doc4_MerchantPhoneNumber": "+88627488288",
        "doc4_TransactionDate": "2022-02-25T00:00:00.000Z",
        "__raw__": {
            "content": "HSBC\n滙豐\nThe Hongkong and Shanghai Banking Corporation Limited\n香港上海滙豐銀行有限公司\nSTATEMENT OF BUSINESS CARD ACCOUNT 公司卡戶口結單\nPage\n1/4\nMR LEE SEE MING\nM\nAccount number 戶口號碼\nC/O SML UNIVERSE LIMITED\n00922\n5199 3100 0018 7511\nFLAT F 27/F BLK 10 VISTA PARADISO\nCard type 信用卡類別\nCredit limit 信用限額\n2 HANG MING ST\nPlatinum Business MC\nHKD75,000.00\nNEW TERRITORIES\nStatement date 結單日\nStatement balance 結單結欠/結餘\n25 FEB 2022\nHKD31, 247.84\nPost date\nTrans date\nDescription of transaction\nAmount\n(HKD)\n記賬日期\n交易日期\n交易說明\n金額\nPREVIOUS BALANCE\n上月結欠/結餘\n13,505.64\n31JAN\n30JAN\nIFS PAYMENT - THANK YOU\n13,537.61CR\n14FEB\n13FEB\nIFS PAYMENT - THANK YOU\n30,361.52CR\n5199 3100 0018 7511\nSEE-MING LEE\nSML UNIVERSE LTD\n28JAN\n27JAN\nPAYPAL *TWITCHINTER\n4029357733\nUS\n31.99\n31JAN\n30JAN\nPAYPAL *ORANGEMONKI\n4029357733\nHK\n1,791.14\n31JAN\n30JAN\nAPPLE. COM/BILL\n85221120099\nIE\n398.00\n31JAN\n30JAN\nAdobe . com\nDublin\nIE\n408.00\n31JAN\n30JAN\nDATYLON\nANTWERPEN\nBE\nUSD\n19.95\n158.54\n*EXCHANGE RATE: 7.94687\n04FEB\n01FEB\nSTACK* ZEROSSL\nWIEN\nAT\nUSD\n10.00\n79.50\n*EXCHANGE RATE: 7.95000\n04FEB\n30JAN\nMPJ MOBILE APPS THE DA\nQuarry Bay\nHK\n680.41\n04FEB\n01FEB\nAPPLE. COM/BILL\nITUNES . COM\nIE\n78.00\n04FEB\n01FEB\nOPEN SOURCE COLLECTIVE\nWALNUT\nUS\nUSD\n5.00\n39.76\n*EXCHANGE RATE: 7.95200\n04FEB\n02FEB\nPOSTABLE . COM\nNEW YORK CITY\nUS\nUSD\n4.57\n36.33\n* EXCHANGE RATE: 7.94967\n04FEB\n01FEB\nMAILGUN TECHNOLOGIES,\nSAN ANTONIO\nUS\nUSD\n2.78\n22.10\n*EXCHANGE RATE: 7.94964\n04FEB\n01FEB\nPAYPAL *PATREON\nMEMBE\n4029357733\nUS\n16.25\n04FEB\n03FEB\nNRI*NEW RELIC\n888-643-8776\nUS\nUSD\n251.75\n2,001.24\n* EXCHANGE RATE: 7.94931\n04FEB\n03FEB\nMPJ MOBILE APPS THE DA\nQuarry Bay\nHK\n865.70\n04FEB\n02FEB\nPAYPAL *1800FLOWERS\n4029357733\nUS\n1,282.61\n04FEB\n01FEB\nAPPLE. COM/BILL\nITUNES . COM\nIE\n101.00\nFor important information such as payment methods, fees and charges, lost\nMinimum payment summary 最低付款摘要\nHKD\ncard reporting, and change of correspondence address / telephone number,\nplease visit www.hsbc.com.hk or call our Customer Service Hotline on\nCurrent minimum payment due 目前最低付款額\n313.00\n(852) 2748 8288.\nPlease pay by 須於此付款到期日或之前繳交\n25 MAR 2022\n有關您戶口的重要資料包括付款方式,利息與收費,報失信用卡,以及更改\nOverdue / overlimit due now\n通訊地址/電話號碼,請瀏覽網址www.hsbc.com.hk或聯絡我們的客戶服務熱\n須立即繳交的過期款項/超額款項\n0.00\n線(852) 2748 8288.\nTotal minimum payment due\n最低付款總額\n313.00\nHSBC\n滙豐\nPayment Slip 付款存根\nAccount number 戶口號碼\nCard type 信用卡類別\nIf you are paying by mail, please detach this payment slip and return it with a\n5199 3100 0018 7511\nPlatinum Business MC\ncrossed cheque made payable to \"The Hongkong and Shanghai Banking\nCorporation Limited\" or \"HSBC\" at least three working days before the\nStatement date 結單日\nStatement balance 結單結欠/結餘\npayment due date to our Centre, PO BOX NO. 73730, KOWLOON CENTRAL\n25 FEB 2022\nHKD31, 247.84\nPOST OFFICE HK. Please write your account number on the back of the\nCheque number 支票號碼\nAmount enclosed\n夾附金額\n如欲以郵寄方式付款,請撕下此付款存根,於付款到期日三個工作天前,連同以\ncheque.\n「香港上海滙豐銀行有限公司」或「滙豐」為抬頭的劃線支票,寄回 PO BOX\nNO. 73730, KOWLOON CENTRAL POST OFFICE HK. 信用卡中心收,請於支\n票背面寫上您的戶口號碼。\nThank you for choosing HSBC.多謝選用滙豐服務。\nHSBC\n滙豐\nThe Hongkong and Shanghai Banking Corporation Limited\n香港上海滙豐銀行有限公司\nSTATEMENT OF BUSINESS CARD ACCOUNT 公司卡戶口結單\nPage\n2/4\nCardholder's name 持卡人姓名\nAccount number 戶口號碼\nStatement date 結單日\nSEE-MING LEE\n5199 3100 0018 7511\n25 FEB 2022\nPost date\nTrans date\nDescription of transaction\nAmount\n( HKD)\n記賬日期\n交易日期\n交易說明\n金額\n04FEB\n03FEB\nAmazon web services\naws. amazon. co\nUS\nUSD\n162.61\n1,292.63\n*EXCHANGE RATE: 7.94927\n04FEB\n02FEB\nPAYPAL *CARDLY CARDLY\n4029357733\nHK\n110.86\n04FEB\n02FEB\nBLS*REDIS LABS\n14085242916\nIL\nUSD\n248.00\n1,971.72\n* EXCHANGE RATE: 7.95048\n04FEB\n01FEB\nLINODE\n8554546633\nUS\nUSD\n387.29\n3,080.08\n*EXCHANGE RATE: 7.95290\n04FEB\n02FEB\nBROWSERSTACK. COM\nLEWES\nUS\nUSD\n19.00\n151.06\n*EXCHANGE RATE: 7.95053\n04FEB\n01FEB\nCLOUDFLARE\nSAN FRANCISCO\nUS\nUSD\n67.55\n537.22\n*EXCHANGE RATE: 7.95292\n05FEB\n04FEB\nAPPLE. COM/BILL\nITUNES . COM\nIE\n25.00\n05FEB\n04FEB\nHUTCHISON TELECOM 3CC\nHONG KONG\nHK\n136.00\n05FEB\n04FEB\nPAYPAL *FONTAWESOME\n4029357733\nUS\n804.02\n05FEB\n04FEB\nLINODE\n8554546633\nUS\nUSD\n132.08\n1,050.04\n*EXCHANGE RATE: 7.95003\n07FEB\n06FEB\nLINODE\n8554546633\nUS\nUSD\n501.53\n3,985.46\n*EXCHANGE RATE: 7.94660\n07FEB\n05FEB\nMPJ MOBILE APPS THE DA\nQuarry Bay\nHK\n522.83\n08FEB\n07FEB\nPAYPAL *OREILLYMEDI\n4029357733\nUS\n316.61\n08FEB\n07FEB\nPAYPAL *PADDLE. COM\n35314369001\nGB\n779.00\n09FEB\n08FEB\nMPJ MOBILE APPS THE DA\nQuarry Bay\nHK\n284.46\n09FEB\n08FEB\nDROPBOX*62DS3FXCBFS5\nD02FD79\nIE\nUSD\n199.00\n1,581.42\n*EXCHANGE RATE: 7.94683\n09FEB\n08FEB\nSMARTONE AUTOPAY\nKWUN TONG\nHK\n220.00\n09FEB\n08FEB\nMPJ MOBILE APPS THE DA\nQuarry Bay\nHK\n278.00\n09FEB\n08FEB\nAPPLE. COM/BILL\nITUNES . COM\nIE\n436.00\n10FEB\n09FEB\nLINODE\n8554546633\nUS\nUSD\n501.53\n3,986.64\n*EXCHANGE RATE: 7.94896\n11FEB\n10FEB\nJetBrains\nPrague\nCZ\nUSD\n71.00\n564.37\n*EXCHANGE RATE: 7.94887\n11FEB\n09FEB\nMPJ MOBILE APPS THE DA\nQuarry Bay\nHK\n211.50\n12FEB\n11FEB\nAPPLE. COM/BILL\nITUNES. COM\nIE\n78.00\n14FEB\n12FEB\nPAYPAL *TIDAL HIFI\n35314369001\nSE\n96.00\n14FEB\n11FEB\n7-Eleven, HK (0824)\nMA ON SHAN\nHK\n2,043.00\n14FEB\n11FEB\n7-Eleven, HK (0434)\nMA ON SHAN\nHK\n1,474.00\n14FEB\n12FEB\nLINODE\n8554546633\nUS\nUSD\n501.53\n3,990.65\n*EXCHANGE RATE : 7.95695\n14FEB\n12FEB\nMPJ MOBILE APPS THE DA\nQuarry Bay\nHK\n444.63\n15FEB\n14FEB\nMPJ MOBILE APPS THE DA\nQuarry Bay\nHK\n266.90\n16FEB\n15FEB\nMPJ MOBILE APPS THE DA\nQuarry Bay\nHK\n406.64\n16FEB\n15FEB\nLINODE\n8554546633\nUS\nUSD\n508.90\n4,049.03\n*EXCHANGE RATE: 7.95644\n16FEB\n14FEB\nMPJ MOBILE APPS THE DA\nQuarry Bay\nHK\n304.17\n17FEB\n16FEB\nAPPLE. COM/BILL\nITUNES . COM\nIE\n101.00\n17FEB\n16FEB\nDR. IP CHI MAN DENTAL\nN.T.\nHK\n2,860.00\n18FEB\n16FEB\nMPJ MOBILE APPS THE DA\nQuarry Bay\nHK\n102.87\n18FEB\n17FEB\nMPJ MOBILE APPS THE DA\nQuarry Bay\nHK\n83.26\n18FEB\n17FEB\nLINODE\n8554546633\nUS\nUSD\n501.59\n3,990.10\n*EXCHANGE RATE: 7.95490\n18FEB\n17FEB\nPAYPAL *OUTPUT\n4029357733\nUS\n81.27\n18FEB\n17FEB\nIFTTT PRO (LEGACY)\nSAN FRANCISCO\nUS\nUSD\n1.99\n15.83\n*EXCHANGE RATE: 7.95477\n18FEB\n18FEB\nCITY SUPER LIMITED\nTSIM SHA TSUI\nHK\n1,050.00\n19FEB\n18FEB\nMPJ MOBILE APPS THE DA\nQuarry Bay\nHK\n633.90\n19FEB\n18FEB\nMPJ MOBILE APPS THE DA\nQuarry Bay\nHK\n253.00\n21FEB\n19FEB\nNetflix.com\nSINGAPORE\nSG\n78.00\n21FEB\n20FEB\nLINODE\n8554546633\nUS\nUSD\n508.90\n4,047.63\n*EXCHANGE RATE: 7.95368\n22FEB\n21FEB\nFLICKR. COM\nMOUNTAIN VIEW\nUS\nUSD\n79.99\n636.22\n*EXCHANGE RATE: 7.95374\n23FEB\n22FEB\nMPJ MOBILE APPS THE DA\nQuarry Bay\nHK\n250.58\n23FEB\n21FEB\nPAYPAL *GITHUB INC\n4029357733\nUS\n73.13\n24FEB\n23FEB\nPAYPAL *WAKATIME\n4029357733\nHK\n73.15\nHSBC\n滙豐\nThe Hongkong and Shanghai Banking Corporation Limited\n香港上海滙豐銀行有限公司\nSTATEMENT OF BUSINESS CARD ACCOUNT 公司卡戶口結單\nPage 3 /4\nCardholder's name 持卡人姓名\nAccount number 戶口號碼\nStatement date 結單日\nSEE-MING LEE\n5199 3100 0018 7511\n25 FEB 2022\nPost date\nTrans date\nDescription of transaction\nAmount\n(HKD)\n記賬日期\n交易日期\n交易說明\n金額\n24FEB\n23FEB\nNYTimes*NYTimes\n800-698-4637\nUS\nUSD\n12.00\n95.50\n*EXCHANGE RATE: 7.95833\n24FEB\n23FEB\nLINODE\n8554546633\nUS\nUSD\n502.17\n3,995.38\n*EXCHANGE RATE: 7.95623\n25FEB\n25FEB\nCREDIT REWARD CASH REBATE\n248.00CR\n*For credit card transactions effected in currencies other\nthan Hong Kong dollars, the exchange rate applied includes a\nhandling fee equivalent to 1.95% of each transaction. The\nfee relating to foreign currency transaction is not\napplicable to RMB Business Card.\n就每項以非港元進行的信用卡交易,所用外幣匯率已包括交易金\n額1.95%的手續費。外幣交易有關費用不適用於人民幣公司卡。\nNote: \"CR\" means Credit transaction / balance\n註:「CR」為入賬交易/結餘\n**** REWARDCASH SUMMARY FOR CARD NUMBER 5199 3100 0018 7511\nREWARDCASH EARNED\n248\n..\nREWARDCASH ADJUSTED\n0\n..\nREWARDCASH REDEEMED\n0\n..\nCONVERTED TO CASH REBATE\n248\n..\nSTATEMENT BALANCE\n結單結欠/結餘\n31,247.84\n*****\nTRANSACTION SUMMARY\n*****\nCREDIT/PAYMENT\n43,899.13CR\n..\nPURCHASES AND INSTALMENTS\n61,889.33\n..\nCREDIT ADJUSTMENT\n248.00CR\n..\nTOTAL ACCOUNT BALANCE\n31,247.84\n..\nFEES AND CHARGES SUMMARY\nFEE/CHARGE TYPE\nAMOUNT\nTOTAL FEES/CHARGES ( EXCLUDING FINANCE CHARGE)\n0.00\n***** FINANCE CHARGE SUMMARY\n*:\nBALANCE TYPE\nANNUALISED PERCENTAGE RATE (APR)\nFINANCE CHARGE\nCASH ADVANCE\n35.61%\n0.00\nPURCHASE\n34.46%\n0.00\nTOTAL FINANCE CHARGE\n0.00\n*********** INFORMATION REGARDING MAKING MINIMUM PAYMENT *******\nHSBC\n滙豐\nThe Hongkong and Shanghai Banking Corporation Limited\n香港上海滙豐銀行有限公司\nSTATEMENT OF BUSINESS CARD ACCOUNT 公司卡戶口結單\nPage 4 / 4\nCardholder's name 持卡人姓名\nAccount number\n1號碼\nStatement date 結單日\nSEE-MING LEE\n5199 3100 0018 7511\n25 FEB 2022\nPost date\nTrans date\nDescription of transaction\nAmount\n( HKD)\n記賬日期\n交易日期\n交易說明\n金額\nThe below examples are for illustration only. You may visit our Bank\nwebsite at www.hsbc. com.hk for an online credit card repayment\ncalculator for customized information.\nIf you make no additional\ncharges, purchases and\nYou will pay off the\nand you will end up\ncash advances on this card|\noutstanding balance*\npaying an estimated\nof HKD20,000 in\ntotal of ...\nand each month you pay. ..\nabout .. .\n|\n|\n|\nOnly Minimum Payment Due\n|\n26 years **\n|\nHKD67,536 ***\n|\n|\nHKD849\n|\n3 years **\n|\nHKD30,565 ***\n|\n(Savings=HKD36, 971)\n* The outstanding balance of HKD20, 000 is accrued from purchase only.\n** Assume repayment is made on or before the payment due date of each\nstatement month.\n*** Include the outstanding balance of HKD20, 000 and the total finance\ncharge which is accrued daily and calculated at an interest rate of\n2.5% per month (equivalent to an annualised percentage rate of 34.46%\non purchase and 35.61% on cash advance) on the outstanding balance\nuntil it is fully paid.\nThe statement is for your reference only. Payment to be\narranged by your corporation.\nThe RewardCash earned by the company have been\ntransferred to your Business Card account.\nIf the statement balance for your credit card account\nexceeds the credit limit on the statement date, an overlimit\nhandling fee will be debited to the account. If you wish to\nopt out of the over-the-limit facility, you may fill out\nthe form on the back of the statement. For enquiries,\nplease contact us on 2748 8288.\n若您的結單結欠超出該信用卡戶口截至結單日的信用限額,\n本行會徵收超出信用限額手續費。如您欲拒絕接受超出信用限額\n信貸安排,請填妥結單背頁之表格作出指示。如有任何\n查詢,請致電2748 8288。",
            "paragraphs": []
        },
        "created_at": "2024-01-12T21:33:38.635Z"
    },
    {
        "doc1_Currency": "JPY",
        "doc1_Items": [
            {
                "_source": "08MAR\n08MAR\nIFS PAYMENT - THANK YOU\n11,590.36CR",
                "Category": "Other",
                "Date": "2008-03-08T00:00:00.000Z",
                "Description": "IFS PAYMENT - THANK YOU",
                "TotalPrice": 11590.36
            },
            {
                "_source": "15MAR\n14MAR\nIFS PAYMENT\n- THANK YOU\n14,674.90CR",
                "Category": "Other",
                "Date": "2014-03-15T00:00:00.000Z",
                "Description": "IFS PAYMENT\n- THANK YOU",
                "TotalPrice": 14674.9
            },
            {
                "_source": "18MAR\n18MAR\nIFS PAYMENT - THANK YOU\n10,480.66CR\n5199 3100 0018 7511\nSEE-MING LEE\nSML UNIVERSE LTD",
                "Category": "Other",
                "Date": "2018-03-18T00:00:00.000Z",
                "Description": "IFS PAYMENT - THANK YOU",
                "TotalPrice": 10480.66
            },
            {
                "_source": "28FEB\n27FEB\nAdobe . com\nDublin\nIE\n408.00",
                "Category": "Credit",
                "Date": "1928-02-27T00:00:00.000Z",
                "Description": "Adobe . com",
                "TotalPrice": 408
            },
            {
                "_source": "28FEB\n26FEB\nPAYPAL *HAYU\n35314369001\nGB\n40.00",
                "Category": "Credit",
                "Date": "1928-02-26T00:00:00.000Z",
                "Description": "PAYPAL *HAYU",
                "TotalPrice": 40
            },
            {
                "_source": "28FEB\n26FEB\nAPPLE. COM/BILL\nCORK\nIE\n398.00",
                "Category": "Meals",
                "Date": "1928-02-26T00:00:00.000Z",
                "Description": "APPLE. COM/BILL",
                "TotalPrice": 398
            },
            {
                "_source": "28FEB\n26FEB\nLINODE\n8554546633\nUS\nUSD\n502.17\n3,998.49\n*EXCHANGE RATE: 7.96242",
                "Category": "Credit",
                "Date": "28FEB",
                "Description": "LINODE"
            },
            {
                "_source": "28FEB\n27FEB\nPAYPAL *TWITCHINTER\n4029357733\nUS\n31.99",
                "Category": "Credit",
                "Date": "1928-02-27T00:00:00.000Z",
                "Description": "PAYPAL *TWITCHINTER",
                "TotalPrice": 31.99
            },
            {
                "_source": "01MAR\n28FEB\nLINODE\n8554546633\nUS\nUSD\n501.06\n3,989.65\n*EXCHANGE RATE: 7.96242",
                "Date": "01MAR",
                "Description": "LINODE"
            },
            {
                "_source": "01MAR\n28FEB\nDATYLON\nANTWERPEN\nBE\nUSD\n19.95\n158.85\n*EXCHANGE RATE: 7.96241",
                "Date": "2001-03-28T00:00:00.000Z",
                "Description": "DATYLON"
            },
            {
                "_source": "01MAR\n28FEB\nAPPLE. COM/BILL\nITUNES. COM\nIE\n48.00",
                "Date": "2001-03-28T00:00:00.000Z",
                "Description": "APPLE. COM/BILL",
                "TotalPrice": 48
            },
            {
                "_source": "02MAR\n01MAR\nCLOUDFLARE\nSAN FRANCISCO\nUS\nUSD\n66.30\n527.91\n*EXCHANGE RATE: 7.96244",
                "Category": "Meals",
                "Date": "2001-03-02T00:00:00.000Z",
                "Description": "CLOUDFLARE"
            },
            {
                "_source": "02MAR\n01MAR\nOPEN SOURCE COLLECTIVE\nWALNUT\nUS\nUSD\n5.00\n39.81\n*EXCHANGE RATE: 7.96200",
                "Category": "Meals",
                "Date": "2001-03-02T00:00:00.000Z",
                "Description": "OPEN SOURCE COLLECTIVE\nWALNUT"
            },
            {
                "_source": "02MAR\n01MAR\nPAYPAL *PADDLE. COM\n35314369001\nGB\n179.00",
                "Category": "Credit",
                "Date": "02MAR",
                "Description": "PAYPAL *PADDLE. COM",
                "TotalPrice": 179
            },
            {
                "_source": "02MAR\n01MAR\nSTACK* ZEROSSL\nWIEN\nAT\nUSD\n10.00\n79.62\n*EXCHANGE RATE: 7.96200",
                "Category": "Meals",
                "Date": "02MAR",
                "Description": "STACK* ZEROSSL",
                "TotalPrice": 79.62
            },
            {
                "_source": "02MAR\n01MAR\nLINODE\n8554546633\nUS\nUSD\n21.40\n170.40\n*EXCHANGE RATE: 7.96262",
                "Date": "02MAR",
                "Description": "LINODE"
            }
        ],
        "doc1_MerchantAddress": {
            "_source": "PO BOX NO. 73730, KOWLOON CENTRAL",
            "poBox": "PO BOX NO. 73730",
            "city": "KOWLOON",
            "state": "CENTRAL",
            "streetAddress": "PO BOX NO. 73730"
        },
        "doc1_MerchantAliases": [
            "香港上海滙豐銀行有限公司",
            "HSBC.",
            "The Hongkong and Shanghai Banking Corporation Limited",
            "HSBC\n滙豐"
        ],
        "doc1_MerchantName": "香港上海滙豐銀行有限公司",
        "doc1_MerchantPhoneNumber": "+88685227488288",
        "doc2_Currency": "USD",
        "doc2_Items": [
            {
                "_source": "02MAR\n01MAR\nBLS*REDIS LABS14085242\nLONDON\nGB\nUSD\n248.00\n1,974.68\n*EXCHANGE RATE: 7.96242",
                "Category": "Credit",
                "Date": "2001-03-02T00:00:00.000Z",
                "Description": "BLS*REDIS LABS14085242",
                "TotalPrice": 1974.68
            },
            {
                "_source": "03MAR\n01MAR\nPAYPAL *PATREON\nMEMBE\n4029357733\nUS\n16.28",
                "Category": "Meals",
                "Date": "2001-03-03T00:00:00.000Z",
                "Description": "PAYPAL *PATREON\nMEMBE",
                "TotalPrice": 16.28
            },
            {
                "_source": "03MAR\n02MAR\nBROWSERSTACK. COM\nLEWES\nUS\nUSD\n19.00\n151.44\n*EXCHANGE RATE: 7.97053",
                "Date": "2002-03-03T00:00:00.000Z",
                "Description": "BROWSERSTACK. COM",
                "TotalPrice": 151.44
            },
            {
                "_source": "04MAR\n03MAR\nAmazon web services\naws. amazon. co\nUS\nUSD\n173.43\n1,382.22\n*EXCHANGE RATE: 7.96990",
                "Category": "Credit",
                "Date": "2003-03-04T00:00:00.000Z",
                "Description": "Amazon web services",
                "TotalPrice": 1382.22
            },
            {
                "_source": "04MAR\n03MAR\nAPPLE. COM/BILL\nITUNES . COM\nIE\n113.00",
                "Date": "2003-03-04T00:00:00.000Z",
                "Description": "APPLE. COM/BILL",
                "TotalPrice": 113
            },
            {
                "_source": "05MAR\n04MAR\nPAYPAL *MISTERHORSE\n35314369001\nSK\n398.92",
                "Date": "2004-03-05T00:00:00.000Z",
                "Description": "PAYPAL *MISTERHORSE",
                "TotalPrice": 398.92
            },
            {
                "_source": "05MAR\n04MAR\nDROPBOX*YPW2TBXSYLZC\nD02FD79\nIE\nUSD\n55.94\n445.78\n*EXCHANGE RATE: 7.96890",
                "Category": "Meals",
                "Date": "2004-03-05T00:00:00.000Z",
                "Description": "DROPBOX*YPW2TBXSYLZC",
                "TotalPrice": 445.78
            },
            {
                "_source": "05MAR\n04MAR\nNRI*NEW RELIC\n888-643-8776\nUS\nUSD\n230.50\n1,836.80\n*EXCHANGE RATE: 7.96876",
                "Date": "05MAR",
                "Description": "NRI*NEW RELIC",
                "TotalPrice": 1836.8
            },
            {
                "_source": "05MAR\n04MAR\nAPPLE. COM/BILL\n85221120099\nIE\n78.00",
                "Category": "Other",
                "Date": "05MAR",
                "Description": "APPLE. COM/BILL",
                "TotalPrice": 78
            },
            {
                "_source": "07MAR\n06MAR\nAPPLE. COM/BILL\nITUNES. COM\nIE\n468.00",
                "Category": "Other",
                "Date": "2006-03-07T00:00:00.000Z",
                "Description": "APPLE. COM/BILL",
                "TotalPrice": 468
            },
            {
                "_source": "07MAR\n06MAR\nLINODE . COM\n855-4546633\nUS\nUSD\n501.63\n3,998.58\n*EXCHANGE RATE: 7.97117",
                "Category": "Credit",
                "Date": "2006-03-07T00:00:00.000Z",
                "Description": "LINODE . COM",
                "TotalPrice": 3998.58
            },
            {
                "_source": "07MAR\n05MAR\nAPPLE. COM/BILL\nCORK\nIE\n473.00",
                "Category": "Other",
                "Date": "2005-03-07T00:00:00.000Z",
                "Description": "APPLE. COM/BILL",
                "TotalPrice": 473
            },
            {
                "_source": "08MAR\n07MAR\nPAYPAL *OREILLYMEDI\n4029357733\nUS\n317.59",
                "Category": "Credit",
                "Date": "2007-03-08T00:00:00.000Z",
                "Description": "PAYPAL *OREILLYMEDI"
            },
            {
                "_source": "08MAR\n08MAR\nSMARTONE AUTOPAY\nKWUN TONG\nHK\n220.00",
                "Category": "Other",
                "Date": "08MAR",
                "Description": "SMARTONE AUTOPAY",
                "TotalPrice": 220
            },
            {
                "_source": "08MAR\n07MAR\nHUTCHISON TELECOM 3CC\nHONG KONG\nHK\n136.00",
                "Category": "Other",
                "Date": "08MAR",
                "Description": "HUTCHISON TELECOM 3CC",
                "TotalPrice": 136
            },
            {
                "_source": "09MAR\n08MAR\nSMART VISION CENTRE\nMA ON SHAN\nHK\n2,090.00",
                "Category": "Credit",
                "Date": "2008-03-09T00:00:00.000Z",
                "Description": "SMART VISION CENTRE",
                "TotalPrice": 2090
            },
            {
                "_source": "10MAR\n09MAR\nAPPLE. COM/BILL\nITUNES. COM\nIE\n38.00",
                "Category": "Other",
                "Date": "2009-03-10T00:00:00.000Z",
                "Description": "APPLE. COM/BILL",
                "TotalPrice": 38
            },
            {
                "_source": "11MAR\n10MAR\nPAYPAL *FASTSPRING\n4029357733\nUS\n2,443.94",
                "Category": "Other",
                "Date": "2010-03-11T00:00:00.000Z",
                "Description": "PAYPAL *FASTSPRING",
                "TotalPrice": 2443.94
            },
            {
                "_source": "12MAR\n11MAR\nAPPLE. COM/BILL\nITUNES . COM\nIE\n398.00",
                "Category": "Other",
                "Date": "2011-03-12T00:00:00.000Z",
                "Description": "APPLE. COM/BILL",
                "TotalPrice": 398
            },
            {
                "_source": "12MAR\n11MAR\nAPPLE. COM/BILL\nITUNES. COM\nIE\n78.00",
                "Category": "Other",
                "Date": "2011-03-12T00:00:00.000Z",
                "Description": "APPLE. COM/BILL",
                "TotalPrice": 78
            },
            {
                "_source": "12MAR\n11MAR\nLINODE. COM\n855-4546633\nUS\nUSD\n502.89\n4,010.79\n*EXCHANGE RATE: 7.97548",
                "Date": "12MAR",
                "Description": "LINODE. COM",
                "TotalPrice": 4010.79
            },
            {
                "_source": "14MAR\n13MAR\nPAYPAL *IFLIGHTTECH\n4029357733\nHK\n1,727.00",
                "Category": "Other",
                "Date": "2013-03-14T00:00:00.000Z",
                "Description": "PAYPAL *IFLIGHTTECH",
                "TotalPrice": 1727
            },
            {
                "_source": "14MAR\n11MAR\nPAYPAL *BATTLEAXEIN BA\n4029357733\nHK\n162.96",
                "Category": "Other",
                "Date": "14MAR",
                "Description": "PAYPAL *BATTLEAXEIN BA",
                "TotalPrice": 162.96
            },
            {
                "_source": "14MAR\n12MAR\nAPPLE. COM/BILL\n85221120099\nIE\n71.00",
                "Category": "Other",
                "Date": "14MAR",
                "Description": "12MAR\nAPPLE. COM/BILL",
                "TotalPrice": 71
            },
            {
                "_source": "14MAR\n13MAR\nLINODE . COM\n855-4546633\nUS\nUSD\n502.89\n4,014.35\n*EXCHANGE RATE: 7.98256",
                "Category": "Other",
                "Date": "14MAR",
                "Description": "LINODE . COM",
                "TotalPrice": 4014.35
            },
            {
                "_source": "15MAR\n14MAR\nPAYPAL *TIDAL HIFI\n35314369001\nSE\n96.00",
                "Category": "Other",
                "Date": "15MAR",
                "Description": "PAYPAL *TIDAL HIFI",
                "TotalPrice": 96
            },
            {
                "_source": "15MAR\n14MAR\nLINODE\n8554546633\nUS\nUSD\n502.89\n4,014.35\n*EXCHANGE RATE: 7.98256",
                "Category": "Credit",
                "Date": "15MAR",
                "Description": "LINODE",
                "TotalPrice": 4014.35
            },
            {
                "_source": "16MAR\n15MAR\nAPPLE. COM/BILL\nCORK\nIE\n398.00",
                "Category": "Meals",
                "Date": "2015-03-16T00:00:00.000Z",
                "Description": "APPLE. COM/BILL",
                "TotalPrice": 398
            },
            {
                "_source": "18MAR\n17MAR\nPAYPAL *OUTPUT\n4029357733\nUS\n81.54",
                "Category": "Credit",
                "Date": "2017-03-18T00:00:00.000Z",
                "Description": "PAYPAL *OUTPUT",
                "TotalPrice": 81.54
            },
            {
                "_source": "18MAR\n17MAR\nBITLY. COM\nNEW YORK CITY\nUS\nUSD\n348.00\n2,775.57\n*EXCHANGE RATE: 7.97578",
                "Category": "Credit",
                "Date": "18MAR",
                "Description": "BITLY. COM",
                "TotalPrice": 2775.57
            },
            {
                "_source": "18MAR\n16MAR\nAPPLE. COM/HK\nHONG KONG\nHK\n1,298.00",
                "Category": "Other",
                "Date": "2016-03-18T00:00:00.000Z",
                "Description": "APPLE. COM/HK",
                "TotalPrice": 1298
            },
            {
                "_source": "18MAR\n17MAR\nIFTTT PRO (LEGACY)\nSAN FRANCISCO\nUS\nUSD\n1.99\n15.87\n*EXCHANGE RATE: 7.97487",
                "Category": "Other",
                "Date": "2017-03-18T00:00:00.000Z",
                "Description": "IFTTT PRO (LEGACY)",
                "TotalPrice": 15.87
            },
            {
                "_source": "18MAR\n17MAR\nLINODE\n8554546633\nUS\nUSD\n502.59\n4,011.40\n*EXCHANGE RATE: 7.98146",
                "Date": "2017-03-18T00:00:00.000Z",
                "Description": "LINODE",
                "TotalPrice": 4011.4
            },
            {
                "_source": "21MAR\n19MAR\nNetflix.com\nLos Gatos\nSG\n78.00",
                "Category": "Other",
                "Date": "2019-03-21T00:00:00.000Z",
                "Description": "Netflix.com",
                "TotalPrice": 78
            },
            {
                "_source": "21MAR\n19MAR\nLINODE\n8554546633\nUS\nUSD\n503.19\n4,013.78\n*EXCHANGE RATE: 7.97667",
                "Category": "Other",
                "Date": "2019-03-21T00:00:00.000Z",
                "Description": "LINODE",
                "TotalPrice": 4013.78
            },
            {
                "_source": "21MAR\n20MAR\nAPPLE. COM/BILL\nCORK\nIE\n23.00",
                "Category": "Other",
                "Date": "21MAR",
                "Description": "APPLE. COM/BILL",
                "TotalPrice": 23
            },
            {
                "_source": "22MAR\n21MAR\nAPPLE. COM/BILL\nITUNES . COM\nIE\n308.00",
                "Category": "Other",
                "Date": "2021-03-22T00:00:00.000Z",
                "Description": "APPLE. COM/BILL",
                "TotalPrice": 308
            },
            {
                "_source": "23MAR\n21MAR\nAPPLE.COM/HK\nHONG KONG\nHK\n1,998.00",
                "Category": "Other",
                "Date": "2021-03-23T00:00:00.000Z",
                "Description": "APPLE.COM/HK",
                "TotalPrice": 1998
            },
            {
                "_source": "23MAR\n22MAR\nLINODE\n8554546633\nUS\nUSD\n510.30\n4,073.32\n*EXCHANGE RATE: 7.98221",
                "Date": "23MAR",
                "Description": "22MAR\nLINODE",
                "TotalPrice": 4073.32
            },
            {
                "_source": "23MAR\n21MAR\nPAYPAL *GITHUB INC\n4029357733\nUS\n73.35",
                "Category": "Other",
                "Date": "23MAR",
                "Description": "PAYPAL *GITHUB INC",
                "TotalPrice": 73.35
            },
            {
                "_source": "24MAR\n23MAR\nPAYPAL *COLOREXPERT\n4029357733\nUS\n901.08",
                "Category": "Credit",
                "Date": "24MAR",
                "Description": "PAYPAL *COLOREXPERT",
                "TotalPrice": 901.08
            },
            {
                "_source": "24MAR\n23MAR\nAPPLE. COM/BILL\nITUNES . COM\nIE\n778.00",
                "Category": "Other",
                "Date": "24MAR",
                "Description": "APPLE. COM/BILL",
                "TotalPrice": 778
            },
            {
                "_source": "24MAR\n23MAR\nNYTimes *NYTimes\n800-698-4637\nUS\nUSD\n12.00\n95.77\n*EXCHANGE RATE: 7.98083",
                "Category": "Other",
                "Date": "24MAR",
                "Description": "NYTimes *NYTimes",
                "TotalPrice": 95.77
            },
            {
                "_source": "24MAR\n23MAR\nPAYPAL *WAKATIME\n4029357733\nHK\n73.39",
                "Category": "Other",
                "Date": "2023-03-24T00:00:00.000Z",
                "Description": "PAYPAL *WAKATIME",
                "TotalPrice": 73.39
            },
            {
                "_source": "25MAR\n23MAR\nAPPLE. COM/HK\nHONG KONG\nHK\n298.00",
                "Category": "Other",
                "Date": "25MAR",
                "Description": "23MAR\nAPPLE. COM/HK",
                "TotalPrice": 298
            },
            {
                "_source": "26MAR\n25MAR\nLINODE\n8554546633\nUS\nUSD\n503.15\n4,014.21\n*EXCHANGE RATE: 7.97816",
                "Date": "26MAR",
                "Description": "25MAR\nLINODE",
                "TotalPrice": 4014.21
            },
            {
                "_source": "28MAR\n26MAR\nPAYPAL *HAYU\n35314369001\nGB\n40.00",
                "Category": "Other",
                "Date": "28MAR",
                "Description": "PAYPAL *HAYU",
                "TotalPrice": 40
            },
            {
                "_source": "28MAR\n27MAR\nPAYPAL *TWITCHINTER\n4029357733\nUS\n31.99",
                "Category": "Other",
                "Date": "1927-03-28T00:00:00.000Z",
                "Description": "PAYPAL *TWITCHINTER",
                "TotalPrice": 31.99
            }
        ],
        "doc2_MerchantAliases": [
            "The Hongkong and Shanghai Banking Corporation Limited",
            "HSBC\n滙豐"
        ],
        "doc2_MerchantName": "香港上海滙豐銀行有限公司",
        "doc3_Items": [
            {
                "_source": "29MAR\n28MAR\nAPPLE. COM/BILL\n85221120099\nIE\n181.00\n29MAR\n27MAR\nLINODE\n8554546633\nUS\nUSD\n502.06\n4,007.19\n*EXCHANGE RATE: 7.98150",
                "Description": "APPLE. COM/BILL\nLINODE",
                "ProductCode": "85221120099",
                "TotalPrice": 181
            },
            {
                "_source": "29MAR\n28MAR\nAPPLE. COM/BILL\nITUNES .COM\nIE\n78.00\n29MAR\n28MAR\nAPPLE. COM/BILL\n85221120099\nIE\n78.00\n29MAR\n28MAR\nAPPLE. COM/BILL\n85221120099\nIE\n118.00",
                "Description": "APPLE. COM/BILL\nAPPLE. COM/BILL\nAPPLE. COM/BILL",
                "Price": 28,
                "ProductCode": "85221120099",
                "TotalPrice": 118
            },
            {
                "_source": "29MAR\n29MAR\nAPPLE. COM/BILL\n85221120099\nIE\n101.00",
                "Description": "APPLE. COM/BILL",
                "Price": 29,
                "ProductCode": "85221120099",
                "TotalPrice": 101
            },
            {
                "_source": "30MAR\n30MAR\nCREDIT REWARD CASH REBATE",
                "Description": "CREDIT REWARD CASH REBATE"
            },
            {
                "_source": "REWARDCASH EARNED\n284",
                "Description": "REWARDCASH EARNED",
                "TotalPrice": 284
            },
            {
                "_source": "REWARDCASH ADJUSTED\n0\nREWARDCASH REDEEMED\n0",
                "Description": "REWARDCASH ADJUSTED",
                "TotalPrice": "0"
            },
            {
                "_source": "CONVERTED TO CASH REBATE\n284",
                "Description": "CONVERTED TO CASH REBATE",
                "TotalPrice": 284
            }
        ],
        "doc3_MerchantName": "香港上海滙豐銀行有限公司\nHongkong and Shanghai Banking Corporation Limited",
        "doc3_Total": 72870.24,
        "doc3_TransactionDate": "2022-03-30T00:00:00.000Z",
        "doc4_MerchantName": "香港上海滙豐銀行有限公司",
        "doc4_MerchantPhoneNumber": "+88627488288",
        "doc4_TransactionDate": "2022-03-30T00:00:00.000Z",
        "__raw__": {
            "content": "HSBC\n滙豐\nThe Hongkong and Shanghai Banking Corporation Limited\n香港上海滙豐銀行有限公司\nSTATEMENT OF BUSINESS CARD ACCOUNT 公司卡戶口結單\nPage\n1/4\nMR LEE SEE MING\nM\nAccount number 戶口號碼\nC/O SML UNIVERSE LIMITED\n00910\n5199 3100 0018 7511\nFLAT F 27/F BLK 10 VISTA PARADISO\nCard type 信用卡類別\nCredit limit 信用限額\n2 HANG MING ST\nPlatinum Business MC\nHKD75,000.00\nNEW TERRITORIES\nStatement date 結單日\nStatement balance 結單結欠/結餘\n30 MAR 2022\nHKD29, 261.46\nPost date\nTrans date\nDescription of transaction\nAmount\n( HKD )\n記賬日期\n交易日期\n交易說明\n金額\nPREVIOUS BALANCE\n上月結欠/結餘\n31,247.84\n01MAR\n01MAR\nIFS PAYMENT - THANK YOU\n36,124.32CR\n08MAR\n08MAR\nIFS PAYMENT - THANK YOU\n11,590.36CR\n15MAR\n14MAR\nIFS PAYMENT\n- THANK YOU\n14,674.90CR\n18MAR\n18MAR\nIFS PAYMENT - THANK YOU\n10,480.66CR\n5199 3100 0018 7511\nSEE-MING LEE\nSML UNIVERSE LTD\n28FEB\n27FEB\nAdobe . com\nDublin\nIE\n408.00\n28FEB\n26FEB\nPAYPAL *HAYU\n35314369001\nGB\n40.00\n28FEB\n26FEB\nAPPLE. COM/BILL\nCORK\nIE\n398.00\n28FEB\n26FEB\nLINODE\n8554546633\nUS\nUSD\n502.17\n3,998.49\n*EXCHANGE RATE: 7.96242\n28FEB\n27FEB\nPAYPAL *TWITCHINTER\n4029357733\nUS\n31.99\n01MAR\n28FEB\nLINODE\n8554546633\nUS\nUSD\n501.06\n3,989.65\n*EXCHANGE RATE: 7.96242\n01MAR\n28FEB\nDATYLON\nANTWERPEN\nBE\nUSD\n19.95\n158.85\n*EXCHANGE RATE: 7.96241\n01MAR\n28FEB\nAPPLE. COM/BILL\nITUNES. COM\nIE\n48.00\n02MAR\n01MAR\nCLOUDFLARE\nSAN FRANCISCO\nUS\nUSD\n66.30\n527.91\n*EXCHANGE RATE: 7.96244\n02MAR\n01MAR\nOPEN SOURCE COLLECTIVE\nWALNUT\nUS\nUSD\n5.00\n39.81\n*EXCHANGE RATE: 7.96200\n02MAR\n01MAR\nPAYPAL *PADDLE. COM\n35314369001\nGB\n179.00\n02MAR\n01MAR\nSTACK* ZEROSSL\nWIEN\nAT\nUSD\n10.00\n79.62\n*EXCHANGE RATE: 7.96200\n02MAR\n01MAR\nLINODE\n8554546633\nUS\nUSD\n21.40\n170.40\n*EXCHANGE RATE: 7.96262\nFor important information such as payment methods, fees and charges, lost\nMinimum payment summary 最低付款摘要\nHKD\ncard reporting, and change of correspondence address / telephone number,\nplease visit www.hsbc.com.hk or call our Customer Service Hotline on\nCurrent minimum payment due 目前最低付款額\n293.00\n(852) 2748 8288.\nPlease pay by 須於此付款到期日或之前繳交\n25 APR 2022\n有關您戶口的重要資料包括付款方式,利息與收費,報失信用卡,以及更改\nOverdue / overlimit due now\n通訊地址/電話號碼,請瀏覽網址www.hsbc.com.hk或聯絡我們的客戶服務熱\n須立即繳交的過期款項/超額款項\n0.00\n線(852) 2748 8288°\nTotal minimum payment due\n最低付款總額\n293.00\nHSBC\n滙豐\nPayment Slip 付款存根\nAccount number 戶口號碼\nCard type 信用卡類別\nIf you are paying by mail, please detach this payment slip and return it with a\n5199 3100 0018 7511\nPlatinum Business MC\ncrossed cheque made payable to \"The Hongkong and Shanghai Banking\nCorporation Limited\" or \"HSBC\" at least three working days before the\nStatement date 結單日\nStatement balance 結單結欠/結餘\npayment due date to our Centre, PO BOX NO. 73730, KOWLOON CENTRAL\n30 MAR 2022\nHKD29, 261.46\nPOST OFFICE HK. Please write your account number on the back of the\nCheque number 支票號碼\nAmount enclosed\n夾附金額\n如欲以郵寄方式付款,請撕下此付款存根,於付款到期日三個工作天前,連同以\ncheque.\n「香港上海滙豐銀行有限公司」或「滙豐」為抬頭的劃線支票,寄回 PO BOX\nNO. 73730, KOWLOON CENTRAL POST OFFICE HK. 信用卡中心收,請於支\n票背面寫上您的戶口號碼。\nThank you for choosing HSBC.多謝選用滙豐服務。\nHSBC\n滙豐\nThe Hongkong and Shanghai Banking Corporation Limited\n香港上海滙豐銀行有限公司\nSTATEMENT OF BUSINESS CARD ACCOUNT 公司卡戶口結單\nPage 2 /4\nCardholder's name 持卡人姓名\nAccount number 戶口號碼\nStatement date 結單日\nSEE-MING LEE\n5199 3100 0018 7511\n30 MAR 2022\nPost date\nTrans date\nDescription of transaction\nAmount\n(HKD)\n記賬日期\n交易日期\n交易說明\n金額\n02MAR\n01MAR\nBLS*REDIS LABS14085242\nLONDON\nGB\nUSD\n248.00\n1,974.68\n*EXCHANGE RATE: 7.96242\n03MAR\n01MAR\nPAYPAL *PATREON\nMEMBE\n4029357733\nUS\n16.28\n03MAR\n02MAR\nBROWSERSTACK. COM\nLEWES\nUS\nUSD\n19.00\n151.44\n*EXCHANGE RATE: 7.97053\n04MAR\n03MAR\nAmazon web services\naws. amazon. co\nUS\nUSD\n173.43\n1,382.22\n*EXCHANGE RATE: 7.96990\n04MAR\n03MAR\nAPPLE. COM/BILL\nITUNES . COM\nIE\n113.00\n05MAR\n04MAR\nPAYPAL *MISTERHORSE\n35314369001\nSK\n398.92\n05MAR\n04MAR\nDROPBOX*YPW2TBXSYLZC\nD02FD79\nIE\nUSD\n55.94\n445.78\n*EXCHANGE RATE: 7.96890\n05MAR\n04MAR\nNRI*NEW RELIC\n888-643-8776\nUS\nUSD\n230.50\n1,836.80\n*EXCHANGE RATE: 7.96876\n05MAR\n04MAR\nAPPLE. COM/BILL\n85221120099\nIE\n78.00\n07MAR\n06MAR\nAPPLE. COM/BILL\nITUNES. COM\nIE\n468.00\n07MAR\n06MAR\nLINODE . COM\n855-4546633\nUS\nUSD\n501.63\n3,998.58\n*EXCHANGE RATE: 7.97117\n07MAR\n05MAR\nAPPLE. COM/BILL\nCORK\nIE\n473.00\n08MAR\n07MAR\nPAYPAL *OREILLYMEDI\n4029357733\nUS\n317.59\n08MAR\n08MAR\nSMARTONE AUTOPAY\nKWUN TONG\nHK\n220.00\n08MAR\n07MAR\nHUTCHISON TELECOM 3CC\nHONG KONG\nHK\n136.00\n09MAR\n08MAR\nSMART VISION CENTRE\nMA ON SHAN\nHK\n2,090.00\n10MAR\n09MAR\nAPPLE. COM/BILL\nITUNES. COM\nIE\n38.00\n11MAR\n10MAR\nPAYPAL *FASTSPRING\n4029357733\nUS\n2,443.94\n12MAR\n11MAR\nAPPLE. COM/BILL\nITUNES . COM\nIE\n398.00\n12MAR\n11MAR\nAPPLE. COM/BILL\nITUNES. COM\nIE\n78.00\n12MAR\n11MAR\nLINODE. COM\n855-4546633\nUS\nUSD\n502.89\n4,010.79\n*EXCHANGE RATE: 7.97548\n14MAR\n13MAR\nPAYPAL *IFLIGHTTECH\n4029357733\nHK\n1,727.00\n14MAR\n11MAR\nPAYPAL *BATTLEAXEIN BA\n4029357733\nHK\n162.96\n14MAR\n12MAR\nAPPLE. COM/BILL\n85221120099\nIE\n71.00\n14MAR\n13MAR\nLINODE . COM\n855-4546633\nUS\nUSD\n502.89\n4,014.35\n*EXCHANGE RATE: 7.98256\n15MAR\n14MAR\nPAYPAL *TIDAL HIFI\n35314369001\nSE\n96.00\n15MAR\n14MAR\nLINODE\n8554546633\nUS\nUSD\n502.89\n4,014.35\n*EXCHANGE RATE: 7.98256\n16MAR\n15MAR\nAPPLE. COM/BILL\nCORK\nIE\n398.00\n18MAR\n17MAR\nPAYPAL *OUTPUT\n4029357733\nUS\n81.54\n18MAR\n17MAR\nBITLY. COM\nNEW YORK CITY\nUS\nUSD\n348.00\n2,775.57\n*EXCHANGE RATE: 7.97578\n18MAR\n16MAR\nAPPLE. COM/HK\nHONG KONG\nHK\n1,298.00\n18MAR\n17MAR\nIFTTT PRO (LEGACY)\nSAN FRANCISCO\nUS\nUSD\n1.99\n15.87\n*EXCHANGE RATE: 7.97487\n18MAR\n17MAR\nLINODE\n8554546633\nUS\nUSD\n502.59\n4,011.40\n*EXCHANGE RATE: 7.98146\n21MAR\n19MAR\nNetflix.com\nLos Gatos\nSG\n78.00\n21MAR\n19MAR\nLINODE\n8554546633\nUS\nUSD\n503.19\n4,013.78\n*EXCHANGE RATE: 7.97667\n21MAR\n20MAR\nAPPLE. COM/BILL\nCORK\nIE\n23.00\n22MAR\n21MAR\nAPPLE. COM/BILL\nITUNES . COM\nIE\n308.00\n23MAR\n21MAR\nAPPLE.COM/HK\nHONG KONG\nHK\n1,998.00\n23MAR\n22MAR\nLINODE\n8554546633\nUS\nUSD\n510.30\n4,073.32\n*EXCHANGE RATE: 7.98221\n23MAR\n21MAR\nPAYPAL *GITHUB INC\n4029357733\nUS\n73.35\n24MAR\n23MAR\nPAYPAL *COLOREXPERT\n4029357733\nUS\n901.08\n24MAR\n23MAR\nAPPLE. COM/BILL\nITUNES . COM\nIE\n778.00\n24MAR\n23MAR\nNYTimes *NYTimes\n800-698-4637\nUS\nUSD\n12.00\n95.77\n*EXCHANGE RATE: 7.98083\n24MAR\n23MAR\nPAYPAL *WAKATIME\n4029357733\nHK\n73.39\n25MAR\n23MAR\nAPPLE. COM/HK\nHONG KONG\nHK\n298.00\n26MAR\n25MAR\nLINODE\n8554546633\nUS\nUSD\n503.15\n4,014.21\n*EXCHANGE RATE: 7.97816\n28MAR\n26MAR\nPAYPAL *HAYU\n35314369001\nGB\n40.00\n28MAR\n27MAR\nPAYPAL *TWITCHINTER\n4029357733\nUS\n31.99\nHSBC\n滙豐\nThe Hongkong and Shanghai Banking Corporation Limited\n香港上海滙豐銀行有限公司\nSTATEMENT OF BUSINESS CARD ACCOUNT 公司卡戶口結單\nPage\n3/4\nCardholder's name 持卡人姓名\nAccount number 戶口號碼\nStatement date 結單日\nSEE-MING LEE\n5199 3100 0018 7511\n30 MAR 2022\nPost date\nTrans date\nDescription of transaction\nAmount\n(HKD)\n記賬日期\n交易日期\n交易說明\n金額\n29MAR\n28MAR\nAPPLE. COM/BILL\n85221120099\nIE\n181.00\n29MAR\n27MAR\nLINODE\n8554546633\nUS\nUSD\n502.06\n4,007.19\n*EXCHANGE RATE: 7.98150\n29MAR\n28MAR\nAPPLE. COM/BILL\nITUNES .COM\nIE\n78.00\n29MAR\n28MAR\nAPPLE. COM/BILL\n85221120099\nIE\n78.00\n29MAR\n28MAR\nAPPLE. COM/BILL\n85221120099\nIE\n118.00\n29MAR\n29MAR\nAPPLE. COM/BILL\n85221120099\nIE\n101.00\n30MAR\n30MAR\nCREDIT REWARD CASH REBATE\n284.00CR\n*For credit card transactions effected in currencies other\nthan Hong Kong dollars, the exchange rate applied includes a\nhandling fee equivalent to 1.95% of each transaction. The\nfee relating to foreign currency transaction is not\napplicable to RMB Business Card.\n就每項以非港元進行的信用卡交易,所用外幣匯率已包括交易金\n額1.95%的手續費。外幣交易有關費用不適用於人民幣公司卡。\nNote: \"CR\" means Credit transaction / balance\n註:「CR」為入賬交易/結餘\n**** REWARDCASH SUMMARY FOR CARD NUMBER 5199 3100 0018 7511\nREWARDCASH EARNED\n:\n284\nREWARDCASH ADJUSTED\n0\n..\nREWARDCASH REDEEMED\n0\n..\nCONVERTED TO CASH REBATE\n284\n..\nSTATEMENT BALANCE\n結單結欠/結餘\n29,261.46\n*****\nTRANSACTION SUMMARY\nCREDIT/PAYMENT\n72,870.24CR\n..\nPURCHASES AND INSTALMENTS\n71,167.86\n..\nCREDIT ADJUSTMENT\n:\n284.00CR\nTOTAL ACCOUNT BALANCE\n:\n29,261.46\nFEES AND CHARGES SUMMARY\nFEE/CHARGE TYPE\nAMOUNT\nTOTAL FEES/CHARGES ( EXCLUDING FINANCE CHARGE)\n0.00\n***** FINANCE CHARGE SUMMARY *\nBALANCE TYPE\nANNUALISED PERCENTAGE RATE (APR)\nFINANCE CHARGE\nCASH ADVANCE\n35.61%\n0.00\nPURCHASE\n34.46%\n0.00\nTOTAL FINANCE CHARGE\n0.00\n*********** INFORMATION REGARDING MAKING MINIMUM PAYMENT *******\nHSBC\n滙豐\nThe Hongkong and Shanghai Banking Corporation Limited\n香港上海滙豐銀行有限公司\nSTATEMENT OF BUSINESS CARD ACCOUNT 公司卡戶口結單\nPage 4 / 4\nCardholder's name 持卡人姓名\nAccount number\n1號碼\nStatement date 結單日\nSEE-MING LEE\n5199 3100 0018 7511\n30 MAR 2022\nPost date\nTrans date\nDescription of transaction\nAmount\n( HKD)\n記賬日期\n交易日期\n交易說明\n金額\nThe below examples are for illustration only. You may visit our Bank\nwebsite at www.hsbc. com.hk for an online credit card repayment\ncalculator for customized information.\nIf you make no additional\ncharges, purchases and\nYou will pay off the\nand you will end up\ncash advances on this card|\noutstanding balance*\npaying an estimated\nof HKD20,000 in\ntotal of ...\nand each month you pay. ..\nabout .. .\n|\n|\n|\nOnly Minimum Payment Due\n|\n26 years **\n|\nHKD67,536 ***\n|\n|\nHKD849\n|\n3 years **\n|\nHKD30,565 ***\n|\n(Savings=HKD36, 971)\n* The outstanding balance of HKD20, 000 is accrued from purchase only.\n** Assume repayment is made on or before the payment due date of each\nstatement month.\n*** Include the outstanding balance of HKD20, 000 and the total finance\ncharge which is accrued daily and calculated at an interest rate of\n2.5% per month (equivalent to an annualised percentage rate of 34.46%\non purchase and 35.61% on cash advance) on the outstanding balance\nuntil it is fully paid.\nThe statement is for your reference only. Payment to be\narranged by your corporation.\nThe RewardCash earned by the company have been\ntransferred to your Business Card account.\nIf the statement balance for your credit card account\nexceeds the credit limit on the statement date, an overlimit\nhandling fee will be debited to the account. If you wish to\nopt out of the over-the-limit facility, you may fill out\nthe form on the back of the statement. For enquiries,\nplease contact us on 2748 8288.\n若您的結單結欠超出該信用卡戶口截至結單日的信用限額,\n本行會徵收超出信用限額手續費。如您欲拒絕接受超出信用限額\n信貸安排,請填妥結單背頁之表格作出指示。如有任何\n查詢,請致電2748 8288。",
            "paragraphs": []
        },
        "created_at": "2024-01-12T21:40:58.823Z"
    },
    {
        "Currency": "JPY",
        "Items": [
            {
                "_source": "05MAY\n05MAY\nIFS PAYMENT - THANK YOU\n15,796.21CR",
                "Date": "05MAY"
            },
            {
                "_source": "30APR\n29APR\nADOBE CREATIVE CLOUD",
                "Date": "1930-04-29T00:00:00.000Z",
                "Description": "ADOBE CREATIVE CLOUD"
            },
            {
                "_source": "03MAY\n01MAY\nMAILGUN TECHNOLOGIES,\nSAN ANTONIO\nUS\nUSD\n3.25\n26.01\n*EXCHANGE RATE: 8.00308",
                "Date": "2001-05-03T00:00:00.000Z",
                "Description": "MAILGUN TECHNOLOGIES,",
                "TotalPrice": 26.01
            },
            {
                "_source": "03MAY\n01MAY\nSTACK* ZEROSSL\nWIEN\nAT\nUSD\n10.00\n80.02\n*EXCHANGE RATE: 8.00200",
                "Date": "03MAY",
                "Description": "STACK* ZEROSSL",
                "TotalPrice": 80.02
            },
            {
                "_source": "03MAY\n01MAY\nBLS*REDIS LABS14085242\nLONDON\nGB\nUSD\n248.00\n1,984.45\n*EXCHANGE RATE: 8.00181",
                "Category": "Credit",
                "Date": "03MAY",
                "Description": "BLS*REDIS LABS14085242",
                "TotalPrice": 1984.45
            },
            {
                "_source": "03MAY\n02MAY\nBROWSERSTACK. COM\nLEWES\nUS\nUSD\n19.00\n152.04\n*EXCHANGE RATE: 8.00211",
                "Date": "2002-05-03T00:00:00.000Z",
                "Description": "BROWSERSTACK. COM",
                "TotalPrice": 152.04
            },
            {
                "_source": "03MAY\n01MAY\nPAYPAL *PATREON\nMEMBE\n4029357733\nUS\n16.35",
                "Category": "Credit",
                "Date": "2001-05-03T00:00:00.000Z",
                "Description": "PAYPAL *PATREON\nMEMBE",
                "TotalPrice": 16.35
            },
            {
                "_source": "03MAY\n01MAY\nOPEN SOURCE COLLECTIVE\nWALNUT\nUS\nUSD\n5.00\n40.01\n*EXCHANGE RATE: 8.00200",
                "Category": "Meals",
                "Date": "03MAY",
                "Description": "OPEN SOURCE COLLECTIVE"
            },
            {
                "_source": "03MAY\n01MAY\nAPPLE. COM/BILL\n85221120099\nIE\n398.00",
                "Category": "Meals",
                "Date": "03MAY",
                "Description": "APPLE. COM/BILL",
                "TotalPrice": 398
            },
            {
                "_source": "03MAY\n01MAY\nLINODE\n8554546633\nUS\nUSD\n2,643.39\n21,151.90\n*EXCHANGE RATE: 8.00181",
                "Category": "Meals",
                "Date": "03MAY",
                "Description": "LINODE"
            },
            {
                "_source": "03MAY\n30APR\nDATYLON\nANTWERPEN\nBE\nUSD\n19.95\n159.63\n*EXCHANGE RATE: 8.00150",
                "Category": "Meals",
                "Description": "DATYLON",
                "TotalPrice": 159.63
            },
            {
                "_source": "03MAY\n01MAY\nCLOUDFLARE\nSAN FRANCISCO\nUS\nUSD\n65.90\n527.32\n*EXCHANGE RATE: 8.00182",
                "Category": "Meals",
                "Description": "CLOUDFLARE",
                "TotalPrice": 527.32
            },
            {
                "_source": "04MAY\n04MAY\nYINGKEE TRADING\nHONG KONG\nHK\n3,435.24",
                "Date": "04MAY",
                "Description": "YINGKEE TRADING",
                "TotalPrice": 3435.24
            },
            {
                "_source": "04MAY\n03MAY",
                "Date": "04MAY"
            },
            {
                "_source": "Amazon web services\n*EXCHANGE RATE: 8.00113\naws . amazon. co\nUS\nUSD\n194.86\n1,559.10",
                "Description": "Amazon web services"
            },
            {
                "_source": "05MAY\n04MAY\nAPPLE. COM/BILL\nITUNES. COM\nIE\n38.00",
                "Description": "APPLE. COM/BILL",
                "TotalPrice": 38
            },
            {
                "_source": "05MAY\n04MAY\nNRI*NEW RELIC\n888-643-8776\nUS\nUSD\n262.00\n2,096.58\n*EXCHANGE RATE: 8.00221",
                "Description": "NRI*NEW RELIC",
                "Price": 262,
                "ProductCode": "888-643-8776"
            },
            {
                "_source": "06MAY\n05MAY\nHUTCHISON TELECOM 3CC\nHONG KONG\nHK\n136.00",
                "Description": "HUTCHISON TELECOM 3CC",
                "TotalPrice": 136
            },
            {
                "_source": "07MAY\n06MAY\nAMZN Mktp US*1L4L184W1\nAmzn. com/bill\nUS\n73.87\n10MAY\n09MAY\nYINGKEE TRADING\nHONG KONG\nHK\n433.40",
                "Description": "AMZN Mktp US*1L4L184W1\nYINGKEE TRADING",
                "TotalPrice": 433.4
            },
            {
                "_source": "10MAY\n07MAY\nPAYPAL *OREILLYMEDI\n4029357733\nUS\n318.90",
                "Description": "PAYPAL *OREILLYMEDI",
                "ProductCode": "4029357733",
                "TotalPrice": 318.9
            },
            {
                "_source": "10MAY\n10MAY\n07MAY\nUNDERCONSIDERATION\nBLOOMINGTON\nUS\nUSD\n20.00\n160.06\n*EXCHANGE RATE: 8.00300\n12MAY\n78.00\n12MAY",
                "Description": "UNDERCONSIDERATION",
                "Price": 20,
                "TotalPrice": 160.06
            },
            {
                "_source": "12MAY\n23.00",
                "TotalPrice": 23
            },
            {
                "_source": "12MAY\n11MAY\nHA-PRINCE OF WALES HOS\nHK\n460.00",
                "Description": "HA-PRINCE OF WALES HOS",
                "TotalPrice": 460
            },
            {
                "_source": "12MAY\nSL*Rainbow Store Camer\nHK\n2,750.00",
                "Description": "SL*Rainbow Store Camer",
                "TotalPrice": 2750
            },
            {
                "_source": "YINGKEE TRADING\nHONG KONG\nHK\n20.60CR",
                "Description": "YINGKEE TRADING",
                "TotalPrice": 20.6
            },
            {
                "_source": "13MAY\n12MAY\nDOCKER : INV-1C238226-29\nSAN FRANCISCO\nUS\nUSD\n60.00\n480.20\n*EXCHANGE RATE: 8.00333",
                "Description": "DOCKER : INV-1C238226-29",
                "TotalPrice": 480.2
            },
            {
                "_source": "13MAY\n13MAY\nSL*Rainbow Store Camer\nHK\nHK\n906.00",
                "Description": "SL*Rainbow Store Camer\nHK",
                "TotalPrice": 906
            },
            {
                "_source": "13MAY\n12MAY\nAPPLE. COM/BILL\n85221120099\nIE\n76.00",
                "Description": "12MAY\nAPPLE. COM/BILL",
                "ProductCode": "85221120099",
                "TotalPrice": 76
            },
            {
                "_source": "14MAY\n13MAY\nPAYPAL *TIDAL HIFI\n35314369001\nSE\n96.00",
                "Description": "13MAY\nPAYPAL *TIDAL HIFI",
                "ProductCode": "35314369001",
                "TotalPrice": 96
            },
            {
                "_source": "14MAY\n14MAY\nSL*Rainbow Store Camer\nHK\nHK\n100.00CR",
                "Description": "14MAY\nSL*Rainbow Store Camer\nHK",
                "TotalPrice": 100
            },
            {
                "_source": "16MAY\n15MAY\nPAYPAL *YALEUNIVERS\n4029357733\nUS\n613.30",
                "Description": "15MAY\nPAYPAL *YALEUNIVERS",
                "ProductCode": "4029357733",
                "TotalPrice": 613.3
            },
            {
                "_source": "16MAY\n15MAY\nAPPLE. COM/BILL\nITUNES . COM\nIE\n23.00",
                "Description": "15MAY\nAPPLE. COM/BILL",
                "TotalPrice": 23
            },
            {
                "_source": "18MAY\n17MAY\nIFTTT PRO (LEGACY)\nSAN FRANCISCO\nUS\nUSD\n1.99\n15.92\n*EXCHANGE RATE: 8.00000",
                "Description": "17MAY\nIFTTT PRO (LEGACY)",
                "TotalPrice": 15.92
            },
            {
                "_source": "18MAY\n17MAY\nPAYPAL *OUTPUT\n4029357733\nUS\n81.77",
                "Description": "17MAY\nPAYPAL *OUTPUT",
                "ProductCode": "4029357733",
                "TotalPrice": 81.77
            },
            {
                "_source": "19MAY\n18MAY\nAPPLE. COM/BILL\n85221120099\nIE\n406.00",
                "Description": "APPLE. COM/BILL",
                "ProductCode": "85221120099",
                "TotalPrice": 406
            },
            {
                "_source": "19MAY\n18MAY\nNYTimes *NYTimes\n800-698-4637\nUS\nUSD\n12.00\n96.04\n*EXCHANGE RATE: 8.00333",
                "Description": "18MAY\nNYTimes *NYTimes",
                "TotalPrice": 96.04
            },
            {
                "_source": "19MAY\n18MAY\nAPPLE. COM/BILL\nITUNES . COM\nIE\n44.00",
                "Description": "APPLE. COM/BILL",
                "TotalPrice": 44
            },
            {
                "_source": "20MAY\n19MAY\nNetflix.com\nLos Gatos\nSG\n78.00",
                "Description": "Netflix.com",
                "TotalPrice": 78
            },
            {
                "_source": "21MAY\n20MAY\nPAYPAL *GODADDY . COM\n4029357733\nUS\n274.49",
                "Description": "20MAY\nPAYPAL *GODADDY . COM",
                "ProductCode": "4029357733",
                "TotalPrice": 274.49
            },
            {
                "_source": "21MAY\n20MAY\nPAYPAL *GODADDY . COM\n4029357733\nUS\n90.40",
                "Description": "20MAY\nPAYPAL *GODADDY . COM",
                "ProductCode": "4029357733",
                "TotalPrice": 90.4
            },
            {
                "_source": "23MAY\n21MAY\nPAYPAL *GITHUB INC\n4029357733\nUS\n73.58",
                "Description": "21MAY\nPAYPAL *GITHUB INC",
                "ProductCode": "4029357733",
                "TotalPrice": 73.58
            },
            {
                "_source": "23MAY\n21MAY\nAPPLE. COM/BILL\nITUNES. COM\nIE\n48.00",
                "Description": "21MAY\nAPPLE. COM/BILL",
                "TotalPrice": 48
            },
            {
                "_source": "24MAY\n23MAY\nPAYPAL *WAKATIME\n4029357733\nHK\n73.58",
                "Description": "23MAY\nPAYPAL *WAKATIME",
                "ProductCode": "4029357733",
                "TotalPrice": 73.58
            },
            {
                "_source": "25MAY\n24MAY\nPAYPAL *SIA WEBY\n35314369001\nLV\n98.03",
                "Description": "24MAY\nPAYPAL *SIA WEBY",
                "ProductCode": "35314369001",
                "TotalPrice": 98.03
            },
            {
                "_source": "26MAY\n25MAY\nPAYPAL *SIA WEBY\n35314369001\nLV\n98.04",
                "Description": "PAYPAL *SIA WEBY",
                "ProductCode": "35314369001",
                "TotalPrice": 98.04
            },
            {
                "_source": "26MAY\n25MAY\nAMZN Digital*1R67Z8XB0\n888-802-3080\nUS\nUSD",
                "Description": "AMZN Digital*1R67Z8XB0"
            },
            {
                "_source": "26MAY\n25MAY\nAPPLE. COM/BILL\nITUNES\nCOM\nIE\n15.00",
                "Description": "APPLE. COM/BILL",
                "TotalPrice": 15
            },
            {
                "_source": "27MAY\n26MAY\nUNIQLO HONG KONG LTD",
                "Description": "UNIQLO HONG KONG LTD"
            },
            {
                "_source": "27MAY\n26MAY\nAPPLE. COM/BILL\n85221120099\nIE\n233.00",
                "Description": "APPLE. COM/BILL",
                "ProductCode": "85221120099",
                "TotalPrice": 233
            },
            {
                "_source": "27MAY\n26MAY\nPAYPAL *HAYU\n35314369001\nGB\n40.00",
                "Description": "PAYPAL *HAYU",
                "ProductCode": "35314369001",
                "TotalPrice": 40
            },
            {
                "_source": "27MAY\n25MAY\nMPJ MOBILE APPS THE DA\nQuarry Bay\nHK\n152.00",
                "Description": "MPJ MOBILE APPS THE DA\nQuarry Bay",
                "TotalPrice": 152
            },
            {
                "_source": "28MAY\n27MAY\nPAYPAL *TWITCHINTER\n4029357733\nUS\n31.99",
                "Description": "PAYPAL *TWITCHINTER",
                "ProductCode": "4029357733",
                "TotalPrice": 31.99
            },
            {
                "_source": "30MAY\n29MAY\nAPPLE. COM/BILL\n85221120099\nIE\n76.00",
                "Description": "APPLE. COM/BILL",
                "ProductCode": "85221120099",
                "TotalPrice": 76
            },
            {
                "_source": "30MAY\n30MAY\nCREDIT REWARD CASH REBATE",
                "Description": "CREDIT"
            },
            {
                "_source": "2H21",
                "Description": "2H21"
            }
        ],
        "MerchantAddress": {
            "_source": "PO BOX\nNO. 73730, KOWLOON CENTRAL POST OFFICE HK.",
            "poBox": "PO BOX\nNO. 73730",
            "streetAddress": "PO BOX\nNO. 73730",
            "house": "KOWLOON CENTRAL POST OFFICE HK."
        },
        "MerchantAliases": [
            "HSBC.",
            "The Hongkong and Shanghai Limited",
            "HSBC\n滙豐"
        ],
        "MerchantName": "香港上海滙豐銀行有限公司",
        "MerchantPhoneNumber": "+88627488288",
        "Total": 986,
        "TransactionDate": "2022-05-30T00:00:00.000Z",
        "__raw__": {
            "content": "HSBC\n滙豐\nThe Hongkong and Shanghai Banking Corporation Limited\n香港上海滙豐銀行有限公司\nSTATEMENT OF BUSINESS CARD ACCOUNT 公司卡戶口結單\nPage\n1/4\nMR LEE SEE MING\nM\nAccount number 戶口號碼\nC/O SML UNIVERSE LIMITED\n00903\n5199 3100 0018 7511\nFLAT F 27/F BLK 10 VISTA PARADISO\nCard type 信用卡類別\nCredit limit 信用限額\n2 HANG MING ST\nPlatinum Business MC\nHKD75,000.00\nNEW TERRITORIES\nStatement date 結單日\nStatement balance 結單結欠/結餘\n30 MAY 2022\nHKD15,683.46\nPost date\nTrans date\nDescription of transaction\nAmount\n(HKD)\n記賬日期\n交易日期\n交易說明\n金額\nPREVIOUS BALANCE\n上月結欠/結餘\n13,733.86\n03MAY\n30APR\nIFS PAYMENT - THANK YOU\n13,733.86CR\n03MAY\n02MAY\nIFS PAYMENT - THANK YOU\n14,141.86CR\n05MAY\n05MAY\nIFS PAYMENT - THANK YOU\n15,796.21CR\n5199 3100 0018 7511\nSEE-MING LEE\nSML UNIVERSE LTD\n30APR\n29APR\nADOBE CREATIVE CLOUD\nDublin\nIE\n408.00\n03MAY\n01MAY\nMAILGUN TECHNOLOGIES,\nSAN ANTONIO\nUS\nUSD\n3.25\n26.01\n*EXCHANGE RATE: 8.00308\n03MAY\n01MAY\nSTACK* ZEROSSL\nWIEN\nAT\nUSD\n10.00\n80.02\n*EXCHANGE RATE: 8.00200\n03MAY\n01MAY\nBLS*REDIS LABS14085242\nLONDON\nGB\nUSD\n248.00\n1,984.45\n*EXCHANGE RATE: 8.00181\n03MAY\n02MAY\nBROWSERSTACK. COM\nLEWES\nUS\nUSD\n19.00\n152.04\n*EXCHANGE RATE: 8.00211\n03MAY\n01MAY\nPAYPAL *PATREON\nMEMBE\n4029357733\nUS\n16.35\n03MAY\n01MAY\nOPEN SOURCE COLLECTIVE\nWALNUT\nUS\nUSD\n5.00\n40.01\n*EXCHANGE RATE: 8.00200\n03MAY\n01MAY\nAPPLE. COM/BILL\n85221120099\nIE\n398.00\n03MAY\n01MAY\nLINODE\n8554546633\nUS\nUSD\n2,643.39\n21,151.90\n*EXCHANGE RATE: 8.00181\n03MAY\n30APR\nDATYLON\nANTWERPEN\nBE\nUSD\n19.95\n159.63\n*EXCHANGE RATE: 8.00150\n03MAY\n01MAY\nCLOUDFLARE\nSAN FRANCISCO\nUS\nUSD\n65.90\n527.32\n*EXCHANGE RATE: 8.00182\n04MAY\n04MAY\nYINGKEE TRADING\nHONG KONG\nHK\n3,435.24\n04MAY\n03MAY\nAmazon web services\n*EXCHANGE RATE: 8.00113\naws . amazon. co\nUS\nUSD\n194.86\n1,559.10\nFor important information such as payment methods, fees and charges, lost\ncard reporting, and change of correspondence address / telephone number,\nMinimum payment summary 最低付款摘要\nHKD\nplease visit www.hsbc.com.hk or call our Customer Service Hotline on\nCurrent minimum payment due 目前最低付款額\n157.00\n(852) 2748 8288.\nPlease pay by 須於此付款到期日或之前繳交\n24 JUN 2022\n有關您戶口的重要資料包括付款方式,利息與收費,報失信用卡,以及更改\nOverdue / overlimit due now\n通訊地址/電話號碼,請瀏覽網址www.hsbc.com.hk或聯絡我們的客戶服務熱\n須立即繳交的過期款項/超額款項\n0.00\n線(852) 2748 82880\nTotal minimum payment due\n最低付款總額\n157.00\nHSBC\n滙豐\nPayment Slip 付款存根\nAccount number 戶口號碼\nCard type 信用卡類別\nIf you are paying by mail, please detach this payment slip and return it with a\n5199 3100 0018 7511\nPlatinum Business MC\ncrossed cheque made payable to \"The Hongkong and Shanghai Banking\nCorporation Limited\" or \"HSBC\" at least three working days before the\nStatement date 結單日\nStatement balance 結單結欠/結餘\npayment due date to our Centre, PO BOX NO. 73730, KOWLOON CENTRAL\n30 MAY 2022\nHKD15, 683.46\nPOST OFFICE HK. Please write your account number on the back of the\nCheque number 支票號碼\nAmount enclosed\n夾附金額\n如欲以郵寄方式付款,請撕下此付款存根,於付款到期日三個工作天前,連同以\ncheque.\n「香港上海滙豐銀行有限公司」或「滙豐」為抬頭的劃線支票,寄回 PO BOX\nNO. 73730, KOWLOON CENTRAL POST OFFICE HK. 信用卡中心收,請於支\n票背面寫上您的戶口號碼。\nThank you for choosing HSBC.多謝選用滙豐服務。\nHSBC\n滙豐\nThe Hongkong and Shanghai Banking Corporation Limited\n香港上海滙豐銀行有限公司\nSTATEMENT OF BUSINESS CARD ACCOUNT 公司卡戶口結單\nPage 2 /4\nCardholder's name 持卡人姓名\nAccount number 戶口號碼\nStatement date 結單日\nSEE-MING LEE\n5199 3100 0018 7511\n30 MAY 2022\nPost date\nTrans date\nDescription of transaction\nAmount\n( HKD)\n記賬日期\n交易日期\n交易說明\n金額\n05MAY\n04MAY\nAPPLE. COM/BILL\nITUNES. COM\nIE\n38.00\n05MAY\n04MAY\nNRI*NEW RELIC\n888-643-8776\nUS\nUSD\n262.00\n2,096.58\n*EXCHANGE RATE: 8.00221\n06MAY\n05MAY\nHUTCHISON TELECOM 3CC\nHONG KONG\nHK\n136.00\n07MAY\n06MAY\nAMZN Mktp US*1L4L184W1\nAmzn. com/bill\nUS\n73.87\n10MAY\n09MAY\nYINGKEE TRADING\nHONG KONG\nHK\n433.40\n10MAY\n07MAY\nPAYPAL *OREILLYMEDI\n4029357733\nUS\n318.90\n10MAY\n09MAY\nSL*Rainbow Store Camer\nHK\nHK\n1,192.00\n10MAY\n07MAY\nUNDERCONSIDERATION\nBLOOMINGTON\nUS\nUSD\n20.00\n160.06\n*EXCHANGE RATE: 8.00300\n12MAY\n11MAY\nAPPLE. COM/BILL\nITUNES . COM\nIE\n78.00\n12MAY\n10MAY\nAPPLE. COM/HK\nHONG KONG\nHK\n1,048.00\n12MAY\n11MAY\nHA-PRINCE OF WALES HOS\nHONG KONG\nHK\n2,380.00\n12MAY\n11MAY\nAPPLE. COM/BILL\nITUNES . COM\nIE\n23.00\n12MAY\n11MAY\nHA-PRINCE OF WALES HOS\nHONG KONG\nHK\n460.00\n12MAY\n12MAY\nSL*Rainbow Store Camer\nHK\nHK\n2,750.00\n13MAY\n12MAY\nYINGKEE TRADING\nHONG KONG\nHK\n20.60CR\n13MAY\n12MAY\nDOCKER : INV-1C238226-29\nSAN FRANCISCO\nUS\nUSD\n60.00\n480.20\n*EXCHANGE RATE: 8.00333\n13MAY\n13MAY\nSL*Rainbow Store Camer\nHK\nHK\n906.00\n13MAY\n12MAY\nAPPLE. COM/BILL\n85221120099\nIE\n76.00\n14MAY\n13MAY\nPAYPAL *TIDAL HIFI\n35314369001\nSE\n96.00\n14MAY\n14MAY\nSL*Rainbow Store Camer\nHK\nHK\n100.00CR\n16MAY\n15MAY\nPAYPAL *YALEUNIVERS\n4029357733\nUS\n613.30\n16MAY\n15MAY\nAPPLE. COM/BILL\nITUNES . COM\nIE\n23.00\n18MAY\n17MAY\nIFTTT PRO (LEGACY)\nSAN FRANCISCO\nUS\nUSD\n1.99\n15.92\n*EXCHANGE RATE: 8.00000\n18MAY\n17MAY\nPAYPAL *OUTPUT\n4029357733\nUS\n81.77\n19MAY\n18MAY\nAPPLE. COM/BILL\n85221120099\nIE\n406.00\n19MAY\n18MAY\nNYTimes *NYTimes\n800-698-4637\nUS\nUSD\n12.00\n96.04\n*EXCHANGE RATE: 8.00333\n19MAY\n18MAY\nAPPLE. COM/BILL\nITUNES . COM\nIE\n44.00\n20MAY\n19MAY\nNetflix.com\nLos Gatos\nSG\n78.00\n21MAY\n20MAY\nPAYPAL *GODADDY . COM\n4029357733\nUS\n274.49\n21MAY\n20MAY\nPAYPAL *GODADDY . COM\n4029357733\nUS\n90.40\n23MAY\n21MAY\nPAYPAL *GITHUB INC\n4029357733\nUS\n73.58\n23MAY\n21MAY\nAPPLE. COM/BILL\nITUNES. COM\nIE\n48.00\n24MAY\n23MAY\nPAYPAL *WAKATIME\n4029357733\nHK\n73.58\n25MAY\n24MAY\nPAYPAL *SIA WEBY\n35314369001\nLV\n98.03\n26MAY\n25MAY\nPAYPAL *SIA WEBY\n35314369001\nLV\n98.04\n26MAY\n25MAY\nAMZN Digital*1R67Z8XB0\n888-802-3080\nUS\nUSD\n28.79\n230.41\n*EXCHANGE RATE: 8.00313\n26MAY\n25MAY\nAPPLE. COM/BILL\nITUNES . COM\nIE\n15.00\n27MAY\n26MAY\nUNIQLO HONG KONG LTD\nSHATIN\nHK\n1,151.50\n27MAY\n26MAY\nAPPLE. COM/BILL\n85221120099\nIE\n233.00\n27MAY\n26MAY\nPAYPAL *HAYU\n35314369001\nGB\n40.00\n27MAY\n25MAY\nMPJ MOBILE APPS THE DA\nQuarry Bay\nHK\n152.00\n28MAY\n27MAY\nPAYPAL *TWITCHINTER\n4029357733\nUS\n31.99\n30MAY\n29MAY\nAPPLE. COM/BILL\n85221120099\nIE\n76.00\n30MAY\n30MAY\nCREDIT REWARD CASH REBATE\n986.00CR\n*For credit card transactions effected in currencies other\nthan Hong Kong dollars, the exchange rate applied includes a\nhandling fee equivalent to 1.95% of each transaction. The\nfee relating to foreign currency transaction is not\napplicable to RMB Business Card.\n就每項以非港元進行的信用卡交易,所用外幣匯率已包括交易金\n額1.95%的手續費。外幣交易有關費用不適用於人民幣公司卡。\nNote: \"CR\" means Credit transaction / balance\n註:「CR」為入賬交易/結餘\n****\nREWARDCASH SUMMARY FOR CARD NUMBER 5199 3100 0018 7511\nREWARDCASH EARNED\n186\n..\nHSBC\n滙豐\nThe Hongkong and Shanghai Banking Corporation Limited\n香港上海滙豐銀行有限公司\nSTATEMENT OF BUSINESS CARD ACCOUNT 公司卡戶口結單\nPage 3 /4\nCardholder's name 持卡人姓名\nAccount number 戶口號碼\nStatement date 結單日\nSEE-MING LEE\n5199 3100 0018 7511\n30 MAY 2022\nPost date\nTrans date\nDescription of transaction\nAmount\n(HKD)\n記賬日期\n交易日期\n交易說明\n金額\nREWARDCASH ADJUSTED\n800\n..\nREWARDCASH REDEEMED\n..\n0\nCONVERTED TO CASH REBATE\n986\n..\n**** REWARDCASH EARNINGS FROM PROMOTIONS FOR 5199 3100 0018 7511 ****\nMARKETING PROGRAMME\nREWARDCASH ADJUSTED\nADJUSTMENT DATE\n2H21 BCARD USAGE CAMPAIGN\n+800\n27-MAY-22\nREWARDCASH ADJUSTMENT\nSTATEMENT BALANCE\n15,683.46\n結單結欠/結餘\nTRANSACTION SUMMARY\nCREDIT/PAYMENT\n43,792.53CR\n..\nPURCHASES AND INSTALMENTS\n46,728.13\n..\nCREDIT ADJUSTMENT\n986.00CR\n..\nTOTAL ACCOUNT BALANCE\n15,683.46\n..\n**\n** FEES AND CHARGES SUMMARY\nFEE/CHARGE TYPE\nAMOUNT\nTOTAL FEES/CHARGES ( EXCLUDING FINANCE CHARGE)\n0.00\n***** FINANCE CHARGE SUMMARY **\nBALANCE TYPE\nANNUALISED PERCENTAGE RATE (APR)\nFINANCE CHARGE\nCASH ADVANCE\n35.61%\n0.00\nPURCHASE\n34. 46%\n0.00\nTOTAL FINANCE CHARGE\n0.00\n* * ****\n*INFORMATION REGARDING MAKING MINIMUM PAYMENT*\nThe below examples are for illustration only. You may visit our Bank\nwebsite at www.hsbc. com.hk for an online credit card repayment\ncalculator for customized information.\nIf you make no additional\nYou will pay off the\n|and you will end up\ncharges, purchases and\noutstanding balance*\ncash advances on this card\npaying an estimated\ntotal of ...\nand each month you pay. . .\nof HKD20,000 in\nabout .. .\n|\n|\n|\nOnly Minimum Payment Due\n|\n26 years **\n|\nHKD67,536 ***\n|\n|\nHKD849\n|\n3 years **\n|\nHKD30,565 ***\n|\n(Savings=HKD36, 971)\n* The outstanding balance of HKD20, 000 is accrued from purchase only.\n** Assume repayment is made on or before the payment due date of each\nstatement month.\n*** Include the outstanding balance of HKD20, 000 and the total finance\ncharge which is accrued daily and calculated at an interest rate of\n2.5% per month (equivalent to an annualised percentage rate of 34.46%\non purchase and 35.61% on cash advance) on the outstanding balance\nuntil it is fully paid.\nThe statement is for your reference only.\nPayment to be\narranged by your corporation.\nThe RewardCash earned by the company have been\ntransferred to your Business Card account.\nIf the statement balance for your credit card account\nHSBC\n滙豐\nThe Hongkong and Shanghai Banking Corporation Limited\n香港上海滙豐銀行有限公司\nSTATEMENT OF BUSINESS CARD ACCOUNT 公司卡戶口結單\nPage 4 / 4\nCardholder's name 持卡人姓名\nAccount number 戶口號碼\nStatement date 結單日\nSEE-MING LEE\n5199 3100 0018 7511\n30 MAY 2022\nPost date\nTrans date\nDescription of transaction\nAmount\n( HKD)\n記賬日期\n交易日期\n交易說明\n金額\nexceeds the credit limit on the statement date, an overlimit\nhandling fee will be debited to the account. If you wish to\nopt out of the over-the-limit facility, you may fill out\nthe form on the back of the statement. For enquiries,\nplease contact us on 2748 8288.\n若您的結單結欠超出該信用卡戶口截至結單日的信用限額,\n本行會徵收超出信用限額手續費。如您欲拒絕接受超出信用限額\n信貸安排,請填妥結單背頁之表格作出指示。如有任何\n查詢,請致電2748 8288。",
            "paragraphs": []
        },
        "created_at": "2024-01-12T21:40:58.905Z"
    },
    {
        "Currency": "JPY",
        "Items": [
            {
                "_source": "03OCT\n01OCT\nPAYPAL *PATREON\nMEMBE\n4029357733\nUS\n16.35",
                "Category": "Meals",
                "Date": "2003-10-01T00:00:00.000Z",
                "Description": "PAYPAL *PATREON\nMEMBE",
                "TotalPrice": 16.35
            },
            {
                "_source": "03OCT\n01OCT\nCLOUDFLARE\nSAN FRANCISCO\nUS\nUSD\n56.00\n448.19\n*EXCHANGE RATE: 8.00339",
                "Category": "Meals",
                "Date": "2003-10-01T00:00:00.000Z",
                "Description": "CLOUDFLARE",
                "TotalPrice": 448.19
            },
            {
                "_source": "03OCT\n01OCT\nBLS*REDIS LABS14085242\nLONDON\nGB\nUSD\n248.00\n1,984.86\n*EXCHANGE RATE: 8.00347",
                "Category": "Credit",
                "Date": "2003-10-01T00:00:00.000Z",
                "Description": "BLS*REDIS LABS14085242"
            },
            {
                "_source": "03OCT",
                "Date": "03OCT"
            },
            {
                "_source": "03OCT\n01OCT\nLINODE . AKAMAI\n6093807100\nUS\nUSD\n4,845.65\n38,782.00\n* EXCHANGE RATE: 8.00347",
                "Date": "2003-10-01T00:00:00.000Z",
                "Description": "LINODE"
            },
            {
                "_source": "03OCT\n01OCT\nSTACK* ZEROSSL\nWIEN\nAT\nUSD\n10.00\n80.03\n*EXCHANGE RATE: 8.00300",
                "Category": "Meals",
                "Date": "03OCT",
                "Description": "STACK* ZEROSSL",
                "TotalPrice": 80.03
            },
            {
                "_source": "03OCT\n02OCT\nBROWSERSTACK. COM\nLEWES\nUS\nUSD\n19.00\n152.07\n* EXCHANGE RATE: 8.00368",
                "Category": "Meals",
                "Date": "03OCT",
                "Description": "BROWSERSTACK. COM",
                "TotalPrice": 152.07
            },
            {
                "_source": "03OCT\n30SEP\nDATYLON\nANTWERPEN\nBE\nUSD\n19.95\n159.67\n*EXCHANGE RATE: 8.00351",
                "Description": "DATYLON"
            },
            {
                "_source": "03OCT\n01OCT\nMAILGUN TECHNOLOGIES,\nSAN ANTONIO\nUS\nUSD\n2.81\n22.49\n*EXCHANGE RATE: 8.00356",
                "Description": "MAILGUN TECHNOLOGIES,\nSAN ANTONIO",
                "TotalPrice": 22.49
            },
            {
                "_source": "05OCT\n04OCT\nNRI*NEW RELIC\n888-643-8776\nUS\nUSD\n338.70\n2,710.74\n*EXCHANGE RATE: 8.00337",
                "Description": "NRI*NEW RELIC"
            },
            {
                "_source": "05OCT\n04OCT\nAPPLE. COM/BILL\nITUNES . COM\nIE\n106.00",
                "Date": "05OCT",
                "Description": "APPLE. COM/BILL",
                "TotalPrice": 106
            },
            {
                "_source": "05OCT\n02OCT\nPAYPAL *OFFGAMERS\n4029357733\nSG\n630.21",
                "Category": "Credit",
                "Date": "05OCT",
                "Description": "PAYPAL *OFFGAMERS",
                "TotalPrice": 630.21
            },
            {
                "_source": "05OCT\n03OCT\nAmazon web services\naws . amazon. co\nUS\nUSD\n285.45\n2,284.59\n*EXCHANGE RATE: 8.00347",
                "Category": "Credit",
                "Date": "05OCT",
                "Description": "Amazon web services\naws",
                "TotalPrice": 2284.59
            },
            {
                "_source": "06OCT\n05OCT\nHUTCHISON TELECOM 3CC\nHONG KONG\nHK\n465.00",
                "Category": "Other",
                "Date": "2005-10-06T00:00:00.000Z",
                "Description": "HUTCHISON TELECOM 3CC",
                "TotalPrice": 465
            },
            {
                "_source": "06OCT\n05OCT\nNYTimes*NYTimes\n800-698-4637\nUS\nUSD\n12.00\n96.04\n*EXCHANGE RATE: 8.00333",
                "Category": "Other",
                "Date": "06OCT",
                "Description": "NYTimes*NYTimes",
                "TotalPrice": 96.04
            },
            {
                "_source": "08OCT\n08OCT\nAPPLE. COM/BILL\nITUNES . COM\nIE\n15.00",
                "Date": "2008-10-08T00:00:00.000Z",
                "Description": "APPLE. COM/BILL",
                "TotalPrice": 15
            },
            {
                "_source": "10OCT\n08OCT\nMPJ MOBILE APPS THE DA\nQUARRY BAY\nHK\n510.03",
                "Category": "Meals",
                "Date": "10OCT",
                "Description": "MPJ MOBILE APPS THE",
                "TotalPrice": 510.03
            },
            {
                "_source": "11OCT\n11OCT\nAPPLE. COM/BILL\nITUNES . COM\nIE\n38.00",
                "Category": "Other",
                "Date": "11OCT",
                "Description": "APPLE. COM/BILL",
                "TotalPrice": 38
            },
            {
                "_source": "12OCT\n10OCT\nPAYPAL *FASTSPRING\n4029357733\nUS\n243.99",
                "Category": "Credit",
                "Date": "12OCT",
                "Description": "PAYPAL *FASTSPRING",
                "TotalPrice": 243.99
            },
            {
                "_source": "12OCT\n11OCT\nAPPLE. COM/BILL\n85221120099\nIE\n1,188.00",
                "Category": "Other",
                "Date": "12OCT",
                "Description": "APPLE. COM/BILL",
                "TotalPrice": 1188
            },
            {
                "_source": "12OCT\n11OCT\nAPPLE. COM/BILL\nITUNES . COM\nIE\n78.00",
                "Category": "Other",
                "Date": "12OCT",
                "Description": "APPLE. COM/BILL",
                "TotalPrice": 78
            },
            {
                "_source": "14OCT\n13OCT\nMIDJOURNEY INC.\nSAN FRANCISCO\nUS\nUSD\n30.00\n240.10\n*EXCHANGE RATE: 8.00333",
                "Category": "Other",
                "Date": "14OCT",
                "Description": "MIDJOURNEY INC.",
                "TotalPrice": 240.1
            },
            {
                "_source": "15OCT\n14OCT\nAPPLE. COM/BILL\nITUNES . COM\nIE\n68.00",
                "Date": "15OCT",
                "Description": "APPLE. COM/BILL",
                "TotalPrice": 68
            },
            {
                "_source": "17OCT\n17OCT\nAPPLE. COM/BILL\nITUNES. COM\nIE\n38.00",
                "Category": "Other",
                "Date": "2017-10-17T00:00:00.000Z",
                "Description": "APPLE. COM/BILL",
                "TotalPrice": 38
            },
            {
                "_source": "17OCT\n14OCT\nDHL SHIPMENT NO 495995\nPLANETENWEG 4\nDE\n557.81",
                "Category": "Credit",
                "Date": "17OCT",
                "Description": "DHL SHIPMENT NO 495995",
                "TotalPrice": 557.81
            },
            {
                "_source": "20OCT\n20OCT\nNetflix.com\nLos Gatos\nSG\n78.00",
                "Category": "Credit",
                "Date": "20OCT",
                "Description": "Netflix.com",
                "TotalPrice": 78
            },
            {
                "_source": "21OCT\n20OCT\nCOURTYARD BY MARRIOTT\nNT\nHK\n6,930.00CR",
                "Category": "Room",
                "Date": "21OCT",
                "Description": "COURTYARD BY MARRIOTT\nNT",
                "TotalPrice": 6930
            },
            {
                "_source": "21OCT\n20OCT\nAPPLE. COM/BILL\nITUNES. COM\nIE\n23.00",
                "Category": "Meals",
                "Date": "21OCT",
                "Description": "APPLE. COM/BILL",
                "TotalPrice": 23
            },
            {
                "_source": "21OCT\n20OCT\nFORTRESS 484 KLN\nHONG KONG\nHK\n1,638.00",
                "Category": "Meals",
                "Date": "21OCT",
                "Description": "FORTRESS 484 KLN",
                "TotalPrice": 1638
            },
            {
                "_source": "22OCT\n21OCT\nAPPLE. COM/BILL\nCORK\nIE\n778.00",
                "Date": "22OCT",
                "Description": "APPLE. COM/BILL",
                "TotalPrice": 778
            },
            {
                "_source": "22OCT\n20OCT\nAPPLE.COM/HK\nHONG KONG\nHK\n298.00",
                "Date": "22OCT",
                "Description": "APPLE.COM/HK",
                "TotalPrice": 298
            },
            {
                "_source": "24OCT\n22OCT\nIFTTT PRO (LEGACY)\nSAN FRANCISCO\nUS\nUSD\n1.99\n15.92",
                "Category": "Credit",
                "Date": "2022-10-24T00:00:00.000Z",
                "Description": "IFTTT PRO (LEGACY)",
                "TotalPrice": 15.92
            },
            {
                "_source": "28OCT\n28OCT\nCREDIT REWARD CASH REBATE\n195.00CR",
                "Category": "Credit",
                "Date": "1928-10-28T00:00:00.000Z",
                "Description": "CREDIT REWARD CASH REBATE",
                "TotalPrice": 195
            },
            {
                "_source": "CASH",
                "Description": "CASH"
            }
        ],
        "MerchantAddress": {
            "_source": "PO BOX NO. 73730, KOWLOON CENTRAL",
            "poBox": "PO BOX NO. 73730",
            "city": "KOWLOON",
            "state": "CENTRAL",
            "streetAddress": "PO BOX NO. 73730"
        },
        "MerchantAliases": [
            "HSBC.",
            "香港上海滙豐銀行有限公司",
            "The Hongkong and Shanghai Banking Corporation Limited",
            "HSBC\n滙豐",
            "The Hongkong and Shanghai Banking Corporation Limited",
            "HSBC\n豐"
        ],
        "MerchantName": "香港上海滙豐銀行有限公司",
        "MerchantPhoneNumber": "+88627488288",
        "TransactionDate": "2022-10-28T00:00:00.000Z",
        "__raw__": {
            "content": "HSBC\n滙豐\nThe Hongkong and Shanghai Banking Corporation Limited\n香港上海滙豐銀行有限公司\nSTATEMENT OF BUSINESS CARD ACCOUNT 公司卡戶口結單\nPage\n1/3\nMR LEE SEE MING\nM\nAccount number 戶口號碼\nC/O SML UNIVERSE LIMITED\n00924\n5199 3100 0018 7511\nFLAT F 27/F BLK 10 VISTA PARADISO\nCard type 信用卡類別\nCredit limit 信用限額\n2 HANG MING ST\nPlatinum Business MC\nHKD75,000.00\nNEW TERRITORIES\nStatement date 結單日\nStatement balance 結單結欠/結餘\n28 OCT 2022\nHKD6, 253.96\nPost date\nTrans date\nDescription of transaction\nAmount\n( HKD)\n記賬日期\n交易日期\n交易說明\n金額\nPREVIOUS BALANCE\n上月結欠/結餘\n19,894.76\n03OCT\n01OCT\nIFS PAYMENT - THANK YOU\n20,320.36CR\n05OCT\n04OCT\nIFS PAYMENT - THANK YOU\n41,691.08CR\n5199 3100 0018 7511\nSEE-MING LEE\nSML UNIVERSE LTD\n30SEP\n29SEP\nADOBE CREATIVE CLOUD\nDublin\nIE\n408.00\n03OCT\n01OCT\nPAYPAL *PATREON\nMEMBE\n4029357733\nUS\n16.35\n03OCT\n01OCT\nCLOUDFLARE\nSAN FRANCISCO\nUS\nUSD\n56.00\n448.19\n*EXCHANGE RATE: 8.00339\n03OCT\n01OCT\nOPEN SOURCE COLLECTIVE\nWALNUT\nUS\nUSD\n5.00\n40.02\n*EXCHANGE RATE: 8.00400\n03OCT\n01OCT\nBLS*REDIS LABS14085242\nLONDON\nGB\nUSD\n248.00\n1,984.86\n*EXCHANGE RATE: 8.00347\n03OCT\n30SEP\nAPPLE. COM/BILL\nITUNES . COM\nIE\n23.00\n03OCT\n01OCT\nLINODE . AKAMAI\n6093807100\nUS\nUSD\n4,845.65\n38,782.00\n* EXCHANGE RATE: 8.00347\n03OCT\n01OCT\nSTACK* ZEROSSL\nWIEN\nAT\nUSD\n10.00\n80.03\n*EXCHANGE RATE: 8.00300\n03OCT\n02OCT\nBROWSERSTACK. COM\nLEWES\nUS\nUSD\n19.00\n152.07\n* EXCHANGE RATE: 8.00368\n03OCT\n30SEP\nDATYLON\nANTWERPEN\nBE\nUSD\n19.95\n159.67\n*EXCHANGE RATE: 8.00351\n03OCT\n01OCT\nMAILGUN TECHNOLOGIES,\nSAN ANTONIO\nUS\nUSD\n2.81\n22.49\n*EXCHANGE RATE: 8.00356\n05OCT\n04OCT\nNRI*NEW RELIC\n888-643-8776\nUS\nUSD\n338.70\n2,710.74\n*EXCHANGE RATE: 8.00337\n05OCT\n04OCT\nAPPLE. COM/BILL\nITUNES . COM\nIE\n106.00\n05OCT\n02OCT\nPAYPAL *OFFGAMERS\n4029357733\nSG\n630.21\nFor important information such as payment methods, fees and charges, lost\nMinimum payment summary 最低付款摘要\ncard reporting, and change of correspondence address / telephone number,\nHKD\nplease visit www.hsbc.com.hk or call our Customer Service Hotline on\nCurrent minimum payment due 目前最低付款額\n63.00\n(852) 2748 8288.\nPlease pay by 須於此付款到期日或之前繳交\n24 NOV 2022\n有關您戶口的重要資料包括付款方式,利息與收費,報失信用卡,以及更改\nOverdue / overlimit due now\n通訊地址/電話號碼,請瀏覽網址www.hsbc.com.hk或聯絡我們的客戶服務熱\n須立即繳交的過期款項/超額款項\n0.00\n線(852) 2748 8288°\nTotal minimum payment due\n最低付款總額\n63.00\nHSBC\n滙豐\nPayment Slip 付款存根\nAccount number 戶口號碼\nCard type 信用卡類別\nIf you are paying by mail, please detach this payment slip and return it with a\n5199 3100 0018 7511\nPlatinum Business MC\ncrossed cheque made payable to \"The Hongkong and Shanghai Banking\nCorporation Limited\" or \"HSBC\" at least three working days before the\nStatement date 結單日\nStatement balance 結單結欠/結餘\npayment due date to our Centre, PO BOX NO. 73730, KOWLOON CENTRAL\n28 OCT 2022\nHKD6, 253.96\nPOST OFFICE HK. Please write your account number on the back of the\nCheque number 支票號碼\nAmount enclosed\n夾附金額\n如欲以郵寄方式付款,請撕下此付款存根,於付款到期日三個工作天前,連同以\ncheque.\n「香港上海滙豐銀行有限公司」或「滙豐」為抬頭的劃線支票,寄回 PO BOX\nNO. 73730, KOWLOON CENTRAL POST OFFICE HK. 信用卡中心收,請於支\n票背面寫上您的戶口號碼。\nThank you for choosing HSBC.多謝選用滙豐服務。\nHSBC\n滙豐\nThe Hongkong and Shanghai Banking Corporation Limited\n香港上海滙豐銀行有限公司\nSTATEMENT OF BUSINESS CARD ACCOUNT 公司卡戶口結單\nPage 2/3\nCardholder's name 持卡人姓名\nAccount number\n1號碼\nStatement date 結單日\nSEE-MING LEE\n5199 3100 0018 7511\n28 OCT 2022\nPost date\nTrans date\nDescription of transaction\nAmount\n( HKD)\n記賬日期\n交易日期\n交易說明\n金額\n05OCT\n03OCT\nAmazon web services\naws . amazon. co\nUS\nUSD\n285.45\n2,284.59\n*EXCHANGE RATE: 8.00347\n06OCT\n05OCT\nHUTCHISON TELECOM 3CC\nHONG KONG\nHK\n465.00\n06OCT\n05OCT\nNYTimes*NYTimes\n800-698-4637\nUS\nUSD\n12.00\n96.04\n*EXCHANGE RATE: 8.00333\n08OCT\n08OCT\nAPPLE. COM/BILL\nITUNES . COM\nIE\n15.00\n10OCT\n08OCT\nMPJ MOBILE APPS THE DA\nQUARRY BAY\nHK\n510.03\n11OCT\n11OCT\nAPPLE. COM/BILL\nITUNES . COM\nIE\n38.00\n12OCT\n10OCT\nPAYPAL *FASTSPRING\n4029357733\nUS\n243.99\n12OCT\n11OCT\nAPPLE. COM/BILL\n85221120099\nIE\n1,188.00\n12OCT\n11OCT\nAPPLE. COM/BILL\nITUNES . COM\nIE\n78.00\n14OCT\n13OCT\nMIDJOURNEY INC.\nSAN FRANCISCO\nUS\nUSD\n30.00\n240.10\n*EXCHANGE RATE: 8.00333\n15OCT\n13OCT\nHKTV Shopping Net C Lt\nHong Kong\nHK\n837.00\nCRI: 66570531041262332\n15OCT\n14OCT\nAPPLE. COM/BILL\nITUNES . COM\nIE\n68.00\n17OCT\n17OCT\nAPPLE. COM/BILL\nITUNES. COM\nIE\n38.00\n17OCT\n14OCT\nDHL SHIPMENT NO 495995\nPLANETENWEG 4\nDE\n557.81\n20OCT\n20OCT\nNetflix.com\nLos Gatos\nSG\n78.00\n21OCT\n20OCT\nCOURTYARD BY MARRIOTT\nNT\nHK\n6,930.00CR\n21OCT\n20OCT\nAPPLE. COM/BILL\nITUNES. COM\nIE\n23.00\n21OCT\n20OCT\nFORTRESS 484 KLN\nHONG KONG\nHK\n1,638.00\n22OCT\n21OCT\nAPPLE. COM/BILL\nCORK\nIE\n778.00\n22OCT\n20OCT\nAPPLE.COM/HK\nHONG KONG\nHK\n298.00\n24OCT\n22OCT\nIFTTT PRO (LEGACY)\nSAN FRANCISCO\nUS\nUSD\n1.99\n15.92\n*EXCHANGE RATE: 8.00000\n25OCT\n24OCT\nAPPLE. COM/BILL\nITUNES . COM\nIE\n23.00\n26OCT\n25OCT\nAPPLE. COM/BILL\nCORK\nIE\n769.47CR\n26OCT\n25OCT\nAPPLE. COM/BILL\n85221120099\nIE\n1,188.00\n28OCT\n28OCT\nCREDIT REWARD CASH REBATE\n195.00CR\n*For credit card transactions effected in currencies other\nthan Hong Kong dollars, the exchange rate applied includes a\nhandling fee equivalent to 1.95% of each transaction. The\nfee relating to foreign currency transaction is not\napplicable to RMB Business Card.\n就每項以非港元進行的信用卡交易,所用外幣匯率已包括交易金\n額1.95%的手續費。外幣交易有關費用不適用於人民幣公司卡。\nNote: \"CR\" means Credit transaction / balance\n註:「CR」為入賬交易/結餘\n****\nREWARDCASH SUMMARY FOR CARD NUMBER 5199 3100 0018 7511 **\n**\nREWARDCASH EARNED\n195\n..\nREWARDCASH ADJUSTED\n:\n0\nREWARDCASH REDEEMED\n0\n..\nCONVERTED TO CASH REBATE\n:\n195\nSTATEMENT BALANCE\n結單結欠/結餘\n6,253.96\nTRANSACTION SUMMARY\n*\nCREDIT/PAYMENT\n69,710.91CR\n..\nPURCHASES AND INSTALMENTS\n:\n56,265.11\nCREDIT ADJUSTMENT\n195.00CR\n..\nTOTAL ACCOUNT BALANCE\n6,253.96\n..\nFEES AND CHARGES SUMMARY\nFEE/CHARGE TYPE\nAMOUNT\nTOTAL FEES/CHARGES ( EXCLUDING FINANCE CHARGE)\n0.00\n** FINANCE CHARGE SUMMARY\n**\nHSBC\n滙豐\nThe Hongkong and Shanghai Banking Corporation Limited\n香港上海滙豐銀行有限公司\nSTATEMENT OF BUSINESS CARD ACCOUNT 公司卡戶口結單\nPage\n3/3\nCardholder's name 持卡人姓名\nAccount number 戶口號碼\nStatement date 結單日\nSEE-MING LEE\n5199 3100 0018 7511\n28 OCT 2022\nPost date\nTrans date\nDescription of transaction\nAmount\n( HKD)\n記賬日期\n交易日期\n交易說明\n金額\nBALANCE TYPE\nANNUALISED PERCENTAGE RATE (APR)\nFINANCE CHARGE\nCASH ADVANCE\n35.61%\n0.00\nPURCHASE\n34.46%\n0.00\nTOTAL FINANCE CHARGE\n0.00\n* * * * **\n*INFORMATION REGARDING MAKING MINIMUM PAYMENT*\nThe below examples are for illustration only. You may visit our Bank\nwebsite at www.hsbc. com.hk for an online credit card repayment\ncalculator for customized information.\nIf you make no additional\nYou will pay off the\n| and you will end up\ncharges, purchases and\noutstanding balance*\ncash advances on this card\nof HKD20, 000 in\npaying an estimated\ntotal of ...\nand each month you pay. ..\nabout. . .\n|\n|\n|\nOnly Minimum Payment Due\n|\n26 years **\n|\nHKD67,536 ***\n|\n|\nHKD849\n|\n3 years **\n|\nHKD30,565 ***\n|\n(Savings=HKD36, 971)\n* The outstanding balance of HKD20, 000 is accrued from purchase only.\n** Assume repayment is made on or before the payment due date of each\nstatement month.\n*** Include the outstanding balance of HKD20, 000 and the total finance\ncharge which is accrued daily and calculated at an interest rate of\n2.5% per month (equivalent to an annualised percentage rate of 34.46%\non purchase and 35.61% on cash advance) on the outstanding balance\nuntil it is fully paid.\nThe statement is for your reference only.\nPayment to be\narranged by your corporation.\nThe RewardCash earned by the company have been\ntransferred to your Business Card account.\nIf the statement balance for your credit card account\nexceeds the credit limit on the statement date, an overlimit\nhandling fee will be debited to the account. If you wish to\nopt out of the over-the-limit facility, you may fill out\nthe form on the back of the statement. For enquiries,\nplease contact us on 2748 8288.\n若您的結單結欠超出該信用卡戶口截至結單日的信用限額,\n本行會徵收超出信用限額手續費。如您欲拒絕接受超出信用限額\n信貸安排,請填妥結單背頁之表格作出指示。如有任何\n查詢,請致電2748 8288。",
            "paragraphs": []
        },
        "created_at": "2024-01-12T21:40:58.917Z"
    },
    {
        "doc1_Currency": "JPY",
        "doc1_Items": [
            {
                "_source": "02SEP\n01SEP\nPAYPAL *PATREON\nMEMBE\n4029357733\nUS\n16.35",
                "Description": "*PATREON",
                "TotalPrice": 16.35
            },
            {
                "_source": "02SEP\n01SEP\nMAILGUN TECHNOLOGIES,\nSAN ANTONIO\nUS\nUSD\n2.83\n22.64\n*EXCHANGE RATE: 8.00000\n02SEP\n01SEP\nLINODE . AKAMAI\n6093807100\nUS\nUSD\n4,637.94\n37,116.20\n*EXCHANGE RATE: 8.00273",
                "Category": "Credit",
                "Description": ". AKAMAI"
            },
            {
                "_source": "02SEP\n01SEP\nCLOUDFLARE\nSAN FRANCISCO\nUS\nUSD\n61.80\n494.57\n*EXCHANGE RATE: 8.00275",
                "Category": "Meals",
                "Date": "2002-09-01T00:00:00.000Z",
                "Description": "CLOUDFLARE",
                "TotalPrice": 494.57
            },
            {
                "_source": "02SEP\n01SEP\nPAYPAL *OFFGAMERS\n4029357733\nSG\n1,315.74",
                "Category": "Meals",
                "Date": "02SEP",
                "Description": "PAYPAL *OFFGAMERS",
                "TotalPrice": 1315.74
            },
            {
                "_source": "02SEP\n01SEP\nOPEN SOURCE COLLECTIVE\nWALNUT\nUS\nUSD\n5.00\n40.02\n*EXCHANGE RATE: 8.00400",
                "Category": "Meals",
                "Date": "02SEP",
                "Description": "OPEN SOURCE",
                "TotalPrice": 40.02
            },
            {
                "_source": "03SEP\n02SEP\nBROWSERSTACK. COM\nLEWES\nUS\nUSD\n19.00\n152.06\n*EXCHANGE RATE: 8.00316",
                "Category": "Meals",
                "Description": "BROWSERSTACK. COM",
                "TotalPrice": 152.06
            },
            {
                "_source": "03SEP\n02SEP\nSTACK* ZEROSSL\nWIEN\nAT\nUSD\n10.00\n80.03\n*EXCHANGE RATE: 8.00300",
                "Description": "STACK* ZEROSSL"
            },
            {
                "_source": "05SEP\n02SEP\nHKTV Shopping Net C Lt\nHong Kong\nHK\n589.00\nCRI : 66213944631864017",
                "Date": "05SEP",
                "Description": "HKTV Shopping Net C Lt"
            }
        ],
        "doc1_MerchantAddress": {
            "_source": "PO BOX NO. 73730, KOWLOON CENTRAL",
            "poBox": "PO BOX NO. 73730",
            "city": "KOWLOON",
            "state": "CENTRAL",
            "streetAddress": "PO BOX NO. 73730"
        },
        "doc1_MerchantAliases": [
            "HSBC.",
            "The Hongkong and Shanghai Limited",
            "香港上海滙",
            "HSBC\n滙豐"
        ],
        "doc1_MerchantName": "香港上海滙豐銀行有限公司",
        "doc1_MerchantPhoneNumber": "+88685227488288",
        "doc2_Items": [
            {
                "_source": "05SEP\n03SEP\nAmazon web services\naws . amazon. co\nUS\nUSD\n263.63\n2,109.81\n*EXCHANGE RATE: 8.00292",
                "Description": "Amazon web services\naws",
                "TotalPrice": 2109.81
            },
            {
                "_source": "05SEP\n03SEP\nNRI*NEW RELIC\n888-643-8776\nUS\nUSD\n436.20\n3,490.88\n*EXCHANGE RATE: 8.00293",
                "Description": "NRI*NEW RELIC",
                "ProductCode": "03SEP",
                "TotalPrice": 3490.88
            },
            {
                "_source": "05SEP\n03SEP\nZAPIER.COM/CHARGE\nSAN FRANCISCO\nUS\nUSD\n240.00\n1,920.71\n*EXCHANGE RATE: 8.00296",
                "Description": "ZAPIER.COM/CHARGE",
                "Price": 240,
                "TotalPrice": 1920.71
            },
            {
                "_source": "05SEP\n03SEP\nMIDJOURNEY INC.\nSAN FRANCISCO\nUS\nUSD\n10.00\n80.03\n*EXCHANGE RATE: 8.00300\n05SEP\n04SEP\nHUTCHISON TELECOM 3CC\nHONG KONG\nHK\n197.00",
                "Description": "MIDJOURNEY INC.\nHUTCHISON TELECOM 3CC",
                "TotalPrice": 80.03
            },
            {
                "_source": "05SEP\n31AUG\nDHL SHIPMENT NO 861812\nPLANETENWEG 4\nDE\n622.64\n05SEP\n04SEP\n*quinterovinny\nHK\n210.55",
                "Description": "DHL SHIPMENT NO 861812\n*quinterovinny",
                "Price": 31,
                "TotalPrice": 622.64
            },
            {
                "_source": "08SEP\n07SEP\nNYTimes *NYTimes\n800-698-4637\nUS\nUSD\n12.00\n96.04\n*EXCHANGE RATE: 8.00333\n08SEP\n07SEP\nPAYPAL *OREILLYMEDI\n4029357733\nUS\n318.90",
                "Description": "NYTimes *NYTimes\nPAYPAL *OREILLYMEDI",
                "TotalPrice": 96.04
            },
            {
                "_source": "08SEP\n07SEP\nAPPLE. COM/BILL\nITUNES . COM\nIE\n38.00",
                "Description": "APPLE. COM/BILL",
                "TotalPrice": 38
            },
            {
                "_source": "09SEP\n08SEP\nHA-PRINCE OF WALES HOS\nHONG KONG\nHK\n3,480.00",
                "Description": "HA-PRINCE OF WALES HOS",
                "TotalPrice": 3480
            },
            {
                "_source": "09SEP\n09SEP\nAPPLE. COM/BILL\nITUNES . COM\nIE\n124.00",
                "Description": "APPLE. COM/BILL",
                "TotalPrice": 124
            },
            {
                "_source": "*TIDAL HIFI\n35314369001\nSE\n96.00",
                "Description": "*TIDAL HIFI",
                "TotalPrice": 96
            },
            {
                "_source": "13SEP\n10SEP\nPAYPAL",
                "Description": "PAYPAL"
            },
            {
                "_source": "13SEP\n11SEP\nAPPLE. COM/BILL\nITUNES . COM\nIE\n78.00",
                "Description": "APPLE. COM/BILL",
                "TotalPrice": 78
            },
            {
                "_source": "13SEP\n12SEP\nUniqlo Hong Kong Limit\nTsim Sha Tsui\nHK\n697.00",
                "Description": "Uniqlo Hong Kong Limit\nTsim Sha Tsui",
                "TotalPrice": 697
            },
            {
                "_source": "14SEP\n13SEP\nMIDJOURNEY INC.\nSAN FRANCISCO\nUS\nUSD\n27.20\n217.67\n*EXCHANGE RATE: 8.00257",
                "Description": "MIDJOURNEY INC.",
                "Price": 27.2,
                "TotalPrice": 217.67
            },
            {
                "_source": "15SEP\n14SEP\nAPPLE. COM/BILL\nITUNES. COM\nIE\n38.00",
                "Description": "APPLE. COM/BILL",
                "Price": 14,
                "TotalPrice": 38
            },
            {
                "_source": "16SEP\n15SEP\nPAYPAL *TWITCHINTER\n4029357733\nUS\n31.99\n17SEP\n16SEP\nAPPLE. COM/BILL\nITUNES . COM\nIE\n36.00",
                "Description": "15SEP\nPAYPAL *TWITCHINTER\n16SEP\nAPPLE. COM/BILL\nITUNES . COM",
                "ProductCode": "4029357733",
                "TotalPrice": 36
            },
            {
                "_source": "17SEP\n16SEP\nZARA\n36\nHONG KONG\nHK\n499.00",
                "Description": "ZARA",
                "TotalPrice": 499
            },
            {
                "_source": "17SEP\n16SEP\nUNIQLO HONG KONG LTD\nSHATIN\nHK\n843.50",
                "Description": "UNIQLO HONG KONG LTD\nSHATIN",
                "TotalPrice": 843.5
            },
            {
                "_source": "17SEP\n15SEP\nAPPLE. COM/HK\nHONG KONG\nHK\n229.00",
                "Description": "APPLE. COM/HK",
                "Price": 15,
                "TotalPrice": 229
            },
            {
                "_source": "17SEP\n16SEP\nCHF*9Lives Ensihoito O\nTAMPERE\nFI\nEUR\n120.00\n962.08\n*EXCHANGE RATE: 8.01733",
                "Description": "CHF*9Lives Ensihoito O\nTAMPERE",
                "Price": 120,
                "TotalPrice": 962.08
            },
            {
                "_source": "19SEP\n17SEP\nPAYPAL *OUTPUT\n4029357733\nUS\n81.77",
                "Description": "PAYPAL *OUTPUT",
                "ProductCode": "4029357733",
                "TotalPrice": 81.77
            },
            {
                "_source": "19SEP\n17SEP\nIFTTT PRO (LEGACY)\nSAN FRANCISCO\nUS\nUSD\n1.99\n15.92\n*EXCHANGE RATE: 8.00000\n20SEP",
                "Description": "IFTTT PRO (LEGACY)",
                "TotalPrice": 15.92
            },
            {
                "_source": "20SEP\n53.00",
                "TotalPrice": 53
            },
            {
                "_source": "20SEP\n19SEP\nASIA LIMITED\nHK\n4,326.00",
                "Description": "ASIA LIMITED",
                "TotalPrice": 4326
            },
            {
                "_source": "21SEP\n20SEP\nT-MOBILE HOTSPOT GMBH\nBONN\nDE\nEUR\n25.00\n200.68\n*EXCHANGE RATE: 8.02720",
                "Description": "T-MOBILE HOTSPOT GMBH\nBONN",
                "Price": 25,
                "TotalPrice": 200.68
            },
            {
                "_source": "21SEP\n20SEP\nAPPLE. COM/BILL\nITUNES. COM\nIE\n313.00\n22SEP\n21SEP\nBISTRO GIMIS, RDB SEAS\nHELSINKI\nFI\nEUR\n27.00\n217.18\n*EXCHANGE RATE: 8.04370",
                "Description": "20SEP\nAPPLE. COM/BILL\nITUNES. COM\nBISTRO GIMIS, RDB SEAS\nHELSINKI",
                "Price": "EUR",
                "TotalPrice": 313
            },
            {
                "_source": "22SEP\n21SEP\nVFI*Minato Team Sushi\nHELSINKI\nFI\nEUR\n13.70\n110.20\n*EXCHANGE RATE: 8.04380",
                "Description": "VFI*Minato Team Sushi\nHELSINKI",
                "TotalPrice": 110.2
            },
            {
                "_source": "22SEP\n21SEP\nLUFTHANSA RETAIL INMOT\nKOELN\nDE\nEUR\n6.00",
                "Description": "LUFTHANSA RETAIL INMOT\nKOELN"
            },
            {
                "_source": "48.26\n*EXCHANGE RATE: 8.04333",
                "TotalPrice": 48.26
            },
            {
                "_source": "22SEP\n21SEP\nT-MOBILE HOTSPOT GMBH\nBONN\nDE\nEUR\n12.00\n96.53\n* EXCHANGE RATE: 8.04417",
                "Description": "T-MOBILE HOTSPOT GMBH\nBONN",
                "Price": "EUR",
                "TotalPrice": 96.53
            }
        ],
        "doc2_MerchantName": "香港上海滙豐銀行有限公司\nHongkong and Limited",
        "doc2_TransactionDate": "2022-09-29T00:00:00.000Z",
        "doc3_Currency": "JPY",
        "doc3_Items": [
            {
                "_source": "26SEP\n24SEP\nMORTON MOMENT OY\nHelsinki\nFI\nEUR\n9.90\n78.06\n*EXCHANGE RATE: 7. 88485",
                "Category": "Credit",
                "Date": "26SEP",
                "Description": "MORTON MOMENT OY",
                "TotalPrice": 78.06
            },
            {
                "_source": "26SEP\n24SEP\nVerifone Fin*Compass\nHelsinki\nFI\nEUR\n3.50\n27.60\n*EXCHANGE RATE: 7. 88571",
                "Category": "Other",
                "Date": "1926-09-24T00:00:00.000Z",
                "Description": "Verifone Fin*Compass\nHelsinki",
                "TotalPrice": 27.6
            },
            {
                "_source": "26SEP\n23SEP\nLUFTHAN2204000825139\nVANTAA\nFI\nEUR\n210.00\n1,665.73\n* EXCHANGE RATE: 7.93205",
                "Date": "1926-09-23T00:00:00.000Z",
                "Description": "LUFTHAN2204000825139\nVANTAA"
            },
            {
                "_source": "26SEP\n24SEP\nMORTON MOMENT OY\nHelsinki\nFI\nEUR\n22.40\n176.64\n*EXCHANGE RATE: 7. 88571",
                "Category": "Tax",
                "Date": "1926-09-24T00:00:00.000Z",
                "Description": "MORTON MOMENT OY",
                "TotalPrice": 176.64
            },
            {
                "_source": "26SEP\n24SEP\nHeatherMill Oy\nHelsinki\nFI\nEUR\n9.00\n70.97\n*EXCHANGE RATE: 7.88556",
                "Category": "Meals",
                "Date": "1926-09-24T00:00:00.000Z",
                "Description": "HeatherMill Oy",
                "TotalPrice": 70.97
            },
            {
                "_source": "26SEP\n23SEP\nHSL Mobiili\nHSL\nFI\nEUR\n2.80\n22.08\n*EXCHANGE RATE: 7. 88571",
                "Category": "Credit",
                "Date": "26SEP",
                "Description": "HSL Mobiili",
                "TotalPrice": 22.08
            },
            {
                "_source": "26SEP\n23SEP\nVerifone Fin*Compass\nHelsinki\nFI\nEUR\n2.90\n23.00\n*EXCHANGE RATE: 7.93103",
                "Category": "Credit",
                "Date": "26SEP",
                "Description": "Verifone Fin*Compass",
                "TotalPrice": 23
            },
            {
                "_source": "26SEP\n26SEP\nHMSHost Helsinki Airpo\nHelsinki\nFI\n29.76",
                "Date": "26SEP",
                "Description": "HMSHost Helsinki Airpo",
                "TotalPrice": 29.76
            },
            {
                "_source": "26SEP\n25SEP\nT-MOBILE HOTSPOT GMBH\nBONN\nDE\nEUR\n10.00\n78.86\n*EXCHANGE RATE: 7.88600",
                "Date": "26SEP",
                "Description": "T-MOBILE HOTSPOT GMBH",
                "TotalPrice": 78.86
            },
            {
                "_source": "26SEP\n26SEP\nHMSHost Helsinki Airpo\nHelsinki\nFI\n29.76",
                "Date": "26SEP",
                "Description": "HMSHost Helsinki Airpo",
                "TotalPrice": 29.76
            },
            {
                "_source": "26SEP\n25SEP\nVerifone Fin*Compass\nHelsinki\nFI\nEUR\n3.50\n27.60\n*EXCHANGE RATE: 7. 88571",
                "Date": "26SEP",
                "Description": "Verifone Fin*Compass",
                "TotalPrice": 27.6
            },
            {
                "_source": "27SEP\n26SEP\nLagard re Fil. 275\nFrankfurt-Flu\nDE\nEUR\n6.50\n51.26\n*EXCHANGE RATE: 7. 88615",
                "Date": "1927-09-26T00:00:00.000Z",
                "Description": "Lagard re Fil. 275\nFrankfurt-Flu"
            },
            {
                "_source": "27SEP\n26SEP\nALEPA HKI-VANTAA LENTO\nVANTAA\nFI\nEUR\n11.90\n93.83\n*EXCHANGE RATE: 7. 88487",
                "Date": "1927-09-26T00:00:00.000Z",
                "Description": "ALEPA HKI-VANTAA LENTO\nVANTAA",
                "TotalPrice": 93.83
            },
            {
                "_source": "27SEP\n26SEP\nPAYPAL *HAYU\n35314369001\nGB\n40.00",
                "Category": "Meals",
                "Date": "1927-09-26T00:00:00.000Z",
                "Description": "PAYPAL *HAYU",
                "TotalPrice": 40
            },
            {
                "_source": "27SEP\n26SEP\nT-MOBILE HOTSPOT GMBH\nBONN\nDE\nEUR\n25.00\n194.29\n*EXCHANGE RATE: 7.77160",
                "Category": "Meals",
                "Date": "27SEP",
                "Description": "T-MOBILE HOTSPOT GMBH\nBONN",
                "TotalPrice": 194.29
            },
            {
                "_source": "27SEP\n26SEP\nNETS*Select Service\nVantaa\nDK\nEUR\n15.70\n123.81\n*EXCHANGE RATE: 7. 88599",
                "Category": "Other",
                "Date": "27SEP",
                "Description": "NETS*Select Service",
                "TotalPrice": 123.81
            },
            {
                "_source": "27SEP\n26SEP\nT-MOBILE HOTSPOT GMBH\nBONN\nDE\nEUR\n12.00\n94.63\n* EXCHANGE RATE: 7.88583",
                "Category": "Meals",
                "Description": "T-MOBILE HOTSPOT GMBH\nBONN",
                "TotalPrice": 94.63
            },
            {
                "_source": "27SEP\n26SEP\nAAVA MEDICAL CENTRE AI\nVANTAA\nFI\nEUR\n300.00\n2,365.68\n*EXCHANGE RATE: 7.88560",
                "Description": "MEDICAL CENTRE AI\nVANTAA"
            },
            {
                "_source": "28SEP\n25SEP\nPAYPAL *FREEPIK\n35314369001\nES\n724.51",
                "Category": "Meals",
                "Date": "28SEP",
                "Description": "PAYPAL *FREEPIK",
                "TotalPrice": 724.51
            },
            {
                "_source": "28SEP\n25SEP\nPAYPAL *FREEPIK\n35314369001\nES\n869.51",
                "Date": "28SEP",
                "Description": "PAYPAL *FREEPIK",
                "TotalPrice": 869.51
            },
            {
                "_source": "29SEP\n28SEP\nAPPLE. COM/BILL\nITUNES. COM\nIE\n38.00",
                "Date": "29SEP",
                "Description": "APPLE. COM/BILL",
                "TotalPrice": 38
            },
            {
                "_source": "29SEP\n29SEP\nCREDIT REWARD CASH REBATE\n296.00CR",
                "Date": "29SEP",
                "Description": "REWARD CASH"
            }
        ],
        "doc3_MerchantAliases": [
            "HSBC\n豐"
        ],
        "doc3_MerchantName": "香港上海滙豐銀行有限公司",
        "doc4_MerchantName": "HSBC\n滙豐",
        "doc4_MerchantPhoneNumber": "+88627488288",
        "doc4_TransactionDate": "2022-09-29T00:00:00.000Z",
        "__raw__": {
            "content": "HSBC\n滙豐\nThe Hongkong and Shanghai Banking Corporation Limited\n香港上海滙豐銀行有限公司\nSTATEMENT OF BUSINESS CARD ACCOUNT 公司卡戶口結單\nPage\n1/4\nMR LEE SEE MING\nM\nAccount number 戶口號碼\nC/O SML UNIVERSE LIMITED\n00954\n5199 3100 0018 7511\nFLAT F 27/F BLK 10 VISTA PARADISO\nCard type 信用卡類別\nCredit limit 信用限額\n2 HANG MING ST\nPlatinum Business MC\nHKD75,000.00\nNEW TERRITORIES\nStatement date 結單日\nStatement balance 結單結欠/結餘\n29 SEP 2022\nHKD19, 894.76\nPost date\nTrans date\nDescription of transaction\nAmount\n(HKD)\n記賬日期\n交易日期\n交易說明\n金額\nPREVIOUS BALANCE\n上月結欠/結餘\n9,349.90\n31AUG\n31AUG\nIFS PAYMENT - THANK YOU\n9,349.90CR\n05SEP\n03SEP\nIFS PAYMENT - THANK YOU\n40,250.16CR\n13SEP\n13SEP\nIFS PAYMENT - THANK YOU\n13,509.65CR\n5199 3100 0018 7511\nSEE-MING LEE\nSML UNIVERSE LTD\n31AUG\n30AUG\nDATYLON\nANTWERPEN\nBE\nUSD\n19.95\n159.64\n*EXCHANGE RATE: 8.00201\n31AUG\n30AUG\nADOBE CREATIVE CLOUD\nDublin\nIE\n408.00\n01SEP\n31AUG\nHKTV Shopping Net C Lt\nHong Kong\nHK\n599.00\nCRI : 66194121190768000\n01SEP\n31AUG\nAPPLE. COM/BILL\nITUNES . COM\nIE\n78.00\n02SEP\n01SEP\nPAYPAL *PATREON\nMEMBE\n4029357733\nUS\n16.35\n02SEP\n01SEP\nMAILGUN TECHNOLOGIES,\nSAN ANTONIO\nUS\nUSD\n2.83\n22.64\n*EXCHANGE RATE: 8.00000\n02SEP\n01SEP\nLINODE . AKAMAI\n6093807100\nUS\nUSD\n4,637.94\n37,116.20\n*EXCHANGE RATE: 8.00273\n02SEP\n01SEP\nCLOUDFLARE\nSAN FRANCISCO\nUS\nUSD\n61.80\n494.57\n*EXCHANGE RATE: 8.00275\n02SEP\n01SEP\nPAYPAL *OFFGAMERS\n4029357733\nSG\n1,315.74\n02SEP\n01SEP\nOPEN SOURCE COLLECTIVE\nWALNUT\nUS\nUSD\n5.00\n40.02\n*EXCHANGE RATE: 8.00400\n03SEP\n02SEP\nBROWSERSTACK. COM\nLEWES\nUS\nUSD\n19.00\n152.06\n*EXCHANGE RATE: 8.00316\n03SEP\n02SEP\nSTACK* ZEROSSL\nWIEN\nAT\nUSD\n10.00\n80.03\n*EXCHANGE RATE: 8.00300\n05SEP\n02SEP\nHKTV Shopping Net C Lt\nHong Kong\nHK\n589.00\nCRI : 66213944631864017\nFor important information such as payment methods, fees and charges, lost\ncard reporting, and change of correspondence address / telephone number,\nMinimum payment summary 最低付款摘要\nHKD\nplease visit www.hsbc.com.hk or call our Customer Service Hotline on\nCurrent minimum payment due 目前最低付款額\n199.00\n(852) 2748 8288.\nPlease pay by 須於此付款到期日或之前繳交\n25 OCT 2022\n有關您戶口的重要資料包括付款方式,利息與收費,報失信用卡,以及更改\nOverdue / overlimit due now\n通訊地址/電話號碼,請瀏覽網址www.hsbc.com.hk或聯絡我們的客戶服務熱\n須立即繳交的過期款項/超額款項\n0.00\n線(852) 2748 8288°\nTotal minimum payment due\n最低付款總額\n199.00\nHSBC\n滙豐\nPayment Slip 付款存根\nAccount number 戶口號碼\nCard type 信用卡類別\nIf you are paying by mail, please detach this payment slip and return it with a\n5199 3100 0018 7511\nPlatinum Business MC\ncrossed cheque made payable to \"The Hongkong and Shanghai Banking\nCorporation Limited\" or \"HSBC\" at least three working days before the\nStatement date 結單日\nStatement balance 結單結欠/結餘\npayment due date to our Centre, PO BOX NO. 73730, KOWLOON CENTRAL\n29 SEP 2022\nHKD19, 894.76\nPOST OFFICE HK. Please write your account number on the back of the\nCheque number 支票號碼\nAmount enclosed\n夾附金額\n如欲以郵寄方式付款,請撕下此付款存根,於付款到期日三個工作天前,連同以\ncheque.\n「香港上海滙豐銀行有限公司」或「滙豐」為抬頭的劃線支票,寄回 PO BOX\nNO. 73730, KOWLOON CENTRAL POST OFFICE HK. 信用卡中心收,請於支\n票背面寫上您的戶口號碼。\nThank you for choosing HSBC.多謝選用滙豐服務。\nHSBC\n滙豐\nThe Hongkong and Shanghai Banking Corporation Limited\n香港上海滙豐銀行有限公司\nSTATEMENT OF BUSINESS CARD ACCOUNT 公司卡戶口結單\nPage 2 /4\nCardholder's name 持卡人姓名\nAccount number\n1號碼\nStatement date 結單日\nSEE-MING LEE\n5199 3100 0018 7511\n29 SEP 2022\nPost date\nTrans date\nDescription of transaction\nAmount\n( HKD )\n記賬日期\n交易日期\n交易說明\n金額\n05SEP\n03SEP\nAmazon web services\naws . amazon. co\nUS\nUSD\n263.63\n2,109.81\n*EXCHANGE RATE: 8.00292\n05SEP\n03SEP\nNRI*NEW RELIC\n888-643-8776\nUS\nUSD\n436.20\n3,490.88\n*EXCHANGE RATE: 8.00293\n05SEP\n03SEP\nZAPIER.COM/CHARGE\nSAN FRANCISCO\nUS\nUSD\n240.00\n1,920.71\n*EXCHANGE RATE: 8.00296\n05SEP\n03SEP\nMIDJOURNEY INC.\nSAN FRANCISCO\nUS\nUSD\n10.00\n80.03\n*EXCHANGE RATE: 8.00300\n05SEP\n04SEP\nHUTCHISON TELECOM 3CC\nHONG KONG\nHK\n197.00\n05SEP\n31AUG\nDHL SHIPMENT NO 861812\nPLANETENWEG 4\nDE\n622.64\n05SEP\n04SEP\nPAYPAL *quinterovinny\n4029357733\nHK\n210.55\n08SEP\n07SEP\nNYTimes *NYTimes\n800-698-4637\nUS\nUSD\n12.00\n96.04\n*EXCHANGE RATE: 8.00333\n08SEP\n07SEP\nPAYPAL *OREILLYMEDI\n4029357733\nUS\n318.90\n08SEP\n07SEP\nAPPLE. COM/BILL\nITUNES . COM\nIE\n38.00\n09SEP\n08SEP\nHA-PRINCE OF WALES HOS\nHONG KONG\nHK\n3,480.00\n09SEP\n09SEP\nAPPLE. COM/BILL\nITUNES . COM\nIE\n124.00\n13SEP\n10SEP\nPAYPAL *TIDAL HIFI\n35314369001\nSE\n96.00\n13SEP\n11SEP\nAPPLE. COM/BILL\nITUNES . COM\nIE\n78.00\n13SEP\n12SEP\nUniqlo Hong Kong Limit\nTsim Sha Tsui\nHK\n697.00\n14SEP\n13SEP\nMIDJOURNEY INC.\nSAN FRANCISCO\nUS\nUSD\n27.20\n217.67\n*EXCHANGE RATE: 8.00257\n15SEP\n14SEP\nAPPLE. COM/BILL\nITUNES. COM\nIE\n38.00\n16SEP\n15SEP\nPAYPAL *TWITCHINTER\n4029357733\nUS\n31.99\n17SEP\n16SEP\nAPPLE. COM/BILL\nITUNES . COM\nIE\n36.00\n17SEP\n16SEP\nZARA\n36\nHONG KONG\nHK\n499.00\n17SEP\n16SEP\nUNIQLO HONG KONG LTD\nSHATIN\nHK\n843.50\n17SEP\n15SEP\nAPPLE. COM/HK\nHONG KONG\nHK\n229.00\n17SEP\n16SEP\nCHF*9Lives Ensihoito O\nTAMPERE\nFI\nEUR\n120.00\n962.08\n*EXCHANGE RATE: 8.01733\n19SEP\n17SEP\nPAYPAL *OUTPUT\n4029357733\nUS\n81.77\n19SEP\n17SEP\nIFTTT PRO (LEGACY)\nSAN FRANCISCO\nUS\nUSD\n1.99\n15.92\n*EXCHANGE RATE: 8.00000\n20SEP\n19SEP\nNetflix.com\nLos Gatos\nSG\n78.00\n20SEP\n19SEP\nAPPLE. COM/BILL\nITUNES . COM\nIE\n53.00\n20SEP\n19SEP\nSAMSONITE ASIA LIMITED\nNEW TERRITORI\nHK\n4,326.00\n21SEP\n20SEP\nT-MOBILE HOTSPOT GMBH\nBONN\nDE\nEUR\n25.00\n200.68\n*EXCHANGE RATE: 8.02720\n21SEP\n20SEP\nAPPLE. COM/BILL\nITUNES. COM\nIE\n313.00\n22SEP\n21SEP\nBISTRO GIMIS, RDB SEAS\nHELSINKI\nFI\nEUR\n27.00\n217.18\n*EXCHANGE RATE: 8.04370\n22SEP\n21SEP\nVFI*Minato Team Sushi\nHELSINKI\nFI\nEUR\n13.70\n110.20\n*EXCHANGE RATE: 8.04380\n22SEP\n21SEP\nLUFTHANSA RETAIL INMOT\nKOELN\nDE\nEUR\n6.00\n48.26\n*EXCHANGE RATE: 8.04333\n22SEP\n21SEP\nPADDLE.NET* ASTUTEGRAP\nLONDON\nGB\nUSD\n139.00\n1,112.47\n*EXCHANGE RATE: 8.00338\n22SEP\n21SEP\nT-MOBILE HOTSPOT GMBH\nBONN\nDE\nEUR\n12.00\n96.53\n* EXCHANGE RATE: 8.04417\n23SEP\n21SEP\nPAYPAL *GITHUB INC\n4029357733\nUS\n73.59\n23SEP\n22SEP\nWolt\nHelsinki\nFI\nEUR\n18.80\n149.12\n*EXCHANGE RATE: 7.93191\n24SEP\n23SEP\nPAYPAL *WAKATIME\n4029357733\nHK\n73.59\n24SEP\n23SEP\nSamsonite Store\nHelsinki\nFI\nEUR\n279.00\n2,213.04\n*EXCHANGE RATE: 7.93204\n26SEP\n23SEP\nVerifone Fin*Compass\nHelsinki\nFI\nEUR\n2.90\n23.00\n*EXCHANGE RATE: 7.93103\n26SEP\n23SEP\nBISTRO GIMIS, RDB SEAS\nHELSINKI\nFI\nEUR\n21.00\n165.60\n*EXCHANGE RATE: 7.88571\n26SEP\n23SEP\nVerifone Fin*Compass\nHelsinki\nFI\nEUR\n3.50\n27.76\n*EXCHANGE RATE: 7.93143\n26SEP\n25SEP\nT-MOBILE HOTSPOT GMBH\nBONN\nDE\nEUR\n25.00\n197.14\n*EXCHANGE RATE: 7.88560\n26SEP\n26SEP\nHMSHost Helsinki Airpo\nHelsinki\nFI\n61.09\nHSBC\n滙豐\nThe Hongkong and Shanghai Banking Corporation Limited\n香港上海滙豐銀行有限公司\nSTATEMENT OF BUSINESS CARD ACCOUNT 公司卡戶口結單\nPage 3 / 4\nCardholder's name 持卡人姓名\nAccount number 戶口號碼\nStatement date 結單日\nSEE-MING LEE\n5199 3100 0018 7511\n29 SEP 2022\nPost date\nTrans date\nDescription of transaction\nAmount\n(HKD)\n記賬日期\n交易日期\n交易說明\n金額\n26SEP\n24SEP\nMORTON MOMENT OY\nHelsinki\nFI\nEUR\n9.90\n78.06\n*EXCHANGE RATE: 7. 88485\n26SEP\n24SEP\nVerifone Fin*Compass\nHelsinki\nFI\nEUR\n3.50\n27.60\n*EXCHANGE RATE: 7. 88571\n26SEP\n23SEP\nLUFTHAN2204000825139\nVANTAA\nFI\nEUR\n210.00\n1,665.73\n* EXCHANGE RATE: 7.93205\n26SEP\n24SEP\nMORTON MOMENT OY\nHelsinki\nFI\nEUR\n22.40\n176.64\n*EXCHANGE RATE: 7. 88571\n26SEP\n24SEP\nHeatherMill Oy\nHelsinki\nFI\nEUR\n9.00\n70.97\n*EXCHANGE RATE: 7.88556\n26SEP\n23SEP\nHSL Mobiili\nHSL\nFI\nEUR\n2.80\n22.08\n*EXCHANGE RATE: 7. 88571\n26SEP\n23SEP\nVerifone Fin*Compass\nHelsinki\nFI\nEUR\n2.90\n23.00\n*EXCHANGE RATE: 7.93103\n26SEP\n26SEP\nHMSHost Helsinki Airpo\nHelsinki\nFI\n29.76\n26SEP\n25SEP\nT-MOBILE HOTSPOT GMBH\nBONN\nDE\nEUR\n10.00\n78.86\n*EXCHANGE RATE: 7.88600\n26SEP\n26SEP\nHMSHost Helsinki Airpo\nHelsinki\nFI\n29.76\n26SEP\n25SEP\nVerifone Fin*Compass\nHelsinki\nFI\nEUR\n3.50\n27.60\n*EXCHANGE RATE: 7. 88571\n27SEP\n26SEP\nLagard re Fil. 275\nFrankfurt-Flu\nDE\nEUR\n6.50\n51.26\n*EXCHANGE RATE: 7. 88615\n27SEP\n26SEP\nALEPA HKI-VANTAA LENTO\nVANTAA\nFI\nEUR\n11.90\n93.83\n*EXCHANGE RATE: 7. 88487\n27SEP\n26SEP\nPAYPAL *HAYU\n35314369001\nGB\n40.00\n27SEP\n26SEP\nT-MOBILE HOTSPOT GMBH\nBONN\nDE\nEUR\n25.00\n194.29\n*EXCHANGE RATE: 7.77160\n27SEP\n26SEP\nNETS*Select Service\nVantaa\nDK\nEUR\n15.70\n123.81\n*EXCHANGE RATE: 7. 88599\n27SEP\n26SEP\nT-MOBILE HOTSPOT GMBH\nBONN\nDE\nEUR\n12.00\n94.63\n* EXCHANGE RATE: 7.88583\n27SEP\n26SEP\nAAVA MEDICAL CENTRE AI\nVANTAA\nFI\nEUR\n300.00\n2,365.68\n*EXCHANGE RATE: 7.88560\n28SEP\n25SEP\nPAYPAL *FREEPIK\n35314369001\nES\n724.51\n28SEP\n25SEP\nPAYPAL *FREEPIK\n35314369001\nES\n869.51\n29SEP\n28SEP\nAPPLE. COM/BILL\nITUNES. COM\nIE\n38.00\n29SEP\n29SEP\nCREDIT REWARD CASH REBATE\n296.00CR\n*For credit card transactions effected in currencies other\nthan Hong Kong dollars, the exchange rate applied includes a\nhandling fee equivalent to 1.95% of each transaction. The\nfee relating to foreign currency transaction is not\napplicable to RMB Business Card.\n就每項以非港元進行的信用卡交易,所用外幣匯率已包括交易金\n額1.95%的手續費。外幣交易有關費用不適用於人民幣公司卡。\nNote: \"CR\" means Credit transaction / balance\n註:「CR」為入賬交易/結餘\n**** REWARDCASH SUMMARY FOR CARD NUMBER 5199 3100 0018 7511\nREWARDCASH EARNED\n296\n..\nREWARDCASH ADJUSTED\n0\n..\nREWARDCASH REDEEMED\n0\n..\nCONVERTED TO CASH REBATE\n296\n..\nSTATEMENT BALANCE\n結單結欠/結餘\n19,894.76\nHSBC\n滙豐\nThe Hongkong and Shanghai Banking Corporation Limited\n香港上海滙豐銀行有限公司\nSTATEMENT OF BUSINESS CARD ACCOUNT 公司卡戶口結單\nPage 4 / 4\nCardholder's name 持卡人姓名\nAccount number 戶口號碼\nStatement date 結單日\nSEE-MING LEE\n5199 3100 0018 7511\n29 SEP 2022\nPost date\nTrans date\nDescription of transaction\nAmount\n( HKD)\n記賬日期\n交易日期\n交易說明\n金額\nTRANSACTION SUMMARY\n*****\nCREDIT/PAYMENT\n:\n63,109.71CR\nPURCHASES AND INSTALMENTS\n73,950.57\n..\nCREDIT ADJUSTMENT\n:\n296.00CR\nTOTAL ACCOUNT BALANCE\n19,894.76\n..\nFEES AND CHARGES SUMMARY\nFEE/CHARGE TYPE\nAMOUNT\nTOTAL FEES/CHARGES ( EXCLUDING FINANCE CHARGE)\n0.00\n*****\nFINANCE CHARGE SUMMARY\n**\nBALANCE TYPE\nANNUALISED PERCENTAGE RATE (APR)\nFINANCE CHARGE\nCASH ADVANCE\n35.61%\n0.00\nPURCHASE\n34.46%\n0.00\nTOTAL FINANCE CHARGE\n0.00\n**\n***\n*INFORMATION REGARDING MAKING MINIMUM PAYMENT\nThe below examples are for illustration only. You may visit our Bank\nwebsite at www. hsbc. com.hk for an online credit card repayment\ncalculator for customized information.\nIf you make no additional\nYou will pay off the\ncharges, purchases and\nand you will end up\noutstanding balance*\ncash advances on this card\n| paying an estimated\nof HKD20, 000 in\nand each month you pay. ..\ntotal of ...\nabout .. .\n|\n|\n|\nOnly Minimum Payment Due\n|\n26 years **\n|\nHKD67,536 ***\n|\n|\nHKD849\n|\n3 years **\n|\nHKD30,565 ***\n|\n(Savings=HKD36, 971)\n* The outstanding balance of HKD20, 000 is accrued from purchase only.\n** Assume repayment is made on or before the payment due date of each\nstatement month.\n*** Include the outstanding balance of HKD20, 000 and the total finance\ncharge which is accrued daily and calculated at an interest rate of\n2.5% per month (equivalent to an annualised percentage rate of 34.46%\non purchase and 35.61% on cash advance) on the outstanding balance\nuntil it is fully paid.\nThe statement is for your reference only. Payment to be\narranged by your corporation.\nThe RewardCash earned by the company have been\ntransferred to your Business Card account.\nIf the statement balance for your credit card account\nexceeds the credit limit on the statement date, an overlimit\nhandling fee will be debited to the account. If you wish to\nopt out of the over-the-limit facility, you may fill out\nthe form on the back of the statement. For enquiries,\nplease contact us on 2748 8288.\n若您的結單結欠超出該信用卡戶口截至結單日的信用限額,\n本行會徵收超出信用限額手續費。如您欲拒絕接受超出信用限額\n信貸安排,請填妥結單背頁之表格作出指示。如有任何\n查詢,請致電2748 8288。",
            "paragraphs": []
        },
        "created_at": "2024-01-12T21:40:58.921Z"
    },
    {
        "doc1_Currency": "JPY",
        "doc1_Items": [
            {
                "_source": "28FEB",
                "Date": "28FEB"
            },
            {
                "_source": "01MAR\n28FEB\nFoodpanda Hong Kong\nHong Kong\nHK\n521.00",
                "Date": "2001-03-28T00:00:00.000Z",
                "Description": "Foodpanda Hong Kong\nHong Kong",
                "TotalPrice": 521
            },
            {
                "_source": "01MAR\n28FEB\nDATYLON\nANTWERPEN\nBE\nUSD\n19.95\n159.66\n*EXCHANGE RATE: 8.00301",
                "Category": "Meals",
                "Date": "2001-03-28T00:00:00.000Z",
                "Description": "DATYLON",
                "TotalPrice": 159.66
            },
            {
                "_source": "01MAR\n28FEB\n7-Eleven, HK (0824)\nMA ON SHAN\nHK\n4,202.50",
                "Category": "Credit",
                "Date": "01MAR",
                "Description": "7-Eleven, HK (0824)\nMA ON SHAN",
                "TotalPrice": 4202.5
            },
            {
                "_source": "02MAR\n01MAR\nLINODE . AKAMAI\n6093807100\nUS\nUSD\n4,795.52\n38,379.22\n*EXCHANGE RATE: 8.00314",
                "Category": "Credit",
                "Date": "02MAR",
                "Description": "LINODE AKAMAI"
            },
            {
                "_source": "02MAR\n01MAR\nGOOGLE*GSUITE SMLUNIVE\nSingapore\nSG\n70.50",
                "Description": "GOOGLE*GSUITE SMLUNIVE",
                "TotalPrice": 70.5
            },
            {
                "_source": "02MAR\n28FEB\nPAYPAL *FASTSPRING FXF\n4029357733\nUS\n1,054.63",
                "Category": "Credit",
                "Date": "2002-03-28T00:00:00.000Z",
                "Description": "PAYPAL *FASTSPRING FXF",
                "TotalPrice": 1054.63
            },
            {
                "_source": "02MAR\n01MAR\nZEROSSL* ZEROSSL\nVIENNA\nAT\nUSD\n10.00\n80.03\n*EXCHANGE RATE: 8.00300",
                "Date": "2001-03-02T00:00:00.000Z",
                "Description": "ZEROSSL* ZEROSSL"
            },
            {
                "_source": "02MAR\n01MAR\nMAILGUN TECHNOLOGIES,\nSAN ANTONIO\nUS\nUSD\n3.74\n29.93\n*EXCHANGE RATE: 8.00267",
                "Category": "Other",
                "Date": "2001-03-02T00:00:00.000Z",
                "Description": "MAILGUN TECHNOLOGIES,",
                "TotalPrice": 29.93
            },
            {
                "_source": "03MAR\n02MAR\nOPEN SOURCE COLLECTIVE\nCOVINA\nUS\nUSD\n10.00\n80.03\n*EXCHANGE RATE: 8.00300",
                "Category": "Meals",
                "Date": "2002-03-03T00:00:00.000Z",
                "Description": "OPEN SOURCE COLLECTIVE\nCOVINA",
                "TotalPrice": 80.03
            },
            {
                "_source": "03MAR\n02MAR\nBROWSERSTACK. COM\nLEWES\nUS\nUSD\n10.00\n80.03\n*EXCHANGE RATE: 8.00300",
                "Category": "Meals",
                "Date": "2002-03-03T00:00:00.000Z",
                "Description": "BROWSERSTACK. COM",
                "TotalPrice": 80.03
            },
            {
                "_source": "03MAR\n03MAR\nFoodpanda Hong Kong\nHong Kong\nHK\n477.00",
                "Category": "Credit",
                "Date": "2003-03-03T00:00:00.000Z",
                "Description": "Foodpanda Hong Kong",
                "TotalPrice": 477
            },
            {
                "_source": "03MAR\n02MAR\nAmazon web services\naws . amazon . co\nUS\nUSD\n160.47\n1,284.30\n*EXCHANGE RATE: 8.00337",
                "Category": "Credit",
                "Date": "2002-03-03T00:00:00.000Z",
                "Description": "Amazon web services"
            },
            {
                "_source": "03MAR\n02MAR\nREDIS LABS\n140-852-4291\nUS\nUSD\n127.00\n1,016.41\n*EXCHANGE RATE: 8.00323",
                "Date": "2002-03-03T00:00:00.000Z",
                "Description": "REDIS LABS"
            }
        ],
        "doc1_MerchantAddress": {
            "_source": "PO BOX\nNO. 73730, KOWLOON CENTRAL POST OFFICE HK.",
            "poBox": "PO BOX\nNO. 73730",
            "streetAddress": "PO BOX\nNO. 73730",
            "house": "KOWLOON CENTRAL POST OFFICE HK."
        },
        "doc1_MerchantAliases": [
            "HSBC\n滙豐",
            "HSBC.",
            "香港上海滙豐銀行有限公司",
            "The Hongkong and Limited",
            "HSBC\n滙豐"
        ],
        "doc1_MerchantName": "香港上海滙豐銀行有限公司",
        "doc1_MerchantPhoneNumber": "+88685227488288",
        "doc2_Currency": "USD",
        "doc2_Items": [
            {
                "_source": "03MAR\n03MAR\nNRI*NEW RELIC\n888-643-8776\nUS\nUSD\n323.10\n2,585.89\n*EXCHANGE RATE: 8.00337",
                "Category": "Credit",
                "Date": "2003-03-03T00:00:00.000Z",
                "Description": "NRI*NEW RELIC",
                "TotalPrice": 2585.89
            },
            {
                "_source": "06MAR\n04MAR\nAPPLE. COM/BILL\n85221120099\nIE\n78.00",
                "Category": "Other",
                "Date": "2004-03-06T00:00:00.000Z",
                "Description": "APPLE. COM/BILL",
                "TotalPrice": 78
            },
            {
                "_source": "08MAR\n07MAR\nHUTCHISON TELECOM 3CC\nHONG KONG\nHK\n198.00",
                "Category": "Other",
                "Date": "2007-03-08T00:00:00.000Z",
                "Description": "HUTCHISON TELECOM 3CC",
                "TotalPrice": 198
            },
            {
                "_source": "08MAR\n07MAR\nGUM. CO/CC* PETER CASTL\nSAN FRANCISCO\nUS\nUSD\n7.00\n56.02\n*EXCHANGE RATE: 8.00286",
                "Date": "2007-03-08T00:00:00.000Z",
                "Description": "GUM. CO/CC* PETER",
                "TotalPrice": 56.02
            },
            {
                "_source": "09MAR\n08MAR\nPAYPAL *AESCRIPTS\n4029357733\nUS\n122.66",
                "Category": "Credit",
                "Date": "2008-03-09T00:00:00.000Z",
                "Description": "PAYPAL *AESCRIPTS",
                "TotalPrice": 122.66
            },
            {
                "_source": "09MAR\n08MAR\nAPPLE. COM/BILL\nITUNES . COM\nIE\n71.00",
                "Category": "Other",
                "Date": "2008-03-09T00:00:00.000Z",
                "Description": "APPLE. COM/BILL",
                "TotalPrice": 71
            },
            {
                "_source": "10MAR\n09MAR\nPAYPAL *AESCRIPTS\n4029357733\nUS\n349.49",
                "Category": "Credit",
                "Date": "2009-03-10T00:00:00.000Z",
                "Description": "PAYPAL *AESCRIPTS",
                "TotalPrice": 349.49
            },
            {
                "_source": "10MAR\n08MAR\nPAYPAL *PADDLE. NET\n35314369001\nGB\n645.99",
                "Category": "Credit",
                "Date": "2008-03-10T00:00:00.000Z",
                "Description": "PAYPAL *PADDLE. NET",
                "TotalPrice": 645.99
            },
            {
                "_source": "13MAR\n11MAR\nAPPLE. COM/BILL\nITUNES . COM\nIE\n78.00",
                "Category": "Other",
                "Date": "2011-03-13T00:00:00.000Z",
                "Description": "APPLE. COM/BILL",
                "TotalPrice": 78
            },
            {
                "_source": "14MAR\n13MAR\nMIDJOURNEY INC.\nSOUTH SAN FRA\nUS\nUSD\n30.00\n240.10\n*EXCHANGE RATE: 8.00333",
                "Category": "Other",
                "Date": "14MAR",
                "Description": "MIDJOURNEY INC.",
                "TotalPrice": 240.1
            },
            {
                "_source": "16MAR\n15MAR\nDELL HONG KONG LIMITED\nISLAND EAST\nHK\n3,598.00",
                "Date": "16MAR",
                "Description": "DELL HONG KONG LIMITED",
                "TotalPrice": 3598
            },
            {
                "_source": "17MAR\n17MAR\nAPPLE. COM/BILL\nITUNES . COM\nIE\n23.00",
                "Category": "Other",
                "Date": "2017-03-17T00:00:00.000Z",
                "Description": "APPLE. COM/BILL",
                "TotalPrice": 23
            },
            {
                "_source": "18MAR\n15MAR\nPAYPAL *TWITCHINTER\n4029357733\nUS\n31.99",
                "Category": "Credit",
                "Date": "2015-03-18T00:00:00.000Z",
                "Description": "PAYPAL *TWITCHINTER",
                "TotalPrice": 31.99
            },
            {
                "_source": "18MAR\n17MAR\nBITLY.COM\nNEW YORK CITY\nUS\nUSD\n348.00\n2,785.24\n*EXCHANGE RATE: 8.00356",
                "Category": "Credit",
                "Date": "2017-03-18T00:00:00.000Z",
                "Description": "BITLY.COM",
                "TotalPrice": 2785.24
            },
            {
                "_source": "18MAR\n17MAR\nHKTVMALL\nHONG KONG\nHK\n397.20",
                "Date": "2017-03-18T00:00:00.000Z",
                "Description": "HKTVMALL"
            },
            {
                "_source": "18MAR\n17MAR\nIFTTT PRO (LEGACY)\nSAN FRANCISCO\nUS\nUSD\n1.99\n15.92\n*EXCHANGE RATE: 8.00000",
                "Date": "2017-03-18T00:00:00.000Z",
                "Description": "IFTTT PRO (LEGACY)",
                "TotalPrice": 15.92
            },
            {
                "_source": "18MAR\n15MAR\nPAYPAL *STEAM GAMES\n35314369001\nGB\n260.00",
                "Category": "Credit",
                "Date": "2015-03-18T00:00:00.000Z",
                "Description": "PAYPAL *STEAM GAMES",
                "TotalPrice": 260
            },
            {
                "_source": "20MAR\n16MAR\nPAYPAL *STEAM GAMES\n35314369001\nGB\n163.02",
                "Category": "Room",
                "Date": "2016-03-20T00:00:00.000Z",
                "Description": "PAYPAL *STEAM GAMES",
                "TotalPrice": 163.02
            },
            {
                "_source": "20MAR\n19MAR\nNetflix.com\nLos Gatos\nSG\n93.00",
                "Category": "Other",
                "Date": "2019-03-20T00:00:00.000Z",
                "Description": "Netflix.com",
                "TotalPrice": 93
            },
            {
                "_source": "20MAR\n18MAR\nHKTVMALL\nHONG KONG\nHK\n125.00",
                "Date": "2018-03-20T00:00:00.000Z",
                "Description": "HKTVMALL",
                "TotalPrice": 125
            },
            {
                "_source": "20MAR\n18MAR\nDNH*GODADDY. COM HKD\n4805058855\nUS\n320.80",
                "Date": "20MAR",
                "Description": "18MAR\nDNH*GODADDY. COM HKD",
                "TotalPrice": 320.8
            },
            {
                "_source": "20MAR\n16MAR\nPAYPAL *STEAM GAMES\n35314369001\nGB\n201.60",
                "Category": "Other",
                "Date": "2016-03-20T00:00:00.000Z",
                "Description": "PAYPAL *STEAM GAMES",
                "TotalPrice": 201.6
            },
            {
                "_source": "21MAR\n18MAR\nPAYPAL *STEAM GAMES\n35314369001\nGB\n278.09",
                "Category": "Meals",
                "Date": "2018-03-21T00:00:00.000Z",
                "Description": "PAYPAL *STEAM GAMES",
                "TotalPrice": 278.09
            },
            {
                "_source": "22MAR\n21MAR\nTYPECAST AI\nSAN DIEGO\nUS\nUSD\n8.99\n71.92\n*EXCHANGE RATE: 8.00000",
                "Date": "2021-03-22T00:00:00.000Z",
                "Description": "TYPECAST AI",
                "TotalPrice": 71.92
            },
            {
                "_source": "22MAR\n21MAR\nTWITTER PAID FEATURES\nSAN FRANCISCO\nUS\nUSD\n8.00\n64.02\n*EXCHANGE RATE: 8.00250",
                "Category": "Other",
                "Date": "2021-03-22T00:00:00.000Z",
                "Description": "TWITTER PAID FEATURES",
                "TotalPrice": 64.02
            },
            {
                "_source": "22MAR\n21MAR\nHKTVMALL\nHONG KONG\nHK\n350.00",
                "Date": "2021-03-22T00:00:00.000Z",
                "Description": "HKTVMALL",
                "TotalPrice": 350
            },
            {
                "_source": "23MAR\n21MAR\nPAYPAL *GITHUB INC\n4029357733\nUS\n32.71",
                "Date": "2021-03-23T00:00:00.000Z",
                "Description": "PAYPAL *GITHUB INC",
                "TotalPrice": 32.71
            },
            {
                "_source": "23MAR\n22MAR\nNYTimes *NYTimes\n800-698-4637\nUS\nUSD\n12.00\n96.03\n*EXCHANGE RATE: 8.00250",
                "Category": "Credit",
                "Date": "23MAR",
                "Description": "NYTimes *NYTimes",
                "TotalPrice": 96.03
            },
            {
                "_source": "23MAR\n22MAR\n7-Eleven, HK (0824)\nMA ON SHAN\nHK\n4,192.00",
                "Category": "Meals",
                "Date": "2022-03-23T00:00:00.000Z",
                "Description": "7-Eleven, HK (0824)\nMA ON SHAN",
                "TotalPrice": 4192
            },
            {
                "_source": "23MAR\n22MAR\nPAYPAL *ELECTROPUP\n4029357733\nAU\n163.47",
                "Category": "Credit",
                "Date": "2022-03-23T00:00:00.000Z",
                "Description": "PAYPAL *ELECTROPUP",
                "TotalPrice": 163.47
            },
            {
                "_source": "23MAR\n22MAR\nPAYPAL *DIGITALPUPP\n4029357733\nHK\n50.16",
                "Category": "Other",
                "Date": "2022-03-23T00:00:00.000Z",
                "Description": "PAYPAL *DIGITALPUPP",
                "TotalPrice": 50.16
            },
            {
                "_source": "24MAR\n23MAR\nPAYPAL *WAKATIME\n4029357733\nHK\n73.58",
                "Date": "2023-03-24T00:00:00.000Z",
                "Description": "PAYPAL *WAKATIME",
                "TotalPrice": 73.58
            },
            {
                "_source": "24MAR\n23MAR\nSP WACOM ESTORE\nLAI CHI KOK\nHK\n765.00",
                "Category": "Meals",
                "Date": "2023-03-24T00:00:00.000Z",
                "Description": "SP WACOM ESTORE",
                "TotalPrice": 765
            },
            {
                "_source": "27MAR\n26MAR\nPAYPAL *HAYU\n35314369001\nGB\n40.00",
                "Date": "1926-03-27T00:00:00.000Z",
                "Description": "PAYPAL *HAYU",
                "TotalPrice": 40
            },
            {
                "_source": "27MAR\n26MAR\nMIDJOURNEY INC.\nSOUTH SAN FRA\nUS\nUSD\n20.00\n160.07\n*EXCHANGE RATE: 8.00350",
                "Date": "27MAR",
                "Description": "MIDJOURNEY INC.",
                "TotalPrice": 160.07
            },
            {
                "_source": "29MAR\n28MAR\nPAYPAL *TWITCHINTER\n4029357733\nUS\n31.99",
                "Date": "1928-03-29T00:00:00.000Z",
                "Description": "PAYPAL *TWITCHINTER",
                "TotalPrice": 31.99
            },
            {
                "_source": "29MAR\n28MAR\nPAYPAL *AESCRIPTS\n4029357733\nUS\n244.92",
                "Category": "Other",
                "Date": "1928-03-29T00:00:00.000Z",
                "Description": "PAYPAL *AESCRIPTS",
                "TotalPrice": 244.92
            },
            {
                "_source": "29MAR\n28MAR\nMIDJOURNEY INC.\nSOUTH SAN FRA\nUS\nUSD\n20.00\n160.07\n*EXCHANGE RATE: 8.00350",
                "Category": "Other",
                "Date": "1928-03-29T00:00:00.000Z",
                "Description": "MIDJOURNEY INC.\n*EXCHANGE RATE:"
            },
            {
                "_source": "29MAR\n28MAR\nMIDJOURNEY INC.\nSOUTH SAN FRA\nUS\nUSD\n20.00\n160.07\n*EXCHANGE RATE: 8.00350",
                "Date": "1928-03-29T00:00:00.000Z",
                "Description": "MIDJOURNEY INC."
            },
            {
                "_source": "29MAR\n27MAR\nDEVIANTART . COM\nLOS ANGLES\nUS\nUSD\n39.95\n319.74\n*EXCHANGE RATE: 8.00350",
                "Date": "1927-03-29T00:00:00.000Z",
                "Description": "DEVIANTART . COM"
            },
            {
                "_source": "30MAR\n30MAR\nAPPLE. COM/BILL\nITUNES . COM\nIE\n28.00",
                "Category": "Other",
                "Date": "30MAR",
                "Description": "APPLE. COM/BILL",
                "TotalPrice": 28
            },
            {
                "_source": "30MAR\n30MAR\nCREDIT REWARD CASH REBATE\n270.00CR",
                "Category": "Credit",
                "Date": "1930-03-30T00:00:00.000Z",
                "Description": "CREDIT",
                "TotalPrice": 270
            }
        ],
        "doc2_MerchantAliases": [
            "The Hongkong and Shanghai Corporation Limited",
            "HSBC\n滙豐"
        ],
        "doc2_MerchantName": "香港上海滙豐銀行有限公司",
        "doc3_MerchantName": "香港上海滙豐銀行有限公司",
        "doc3_TransactionDate": "2023-03-30T00:00:00.000Z",
        "doc4_MerchantName": "香港上海滙豐銀行有限公司\nHongkong and Shanghai Corporation Limited",
        "doc4_MerchantPhoneNumber": "+88627488288",
        "doc4_TransactionDate": "2023-03-30T00:00:00.000Z",
        "__raw__": {
            "content": "HSBC\n滙豐\nThe Hongkong and Shanghai Banking Corporation Limited\n香港上海滙豐銀行有限公司\nSTATEMENT OF BUSINESS CARD ACCOUNT 公司卡戶口結單\nPage\n1/4\nMR LEE SEE MING\nM\nAccount number 戶口號碼\nC/O SML UNIVERSE LIMITED\n00896\n5199 3100 0018 7511\nFLAT F 27/F BLK 10 VISTA PARADISO\nCard type 信用卡類別\nCredit limit 信用限額\n2 HANG MING ST\nPlatinum Business MC\nHKD150,000.00\nNEW TERRITORIES\nStatement date 結單日\nStatement balance 結單結欠/結餘\n30 MAR 2023\nHKD16,865.87\nPost date\nTrans date\nDescription of transaction\nAmount\n(HKD)\n記賬日期\n交易日期\n交易說明\n金額\nPREVIOUS BALANCE\n上月結欠/結餘\n11,353.59\n27FEB\n27FEB\nIFS PAYMENT - THANK YOU\n11,353.59CR\n06MAR\n05MAR\nIFS PAYMENT - THANK YOU\n50,429.13CR\n5199 3100 0018 7511\nSEE-MING LEE\nSML UNIVERSE LTD\n28FEB\n27FEB\nADOBE CREATIVE CLOUD\nDublin\nIE\n408.00\n01MAR\n28FEB\nFoodpanda Hong Kong\nHong Kong\nHK\n521.00\n01MAR\n28FEB\nDATYLON\nANTWERPEN\nBE\nUSD\n19.95\n159.66\n*EXCHANGE RATE: 8.00301\n01MAR\n28FEB\n7-Eleven, HK (0824)\nMA ON SHAN\nHK\n4,202.50\n02MAR\n01MAR\nLINODE . AKAMAI\n6093807100\nUS\nUSD\n4,795.52\n38,379.22\n*EXCHANGE RATE: 8.00314\n02MAR\n01MAR\nGOOGLE*GSUITE SMLUNIVE\nSingapore\nSG\n70.50\n02MAR\n28FEB\nPAYPAL *FASTSPRING FXF\n4029357733\nUS\n1,054.63\n02MAR\n01MAR\nZEROSSL* ZEROSSL\nVIENNA\nAT\nUSD\n10.00\n80.03\n*EXCHANGE RATE: 8.00300\n02MAR\n01MAR\nMAILGUN TECHNOLOGIES,\nSAN ANTONIO\nUS\nUSD\n3.74\n29.93\n*EXCHANGE RATE: 8.00267\n03MAR\n02MAR\nOPEN SOURCE COLLECTIVE\nCOVINA\nUS\nUSD\n10.00\n80.03\n*EXCHANGE RATE: 8.00300\n03MAR\n02MAR\nBROWSERSTACK. COM\nLEWES\nUS\nUSD\n10.00\n80.03\n*EXCHANGE RATE: 8.00300\n03MAR\n03MAR\nFoodpanda Hong Kong\nHong Kong\nHK\n477.00\n03MAR\n02MAR\nAmazon web services\naws . amazon . co\nUS\nUSD\n160.47\n1,284.30\n*EXCHANGE RATE: 8.00337\n03MAR\n02MAR\nREDIS LABS\n140-852-4291\nUS\nUSD\n127.00\n1,016.41\n*EXCHANGE RATE: 8.00323\nFor important information such as payment methods, fees and charges, lost\ncard reporting, and change of correspondence address / telephone number,\nMinimum payment summary 最低付款摘要\nHKD\nplease visit www.hsbc.com.hk or call our Customer Service Hotline on\nCurrent minimum payment due 目前最低付款額\n169.00\n(852) 2748 8288.\nPlease pay by 須於此付款到期日或之前繳交\n24 APR 2023\n有關您戶口的重要資料包括付款方式,利息與收費,報失信用卡,以及更改\nOverdue / overlimit due now\n通訊地址/電話號碼,請瀏覽網址www.hsbc.com.hk或聯絡我們的客戶服務熱\n須立即繳交的過期款項/超額款項\n0.00\n線(852) 2748 8288°\nTotal minimum payment due\n最低付款總額\n169.00\nHSBC\n滙豐\nPayment Slip 付款存根\nAccount number 戶口號碼\nCard type 信用卡類別\nIf you are paying by mail, please detach this payment slip and return it with a\n5199 3100 0018 7511\nPlatinum Business MC\ncrossed cheque made payable to \"The Hongkong and Shanghai Banking\nCorporation Limited\" or \"HSBC\" at least three working days before the\nStatement date 結單日\nStatement balance 結單結欠/結餘\npayment due date to our Centre, PO BOX NO. 73730, KOWLOON CENTRAL\n30 MAR 2023\nHKD16,865.87\nPOST OFFICE HK. Please write your account number on the back of the\nCheque number 支票號碼\nAmount enclosed\n夾附金額\n如欲以郵寄方式付款,請撕下此付款存根,於付款到期日三個工作天前,連同以\ncheque.\n「香港上海滙豐銀行有限公司」或「滙豐」為抬頭的劃線支票,寄回 PO BOX\nNO. 73730, KOWLOON CENTRAL POST OFFICE HK. 信用卡中心收,請於支\n票背面寫上您的戶口號碼。\nThank you for choosing HSBC.多謝選用滙豐服務。\nHSBC\n滙豐\nThe Hongkong and Shanghai Banking Corporation Limited\n香港上海滙豐銀行有限公司\nSTATEMENT OF BUSINESS CARD ACCOUNT 公司卡戶口結單\nPage\n2/4\nCardholder's name 持卡人姓名\nAccount number 戶口號碼\nStatement date 結單日\nSEE-MING LEE\n5199 3100 0018 7511\n30 MAR 2023\nPost date\nTrans date\nDescription of transaction\nAmount\n( HKD)\n記賬日期\n交易日期\n交易說明\n金額\n03MAR\n03MAR\nNRI*NEW RELIC\n888-643-8776\nUS\nUSD\n323.10\n2,585.89\n*EXCHANGE RATE: 8.00337\n06MAR\n04MAR\nAPPLE. COM/BILL\n85221120099\nIE\n78.00\n08MAR\n07MAR\nHUTCHISON TELECOM 3CC\nHONG KONG\nHK\n198.00\n08MAR\n07MAR\nGUM. CO/CC* PETER CASTL\nSAN FRANCISCO\nUS\nUSD\n7.00\n56.02\n*EXCHANGE RATE: 8.00286\n09MAR\n08MAR\nPAYPAL *AESCRIPTS\n4029357733\nUS\n122.66\n09MAR\n08MAR\nAPPLE. COM/BILL\nITUNES . COM\nIE\n71.00\n10MAR\n09MAR\nPAYPAL *AESCRIPTS\n4029357733\nUS\n349.49\n10MAR\n08MAR\nPAYPAL *PADDLE. NET\n35314369001\nGB\n645.99\n13MAR\n11MAR\nAPPLE. COM/BILL\nITUNES . COM\nIE\n78.00\n14MAR\n13MAR\nMIDJOURNEY INC.\nSOUTH SAN FRA\nUS\nUSD\n30.00\n240.10\n*EXCHANGE RATE: 8.00333\n16MAR\n15MAR\nDELL HONG KONG LIMITED\nISLAND EAST\nHK\n3,598.00\n17MAR\n17MAR\nAPPLE. COM/BILL\nITUNES . COM\nIE\n23.00\n18MAR\n15MAR\nPAYPAL *TWITCHINTER\n4029357733\nUS\n31.99\n18MAR\n17MAR\nBITLY.COM\nNEW YORK CITY\nUS\nUSD\n348.00\n2,785.24\n*EXCHANGE RATE: 8.00356\n18MAR\n17MAR\nHKTVMALL\nHONG KONG\nHK\n397.20\n18MAR\n17MAR\nIFTTT PRO (LEGACY)\nSAN FRANCISCO\nUS\nUSD\n1.99\n15.92\n*EXCHANGE RATE: 8.00000\n18MAR\n15MAR\nPAYPAL *STEAM GAMES\n35314369001\nGB\n260.00\n20MAR\n16MAR\nPAYPAL *STEAM GAMES\n35314369001\nGB\n163.02\n20MAR\n19MAR\nNetflix.com\nLos Gatos\nSG\n93.00\n20MAR\n18MAR\nHKTVMALL\nHONG KONG\nHK\n125.00\n20MAR\n18MAR\nDNH*GODADDY. COM HKD\n4805058855\nUS\n320.80\n20MAR\n16MAR\nPAYPAL *STEAM GAMES\n35314369001\nGB\n201.60\n21MAR\n18MAR\nPAYPAL *STEAM GAMES\n35314369001\nGB\n278.09\n22MAR\n21MAR\nTYPECAST AI\nSAN DIEGO\nUS\nUSD\n8.99\n71.92\n*EXCHANGE RATE: 8.00000\n22MAR\n21MAR\nTWITTER PAID FEATURES\nSAN FRANCISCO\nUS\nUSD\n8.00\n64.02\n*EXCHANGE RATE: 8.00250\n22MAR\n21MAR\nHKTVMALL\nHONG KONG\nHK\n350.00\n23MAR\n21MAR\nPAYPAL *GITHUB INC\n4029357733\nUS\n32.71\n23MAR\n22MAR\nNYTimes *NYTimes\n800-698-4637\nUS\nUSD\n12.00\n96.03\n*EXCHANGE RATE: 8.00250\n23MAR\n22MAR\n7-Eleven, HK (0824)\nMA ON SHAN\nHK\n4,192.00\n23MAR\n22MAR\nPAYPAL *ELECTROPUP\n4029357733\nAU\n163.47\n23MAR\n22MAR\nPAYPAL *DIGITALPUPP\n4029357733\nHK\n50.16\n24MAR\n23MAR\nPAYPAL *WAKATIME\n4029357733\nHK\n73.58\n24MAR\n23MAR\nSP WACOM ESTORE\nLAI CHI KOK\nHK\n765.00\n27MAR\n26MAR\nPAYPAL *HAYU\n35314369001\nGB\n40.00\n27MAR\n26MAR\nMIDJOURNEY INC.\nSOUTH SAN FRA\nUS\nUSD\n20.00\n160.07\n*EXCHANGE RATE: 8.00350\n29MAR\n28MAR\nPAYPAL *TWITCHINTER\n4029357733\nUS\n31.99\n29MAR\n28MAR\nPAYPAL *AESCRIPTS\n4029357733\nUS\n244.92\n29MAR\n28MAR\nMIDJOURNEY INC.\nSOUTH SAN FRA\nUS\nUSD\n20.00\n160.07\n*EXCHANGE RATE: 8.00350\n29MAR\n28MAR\nMIDJOURNEY INC.\nSOUTH SAN FRA\nUS\nUSD\n20.00\n160.07\n*EXCHANGE RATE: 8.00350\n29MAR\n27MAR\nDEVIANTART . COM\nLOS ANGLES\nUS\nUSD\n39.95\n319.74\n*EXCHANGE RATE: 8.00350\n30MAR\n30MAR\nAPPLE. COM/BILL\nITUNES . COM\nIE\n28.00\n30MAR\n30MAR\nCREDIT REWARD CASH REBATE\n270.00CR\n*For credit card transactions effected in currencies other\nthan Hong Kong dollars, the exchange rate applied includes a\nhandling fee equivalent to 1.95% of each transaction. The\nfee relating to foreign currency transaction is not\napplicable to RMB Business Card.\n就每項以非港元進行的信用卡交易,所用外幣匯率已包括交易金\n額1.95%的手續費。外幣交易有關費用不適用於人民幣公司卡。\nHSBC\n滙豐\nThe Hongkong and Shanghai Banking Corporation Limited\n香港上海滙豐銀行有限公司\nSTATEMENT OF BUSINESS CARD ACCOUNT 公司卡戶口結單\nPage\n3/4\nCardholder's name 持卡人姓名\nAccount number 戶口號碼\nStatement date 結單日\nSEE-MING LEE\n5199 3100 0018 7511\n30 MAR 2023\nPost date\nTrans date\nDescription of transaction\nAmount\n( HKD)\n記賬日期\n交易日期\n交易說明\n金額\nNote: \"CR\" means Credit transaction / balance\n註:「CR」為入賬交易/結餘\n**** REWARDCASH SUMMARY FOR CARD NUMBER 5199 3100 0018 7511\nREWARDCASH EARNED\n270\n..\nREWARDCASH ADJUSTED\n0\n..\nREWARDCASH REDEEMED\n0\n..\nCONVERTED TO CASH REBATE\n:\n270\nSTATEMENT BALANCE\n結單結欠/結餘\n16,865.87\nTRANSACTION SUMMARY\nCREDIT/PAYMENT\n61,782.72CR\n..\nPURCHASES AND INSTALMENTS\n67,565.00\n..\nCREDIT ADJUSTMENT\n270.00CR\n..\nTOTAL ACCOUNT BALANCE\n16,865.87\n..\n**\n** FEES AND CHARGES SUMMARY\nFEE/CHARGE TYPE\nAMOUNT\nTOTAL FEES/CHARGES ( EXCLUDING FINANCE CHARGE)\n0.00\n***** FINANCE CHARGE SUMMARY **\nBALANCE TYPE\nANNUALISED PERCENTAGE RATE (APR)\nFINANCE CHARGE\nCASH ADVANCE\n35.61%\n0.00\nPURCHASE\n34. 46%\n0.00\nTOTAL FINANCE CHARGE\n0.00\n* * ****\n*INFORMATION REGARDING MAKING MINIMUM PAYMENT*\nThe below examples are for illustration only. You may visit our Bank\nwebsite at www.hsbc. com.hk for an online credit card repayment\ncalculator for customized information.\nIf you make no additional\nYou will pay off the\n|and you will end up\ncharges, purchases and\noutstanding balance*\ncash advances on this card\npaying an estimated\ntotal of ...\nand each month you pay. . .\nof HKD20,000 in\nabout .. .\n|\n|\n|\nOnly Minimum Payment Due\n|\n26 years **\n|\nHKD67,536 ***\n|\n|\nHKD849\n|\n3 years **\n|\nHKD30,565 ***\n|\n(Savings=HKD36, 971)\n* The outstanding balance of HKD20, 000 is accrued from purchase only.\n** Assume repayment is made on or before the payment due date of each\nstatement month.\n*** Include the outstanding balance of HKD20, 000 and the total finance\ncharge which is accrued daily and calculated at an interest rate of\n2.5% per month (equivalent to an annualised percentage rate of 34.46%\non purchase and 35.61% on cash advance) on the outstanding balance\nuntil it is fully paid.\nThe statement is for your reference only.\nPayment to be\narranged by your corporation.\nPlease note that your credit limit has been revised to\nHKD 150,000.00.\nThe RewardCash earned by the company have been\nHSBC\n滙豐\nThe Hongkong and Shanghai Banking Corporation Limited\n香港上海滙豐銀行有限公司\nSTATEMENT OF BUSINESS CARD ACCOUNT 公司卡戶口結單\nPage 4 / 4\nCardholder's name 持卡人姓名\nAccount number 戶口號碼\nStatement date 結單日\nSEE-MING LEE\n5199 3100 0018 7511\n30 MAR 2023\nPost date\nTrans date\nDescription of transaction\nAmount\n(HKD)\n記賬日期\n交易日期\n交易說明\n金額\ntransferred to your Business Card account.\nIf the statement balance for your credit card account\nexceeds the credit limit on the statement date, an overlimit\nhandling fee will be debited to the account. If you wish to\nopt out of the over-the-limit facility, you may fill out\nthe form on the back of the statement. For enquiries,\nplease contact us on 2748 8288.\n若您的結單結欠超出該信用卡戶口截至結單日的信用限額,\n本行會徵收超出信用限額手續費。如您欲拒絕接受超出信用限額\n信貸安排,請填妥結單背頁之表格作出指示。如有任何\n查詢,請致電2748 8288。",
            "paragraphs": []
        },
        "created_at": "2024-01-12T21:40:58.935Z"
    },
    {
        "doc1_Currency": "JPY",
        "doc1_Items": [
            {
                "_source": "12APR\n12APR\nIFS PAYMENT - THANK YOU\n21,247.87CR\n5199",
                "Category": "Other",
                "Description": "PAYMENT THANK",
                "TotalPrice": 21247.87
            },
            {
                "_source": "31MAR\n30MAR",
                "Date": "1930-03-31T00:00:00.000Z"
            },
            {
                "_source": "31MAR\n30MAR\nDATYLON\nANTWERPEN\nBE\nUSD\n19.95\n159.23\n*EXCHANGE RATE: 7.98145",
                "Date": "1930-03-31T00:00:00.000Z",
                "Description": "DATYLON",
                "TotalPrice": 159.23
            },
            {
                "_source": "01APR\n31MAR\nFORTRESS ONLINE STORE\nHONG KONG\nHK\n2,380.00",
                "Category": "Meals",
                "Date": "1931-04-01T00:00:00.000Z",
                "Description": "FORTRESS ONLINE STORE\nHONG KONG",
                "TotalPrice": 2380
            },
            {
                "_source": "02APR\n01APR\nOPEN SOURCE COLLECTIVE\nWALNUT\nUS\nUSD\n5.00\n39.92\n*EXCHANGE RATE: 7.98400",
                "Category": "Meals",
                "Date": "2002-04-01T00:00:00.000Z",
                "Description": "OPEN SOURCE COLLECTIVE",
                "TotalPrice": 39.92
            },
            {
                "_source": "02APR\n01APR\nCLOUDFLARE\nSAN FRANCISCO\nUS\nUSD\n66.60\n531.83\n*EXCHANGE RATE: 7.98544",
                "Category": "Credit",
                "Date": "2002-04-01T00:00:00.000Z",
                "Description": "CLOUDFLARE",
                "TotalPrice": 531.83
            },
            {
                "_source": "02APR\n02APR\nAPPLE. COM/BILL\nITUNES. COM\nIE\n344.00",
                "Category": "Meals",
                "Date": "2002-04-02T00:00:00.000Z",
                "Description": "APPLE. COM/BILL",
                "TotalPrice": 344
            },
            {
                "_source": "02APR\n01APR\nSTACK* ZEROSSL\nWIEN\nAT\nUSD\n10.00\n79.89\n*EXCHANGE RATE: 7.98900",
                "Date": "2002-04-01T00:00:00.000Z",
                "Description": "STACK* ZEROSSL",
                "TotalPrice": 79.89
            },
            {
                "_source": "02APR\n01APR\nLINODE\n8554546633\nUS\nUSD\n126.64\n1,011.73\n*EXCHANGE RATE: 7.98902",
                "Category": "Credit",
                "Date": "2002-04-01T00:00:00.000Z",
                "Description": "LINODE"
            },
            {
                "_source": "02APR\n02APR\nAPPLE. COM/BILL\nITUNES . COM\nIE\n118.00",
                "Category": "Other",
                "Date": "2002-04-02T00:00:00.000Z",
                "Description": "APPLE. COM/BILL",
                "TotalPrice": 118
            },
            {
                "_source": "02APR\n02APR\nAPPLE. COM/BILL\nITUNES . COM\nIE\n398.00",
                "Category": "Room",
                "Date": "2002-04-02T00:00:00.000Z",
                "Description": "APPLE. COM/BILL",
                "TotalPrice": 398
            },
            {
                "_source": "02APR\n01APR\nMAILGUN TECHNOLOGIES,\nSAN ANTONIO\nUS\nUSD\n3.66\n29.24\n*EXCHANGE RATE: 7.98907",
                "Date": "2002-04-01T00:00:00.000Z",
                "Description": "MAILGUN TECHNOLOGIES,\nSAN ANTONIO",
                "TotalPrice": 29.24
            },
            {
                "_source": "04APR\n02APR\nBROWSERSTACK. COM\nLEWES\nUS\nUSD\n19.00\n151.79\n*EXCHANGE RATE: 7.98895",
                "Category": "Other",
                "Date": "2004-04-02T00:00:00.000Z",
                "Description": "BROWSERSTACK. COM",
                "TotalPrice": 151.79
            },
            {
                "_source": "04APR\n02APR\nAPPLE. COM/BILL\nITUNES. COM\nIE\n133.00",
                "Category": "Other",
                "Date": "2004-04-02T00:00:00.000Z",
                "Description": "APPLE. COM/BILL",
                "TotalPrice": 133
            },
            {
                "_source": "04APR\n02APR\nAPPLE. COM/BILL\nITUNES . COM\nIE\n656.00",
                "Category": "Other",
                "Date": "2004-04-02T00:00:00.000Z",
                "Description": "APPLE. COM/BILL",
                "TotalPrice": 656
            },
            {
                "_source": "04APR\n01APR\nPAYPAL *PATREON\nMEMBE\n4029357733\nUS\n16.32",
                "Category": "Credit",
                "Date": "2004-04-01T00:00:00.000Z",
                "Description": "PAYPAL *PATREON\nMEMBE",
                "TotalPrice": 16.32
            }
        ],
        "doc1_MerchantAddress": {
            "_source": "PO BOX NO. 73730, KOWLOON CENTRAL",
            "poBox": "PO BOX NO. 73730",
            "city": "KOWLOON",
            "state": "CENTRAL",
            "streetAddress": "PO BOX NO. 73730"
        },
        "doc1_MerchantAliases": [
            "HSBC.",
            "The Hongkong and Shanghai Corporation Limited",
            "HSBC\n滙豐"
        ],
        "doc1_MerchantName": "香港上海滙豐銀行有限公司",
        "doc1_MerchantPhoneNumber": "+88685227488288",
        "doc2_Items": [
            {
                "_source": "04APR\n02APR\nAmazon web services\naws . amazon. co\nUS\nUSD\n186.56\n1,490.44\n*EXCHANGE RATE: 7.98907",
                "Description": "Amazon web services",
                "Price": 186.56
            },
            {
                "_source": "04APR\n02APR\nAPPLE. COM/BILL\nITUNES. COM\nIE\n758.82CR",
                "Description": "APPLE. COM/BILL",
                "TotalPrice": 758.82
            },
            {
                "_source": "04APR\n01APR\nBLS*REDIS LABS14085242\nLONDON\nGB\nUSD\n248.00\n1,980.39\n* EXCHANGE RATE: 7.98544",
                "Description": "BLS*REDIS LABS14085242",
                "Price": 248,
                "TotalPrice": 1980.39
            },
            {
                "_source": "04APR\n03APR\nNRI*NEW RELIC\n888-643-8776\nUS\nUSD\n244.00\n1,949.32\n*EXCHANGE RATE: 7.98902",
                "Description": "NRI*NEW RELIC",
                "Price": 244,
                "ProductCode": "888-643-8776",
                "TotalPrice": 1949.32
            },
            {
                "_source": "04APR\n03APR\nLINODE\n8554546633\nUS\nUSD\n503.25\n4,020.49\n*EXCHANGE RATE: 7.98905\n06APR\n04APR\nHUTCHISON TELECOM 3CC\nHONG KONG\nHK\n136.00\n07APR\n06APR\nLINODE\n8554546633\nUS\nUSD\n502.77\n4,016.40\n*EXCHANGE RATE: 7.98854",
                "Description": "LINODE\nHUTCHISON TELECOM 3CC\nLINODE",
                "Price": 502.77,
                "ProductCode": "8554546633",
                "TotalPrice": 136
            },
            {
                "_source": "07APR\n06APR\nAPPLE. COM/BILL\nITUNES. COM\nIE\n276.00\n07APR\n07APR\nSMARTONE AUTOPAY\nKWUN TONG\nHK\n220.00\n08APR\n07APR\nPAYPAL *OREILLYMEDI\n4029357733\nUS\n318.45",
                "Description": "APPLE. COM/BILL\nSMARTONE AUTOPAY\nPAYPAL *OREILLYMEDI",
                "ProductCode": "4029357733",
                "TotalPrice": 318.45
            },
            {
                "_source": "08APR\n07APR\nAPPLE. COM/BILL\nITUNES . COM\nIE\n58.00",
                "Description": "APPLE. COM/BILL",
                "TotalPrice": 58
            },
            {
                "_source": "09APR\n08APR\nPAYPAL *GUMROAD BEARS\n4029357733\nUS\n52.58",
                "Description": "PAYPAL *GUMROAD BEARS",
                "ProductCode": "4029357733",
                "TotalPrice": 52.58
            },
            {
                "_source": "09APR\n08APR\nPAYPAL",
                "Description": "PAYPAL"
            },
            {
                "_source": "*GUMROAD BEARS\n4029357733\nUS\n98.55",
                "Description": "*GUMROAD BEARS",
                "ProductCode": "4029357733",
                "TotalPrice": 98.55
            },
            {
                "_source": "09APR\n08APR\nPAYPAL *GUMROAD BEARS\n4029357733\nUS\n59.12",
                "Description": "*GUMROAD BEARS",
                "ProductCode": "4029357733",
                "TotalPrice": 59.12
            },
            {
                "_source": "09APR\n08APR\nAPPLE. COM/BILL\n85221120099\nIE\n108.00",
                "Description": "APPLE. COM/BILL",
                "ProductCode": "85221120099",
                "TotalPrice": 108
            },
            {
                "_source": "11APR\n10APR\nAPPLE. COM/BILL\nITUNES . COM\nIE\n58.00",
                "Description": "APPLE. COM/BILL",
                "TotalPrice": 58
            },
            {
                "_source": "11APR\n10APR\nAPPLE. COM/BILL\nITUNES . COM\nIE\n708.00",
                "Description": "APPLE. COM/BILL",
                "TotalPrice": 708
            },
            {
                "_source": "12APR\n11APR\nAPPLE. COM/BILL\nITUNES . COM\nIE\n78.00",
                "Description": "APPLE. COM/BILL",
                "TotalPrice": 78
            },
            {
                "_source": "13APR\n12APR\nAPPLE STORE R610\n28\nHONG KONG\nHK\n3,998.00\n13APR\n12APR\nAPPLE. COM/BILL\nITUNES . COM\nIE\n78.00",
                "Description": "APPLE STORE R610\nAPPLE. COM/BILL",
                "TotalPrice": 78
            },
            {
                "_source": "13APR\n11APR\nLINODE\n8554546633\nUS\nUSD\n488.25\n3,902.70\n*EXCHANGE RATE: 7.99324",
                "Description": "LINODE",
                "Price": 488.25,
                "ProductCode": "8554546633",
                "TotalPrice": 3902.7
            },
            {
                "_source": "14APR\n13APR\nPAYPAL *TIDAL HIFI\n35314369001\nSE\n96.00\n19APR\n15APR\nAPPLE. COM/BILL\nITUNES . COM\nIE\n398.00",
                "Description": "PAYPAL *TIDAL HIFI\nAPPLE. COM/BILL\nITUNES . COM",
                "ProductCode": "35314369001",
                "TotalPrice": 398
            },
            {
                "_source": "19APR\n17APR\nPAYPAL *OUTPUT\n4029357733\nUS\n81.69",
                "Description": "PAYPAL *OUTPUT",
                "ProductCode": "4029357733",
                "TotalPrice": 81.69
            },
            {
                "_source": "19APR\n17APR\nIFTTT PRO (LEGACY)\nSAN FRANCISCO\nUS\nUSD\n1.99\n15.91\n*EXCHANGE RATE: 7.99497",
                "Description": "IFTTT PRO (LEGACY)",
                "Price": 1.99,
                "TotalPrice": 15.91
            },
            {
                "_source": "19APR\n18APR\nAPPLE. COM/BILL\nITUNES . COM\nIE\n38.00",
                "Description": "APPLE. COM/BILL",
                "TotalPrice": 38
            },
            {
                "_source": "19APR\n15APR\nPAYPAL *BELLROY\n4029357733\nAU\n700.00",
                "Description": "PAYPAL *BELLROY",
                "ProductCode": "4029357733",
                "TotalPrice": 700
            },
            {
                "_source": "19APR\n14APR\nLINODE\n8554546633\nUS\nUSD\n502.75\n4,018.50\n*EXCHANGE RATE: 7.99304\n20APR\n19APR\n78.00",
                "Description": "LINODE",
                "Price": 502.75,
                "ProductCode": "8554546633",
                "TotalPrice": 4018.5
            },
            {
                "_source": "19APR\n15APR\nAPPLE. COM/BILL\nCORK\nIE\n61.00\n21APR\n20APR\nNYTimes*NYTimes\n800-698-4637\nUS\nUSD\n12.00\n95.97\n* EXCHANGE RATE: 7.99750",
                "Description": "CORK",
                "Price": 12,
                "ProductCode": "800-698-4637",
                "TotalPrice": 61
            },
            {
                "_source": "23APR\n21APR\nPAYPAL *GITHUB INC\n4029357733\nUS\n73.53",
                "Description": "PAYPAL *GITHUB INC",
                "ProductCode": "4029357733",
                "TotalPrice": 73.53
            },
            {
                "_source": "25APR\n23APR\nPAYPAL *WAKATIME\n4029357733\nHK\n73.56",
                "Description": "PAYPAL *WAKATIME",
                "ProductCode": "4029357733",
                "TotalPrice": 73.56
            },
            {
                "_source": "27APR\n26APR\nAPPLE. COM/BILL",
                "Description": "APPLE. COM/BILL"
            },
            {
                "_source": "CORK\nIE\n48.00\n27APR\n26APR\nPAYPAL *HAYU\n35314369001\nGB\n40.00",
                "Description": "PAYPAL *HAYU",
                "TotalPrice": 48
            }
        ],
        "doc2_MerchantName": "香港上海滙豐銀行有限公司\nLimited",
        "doc2_Total": 141,
        "doc2_TransactionDate": "2022-04-29T00:00:00.000Z",
        "doc3_MerchantName": "HSBC\n滙豐",
        "doc3_TransactionDate": "2022-04-29T00:00:00.000Z",
        "doc4_MerchantName": "香港上海滙豐銀行有限公司\nHongkong and Shanghai Corporation Limited",
        "doc4_MerchantPhoneNumber": "+88627488288",
        "doc4_TransactionDate": "2022-04-29T00:00:00.000Z",
        "__raw__": {
            "content": "HSBC\n滙豐\nThe Hongkong and Shanghai Banking Corporation Limited\n香港上海滙豐銀行有限公司\nSTATEMENT OF BUSINESS CARD ACCOUNT 公司卡戶口結單\nPage\n1/4\nMR LEE SEE MING\nM\nAccount number 戶口號碼\nC/O SML UNIVERSE LIMITED\n00914\n5199 3100 0018 7511\nFLAT F 27/F BLK 10 VISTA PARADISO\nCard type 信用卡類別\nCredit limit 信用限額\n2 HANG MING ST\nPlatinum Business MC\nHKD75,000.00\nNEW TERRITORIES\nStatement date 結單日\nStatement balance 結單結欠/結餘\n29 APR 2022\nHKD13,733.86\nPost date\nTrans date\nDescription of transaction\nAmount\n( HKD)\n記賬日期\n交易日期\n交易說明\n金額\nPREVIOUS BALANCE\n上月結欠/結餘\n29,261.46\n31MAR\n31MAR\nIFS PAYMENT - THANK YOU\n29,261.46CR\n12APR\n12APR\nIFS PAYMENT - THANK YOU\n21,247.87CR\n5199 3100 0018 7511\nSEE-MING LEE\nSML UNIVERSE LTD\n31MAR\n30MAR\nADOBE CREATIVE CLOUD\nDublin\nIE\n408.00\n31MAR\n30MAR\nDATYLON\nANTWERPEN\nBE\nUSD\n19.95\n159.23\n*EXCHANGE RATE: 7.98145\n01APR\n31MAR\nFORTRESS ONLINE STORE\nHONG KONG\nHK\n2,380.00\n02APR\n01APR\nOPEN SOURCE COLLECTIVE\nWALNUT\nUS\nUSD\n5.00\n39.92\n*EXCHANGE RATE: 7.98400\n02APR\n01APR\nCLOUDFLARE\nSAN FRANCISCO\nUS\nUSD\n66.60\n531.83\n*EXCHANGE RATE: 7.98544\n02APR\n02APR\nAPPLE. COM/BILL\nITUNES. COM\nIE\n344.00\n02APR\n01APR\nSTACK* ZEROSSL\nWIEN\nAT\nUSD\n10.00\n79.89\n*EXCHANGE RATE: 7.98900\n02APR\n01APR\nLINODE\n8554546633\nUS\nUSD\n126.64\n1,011.73\n*EXCHANGE RATE: 7.98902\n02APR\n02APR\nAPPLE. COM/BILL\nITUNES . COM\nIE\n118.00\n02APR\n02APR\nAPPLE. COM/BILL\nITUNES . COM\nIE\n398.00\n02APR\n01APR\nMAILGUN TECHNOLOGIES,\nSAN ANTONIO\nUS\nUSD\n3.66\n29.24\n*EXCHANGE RATE: 7.98907\n04APR\n02APR\nBROWSERSTACK. COM\nLEWES\nUS\nUSD\n19.00\n151.79\n*EXCHANGE RATE: 7.98895\n04APR\n02APR\nAPPLE. COM/BILL\nITUNES. COM\nIE\n133.00\n04APR\n02APR\nAPPLE. COM/BILL\nITUNES . COM\nIE\n656.00\n04APR\n01APR\nPAYPAL *PATREON\nMEMBE\n4029357733\nUS\n16.32\nFor important information such as payment methods, fees and charges, lost\ncard reporting, and change of correspondence address / telephone number,\nMinimum payment summary 最低付款摘要\nHKD\nplease visit www.hsbc.com.hk or call our Customer Service Hotline on\nCurrent minimum payment due 目前最低付款額\n138.00\n(852) 2748 8288.\nPlease pay by 須於此付款到期日或之前繳交\n26 MAY 2022\n有關您戶口的重要資料包括付款方式,利息與收費,報失信用卡,以及更改\nOverdue / overlimit due now\n通訊地址/電話號碼,請瀏覽網址www.hsbc.com.hk或聯絡我們的客戶服務熱\n須立即繳交的過期款項/超額款項\n0.00\n線(852) 2748 8288°\nTotal minimum payment due\n最低付款總額\n138.00\nHSBC\n滙豐\nPayment Slip 付款存根\nAccount number 戶口號碼\nCard type 信用卡類別\nIf you are paying by mail, please detach this payment slip and return it with a\n5199 3100 0018 7511\nPlatinum Business MC\ncrossed cheque made payable to \"The Hongkong and Shanghai Banking\nCorporation Limited\" or \"HSBC\" at least three working days before the\nStatement date 結單日\nStatement balance 結單結欠/結餘\npayment due date to our Centre, PO BOX NO. 73730, KOWLOON CENTRAL\n29 APR 2022\nHKD13, 733.86\nPOST OFFICE HK. Please write your account number on the back of the\nCheque number 支票號碼\nAmount enclosed\n夾附金額\n如欲以郵寄方式付款,請撕下此付款存根,於付款到期日三個工作天前,連同以\ncheque.\n「香港上海滙豐銀行有限公司」或「滙豐」為抬頭的劃線支票,寄回 PO BOX\nNO. 73730, KOWLOON CENTRAL POST OFFICE HK. 信用卡中心收,請於支\n票背面寫上您的戶口號碼。\nThank you for choosing HSBC.多謝選用滙豐服務。\nHSBC\n滙豐\nThe Hongkong and Shanghai Banking Corporation Limited\n香港上海滙豐銀行有限公司\nSTATEMENT OF BUSINESS CARD ACCOUNT 公司卡戶口結單\nPage 2 / 4\nCardholder's name 持卡人姓名\nAccount number 戶口號碼\nStatement date 結單日\nSEE-MING LEE\n5199 3100 0018 7511\n29 APR 2022\nPost date\nTrans date\nDescription of transaction\nAmount\n(HKD)\n記賬日期\n交易日期\n交易說明\n金額\n04APR\n02APR\nAmazon web services\naws . amazon. co\nUS\nUSD\n186.56\n1,490.44\n*EXCHANGE RATE: 7.98907\n04APR\n02APR\nAPPLE. COM/BILL\nITUNES. COM\nIE\n758.82CR\n04APR\n01APR\nBLS*REDIS LABS14085242\nLONDON\nGB\nUSD\n248.00\n1,980.39\n* EXCHANGE RATE: 7.98544\n04APR\n03APR\nNRI*NEW RELIC\n888-643-8776\nUS\nUSD\n244.00\n1,949.32\n*EXCHANGE RATE: 7.98902\n04APR\n03APR\nLINODE\n8554546633\nUS\nUSD\n503.25\n4,020.49\n*EXCHANGE RATE: 7.98905\n06APR\n04APR\nHUTCHISON TELECOM 3CC\nHONG KONG\nHK\n136.00\n07APR\n06APR\nLINODE\n8554546633\nUS\nUSD\n502.77\n4,016.40\n*EXCHANGE RATE: 7.98854\n07APR\n06APR\nAPPLE. COM/BILL\nITUNES. COM\nIE\n276.00\n07APR\n07APR\nSMARTONE AUTOPAY\nKWUN TONG\nHK\n220.00\n08APR\n07APR\nPAYPAL *OREILLYMEDI\n4029357733\nUS\n318.45\n08APR\n07APR\nAPPLE. COM/BILL\nITUNES . COM\nIE\n58.00\n09APR\n08APR\nPAYPAL *GUMROAD BEARS\n4029357733\nUS\n52.58\n09APR\n08APR\nPAYPAL *GUMROAD BEARS\n4029357733\nUS\n98.55\n09APR\n08APR\nPAYPAL *GUMROAD BEARS\n4029357733\nUS\n59.12\n09APR\n08APR\nAPPLE. COM/BILL\n85221120099\nIE\n108.00\n11APR\n10APR\nAPPLE. COM/BILL\nITUNES . COM\nIE\n58.00\n11APR\n10APR\nAPPLE. COM/BILL\nITUNES . COM\nIE\n708.00\n12APR\n11APR\nAPPLE. COM/BILL\nITUNES . COM\nIE\n78.00\n13APR\n12APR\nAPPLE STORE R610\n28\nHONG KONG\nHK\n3,998.00\n13APR\n12APR\nAPPLE. COM/BILL\nITUNES . COM\nIE\n78.00\n13APR\n11APR\nLINODE\n8554546633\nUS\nUSD\n488.25\n3,902.70\n*EXCHANGE RATE: 7.99324\n14APR\n13APR\nPAYPAL *TIDAL HIFI\n35314369001\nSE\n96.00\n19APR\n15APR\nAPPLE. COM/BILL\nITUNES . COM\nIE\n398.00\n19APR\n17APR\nPAYPAL *OUTPUT\n4029357733\nUS\n81.69\n19APR\n17APR\nIFTTT PRO (LEGACY)\nSAN FRANCISCO\nUS\nUSD\n1.99\n15.91\n*EXCHANGE RATE: 7.99497\n19APR\n18APR\nAPPLE. COM/BILL\nITUNES . COM\nIE\n38.00\n19APR\n15APR\nPAYPAL *BELLROY\n4029357733\nAU\n700.00\n19APR\n14APR\nLINODE\n8554546633\nUS\nUSD\n502.75\n4,018.50\n*EXCHANGE RATE: 7.99304\n19APR\n15APR\nAPPLE. COM/BILL\nCORK\nIE\n61.00\n20APR\n19APR\nNetflix.com\nLos Gatos\nSG\n78.00\n21APR\n20APR\nNYTimes*NYTimes\n800-698-4637\nUS\nUSD\n12.00\n95.97\n* EXCHANGE RATE: 7.99750\n23APR\n21APR\nPAYPAL *GITHUB INC\n4029357733\nUS\n73.53\n25APR\n23APR\nPAYPAL *WAKATIME\n4029357733\nHK\n73.56\n27APR\n26APR\nAPPLE. COM/BILL\nCORK\nIE\n48.00\n27APR\n26APR\nPAYPAL *HAYU\n35314369001\nGB\n40.00\n29APR\n29APR\nCREDIT REWARD CASH REBATE\n141.00CR\n*For credit card transactions effected in currencies other\nthan Hong Kong dollars, the exchange rate applied includes a\nhandling fee equivalent to 1.95% of each transaction. The\nfee relating to foreign currency transaction is not\napplicable to RMB Business Card.\n就每項以非港元進行的信用卡交易,所用外幣匯率已包括交易金\n額1.95%的手續費。外幣交易有關費用不適用於人民幣公司卡。\nNote: \"CR\" means Credit transaction / balance\n註:「CR」為入賬交易/結餘\n**** REWARDCASH SUMMARY FOR CARD NUMBER 5199 3100 0018 7511\nREWARDCASH EARNED\n:\n141\nREWARDCASH ADJUSTED\n:\n0\nREWARDCASH REDEEMED\n0\n..\nCONVERTED TO CASH REBATE\n:\n141\nHSBC\n滙豐\nThe Hongkong and Shanghai Banking Corporation Limited\n香港上海滙豐銀行有限公司\nSTATEMENT OF BUSINESS CARD ACCOUNT 公司卡戶口結單\nPage 3 / 4\nCardholder's name 持卡人姓名\nAccount number 戶口號碼\nStatement date 結單日\nSEE-MING LEE\n5199 3100 0018 7511\n29 APR 2022\nPost date\nTrans date\nDescription of transaction\nAmount\n( HKD)\n記賬日期\n交易日期\n交易說明\n金額\nSTATEMENT BALANCE\n結單結欠/結餘\n13,733.86\n*:\n** TRANSACTION SUMMARY\n**\n**\nCREDIT/PAYMENT\n51,268.15CR\n..\nPURCHASES AND INSTALMENTS\n:\n35,881.55\nCREDIT ADJUSTMENT\n141.00CR\n..\nTOTAL ACCOUNT BALANCE\n13,733.86\n..\nFEES AND CHARGES SUMMARY\nFEE/CHARGE TYPE\nAMOUNT\nTOTAL FEES/CHARGES ( EXCLUDING FINANCE CHARGE)\n0.00\n* :\n*** FINANCE CHARGE SUMMARY\nBALANCE TYPE\nANNUALISED PERCENTAGE RATE (APR)\nFINANCE CHARGE\nCASH ADVANCE\n35.61%\n0.00\nPURCHASE\n34.46%\n0.00\nTOTAL FINANCE CHARGE\n0.00\n**\n*INFORMATION REGARDING MAKING MINIMUM PAYMENT*\nThe below examples are for illustration only. You may visit our Bank\nwebsite at www.hsbc. com.hk for an online credit card repayment\ncalculator for customized information.\nIf you make no additional\nYou will pay off the\nand you will end up\ncharges, purchases and\noutstanding balance*\ncash advances on this card\n| paying an estimated\nof HKD20, 000 in\ntotal of ...\nand each month you pay. ..\nabout . . .\n|\n|\n|\nOnly Minimum Payment Due\n|\n26 years **\n|\nHKD67,536 ***\n|\n|\nHKD849\n|\n3 years **\n|\nHKD30,565 ***\n|\n(Savings=HKD36, 971)\n* The outstanding balance of HKD20, 000 is accrued from purchase only.\n** Assume repayment is made on or before the payment due date of each\nstatement month.\n*** Include the outstanding balance of HKD20, 000 and the total finance\ncharge which is accrued daily and calculated at an interest rate of\n2.5% per month (equivalent to an annualised percentage rate of 34.46%\non purchase and 35.61% on cash advance) on the outstanding balance\nuntil it is fully paid.\nThe statement is for your reference only.\nPayment to be\narranged by your corporation.\nThe RewardCash earned by the company have been\ntransferred to your Business Card account.\nIf the statement balance for your credit card account\nHSBC\n滙豐\nThe Hongkong and Shanghai Banking Corporation Limited\n香港上海滙豐銀行有限公司\nSTATEMENT OF BUSINESS CARD ACCOUNT 公司卡戶口結單\nPage 4 / 4\nCardholder's name 持卡人姓名\nAccount number 戶口號碼\nStatement date 結單日\nSEE-MING LEE\n5199 3100 0018 7511\n29 APR 2022\nPost date\nTrans date\nDescription of transaction\nAmount\n( HKD)\n記賬日期\n交易日期\n交易說明\n金額\nexceeds the credit limit on the statement date, an overlimit\nhandling fee will be debited to the account. If you wish to\nopt out of the over-the-limit facility, you may fill out\nthe form on the back of the statement. For enquiries,\nplease contact us on 2748 8288.\n若您的結單結欠超出該信用卡戶口截至結單日的信用限額,\n本行會徵收超出信用限額手續費。如您欲拒絕接受超出信用限額\n信貸安排,請填妥結單背頁之表格作出指示。如有任何\n查詢,請致電2748 8288。",
            "paragraphs": []
        },
        "created_at": "2024-01-12T21:40:58.943Z"
    },
    {
        "doc1_Currency": "JPY",
        "doc1_Items": [
            {
                "_source": "29NOV\n28NOV\nPAYPAL *AESCRIPTS\n4029357733\nUS\n375.10",
                "Category": "Other",
                "Date": "1929-11-28T00:00:00.000Z",
                "Description": "PAYPAL *AESCRIPTS",
                "TotalPrice": 375.1
            },
            {
                "_source": "30NOV\n29NOV\nPAYPAL *AESCRIPTS\n4029357733\nUS\n1,527.58",
                "Category": "Other",
                "Date": "1930-11-29T00:00:00.000Z",
                "Description": "PAYPAL *AESCRIPTS",
                "TotalPrice": 1527.58
            },
            {
                "_source": "30NOV\n29NOV\nPAYPAL *AESCRIPTS\n4029357733\nUS\n299.42",
                "Category": "Other",
                "Date": "1930-11-29T00:00:00.000Z",
                "Description": "PAYPAL *AESCRIPTS",
                "TotalPrice": 299.42
            },
            {
                "_source": "30NOV\n29NOV\nADOBE CREATIVE CLOUD\nDublin\nIE\n408.00",
                "Date": "1930-11-29T00:00:00.000Z",
                "Description": "ADOBE CREATIVE CLOUD",
                "TotalPrice": 408
            },
            {
                "_source": "01DEC\n30NOV\nDATYLON\nANTWERPEN\nBE\nUSD\n19.95\n158.91\n*EXCHANGE RATE: 7.96541",
                "Category": "Credit",
                "Date": "2001-12-30T00:00:00.000Z",
                "Description": "DATYLON"
            },
            {
                "_source": "01DEC\n30NOV\nPAYPAL *AESCRIPTS\n4029357733\nUS\n321.81",
                "Category": "Credit",
                "Date": "2001-12-30T00:00:00.000Z",
                "Description": "PAYPAL *AESCRIPTS",
                "TotalPrice": 321.81
            },
            {
                "_source": "01DEC\n30NOV\nNYTimes *NYTimes\n800-698-4637\nUS\nUSD\n12.00\n95.59\n*EXCHANGE RATE: 7.96583",
                "Category": "Credit",
                "Date": "2001-12-30T00:00:00.000Z",
                "Description": "NYTimes *NYTimes",
                "TotalPrice": 95.59
            },
            {
                "_source": "02DEC\n01DEC\nGOOGLE*CLOUD 4JCV7W\nSINGAPORE\nSG",
                "Category": "Credit",
                "Date": "2002-12-01T00:00:00.000Z",
                "Description": "GOOGLE*CLOUD 4JCV7W\nSINGAPORE"
            },
            {
                "_source": "02DEC\n01DEC\nBLS*REDIS LABS14085242\nLONDON\nGB\nUSD\n248.00\n1,975.43\n*EXCHANGE RATE: 7.96544",
                "Category": "Meals",
                "Date": "02DEC",
                "Description": "BLS*REDIS LABS14085242"
            },
            {
                "_source": "02DEC\n01DEC\nMAILGUN TECHNOLOGIES,\nSAN ANTONIO\nUS\nUSD\n3.59\n28.59\n*EXCHANGE RATE: 7.96379",
                "Date": "02DEC",
                "Description": "MAILGUN TECHNOLOGIES,\nSAN",
                "TotalPrice": 28.59
            },
            {
                "_source": "02DEC\n01DEC\nOPEN SOURCE COLLECTIVE\nWALNUT\nUS\nUSD\n5.00\n39.83\n*EXCHANGE RATE: 7.96600",
                "Category": "Meals",
                "Date": "02DEC",
                "Description": "OPEN SOURCE COLLECTIVE\nWALNUT",
                "TotalPrice": 39.83
            },
            {
                "_source": "02DEC\n01DEC\nLINODE . AKAMAI\n6093807100\nUS\nUSD\n4,800.56\n38,238.66\n* EXCHANGE RATE: 7.96546",
                "Category": "Meals",
                "Date": "02DEC",
                "Description": "LINODE AKAMAI"
            },
            {
                "_source": "02DEC\n01DEC\nCLOUDFLARE\nSAN FRANCISCO\nUS\nUSD\n40.00\n318.61\n*EXCHANGE RATE: 7.96525",
                "Description": "CLOUDFLARE"
            },
            {
                "_source": "02DEC\n01DEC\nGOOGLE*GSUITE SMLUNIVE\nSINGAPORE\nSG\n70.50",
                "Description": "GOOGLE*GSUITE SMLUNIVE",
                "TotalPrice": 70.5
            },
            {
                "_source": "02DEC\n01DEC\nZEROSSL* ZEROSSL\nVIENNA\nAT\nUSD\n10.00\n79.64\n*EXCHANGE RATE: 7.96400",
                "Date": "02DEC",
                "Description": "ZEROSSL* ZEROSSL",
                "TotalPrice": 79.64
            }
        ],
        "doc1_MerchantAddress": {
            "_source": "PO BOX\nNO. 73730, KOWLOON CENTRAL POST OFFICE HK.",
            "poBox": "PO BOX\nNO. 73730",
            "streetAddress": "PO BOX\nNO. 73730",
            "house": "KOWLOON CENTRAL POST OFFICE HK."
        },
        "doc1_MerchantAliases": [
            "HSBC.",
            "The Hongkong and Shanghai Corporation Limited",
            "香海滙豐銀行有",
            "HSBC\n滙豐"
        ],
        "doc1_MerchantName": "香港上海滙豐銀行有限公司",
        "doc1_MerchantPhoneNumber": "+8185227488288",
        "doc2_Items": [
            {
                "_source": "03DEC\n02DEC\nPAYPAL *AESCRIPTS\n4029357733\nUS\n121.88",
                "Description": "PAYPAL *AESCRIPTS",
                "ProductCode": "4029357733",
                "TotalPrice": 121.88
            },
            {
                "_source": "03DEC\n02DEC\nBROWSERSTACK. COM\nLEWES\nUS\nUSD\n10.00\n79.64\n*EXCHANGE RATE: 7.96400",
                "Description": "BROWSERSTACK. COM",
                "Price": 10,
                "TotalPrice": 79.64
            },
            {
                "_source": "03DEC\n02DEC\nAmazon web services\nUS\nUSD\n313.20\n2,487.45\n*EXCHANGE RATE: 7.94205",
                "Description": "Amazon web services",
                "TotalPrice": 2487.45
            },
            {
                "_source": "03DEC\n01DEC\nPAYPAL *AESCRIPTS\n4029357733\nUS\n543.04\n03DEC\n01DEC\nPAYPAL *PATREON\nMEMBE\n4029357733\nUS\n16.27",
                "Description": "03DEC\n01DEC\nPAYPAL *AESCRIPTS\n01DEC\nPAYPAL *PATREON\nMEMBE",
                "ProductCode": "4029357733",
                "TotalPrice": 543.04
            },
            {
                "_source": "03DEC\n02DEC\nPAYPAL\n*FASTSPRING\n4029357733\nUS\n80.99",
                "Description": "03DEC\n02DEC\nPAYPAL\n*FASTSPRING",
                "ProductCode": "4029357733",
                "TotalPrice": 80.99
            },
            {
                "_source": "03DEC\n02DEC\nPAYPAL *FASTSPRING\n4029357733\nUS\n113.15",
                "Description": "03DEC\n02DEC\nPAYPAL *FASTSPRING",
                "ProductCode": "4029357733",
                "TotalPrice": 113.15
            },
            {
                "_source": "03DEC\n01DEC\nPAYPAL *AESCRIPTS\n4029357733\nUS\n115.85",
                "Description": "03DEC\n01DEC\nPAYPAL *AESCRIPTS",
                "ProductCode": "4029357733",
                "TotalPrice": 115.85
            },
            {
                "_source": "05DEC\n03DEC\nNRI*NEW RELIC\n888-643-8776\nUS\nUSD\n363.60\n2,887.72\n*EXCHANGE RATE: 7.94202\n05DEC\n03DEC\nPAYPAL *AESCRIPTS\n4029357733\nUS\n303.88",
                "Description": "NRI*NEW RELIC\nPAYPAL *AESCRIPTS",
                "Price": 363.6,
                "ProductCode": "4029357733",
                "TotalPrice": 303.88
            },
            {
                "_source": "05DEC\n03DEC\nAPPLE. COM/BILL\nITUNES\nCOM\nIE\n23.00",
                "Description": "APPLE. COM/BILL",
                "TotalPrice": 23
            },
            {
                "_source": "06DEC\n04DEC\nPAYPAL *AESCRIPTS\n4029357733\nUS\n176.49",
                "Description": "PAYPAL *AESCRIPTS",
                "ProductCode": "4029357733",
                "TotalPrice": 176.49
            },
            {
                "_source": "06DEC\n05DEC\nCLOUDFLARE\nSAN FRANCISCO\nUS\nUSD\n240.00\n1,906.09\n*EXCHANGE RATE: 7.94204",
                "Description": "CLOUDFLARE",
                "Price": 240,
                "TotalPrice": 1906.09
            },
            {
                "_source": "06DEC\n05DEC\n7-Eleven, HK\nHK",
                "Description": "7-Eleven,"
            },
            {
                "_source": "06DEC\n05DEC\nCLOUDFLARE\nSAN FRANCISCO\nUS\nUSD\n240.00\n1,906.09\n*EXCHANGE RATE: 7.94204",
                "Description": "CLOUDFLARE",
                "Price": 240,
                "TotalPrice": 1906.09
            },
            {
                "_source": "06DEC\n05DEC\nHUTCHISON TELECOM 3CC\nHONG KONG\nHK\n197.00",
                "Description": "HUTCHISON TELECOM 3CC",
                "TotalPrice": 197
            },
            {
                "_source": "07DEC\n04DEC\nPAYPAL *CRUNCHY CRUNCH\n4029357733\nHK\n1,048.62",
                "Description": "PAYPAL *CRUNCHY CRUNCH",
                "ProductCode": "4029357733",
                "TotalPrice": 1048.62
            },
            {
                "_source": "08DEC\n07DEC\nAPPLE. COM/BILL\nITUNES. COM\nIE\n38.00\n09DEC\n08DEC\nWolt\nHelsinki\nFI\nEUR\n122.30\n1,023.99\n*EXCHANGE RATE: 8.37277\n12DEC\n12DEC\n11DEC\nAPPLE. COM/BILL\nCOM\n23.00",
                "Description": "APPLE. COM/BILL",
                "Price": 122.3,
                "TotalPrice": 1023.99
            },
            {
                "_source": "12DEC\n11DEC\nPAYPAL *AESCRIPTS\n4029357733\nUS\n316.51\n12DEC\n10DEC\nHKTV MALL\nHONG KONG\nHK\n553.80",
                "Description": "11DEC\nPAYPAL *AESCRIPTS\nHKTV MALL",
                "TotalPrice": 316.51
            },
            {
                "_source": "12DEC\n11DEC\nAPPLE. COM/BILL\nITUNES . COM\nIE\n78.00",
                "Description": "APPLE. COM/BILL",
                "TotalPrice": 78
            },
            {
                "_source": "13DEC\n12DEC\nPAYPAL *AESCRIPTS\n4029357733\nUS\n243.39\n14DEC\n13DEC\nMIDJOURNEY INC.\nSAN FRANCISCO\nUS\nUSD\n30.00\n238.22\n*EXCHANGE RATE: 7.94067",
                "Description": "PAYPAL *AESCRIPTS\nMIDJOURNEY INC.",
                "Price": 30,
                "ProductCode": "4029357733",
                "TotalPrice": 243.39
            },
            {
                "_source": "17DEC\n16DEC\nAPPLE. COM/BILL\n85221120099\nIE\n71.00",
                "Description": "APPLE. COM/BILL",
                "Price": 16,
                "ProductCode": "85221120099",
                "TotalPrice": 71
            },
            {
                "_source": "19DEC\n18DEC\nAPPLE. COM/BILL\nITUNES.\nIE\n23.00",
                "Description": "APPLE. COM/BILL",
                "TotalPrice": 23
            },
            {
                "_source": "19DEC\n17DEC\nIFTTT PRO (LEGACY)\nSAN FRANCISCO\nUS\nUSD\n1.99\n15.79\n*EXCHANGE RATE: 7.93467",
                "Description": "IFTTT PRO (LEGACY)",
                "Price": 1.99,
                "TotalPrice": 15.79
            },
            {
                "_source": "21DEC\n19DEC\nPAYPAL *AESCRIPTS\nUS\n162.13",
                "Description": "PAYPAL *AESCRIPTS",
                "TotalPrice": 162.13
            },
            {
                "_source": "22DEC\n21DEC\nAPPLE. COM/BILL\nITUNES\nCOM\nIE\n36.00",
                "Description": "APPLE. COM/BILL",
                "TotalPrice": 36
            },
            {
                "_source": "*GITHUB INC\n4029357733\nUS\n73.02",
                "Description": "*GITHUB INC",
                "ProductCode": "4029357733",
                "TotalPrice": 73.02
            },
            {
                "_source": "21DEC\nPAYPAL",
                "Description": "PAYPAL"
            },
            {
                "_source": "24DEC\n22DEC\nPAYPAL *AESCRIPTS\n4029357733\nUS\n324.53",
                "Description": "PAYPAL *AESCRIPTS",
                "ProductCode": "4029357733",
                "TotalPrice": 324.53
            },
            {
                "_source": "28DEC\n23DEC\nPAYPAL *WAKATIME\n4029357733\nHK\n73.12",
                "Description": "PAYPAL *WAKATIME",
                "ProductCode": "4029357733",
                "TotalPrice": 73.12
            },
            {
                "_source": "28DEC\n24DEC\nAPPLE. COM/BILL\nITUNES\nCOM\nIE\n15.00",
                "Description": "APPLE. COM/BILL",
                "TotalPrice": 15
            },
            {
                "_source": "28DEC\n25DEC\nMURF.AI\nSALT LAKE CIT\nUS\nUSD\n19.00\n151.19\n*EXCHANGE RATE: 7.95737",
                "Description": "MURF.AI",
                "TotalPrice": 151.19
            },
            {
                "_source": "28DEC\n26DEC\nPAYPAL *HAYU\n35314369001\nGB\n40.00",
                "Description": "PAYPAL *HAYU",
                "ProductCode": "35314369001",
                "TotalPrice": 40
            },
            {
                "_source": "29DEC\n28DEC\nUSD\n12.00\n95.46",
                "TotalPrice": 95.46
            }
        ],
        "doc2_MerchantName": "香港上海滙豐銀行有限公司",
        "doc2_TaxDetails": [
            {
                "_source": "23DEC"
            }
        ],
        "doc2_Total": 261,
        "doc2_TransactionDate": "2022-12-29T00:00:00.000Z",
        "doc3_MerchantName": "香港上海滙豐銀行有限公司",
        "doc3_TransactionDate": "2022-12-29T00:00:00.000Z",
        "doc4_MerchantName": "香港上海滙豐銀行有限公司",
        "doc4_MerchantPhoneNumber": "+88627488288",
        "doc4_TransactionDate": "2022-12-29T00:00:00.000Z",
        "__raw__": {
            "content": "HSBC\n滙豐\nThe Hongkong and Shanghai Banking Corporation Limited\n香港上海滙豐銀行有限公司\nSTATEMENT OF BUSINESS CARD ACCOUNT 公司卡戶口結單\nPage\n1/4\nMR LEE SEE MING\nM\nAccount number 戶口號碼\nC/O SML UNIVERSE LIMITED\n00905\n5199 3100 0018 7511\nFLAT F 27/F BLK 10 VISTA PARADISO\nCard type 信用卡類別\nCredit limit 信用限額\n2 HANG MING ST\nPlatinum Business MC\nHKD75,000.00\nNEW TERRITORIES\nStatement date 結單日\nStatement balance 結單結欠/結餘\n29 DEC 2022\nHKD7, 349.18\nPost date\nTrans date\nDescription of transaction\nAmount\n(HKD)\n記賬日期\n交易日期\n交易說明\n金額\nPREVIOUS BALANCE\n上月結欠/結餘\n9,551.97\n30NOV\n30NOV\nIFS PAYMENT - THANK YOU\n9,927.07CR\n07DEC\n07DEC\nIFS PAYMENT - THANK YOU\n57,479.02CR\n5199 3100 0018 7511\nSEE-MING LEE\nSML UNIVERSE LTD\n29NOV\n28NOV\nPAYPAL *AESCRIPTS\n4029357733\nUS\n375.10\n30NOV\n29NOV\nPAYPAL *AESCRIPTS\n4029357733\nUS\n1,527.58\n30NOV\n29NOV\nPAYPAL *AESCRIPTS\n4029357733\nUS\n299.42\n30NOV\n29NOV\nADOBE CREATIVE CLOUD\nDublin\nIE\n408.00\n01DEC\n30NOV\nDATYLON\nANTWERPEN\nBE\nUSD\n19.95\n158.91\n*EXCHANGE RATE: 7.96541\n01DEC\n30NOV\nPAYPAL *AESCRIPTS\n4029357733\nUS\n321.81\n01DEC\n30NOV\nNYTimes *NYTimes\n800-698-4637\nUS\nUSD\n12.00\n95.59\n*EXCHANGE RATE: 7.96583\n02DEC\n01DEC\nGOOGLE*CLOUD 4JCV7W\nSINGAPORE\nSG\n157.41\n02DEC\n01DEC\nBLS*REDIS LABS14085242\nLONDON\nGB\nUSD\n248.00\n1,975.43\n*EXCHANGE RATE: 7.96544\n02DEC\n01DEC\nMAILGUN TECHNOLOGIES,\nSAN ANTONIO\nUS\nUSD\n3.59\n28.59\n*EXCHANGE RATE: 7.96379\n02DEC\n01DEC\nOPEN SOURCE COLLECTIVE\nWALNUT\nUS\nUSD\n5.00\n39.83\n*EXCHANGE RATE: 7.96600\n02DEC\n01DEC\nLINODE . AKAMAI\n6093807100\nUS\nUSD\n4,800.56\n38,238.66\n* EXCHANGE RATE: 7.96546\n02DEC\n01DEC\nCLOUDFLARE\nSAN FRANCISCO\nUS\nUSD\n40.00\n318.61\n*EXCHANGE RATE: 7.96525\n02DEC\n01DEC\nGOOGLE*GSUITE SMLUNIVE\nSINGAPORE\nSG\n70.50\n02DEC\n01DEC\nZEROSSL* ZEROSSL\nVIENNA\nAT\nUSD\n10.00\n79.64\n*EXCHANGE RATE: 7.96400\nFor important information such as payment methods, fees and charges, lost\nMinimum payment summary 最低付款摘要\ncard reporting, and change of correspondence address / telephone number,\nHKD\nplease visit www.hsbc.com.hk or call our Customer Service Hotline on\nCurrent minimum payment due 目前最低付款額\n74.00\n(852) 2748 8288.\nPlease pay by 須於此付款到期日或之前繳交\n26 JAN 2023\n有關您戶口的重要資料包括付款方式,利息與收費,報失信用卡,以及更改\nOverdue / overlimit due now\n通訊地址/電話號碼,請瀏覽網址www.hsbc.com.hk或聯絡我們的客戶服務熱\n須立即繳交的過期款項/超額款項\n0.00\n線(852) 2748 8288°\nTotal minimum payment due\n最低付款總額\n74.00\nHSBC\n滙豐\nPayment Slip 付款存根\nAccount number 戶口號碼\nCard type 信用卡類別\nIf you are paying by mail, please detach this payment slip and return it with a\n5199 3100 0018 7511\nPlatinum Business MC\ncrossed cheque made payable to \"The Hongkong and Shanghai Banking\nCorporation Limited\" or \"HSBC\" at least three working days before the\nStatement date 結單日\nStatement balance 結單結欠/結餘\npayment due date to our Centre, PO BOX NO. 73730, KOWLOON CENTRAL\n29 DEC 2022\nHKD7, 349.18\nPOST OFFICE HK. Please write your account number on the back of the\nCheque number 支票號碼\nAmount enclosed\n夾附金額\n如欲以郵寄方式付款,請撕下此付款存根,於付款到期日三個工作天前,連同以\ncheque.\n「香港上海滙豐銀行有限公司」或「滙豐」為抬頭的劃線支票,寄回 PO BOX\nNO. 73730, KOWLOON CENTRAL POST OFFICE HK. 信用卡中心收,請於支\n票背面寫上您的戶口號碼。\nThank you for choosing HSBC.多謝選用滙豐服務。\nHSBC\n滙豐\nThe Hongkong and Shanghai Banking Corporation Limited\n香港上海滙豐銀行有限公司\nSTATEMENT OF BUSINESS CARD ACCOUNT 公司卡戶口結單\nPage\n2/4\nCardholder's name 持卡人姓名\nAccount number 戶口號碼\nStatement date 結單日\nSEE-MING LEE\n5199 3100 0018 7511\n29 DEC 2022\nPost date\nTrans date\nDescription of transaction\nAmount\n(HKD)\n記賬日期\n交易日期\n交易說明\n金額\n03DEC\n02DEC\nPAYPAL *AESCRIPTS\n4029357733\nUS\n121.88\n03DEC\n02DEC\nBROWSERSTACK. COM\nLEWES\nUS\nUSD\n10.00\n79.64\n*EXCHANGE RATE: 7.96400\n03DEC\n02DEC\nAmazon web services\naws . amazon. co\nUS\nUSD\n313.20\n2,487.45\n*EXCHANGE RATE: 7.94205\n03DEC\n01DEC\nPAYPAL *AESCRIPTS\n4029357733\nUS\n543.04\n03DEC\n01DEC\nPAYPAL *PATREON\nMEMBE\n4029357733\nUS\n16.27\n03DEC\n02DEC\nPAYPAL\n*FASTSPRING\n4029357733\nUS\n80.99\n03DEC\n02DEC\nPAYPAL *FASTSPRING\n4029357733\nUS\n113.15\n03DEC\n01DEC\nPAYPAL *AESCRIPTS\n4029357733\nUS\n115.85\n05DEC\n03DEC\nNRI*NEW RELIC\n888-643-8776\nUS\nUSD\n363.60\n2,887.72\n*EXCHANGE RATE: 7.94202\n05DEC\n03DEC\nPAYPAL *AESCRIPTS\n4029357733\nUS\n303.88\n05DEC\n03DEC\nAPPLE. COM/BILL\nITUNES . COM\nIE\n23.00\n06DEC\n04DEC\nPAYPAL *AESCRIPTS\n4029357733\nUS\n176.49\n06DEC\n05DEC\nCLOUDFLARE\nSAN FRANCISCO\nUS\nUSD\n240.00\n1,906.09\n*EXCHANGE RATE: 7.94204\n06DEC\n05DEC\n7-Eleven, HK (0824)\nMA ON SHAN\nHK\n2,800.50\n06DEC\n05DEC\nCLOUDFLARE\nSAN FRANCISCO\nUS\nUSD\n240.00\n1,906.09\n*EXCHANGE RATE: 7.94204\n06DEC\n05DEC\nHUTCHISON TELECOM 3CC\nHONG KONG\nHK\n197.00\n07DEC\n04DEC\nPAYPAL *CRUNCHY CRUNCH\n4029357733\nHK\n1,048.62\n08DEC\n07DEC\nAPPLE. COM/BILL\nITUNES. COM\nIE\n38.00\n09DEC\n08DEC\nWolt\nHelsinki\nFI\nEUR\n122.30\n1,023.99\n*EXCHANGE RATE: 8.37277\n12DEC\n10DEC\nPAYPAL *OUTSOURCEEX\n35314369001\nGB\n89.60\n12DEC\n11DEC\nAPPLE. COM/BILL\nITUNES . COM\nIE\n23.00\n12DEC\n11DEC\nPAYPAL *AESCRIPTS\n4029357733\nUS\n316.51\n12DEC\n10DEC\nHKTV MALL\nHONG KONG\nHK\n553.80\n12DEC\n11DEC\nAPPLE. COM/BILL\nITUNES . COM\nIE\n78.00\n13DEC\n12DEC\nPAYPAL *AESCRIPTS\n4029357733\nUS\n243.39\n14DEC\n13DEC\nMIDJOURNEY INC.\nSAN FRANCISCO\nUS\nUSD\n30.00\n238.22\n*EXCHANGE RATE: 7.94067\n17DEC\n16DEC\nAPPLE. COM/BILL\n85221120099\nIE\n71.00\n19DEC\n18DEC\nAPPLE. COM/BILL\nITUNES. COM\nIE\n23.00\n19DEC\n17DEC\nIFTTT PRO (LEGACY)\nSAN FRANCISCO\nUS\nUSD\n1.99\n15.79\n*EXCHANGE RATE: 7.93467\n20DEC\n19DEC\nPAYPAL *AESCRIPTS\n4029357733\nUS\n243.31\n20DEC\n19DEC\nNetflix.com\nLos Gatos\nSG\n78.00\n21DEC\n20DEC\n7-Eleven, HK (0824)\nMA ON SHAN\nHK\n2,524.50\n21DEC\n19DEC\nPAYPAL *AESCRIPTS\n4029357733\nUS\n162.13\n22DEC\n21DEC\nAPPLE. COM/BILL\nITUNES . COM\nIE\n36.00\n23DEC\n21DEC\nPAYPAL *GITHUB INC\n4029357733\nUS\n73.02\n24DEC\n22DEC\nPAYPAL *AESCRIPTS\n4029357733\nUS\n324.53\n28DEC\n23DEC\nPAYPAL *WAKATIME\n4029357733\nHK\n73.12\n28DEC\n24DEC\nAPPLE. COM/BILL\nITUNES . COM\nIE\n15.00\n28DEC\n25DEC\nMURF.AI\nSALT LAKE CIT\nUS\nUSD\n19.00\n151.19\n*EXCHANGE RATE: 7.95737\n28DEC\n26DEC\nPAYPAL *HAYU\n35314369001\nGB\n40.00\n29DEC\n28DEC\nAPPLE. COM/BILL\nITUNES .COM\nIE\n31.00\n29DEC\n28DEC\nNYTimes*NYTimes\n800-698-4637\nUS\nUSD\n12.00\n95.46\n*EXCHANGE RATE: 7.95500\n29DEC\n29DEC\nCREDIT REWARD CASH REBATE\n261.00CR\n*For credit card transactions effected in currencies other\nthan Hong Kong dollars, the exchange rate applied includes a\nhandling fee equivalent to 1.95% of each transaction. The\nfee relating to foreign currency transaction is not\napplicable to RMB Business Card.\n就每項以非港元進行的信用卡交易,所用外幣匯率已包括交易金\n額1.95%的手續費。外幣交易有關費用不適用於人民幣公司卡。\nNote: \"CR\" means Credit transaction / balance\n註:「CR」為入賬交易/結餘\nHSBC\n滙豐\nThe Hongkong and Shanghai Banking Corporation Limited\n香港上海滙豐銀行有限公司\nSTATEMENT OF BUSINESS CARD ACCOUNT 公司卡戶口結單\nPage\n3/4\nCardholder's name 持卡人姓名\nAccount number 戶口號碼\nStatement date 結單日\nSEE-MING LEE\n5199 3100 0018 7511\n29 DEC 2022\nPost date\nTrans date\nDescription of transaction\nAmount\n(HKD)\n記賬日期\n交易日期\n交易說明\n金額\n**** REWARDCASH SUMMARY FOR CARD NUMBER 5199 3100 0018 7511\nREWARDCASH EARNED\n261\n..\nREWARDCASH ADJUSTED\n0\n..\nREWARDCASH REDEEMED\n0\n..\nCONVERTED TO CASH REBATE\n261\n..\nSTATEMENT BALANCE\n結單結欠/結餘\n7,349.18\n***\nTRANSACTION SUMMARY\n*****\nCREDIT/PAYMENT\n67,406.09CR\n..\nPURCHASES AND INSTALMENTS\n:\n65,464.30\nCREDIT ADJUSTMENT\n261.00CR\n..\nTOTAL ACCOUNT BALANCE\n7,349.18\n..\nFEES AND CHARGES SUMMARY\nFEE/CHARGE TYPE\nAMOUNT\nTOTAL FEES/CHARGES ( EXCLUDING FINANCE CHARGE)\n0.00\n***** FINANCE CHARGE SUMMARY\n*:\nBALANCE TYPE\nANNUALISED PERCENTAGE RATE (APR)\nFINANCE CHARGE\nCASH ADVANCE\n35.61%\n0.00\nPURCHASE\n34.46%\n0.00\nTOTAL FINANCE CHARGE\n0.00\n* ** * **\n*INFORMATION REGARDING MAKING MINIMUM PAYMENT*\nThe below examples are for illustration only. You may visit our Bank\nwebsite at www.hsbc. com.hk for an online credit card repayment\ncalculator for customized information.\nIf you make no additional\nYou will pay off the\ncharges, purchases and\nand you will end up\noutstanding balance*\ncash advances on this card\n| paying an estimated\nof HKD20,000 in\n|total of ...\nand each month you pay ...\nabout . ..\n|\nOnly Minimum Payment Due\n|\n|\n|\n26 years **\n|\nHKD67,536 ***\n|\n|\nHKD849\n|\n3 years **\n|\nHKD30,565 ***\n|\n( Savings=HKD36, 971)\n* The outstanding balance of HKD20, 000 is accrued from purchase only.\n** Assume repayment is made on or before the payment due date of each\nstatement month.\n*** Include the outstanding balance of HKD20, 000 and the total finance\ncharge which is accrued daily and calculated at an interest rate of\n2.5% per month (equivalent to an annualised percentage rate of 34.46%\non purchase and 35.61% on cash advance) on the outstanding balance\nuntil it is fully paid.\nThe statement is for your reference only.\nPayment to be\narranged by your corporation.\nThe RewardCash earned by the company have been\ntransferred to your Business Card account.\nIf the statement balance for your credit card account\nHSBC\n滙豐\nThe Hongkong and Shanghai Banking Corporation Limited\n香港上海滙豐銀行有限公司\nSTATEMENT OF BUSINESS CARD ACCOUNT 公司卡戶口結單\nPage 4 /4\nCardholder's name 持卡人姓名\nAccount number 戶口號碼\nStatement date 結單日\nSEE-MING LEE\n5199 3100 0018 7511\n29 DEC 2022\nPost date\nTrans date\nDescription of transaction\nAmount\n( HKD)\n記賬日期\n交易日期\n交易說明\n金額\nexceeds the credit limit on the statement date, an overlimit\nhandling fee will be debited to the account. If you wish to\nopt out of the over-the-limit facility, you may fill out\nthe form on the back of the statement. For enquiries,\nplease contact us on 2748 8288.\n若您的結單結欠超出該信用卡戶口截至結單日的信用限額,\n本行會徵收超出信用限額手續費。如您欲拒絕接受超出信用限額\n信貸安排,請填妥結單背頁之表格作出指示。如有任何\n查詢,請致電2748 8288。\nUpdate of Airport Lounge Access Benefit\nStarting 15 Jan 2023, complimentary access to Plaza Premium\nLounge for cardholders of HSBC Business and Corporate cards\nwill be subject to a maximum of 4 visits per calendar year.\nVisit hsbc. com.hk for details.\n有關機場貴賓室服務之更改\n由2023年1月15日起,匯豐公司卡及商務卡提供之\n免費環亞機場貴賓室服務將限於每曆年最多享用4次。\n有關詳情,請瀏覽hsbc.com.hk。",
            "paragraphs": []
        },
        "created_at": "2024-01-12T21:40:58.961Z"
    },
    {
        "doc1_Items": [
            {
                "_source": "02AUG\n01AUG\nMAILGUN TECHNOLOGIES,\nSAN ANTONIO\nUS\nUSD\n2.53\n20.25\n*EXCHANGE RATE: 8.00395",
                "Description": "MAILGUN TECHNOLOGIES,\nSAN ANTONIO",
                "Price": 2.53,
                "TotalPrice": 20.25
            },
            {
                "_source": "02AUG\n01AUG\nLINODE . AKAMAI\n6093807100\nUS\nUSD\n4,639.62\n37,132.59\n* EXCHANGE RATE: 8.00337",
                "Description": "LINODE . AKAMAI",
                "Price": 4639.62,
                "ProductCode": "6093807100",
                "TotalPrice": 37132.59
            },
            {
                "_source": "03AUG\n02AUG\nNRI*NEW RELIC\n888-643-8776\nUS\nUSD\n255.25\n2,042.88\n* EXCHANGE RATE :\n8.00345",
                "Description": "NRI*NEW RELIC",
                "Price": 255.25,
                "ProductCode": "888-643-8776",
                "TotalPrice": 2042.88
            },
            {
                "_source": "03AUG\n01AUG\nPAYPAL *PATREON\nMEMBE\n4029357733\nUS\n16.35",
                "Description": "PAYPAL *PATREON\nMEMBE",
                "ProductCode": "4029357733",
                "TotalPrice": 16.35
            },
            {
                "_source": "03AUG\n02AUG\nSTACK* ZEROSSL\nWIEN\nAT\nUSD\n10.00\n80.03\n*EXCHANGE RATE: 8.00300",
                "Description": "STACK* ZEROSSL",
                "Price": 10,
                "TotalPrice": 80.03
            },
            {
                "_source": "03AUG\n02AUG\nAPPLE. COM/BILL\nCORK\nIE\n76.00",
                "Description": "APPLE. COM/BILL",
                "TotalPrice": 76
            },
            {
                "_source": "03AUG\n02AUG\nBROWSERSTACK. COM\nLEWES\nUS\nUSD\n19.00\n152.07\n*EXCHANGE RATE: 8.00368",
                "Description": "BROWSERSTACK. COM",
                "Price": 19,
                "TotalPrice": 152.07
            }
        ],
        "doc1_MerchantAddress": {
            "_source": "PO BOX\nNO. 73730, KOWLOON CENTRAL POST OFFICE HK.",
            "poBox": "PO BOX\nNO. 73730",
            "streetAddress": "PO BOX\nNO. 73730",
            "house": "KOWLOON CENTRAL POST OFFICE HK."
        },
        "doc1_MerchantName": "香港上海滙豐銀行有限公司",
        "doc1_MerchantPhoneNumber": "+8185227488288",
        "doc1_Total": 9349.9,
        "doc1_TransactionDate": "2022-09-26T00:00:00.000Z",
        "doc2_Currency": "USD",
        "doc2_Items": [
            {
                "_source": "04AUG\n03AUG\nAmazon web services\naws . amazon. co\nUS\nUSD\n240.81\n1,927.34\n*EXCHANGE RATE: 8.00357",
                "Category": "Credit",
                "Date": "2003-08-04T00:00:00.000Z",
                "Description": "Amazon web services"
            },
            {
                "_source": "05AUG\n04AUG\nAPPLE. COM/BILL\nITUNES. COM\nIE\n76.00",
                "Category": "Other",
                "Date": "2004-08-05T00:00:00.000Z",
                "Description": "APPLE. COM/BILL",
                "TotalPrice": 76
            },
            {
                "_source": "05AUG\n04AUG\nCITY SUPER LIMITED\nTSIM SHA TSUI\nHK\n1,157.40",
                "Date": "2004-08-05T00:00:00.000Z",
                "Description": "CITY SUPER LIMITED"
            },
            {
                "_source": "05AUG\n04AUG\nHUTCHISON TELECOM 3CC\nHONG KONG\nHK\n197.00",
                "Date": "2004-08-05T00:00:00.000Z",
                "Description": "HUTCHISON TELECOM 3CC",
                "TotalPrice": 197
            },
            {
                "_source": "06AUG\n05AUG\nAPPLE. COM/BILL\nITUNES . COM\nIE\n93.00",
                "Category": "Other",
                "Date": "2005-08-06T00:00:00.000Z",
                "Description": "APPLE. COM/BILL",
                "TotalPrice": 93
            },
            {
                "_source": "08AUG\n06AUG\nDELIVEROO\nCENTRAL\nHK\n184.00",
                "Date": "2006-08-08T00:00:00.000Z",
                "Description": "DELIVEROO",
                "TotalPrice": 184
            },
            {
                "_source": "08AUG\n07AUG\nPAYPAL *OREILLYMEDI\n4029357733\nUS\n318.91",
                "Date": "2007-08-08T00:00:00.000Z",
                "Description": "PAYPAL *OREILLYMEDI",
                "TotalPrice": 318.91
            },
            {
                "_source": "09AUG\n08AUG\nAPPLE. COM/BILL\n85221120099\nIE\n163.00",
                "Category": "Other",
                "Date": "2008-08-09T00:00:00.000Z",
                "Description": "APPLE. COM/BILL",
                "TotalPrice": 163
            },
            {
                "_source": "11AUG\n10AUG\nNYTimes*NYTimes\n800-698-4637\nUS\nUSD\n12.00\n96.04\n*EXCHANGE RATE: 8.00333",
                "Category": "Credit",
                "Date": "11AUG",
                "Description": "NYTimes*NYTimes",
                "TotalPrice": 96.04
            },
            {
                "_source": "12AUG\n11AUG\nPAYPAL *TIDAL HIFI\n35314369001\nSE\n96.00",
                "Category": "Credit",
                "Date": "12AUG",
                "Description": "11AUG\nPAYPAL *TIDAL HIFI",
                "TotalPrice": 96
            },
            {
                "_source": "12AUG\n11AUG\nAPPLE. COM/BILL\n85221120099\nIE\n796.00",
                "Category": "Other",
                "Date": "12AUG",
                "Description": "APPLE. COM/BILL",
                "TotalPrice": 796
            },
            {
                "_source": "12AUG\n11AUG\nAPPLE. COM/BILL\nITUNES . COM\nIE\n78.00",
                "Category": "Other",
                "Date": "2011-08-12T00:00:00.000Z",
                "Description": "APPLE. COM/BILL",
                "TotalPrice": 78
            },
            {
                "_source": "16AUG\n15AUG\nPAYPAL *TWITCHINTER\n4029357733\nUS\n31.99",
                "Category": "Credit",
                "Date": "2015-08-16T00:00:00.000Z",
                "Description": "PAYPAL *TWITCHINTER",
                "TotalPrice": 31.99
            },
            {
                "_source": "18AUG\n17AUG\nIFTTT PRO (LEGACY)\nSAN FRANCISCO\nUS\nUSD\n1.99\n15.91\n*EXCHANGE RATE: 7.99497",
                "Category": "Credit",
                "Date": "2017-08-18T00:00:00.000Z",
                "Description": "IFTTT PRO (LEGACY)",
                "TotalPrice": 15.91
            },
            {
                "_source": "18AUG\n17AUG\nPAYPAL *OUTPUT\n4029357733\nUS\n81.70",
                "Category": "Credit",
                "Date": "2017-08-18T00:00:00.000Z",
                "Description": "PAYPAL *OUTPUT"
            },
            {
                "_source": "19AUG\n18AUG\nMPJ MOBILE APPS THE DA\nQUARRY BAY\nHK\n223.71",
                "Date": "19AUG",
                "TotalPrice": 223.71
            },
            {
                "_source": "20AUG\n19AUG\nNetflix. com\nLos Gatos\nSG\n78.00",
                "Date": "20AUG",
                "Description": "Netflix. com",
                "TotalPrice": 78
            },
            {
                "_source": "20AUG\n20AUG\nAPPLE. COM/BILL\nITUNES. COM\nIE\n36.00",
                "Date": "20AUG",
                "Description": "COM/BILL"
            }
        ],
        "doc2_MerchantAliases": [
            "The Hongkong and Shanghai Banking Corporation Limited",
            "HSBC\n滙豐"
        ],
        "doc2_MerchantName": "香港上海滙豐銀行有限公司",
        "doc3_MerchantName": "HSBC\n滙豐",
        "doc3_MerchantPhoneNumber": "+88627488288",
        "doc3_TransactionDate": "2022-08-30T00:00:00.000Z",
        "__raw__": {
            "content": "HSBC\n滙豐\nThe Hongkong and Shanghai Banking Corporation Limited\n香港上海滙豐銀行有限公司\nSTATEMENT OF BUSINESS CARD ACCOUNT 公司卡戶口結單\nPage\n1/3\nMR LEE SEE MING\nM\nAccount number 戶口號碼\nC/O SML UNIVERSE LIMITED\n00983\n5199 3100 0018 7511\nFLAT F 27/F BLK 10 VISTA PARADISO\nCard type 信用卡類別\nCredit limit 信用限額\n2 HANG MING ST\nPlatinum Business MC\nHKD75,000.00\nNEW TERRITORIES\nStatement date 結單日\nStatement balance 結單結欠/結餘\n30 AUG 2022\nHKD9, 349.90\nPost date\nTrans date\nDescription of transaction\nAmount\n(HKD)\n記賬日期\n交易日期\n交易說明\n金額\nPREVIOUS BALANCE\n上月結欠/結餘\n14,821.60\n30JUL\n30JUL\nIFS PAYMENT - THANK YOU\n14,821.61CR\n04AUG\n04AUG\nIFS PAYMENT - THANK YOU\n41,270.37CR\n5199 3100 0018 7511\nSEE-MING LEE\nSML UNIVERSE LTD\n30JUL\n30JUL\nFoodpanda Hong Kong\nHong Kong\nHK\n100.00\n30JUL\n30JUL\nAPPLE. COM/BILL\nITUNES.COM\nIE\n15.00\n30JUL\n30JUL\nFoodpanda Hong Kong\nHong Kong\nHK\n100.00\n01AUG\n29JUL\nPAYPAL *SOUNDCLOUD YEA\n35314369001\nDE\n449.73\n01AUG\n30JUL\nADOBE CREATIVE CLOUD\nDublin\nIE\n408.00\n01AUG\n30JUL\nDATYLON\nANTWERPEN\nBE\nUSD\n19.95\n159.66\n*EXCHANGE RATE: 8.00301\n02AUG\n01AUG\nOPEN SOURCE COLLECTIVE\nWALNUT\nUS\nUSD\n5.00\n40.02\n*EXCHANGE RATE: 8.00400\n02AUG\n01AUG\nCLOUDFLARE\nSAN FRANCISCO\nUS\nUSD\n59.70\n477.80\n*EXCHANGE RATE: 8.00335\n02AUG\n01AUG\nMAILGUN TECHNOLOGIES,\nSAN ANTONIO\nUS\nUSD\n2.53\n20.25\n*EXCHANGE RATE: 8.00395\n02AUG\n01AUG\nLINODE . AKAMAI\n6093807100\nUS\nUSD\n4,639.62\n37,132.59\n* EXCHANGE RATE: 8.00337\n03AUG\n02AUG\nNRI*NEW RELIC\n888-643-8776\nUS\nUSD\n255.25\n2,042.88\n* EXCHANGE RATE :\n8.00345\n03AUG\n01AUG\nPAYPAL *PATREON\nMEMBE\n4029357733\nUS\n16.35\n03AUG\n02AUG\nSTACK* ZEROSSL\nWIEN\nAT\nUSD\n10.00\n80.03\n*EXCHANGE RATE: 8.00300\n03AUG\n02AUG\nAPPLE. COM/BILL\nCORK\nIE\n76.00\n03AUG\n02AUG\nBROWSERSTACK. COM\nLEWES\nUS\nUSD\n19.00\n152.07\n*EXCHANGE RATE: 8.00368\nFor important information such as payment methods, fees and charges, lost\nMinimum payment summary 最低付款摘要\ncard reporting, and change of correspondence address / telephone number,\nHKD\nplease visit www.hsbc.com.hk or call our Customer Service Hotline on\nCurrent minimum payment due 目前最低付款額\n94.00\n(852) 2748 8288.\nPlease pay by 須於此付款到期日或之前繳交\n26 SEP 2022\n有關您戶口的重要資料包括付款方式,利息與收費,報失信用卡,以及更改\nOverdue / overlimit due now\n通訊地址/電話號碼,請瀏覽網址www.hsbc.com.hk或聯絡我們的客戶服務熱\n須立即繳交的過期款項/超額款項\n0.00\n線(852) 2748 8288°\nTotal minimum payment due\n最低付款總額\n94.00\nHSBC\n滙豐\nPayment Slip 付款存根\nAccount number 戶口號碼\nCard type 信用卡類別\nIf you are paying by mail, please detach this payment slip and return it with a\n5199 3100 0018 7511\nPlatinum Business MC\ncrossed cheque made payable to \"The Hongkong and Shanghai Banking\nCorporation Limited\" or \"HSBC\" at least three working days before the\nStatement date 結單日\nStatement balance 結單結欠/結餘\npayment due date to our Centre, PO BOX NO. 73730, KOWLOON CENTRAL\n30 AUG 2022\nHKD9, 349.90\nPOST OFFICE HK. Please write your account number on the back of the\nCheque number 支票號碼\nAmount enclosed\n夾附金額\ncheque.\n如欲以郵寄方式付款,請撕下此付款存根,於付款到期日三個工作天前,連同以\n「香港上海滙豐銀行有限公司」或「滙豐」為抬頭的劃線支票,寄回 PO BOX\nNO. 73730, KOWLOON CENTRAL POST OFFICE HK. 信用卡中心收,請於支\n票背面寫上您的戶口號碼。\nThank you for choosing HSBC.多謝選用滙豐服務。\nHSBC\n滙豐\nThe Hongkong and Shanghai Banking Corporation Limited\n香港上海滙豐銀行有限公司\nSTATEMENT OF BUSINESS CARD ACCOUNT 公司卡戶口結單\nPage\n2/3\nCardholder's name 持卡人姓名\nAccount number 戶口號碼\nStatement date 結單日\nSEE-MING LEE\n5199 3100 0018 7511\n30 AUG 2022\nPost date\nTrans date\nDescription of transaction\nAmount\n( HKD)\n記賬日期\n交易日期\n交易說明\n金額\n04AUG\n03AUG\nAmazon web services\naws . amazon. co\nUS\nUSD\n240.81\n1,927.34\n*EXCHANGE RATE: 8.00357\n05AUG\n04AUG\nAPPLE. COM/BILL\nITUNES. COM\nIE\n76.00\n05AUG\n04AUG\nCITY SUPER LIMITED\nTSIM SHA TSUI\nHK\n1,157.40\n05AUG\n04AUG\nHUTCHISON TELECOM 3CC\nHONG KONG\nHK\n197.00\n06AUG\n05AUG\nAPPLE. COM/BILL\nITUNES . COM\nIE\n93.00\n08AUG\n06AUG\nDELIVEROO\nCENTRAL\nHK\n184.00\n08AUG\n07AUG\nPAYPAL *OREILLYMEDI\n4029357733\nUS\n318.91\n09AUG\n08AUG\nAPPLE. COM/BILL\n85221120099\nIE\n163.00\n11AUG\n10AUG\nNYTimes*NYTimes\n800-698-4637\nUS\nUSD\n12.00\n96.04\n*EXCHANGE RATE: 8.00333\n12AUG\n11AUG\nPAYPAL *TIDAL HIFI\n35314369001\nSE\n96.00\n12AUG\n11AUG\nAPPLE. COM/BILL\n85221120099\nIE\n796.00\n12AUG\n11AUG\nAPPLE. COM/BILL\nITUNES . COM\nIE\n78.00\n16AUG\n15AUG\nPAYPAL *TWITCHINTER\n4029357733\nUS\n31.99\n18AUG\n17AUG\nIFTTT PRO (LEGACY)\nSAN FRANCISCO\nUS\nUSD\n1.99\n15.91\n*EXCHANGE RATE: 7.99497\n18AUG\n17AUG\nPAYPAL *OUTPUT\n4029357733\nUS\n81.70\n19AUG\n19AUG\nCITY SUPER LIMITED\nTSIM SHA TSUI\nHK\n1,298.00\n19AUG\n18AUG\nMPJ MOBILE APPS THE DA\nQUARRY BAY\nHK\n223.71\n20AUG\n19AUG\nNetflix. com\nLos Gatos\nSG\n78.00\n20AUG\n20AUG\nAPPLE. COM/BILL\nITUNES. COM\nIE\n36.00\n22AUG\n20AUG\nDELIVEROO\nCENTRAL\nHK\n203.00\n23AUG\n21AUG\nPAYPAL *GITHUB INC\n4029357733\nUS\n73.56\n24AUG\n23AUG\nPAYPAL *WAKATIME\n4029357733\nHK\n73.57\n24AUG\n23AUG\nAMZN Mktp US*QS1V88XZ3\nAmzn. com/bill\nUS\n568.92\n24AUG\n23AUG\nAMZN Mktp US*A76AA9IO3\nAmzn. com/bill\nUS\n111.77\n26AUG\n25AUG\nMIGADU. COM EMAIL SRVC.\nSCHACHEN B. R\nCH\nUSD\n90.00\n720.07\n*EXCHANGE RATE: 8.00078\n27AUG\n26AUG\nPAYPAL *HAYU\n35314369001\nGB\n40.00\n27AUG\n26AUG\nAPPLE. COM/BILL\nITUNES . COM\nIE\n38.00\n27AUG\n27AUG\nAPPLE. COM/BILL\nITUNES. COM\nIE\n88.00\n29AUG\n27AUG\nPAYPAL *TWITCHINTER\n4029357733\nUS\n31.99\n30AUG\n29AUG\nWEB*REGISTERWEBSITE\n800-8999723\nUS\nUSD\n42.00\n336.02\n*EXCHANGE RATE: 8.00048\n30AUG\n29AUG\nNOUNPROJECT . COM\nLOS ANGELES\nUS\nUSD\n39.99\n320.00\n*EXCHANGE RATE: 8.00200\n30AUG\n30AUG\nCREDIT REWARD CASH REBATE\n203.00CR\n*For credit card transactions effected in currencies other\nthan Hong Kong dollars, the exchange rate applied includes a\nhandling fee equivalent to 1.95% of each transaction. The\nfee relating to foreign currency transaction is not\napplicable to RMB Business Card.\n就每項以非港元進行的信用卡交易,所用外幣匯率已包括交易金\n額1.95%的手續費。外幣交易有關費用不適用於人民幣公司卡。\nNote: \"CR\" means Credit transaction / balance\n註:「CR」為入賬交易/結餘\n**** REWARDCASH SUMMARY FOR CARD NUMBER 5199 3100 0018 7511\nREWARDCASH EARNED\n:\n203\nREWARDCASH ADJUSTED\n:\n0\nREWARDCASH REDEEMED\n0\n..\nCONVERTED TO CASH REBATE\n203\n..\nSTATEMENT BALANCE\n結單結欠/結餘\n9,349.90\nHSBC\n滙豐\nThe Hongkong and Shanghai Banking Corporation Limited\n香港上海滙豐銀行有限公司\nSTATEMENT OF BUSINESS CARD ACCOUNT 公司卡戶口結單\nPage\n3/3\nCardholder's name 持卡人姓名\nAccount number\n1號碼\nStatement date 結單日\nSEE-MING LEE\n5199 3100 0018 7511\n30 AUG 2022\nPost date\nTrans date\nDescription of transaction\nAmount\n(HKD)\n記賬日期\n交易日期\n交易說明\n金額\nTRANSACTION SUMMARY *****\nCREDIT/PAYMENT\n56,091.98CR\n..\nPURCHASES AND INSTALMENTS\n:\n50,823.28\nCREDIT ADJUSTMENT\n203.00CR\n..\nTOTAL ACCOUNT BALANCE\n:\n9,349.90\nFEES AND CHARGES SUMMARY\nFEE/CHARGE TYPE\nAMOUNT\nTOTAL FEES/CHARGES ( EXCLUDING FINANCE CHARGE )\n0.00\n*:\n** FINANCE CHARGE SUMMARY\nBALANCE TYPE\nANNUALISED PERCENTAGE RATE (APR)\nFINANCE CHARGE\nCASH ADVANCE\n35.61%\n0.00\nPURCHASE\n34.46%\n0.00\nTOTAL FINANCE CHARGE\n0.00\n**\n** INFORMATION REGARDING MAKING MINIMUM PAYMENT*\nThe below examples are for illustration only. You may visit our Bank\nwebsite at www.hsbc. com.hk for an online credit card repayment\ncalculator for customized information.\nIf you make no additional\nYou will pay off the\nand you will end up\ncharges, purchases and\noutstanding balance*\n| paying an estimated\ncash advances on this card\nof HKD20, 000 in\ntotal of ...\nand each month you pay. ..\nabout ...\n|\n|\n|\nOnly Minimum Payment Due\n|\n26 years **\n|\nHKD67,536 ***\n|\n|\nHKD849\n|\n3 years **\n|\nHKD30,565 ***\n|\n( Savings=HKD36, 971)\n* The outstanding balance of HKD20, 000 is accrued from purchase only.\n** Assume repayment is made on or before the payment due date of each\nstatement month.\n*** Include the outstanding balance of HKD20, 000 and the total finance\ncharge which is accrued daily and calculated at an interest rate of\n2.5% per month (equivalent to an annualised percentage rate of 34.46%\non purchase and 35.61% on cash advance) on the outstanding balance\nuntil it is fully paid.\nThe statement is for your reference only.\nPayment to be\narranged by your corporation.\nThe RewardCash earned by the company have been\ntransferred to your Business Card account.\nIf the statement balance for your credit card account\nexceeds the credit limit on the statement date, an overlimit\nhandling fee will be debited to the account. If you wish to\nopt out of the over-the-limit facility, you may fill out\nthe form on the back of the statement. For enquiries,\nplease contact us on 2748 8288.\n若您的結單結欠超出該信用卡戶口截至結單日的信用限額,\n本行會徵收超出信用限額手續費。如您欲拒絕接受超出信用限額\n信貸安排,請填妥結單背頁之表格作出指示。如有任何\n查詢,請致電2748 8288。",
            "paragraphs": []
        },
        "created_at": "2024-01-12T21:40:58.965Z"
    },
    {
        "Currency": "JPY",
        "Items": [
            {
                "_source": "12JAN\n11JAN\nIFS PAYMENT\n- THANK YOU\n51,403.85CR",
                "Date": "2012-01-11T00:00:00.000Z"
            },
            {
                "_source": "27JAN\n27JAN\nIFS PAYMENT - THANK YOU\n8,432.95CR\n5199 3100 0018 7511",
                "Date": "1927-01-27T00:00:00.000Z"
            },
            {
                "_source": "31DEC\n30DEC",
                "Date": "1931-12-30T00:00:00.000Z"
            },
            {
                "_source": "31DEC\n30DEC\nWEB*REGISTERWEBSITE\n800-8999723\nUS\nUSD\n38.00\n302.10\n*EXCHANGE RATE: 7.95000",
                "Category": "Meals",
                "Date": "31DEC",
                "Description": "30DEC\nWEB*REGISTERWEBSITE",
                "TotalPrice": 302.1
            },
            {
                "_source": "31DEC\n30DEC\nDATYLON\nANTWERPEN\nBE\nUSD\n19.95\n158.77\n*EXCHANGE RATE: 7.95840",
                "Category": "Credit",
                "Date": "1931-12-30T00:00:00.000Z",
                "Description": "DATYLON"
            },
            {
                "_source": "03JAN\n01JAN\nLINODE . AKAMAI\n6093807100\nUS\nUSD\n4,715.94\n37,530.08\n*EXCHANGE RATE: 7.95813\n03JAN\n01JAN\nGOOGLE *CLOUD RDJ2ML\nSINGAPORE\nSG\n42.27\n03JAN\n01JAN\nGOOGLE*GSUITE SMLUNIVE\nSINGAPORE\nSG\n70.50",
                "Category": "Credit",
                "Date": "2003-01-01T00:00:00.000Z",
                "Description": "LINODE AKAMAI\n*CLOUD\nGOOGLE*GSUITE SMLUNIVE",
                "TotalPrice": 70.5
            },
            {
                "_source": "03JAN\n02JAN\nFoodpanda Hong Kong\nHong Kong\nHK\n372.00",
                "Category": "Room",
                "Date": "2003-01-02T00:00:00.000Z",
                "Description": "Foodpanda Hong Kong",
                "TotalPrice": 372
            },
            {
                "_source": "03JAN\n03JAN\nFoodpanda Hong Kong\nHong Kong\nHK\n138.00",
                "Category": "Tax",
                "Date": "2003-01-03T00:00:00.000Z",
                "Description": "Foodpanda Hong Kong\nHong",
                "TotalPrice": 138
            },
            {
                "_source": "03JAN\n02JAN\nFoodpanda Hong Kong\nHong Kong\nHK\n230.00",
                "Category": "Tax",
                "Date": "2003-01-02T00:00:00.000Z",
                "Description": "Foodpanda Hong Kong\nHong Kong",
                "TotalPrice": 230
            },
            {
                "_source": "03JAN\n01JAN\nBLS*REDIS LABS14085242\nLONDON\nGB\nUSD\n127.00\n1,010.68\n*EXCHANGE RATE: 7.95811",
                "Category": "Meals",
                "Date": "2003-01-01T00:00:00.000Z",
                "Description": "BLS*REDIS LABS14085242\nLONDON"
            },
            {
                "_source": "03JAN\n01JAN\nZEROSSL* ZEROSSL\nVIENNA\nAT\nUSD\n10.00\n79.58\n*EXCHANGE RATE: 7.95800",
                "Category": "Meals",
                "Date": "2003-01-01T00:00:00.000Z",
                "Description": "ZEROSSL* ZEROSSL",
                "TotalPrice": 79.58
            },
            {
                "_source": "03JAN\n31DEC\nAPPLE. COM/BILL\nITUNES . COM\nIE\n33.00",
                "Category": "Credit",
                "Date": "03JAN",
                "Description": "APPLE. COM/BILL",
                "TotalPrice": 33
            },
            {
                "_source": "03JAN\n01JAN\nOPEN SOURCE COLLECTIVE\nCOVINA\nUS\nUSD\n5.00\n39.79\n*EXCHANGE RATE: 7.95800",
                "Description": "OPEN SOURCE COLLECTIVE\nCOVINA",
                "TotalPrice": 39.79
            },
            {
                "_source": "03JAN\n01JAN\nMAILGUN TECHNOLOGIES,\nSAN ANTONIO\nUS\nUSD\n3.80\n30.24\n*EXCHANGE RATE: 7.95789",
                "Date": "03JAN",
                "Description": "MAILGUN TECHNOLOGIES,\nSAN ANTONIO",
                "TotalPrice": 30.24
            },
            {
                "_source": "03JAN\n01JAN\nPAYPAL *PATREON MEMBE\n4029357733\nUS\n16.27",
                "Category": "Credit",
                "Date": "2003-01-01T00:00:00.000Z",
                "Description": "PAYPAL *PATREON MEMBE\n4029357733",
                "TotalPrice": 16.27
            },
            {
                "_source": "03JAN\n02JAN\nBROWSERSTACK. COM\nLEWES\nUS\nUSD\n10.00\n79.58\n*EXCHANGE RATE: 7.95800",
                "Description": "BROWSERSTACK. COM",
                "TotalPrice": 79.58
            },
            {
                "_source": "APPLE.",
                "Description": "APPLE."
            },
            {
                "_source": "03JAN\n02JAN\nCOM/BILL\nITUNES. COM\nIE\n91.00",
                "Description": "COM/BILL",
                "TotalPrice": 91
            },
            {
                "_source": "03JAN\nUSD\n188.91\n*EXCHANGE RATE: 7.96199",
                "Price": 188.91
            },
            {
                "_source": "HKD",
                "Description": "HKD"
            },
            {
                "_source": "DNH*GODADDY.",
                "Description": "DNH*GODADDY."
            },
            {
                "_source": "COM",
                "Description": "COM"
            },
            {
                "_source": "240.39",
                "TotalPrice": 240.39
            },
            {
                "_source": "281.00",
                "TotalPrice": 281
            },
            {
                "_source": "Foodpanda",
                "Description": "Foodpanda"
            },
            {
                "_source": "Hong",
                "Description": "Hong"
            },
            {
                "_source": "Kong",
                "Description": "Kong"
            },
            {
                "_source": "05JAN\n04JAN\nHUTCHISON TELECOM 3CC\nHONG KONG\nHK\n197.00",
                "Description": "HUTCHISON TELECOM 3CC",
                "TotalPrice": 197
            },
            {
                "_source": "05JAN\n05JAN\nFoodpanda HK Grocery\nHong Kong\nHK\n372.40",
                "Description": "Foodpanda HK Grocery",
                "TotalPrice": 372.4
            },
            {
                "_source": "05JAN\n02JAN\nPAYPAL *MUSESCORE\n35314369001\nBE\n243.95\n06JAN\n05JAN\nNRI*NEW RELIC\n888-643-8776\nUS\nUSD\n348.00\n2,774.67\n*EXCHANGE RATE: 7.97319\n06JAN\n3,487.50\n06JAN\n2,443.85\n09JAN\n96.00\n12JAN\n78.00",
                "Description": "PAYPAL *MUSESCORE\nNRI*NEW RELIC",
                "Price": 348,
                "ProductCode": "35314369001",
                "TotalPrice": 243.95
            },
            {
                "_source": "30.00",
                "Price": 30
            },
            {
                "_source": "14JAN\n13JAN\nINC.",
                "Description": "INC."
            },
            {
                "_source": "239.01\n*EXCHANGE RATE: 7.96700",
                "TotalPrice": 239.01
            },
            {
                "_source": "18JAN\n17JAN\nIFTTT PRO (LEGACY)\nSAN FRANCISCO\nUS\nUSD\n1.99\n15.87\n*EXCHANGE RATE: 7.97487",
                "Description": "IFTTT PRO (LEGACY)",
                "Price": 1.99,
                "TotalPrice": 15.87
            },
            {
                "_source": "20JAN\n19JAN\nNetflix.com\nLos Gatos\nSG\n78.00",
                "Description": "Netflix.com",
                "TotalPrice": 78
            },
            {
                "_source": "21JAN\n20JAN\nCITY SUPER LIMITED\nTSIM SHA TSUI\nHK\n811.50",
                "Description": "CITY SUPER LIMITED",
                "TotalPrice": 811.5
            },
            {
                "_source": "26JAN\n20JAN\nAPPLE. COM/BILL\nITUNES\nCOM\nIE\n8.00\n26JAN\n20JAN\nAPPLE.COM/HK\nHONG KONG\nHK\n299.00\n26JAN\n25JAN\nNYTimes *NYTimes\n800-698-4637\nUS\nUSD\n12.00\n95.84\n* EXCHANGE RATE: 7.98667",
                "Description": "APPLE. COM/BILL\nAPPLE.COM/HK\nNYTimes *NYTimes",
                "Price": 12,
                "TotalPrice": 95.84
            },
            {
                "_source": "26JAN\n24JAN\nAPPLE. COM/BILL\nITUNES\nCOM\nIE\n46.00\n26JAN\n20JAN\nBITLY. COM\nNEW YORK CITY\nUS\nUSD\n348.00\n2,779.67\n*EXCHANGE RATE: 7.98756\n26JAN\n25JAN\nMURF.AI\nSALT LAKE CIT\nUS\nUSD\n19.00\n151.75\n*EXCHANGE RATE: 7.98684\n28JAN\n27JAN\nSMARTONE\nKOWLOON\nHK\n118.00\nCRI: W100000003230645\n30JAN\n27JAN\n7-Eleven, HK (0824)\nMA ON SHAN\nHK\n2,716.00\n30JAN\n28JAN\nJetBrains\nPrague\nCZ\nUSD\n59.00\n471.22\n*EXCHANGE RATE: 7.98678",
                "Description": "APPLE. COM/BILL\nCOM\nBITLY. COM\nMURF.AI\nSMARTONE\n7-Eleven, HK (0824)\nMA ON SHAN\nJetBrains",
                "Price": 59,
                "TotalPrice": 118
            },
            {
                "_source": "30JAN\n30JAN\nCREDIT",
                "Description": "CREDIT"
            },
            {
                "_source": "AIRLINES 航空\n7\n17,680.68",
                "Description": "AIRLINES",
                "TotalPrice": 17680.68
            },
            {
                "_source": "HOTELS 酒店\n2\n0.00",
                "Category": "Meals",
                "Description": "HOTELS 酒店",
                "TotalPrice": "0.00"
            },
            {
                "_source": "TRAVEL 旅遊\n3",
                "Description": "TRAVEL 旅遊"
            },
            {
                "_source": "RESTAURANTS 餐廳\n26\n3,974.90",
                "Description": "RESTAURANTS 餐",
                "TotalPrice": 3974.9
            },
            {
                "_source": "ENTERTAINMENT & RECREATION 娛樂\n15\n2,301.83",
                "Description": "ENTERTAINMENT & RECREATION",
                "TotalPrice": 2301.83
            },
            {
                "_source": "DEPARTMENT STORES 百貨\n0\n0.00",
                "Description": "DEPARTMENT STORES",
                "TotalPrice": "0.00"
            },
            {
                "_source": "SPECIALTY RETAIL 零售\n442\n166,132.68",
                "Description": "SPECIALTY RETAIL",
                "TotalPrice": 166132.68
            },
            {
                "_source": "CLOTHING & FOOTWEAR 衣服\n0\n0.00",
                "Description": "CLOTHING FOOTWEAR",
                "TotalPrice": "0.00"
            },
            {
                "_source": "HOUSEHOLD / HOME FURNISHING 家居\n0\n0.00",
                "Description": "HOUSEHOLD HOME FURNISHING",
                "TotalPrice": "0.00"
            },
            {
                "_source": "JEWELRY & ACCESSORIES 飾品\n0",
                "Description": "JEWELRY ACCESSORIES"
            },
            {
                "_source": "TELECOMMUNICATIONS",
                "Description": "TELECOMMUNICATIONS"
            },
            {
                "_source": "SERVICES",
                "Description": "SERVICES"
            }
        ],
        "MerchantAddress": {
            "_source": "PO BOX\nNO. 73730, KOWLOON CENTRAL POST OFFICE HK.",
            "poBox": "PO BOX\nNO. 73730",
            "streetAddress": "PO BOX\nNO. 73730",
            "house": "KOWLOON CENTRAL POST OFFICE HK."
        },
        "MerchantAliases": [
            "HSBC.",
            "The Hongkong and Shanghai Corporation Limited",
            "HSBC\n滙豐",
            "The Hongkong and Shanghai Banking Corporation Limited",
            "HSBC",
            "HSBC\n滙豐"
        ],
        "MerchantName": "香港上海滙豐銀行有限公司",
        "MerchantPhoneNumber": "(852)",
        "Total": 256,
        "TransactionDate": "2023-01-30T00:00:00.000Z",
        "__raw__": {
            "content": "HSBC\n滙豐\nThe Hongkong and Shanghai Banking Corporation Limited\n香港上海滙豐銀行有限公司\nSTATEMENT OF BUSINESS CARD ACCOUNT 公司卡戶口結單\nPage\n1/5\nMR LEE SEE MING\nM\nAccount number 戶口號碼\nC/O SML UNIVERSE LIMITED\n01060\n5199 3100 0018 7511\nFLAT F 27/F BLK 10 VISTA PARADISO\nCard type 信用卡類別\nCredit limit 信用限額\n2 HANG MING ST\nPlatinum Business MC\nHKD150,000.00\nNEW TERRITORIES\nStatement date 結單日\nStatement balance 結單結欠/結餘\n30 JAN 2023\nHKD3,049.22\nPost date\nTrans date\nDescription of transaction\nAmount\n(HKD)\n記賬日期\n交易日期\n交易說明\n金額\nPREVIOUS BALANCE\n上月結欠/結餘\n7,349.18\n03JAN\n03JAN\nIFS PAYMENT - THANK YOU\n8,218.05CR\n12JAN\n11JAN\nIFS PAYMENT\n- THANK YOU\n51,403.85CR\n27JAN\n27JAN\nIFS PAYMENT - THANK YOU\n8,432.95CR\n5199 3100 0018 7511\nSEE-MING LEE\nSML UNIVERSE LTD\n31DEC\n30DEC\nADOBE CREATIVE CLOUD\nDublin\nIE\n408.00\n31DEC\n30DEC\nWEB*REGISTERWEBSITE\n800-8999723\nUS\nUSD\n38.00\n302.10\n*EXCHANGE RATE: 7.95000\n31DEC\n30DEC\nDATYLON\nANTWERPEN\nBE\nUSD\n19.95\n158.77\n*EXCHANGE RATE: 7.95840\n03JAN\n01JAN\nLINODE . AKAMAI\n6093807100\nUS\nUSD\n4,715.94\n37,530.08\n*EXCHANGE RATE: 7.95813\n03JAN\n01JAN\nGOOGLE *CLOUD RDJ2ML\nSINGAPORE\nSG\n42.27\n03JAN\n01JAN\nGOOGLE*GSUITE SMLUNIVE\nSINGAPORE\nSG\n70.50\n03JAN\n02JAN\nFoodpanda Hong Kong\nHong Kong\nHK\n372.00\n03JAN\n03JAN\nFoodpanda Hong Kong\nHong Kong\nHK\n138.00\n03JAN\n02JAN\nFoodpanda Hong Kong\nHong Kong\nHK\n230.00\n03JAN\n01JAN\nBLS*REDIS LABS14085242\nLONDON\nGB\nUSD\n127.00\n1,010.68\n*EXCHANGE RATE: 7.95811\n03JAN\n01JAN\nZEROSSL* ZEROSSL\nVIENNA\nAT\nUSD\n10.00\n79.58\n*EXCHANGE RATE: 7.95800\n03JAN\n31DEC\nAPPLE. COM/BILL\nITUNES . COM\nIE\n33.00\n03JAN\n01JAN\nOPEN SOURCE COLLECTIVE\nCOVINA\nUS\nUSD\n5.00\n39.79\n*EXCHANGE RATE: 7.95800\n03JAN\n01JAN\nMAILGUN TECHNOLOGIES,\nSAN ANTONIO\nUS\nUSD\n3.80\n30.24\n*EXCHANGE RATE: 7.95789\n03JAN\n01JAN\nPAYPAL *PATREON MEMBE\n4029357733\nUS\n16.27\nFor important information such as payment methods, fees and charges, lost\nMinimum payment summary 最低付款摘要\ncard reporting, and change of correspondence address / telephone number,\nHKD\nplease visit www.hsbc.com.hk or call our Customer Service Hotline on\nCurrent minimum payment due 目前最低付款額\n50.00\n(852) 2748 8288.\nPlease pay by 須於此付款到期日或之前繳交\n22 FEB 2023\n有關您戶口的重要資料包括付款方式,利息與收費,報失信用卡,以及更改\nOverdue / overlimit due now\n通訊地址/電話號碼,請瀏覽網址www.hsbc.com.hk或聯絡我們的客戶服務熱\n須立即繳交的過期款項/超額款項\n0.00\n線(852) 2748 8288.\nTotal minimum payment due\n最低付款總額\n50.00\nHSBC\n滙豐\nPayment Slip 付款存根\nAccount number 戶口號碼\nCard type 信用卡類別\nIf you are paying by mail, please detach this payment slip and return it with a\n5199 3100 0018 7511\nPlatinum Business MC\ncrossed cheque made payable to \"The Hongkong and Shanghai Banking\nCorporation Limited\" or \"HSBC\" at least three working days before the\nStatement date 結單日\nStatement balance 結單結欠/結餘\npayment due date to our Centre, PO BOX NO. 73730, KOWLOON CENTRAL\n30 JAN 2023\nHKD3,049.22\nPOST OFFICE HK. Please write your account number on the back of the\nCheque number 支票號碼\nAmount enclosed\n夾附金額\n如欲以郵寄方式付款,請撕下此付款存根,於付款到期日三個工作天前,連同以\ncheque.\n「香港上海滙豐銀行有限公司」或「滙豐」為抬頭的劃線支票,寄回 PO BOX\nNO. 73730, KOWLOON CENTRAL POST OFFICE HK. 信用卡中心收,請於支\n票背面寫上您的戶口號碼。\nThank you for choosing HSBC.多謝選用滙豐服務。\nHSBC\n滙豐\nThe Hongkong and Shanghai Banking Corporation Limited\n香港上海滙豐銀行有限公司\nSTATEMENT OF BUSINESS CARD ACCOUNT 公司卡戶口結單\nPage\n2/5\nCardholder's name 持卡人姓名\nAccount number 戶口號碼\nStatement date 結單日\nSEE-MING LEE\n5199 3100 0018 7511\n30 JAN 2023\nPost date\nTrans date\nDescription of transaction\nAmount\n( HKD)\n記賬日期\n交易日期\n交易說明\n金額\n03JAN\n02JAN\nBROWSERSTACK. COM\nLEWES\nUS\nUSD\n10.00\n79.58\n*EXCHANGE RATE: 7.95800\n03JAN\n02JAN\nAPPLE. COM/BILL\nITUNES. COM\nIE\n91.00\n03JAN\n03JAN\nAmazon web services\naws . amazon. co\nUS\nUSD\n188.91\n1,504.10\n*EXCHANGE RATE: 7.96199\n04JAN\n02JAN\nDNH*GODADDY. COM HKD\n4805058855\nUS\n240.39\n04JAN\n04JAN\nFoodpanda Hong Kong\nHong Kong\nHK\n281.00\n05JAN\n04JAN\nHUTCHISON TELECOM 3CC\nHONG KONG\nHK\n197.00\n05JAN\n05JAN\nFoodpanda HK Grocery\nHong Kong\nHK\n372.40\n05JAN\n02JAN\nPAYPAL *MUSESCORE\n35314369001\nBE\n243.95\n06JAN\n05JAN\nNRI*NEW RELIC\n888-643-8776\nUS\nUSD\n348.00\n2,774.67\n*EXCHANGE RATE: 7.97319\n06JAN\n05JAN\n7-Eleven, HK (0824)\nMA ON SHAN\nHK\n3,487.50\n06JAN\n05JAN\nPAYPAL *FASTSPRING\n4029357733\nUS\n2,443.85\n09JAN\n08JAN\nPAYPAL *TIDAL HIFI\n35314369001\nSE\n96.00\n11JAN\n10JAN\nMPJ MOBILE APPS THE DA\nQuarry Bay\nHK\n687.30\n12JAN\n11JAN\nAPPLE. COM/BILL\nITUNES . COM\nIE\n78.00\n13JAN\n12JAN\nFoodpanda Hong Kong\nHong Kong\nHK\n377.00\n14JAN\n13JAN\nMIDJOURNEY INC.\nSOUTH SAN FRA\nUS\nUSD\n30.00\n239.01\n*EXCHANGE RATE: 7.96700\n16JAN\n15JAN\nAMZN Mktp US*0I74Z18S3\nAmzn. com/bill\nUS\n2,766.01\n18JAN\n17JAN\nIFTTT PRO (LEGACY)\nSAN FRANCISCO\nUS\nUSD\n1.99\n15.87\n*EXCHANGE RATE: 7.97487\n20JAN\n19JAN\nNetflix.com\nLos Gatos\nSG\n78.00\n21JAN\n20JAN\nCITY SUPER LIMITED\nTSIM SHA TSUI\nHK\n811.50\n26JAN\n20JAN\nAPPLE. COM/BILL\nITUNES . COM\nIE\n8.00\n26JAN\n20JAN\nAPPLE.COM/HK\nHONG KONG\nHK\n299.00\n26JAN\n25JAN\nNYTimes *NYTimes\n800-698-4637\nUS\nUSD\n12.00\n95.84\n* EXCHANGE RATE: 7.98667\n26JAN\n24JAN\nAPPLE. COM/BILL\nITUNES . COM\nIE\n46.00\n26JAN\n20JAN\nBITLY. COM\nNEW YORK CITY\nUS\nUSD\n348.00\n2,779.67\n*EXCHANGE RATE: 7.98756\n26JAN\n25JAN\nMURF.AI\nSALT LAKE CIT\nUS\nUSD\n19.00\n151.75\n*EXCHANGE RATE: 7.98684\n28JAN\n27JAN\nSMARTONE\nKOWLOON\nHK\n118.00\nCRI: W100000003230645\n30JAN\n27JAN\n7-Eleven, HK (0824)\nMA ON SHAN\nHK\n2,716.00\n30JAN\n28JAN\nJetBrains\nPrague\nCZ\nUSD\n59.00\n471.22\n*EXCHANGE RATE: 7.98678\n30JAN\n30JAN\nCREDIT REWARD CASH REBATE\n256.00CR\n*For credit card transactions effected in currencies other\nthan Hong Kong dollars, the exchange rate applied includes a\nhandling fee equivalent to 1.95% of each transaction. The\nfee relating to foreign currency transaction is not\napplicable to RMB Business Card.\n就每項以非港元進行的信用卡交易,所用外幣匯率已包括交易金\n額1.95%的手續費。外幣交易有關費用不適用於人民幣公司卡。\nNote: \"CR\" means Credit transaction / balance\n註:「CR」為入賬交易/結餘\n**** REWARDCASH SUMMARY FOR CARD NUMBER 5199 3100 0018 7511\nREWARDCASH EARNED\n256\n..\nREWARDCASH ADJUSTED\n:\n0\nREWARDCASH REDEEMED\n..\n0\nCONVERTED TO CASH REBATE\n256\n..\nSTATEMENT BALANCE\n結單結欠/結餘\n3,049.22\nHSBC\n滙豐\nThe Hongkong and Shanghai Banking Corporation Limited\n香港上海滙豐銀行有限公司\nSTATEMENT OF BUSINESS CARD ACCOUNT 公司卡戶口結單\nPage\n3/5\nCardholder's name 持卡人姓名\nAccount number\n1號碼\nStatement date 結單日\nSEE-MING LEE\n5199 3100 0018 7511\n30 JAN 2023\nPost date\nTrans date\nDescription of transaction\nAmount\n( HKD)\n記賬日期\n交易日期\n交易說明\n金額\nTRANSACTION SUMMARY *****\nCREDIT/PAYMENT\n68,054.85CR\n..\nPURCHASES AND INSTALMENTS\n:\n64,010.89\nCREDIT ADJUSTMENT\n256.00CR\n..\nTOTAL ACCOUNT BALANCE\n:\n3,049.22\nFEES AND CHARGES SUMMARY\nFEE/CHARGE TYPE\nAMOUNT\nTOTAL FEES/CHARGES ( EXCLUDING FINANCE CHARGE )\n0.00\n*:\n** FINANCE CHARGE SUMMARY\nBALANCE TYPE\nANNUALISED PERCENTAGE RATE (APR)\nFINANCE CHARGE\nCASH ADVANCE\n35.61%\n0.00\nPURCHASE\n34.46%\n0.00\nTOTAL FINANCE CHARGE\n0.00\n**\n** INFORMATION REGARDING MAKING MINIMUM PAYMENT*\nThe below examples are for illustration only. You may visit our Bank\nwebsite at www.hsbc. com.hk for an online credit card repayment\ncalculator for customized information.\nIf you make no additional\nYou will pay off the\nand you will end up\ncharges, purchases and\noutstanding balance*\n| paying an estimated\ncash advances on this card\nof HKD20, 000 in\ntotal of ...\nand each month you pay. ..\nabout ...\n|\n|\n|\nOnly Minimum Payment Due\n|\n26 years **\n|\nHKD67,536 ***\n|\n|\nHKD849\n|\n3 years **\n|\nHKD30,565 ***\n|\n( Savings=HKD36, 971)\n* The outstanding balance of HKD20, 000 is accrued from purchase only.\n** Assume repayment is made on or before the payment due date of each\nstatement month.\n*** Include the outstanding balance of HKD20, 000 and the total finance\ncharge which is accrued daily and calculated at an interest rate of\n2.5% per month (equivalent to an annualised percentage rate of 34.46%\non purchase and 35.61% on cash advance) on the outstanding balance\nuntil it is fully paid.\nThe statement is for your reference only.\nPayment to be\narranged by your corporation.\nPlease note that your credit limit has been revised to\nHKD 150,000.00.\nThe RewardCash earned by the company have been\ntransferred to your Business Card account.\nIf the statement balance for your credit card account\nHSBC\n滙豐\nThe Hongkong and Shanghai Banking Corporation Limited\n香港上海滙豐銀行有限公司\nSTATEMENT OF BUSINESS CARD ACCOUNT 公司卡戶口結單\nPage 4/5\nCardholder's name 持卡人姓名\nAccount number 戶口號碼\nStatement date 結單日\nSEE-MING LEE\n5199 3100 0018 7511\n30 JAN 2023\nPost date\nTrans date\nDescription of transaction\nAmount\n( HKD)\n記賬日期\n交易日期\n交易說明\n金額\nexceeds the credit limit on the statement date, an overlimit\nhandling fee will be debited to the account. If you wish to\nopt out of the over-the-limit facility, you may fill out\nthe form on the back of the statement. For enquiries,\nplease contact us on 2748 8288.\n若您的結單結欠超出該信用卡戶口截至結單日的信用限額,\n本行會徵收超出信用限額手續費。如您欲拒絕接受超出信用限額\n信貸安排,請填妥結單背頁之表格作出指示。如有任何\n查詢,請致電2748 8288。\nHSBC\n滙豐\nThe Hongkong and Shanghai Banking Corporation Limited\n香港上海滙豐銀行有限公司\nSTATEMENT OF BUSINESS CARD ACCOUNT 公司卡戶口結單\nPage\n5/5\nMR LEE SEE MING\nM\nAccount number 戶口號碼\nC/O SML UNIVERSE LIMITED\n01060\n5199 3100 0018 7511\nFLAT F 27/F BLK 10 VISTA PARADISO\nCard type 信用卡類別\nCredit limit 信用限額\n2 HANG MING ST\nPlatinum Business MC\nHKD150,000.00\nNEW TERRITORIES\nStatement date 結單日\nPeriod covered 涵蓋日期\n30 JAN 2023\nJAN - DEC 2022\n***\nSpending summary for 2022\n**\n2022年消費紀錄\nCategory\nNumber of transactions\nTotal spending (HKD)\n類別\n消費次數\n消費金額\nAIRLINES 航空\n7\n17,680.68\nHOTELS 酒店\n2\n0.00\nTRAVEL 旅遊\n3\n1,202.53\nRESTAURANTS 餐廳\n26\n3,974.90\nENTERTAINMENT & RECREATION 娛樂\n15\n2,301.83\nDEPARTMENT STORES 百貨\n0\n0.00\nSPECIALTY RETAIL 零售\n442\n166,132.68\nCLOTHING & FOOTWEAR 衣服\n0\n0.00\nHOUSEHOLD / HOME FURNISHING 家居\n0\n0.00\nJEWELRY & ACCESSORIES 飾品\n0\n0.00\nTELECOMMUNICATIONS 電訊\n95\n432,639.32\nSERVICES 服務\n89\n105,068.82\nCASH ADVANCE 現金透支\n0\n0.00\nBALANCE TRANSFER 結餘轉賬\n0\n0.00\nMISCELLANEOUS 其他\n11\n14,419.97\nREFUND/ADJUSTMENT 退款/調整\n13\n3,795.60CR\nTotal\n總計\n703\n739,625.13\nNotes:\n1.\nThe above spending summary is for your reference only.\n2.\nFor important information such as payment methods, fees and charges, lost card reporting and change of correspondence\naddress/telephone number, please visit www.hsbc.com.hk or call our Customer Service Hotline on (852) 2748 8266 (for World Elite\nBusiness MasterCard) or (852) 2748 8288 (for Other Business Cards).\n備註:\n一. 以上消費紀錄僅供參考。\n二. 有關戶口的重要資料包括付款方式,利息與收費,報失信用卡,以及更改通訊地址/電話號碼,請瀏覽網址 www.hsbc.com.hk或聯絡客戶\n服務熱線(852) 2748 8266(環球尊尚公司MasterCard)或(852)2748 8288(其他公司卡)。\nThank you for choosing HSBC多謝選用滙豐服務。",
            "paragraphs": []
        },
        "created_at": "2024-01-12T21:40:58.979Z"
    },
    {
        "Items": [
            {
                "_source": "31MAR\n30MAR\nTwitter Dev Platform\nSan Francisco US USD\n26.89\n215.21\n*EXCHANGE RATE: 8.00335",
                "Description": "Twitter Dev Platform",
                "Price": 26.89,
                "TotalPrice": 215.21
            },
            {
                "_source": "31MAR\n30MAR\nADOBE CREATIVE CLOUD\nDublin\nIE\n408.00",
                "Description": "ADOBE CREATIVE CLOUD\nDublin",
                "TotalPrice": 408
            },
            {
                "_source": "31MAR\n30MAR\nFoodpanda Hong Kong\nHong Kong\nHK\n179.00",
                "Description": "Foodpanda Hong Kong\nHong",
                "TotalPrice": 179
            },
            {
                "_source": "31MAR\n30MAR\nDATYLON\nANTWERPEN\nBE\nUSD\n19.95\n159.67\n*EXCHANGE RATE: 8.00351\n01APR\n31MAR\nMIDJOURNEY INC.\nSOUTH SAN FRA\nUS\nUSD\n60.00\n480.20\n*EXCHANGE RATE: 8.00333\n03APR\n01APR\nPAYPAL *PATREON\n16.35",
                "Description": "DATYLON\nMIDJOURNEY INC.\nPAYPAL *PATREON",
                "Price": 60,
                "TotalPrice": 480.2
            },
            {
                "_source": "03APR\n02APR\nREDIS LABS\n140-852-4291\nUS\nUSD\n127.00\n1,016.44\n* EXCHANGE RATE: 8.00346",
                "Description": "REDIS LABS",
                "Price": 127,
                "TotalPrice": 1016.44
            },
            {
                "_source": "03APR\n01APR\nGOOGLE*GSUITE SMLUNIVE\nSG\n70.50\nSingapore",
                "Description": "GOOGLE*GSUITE SMLUNIVE",
                "TotalPrice": 70.5
            },
            {
                "_source": "03APR\n01APR\nZEROSSL*",
                "Description": "ZEROSSL*"
            },
            {
                "_source": "ZEROSSL\nVIENNA\nAT\nUSD\n10.00\n80.03\n*EXCHANGE RATE: 8.00300",
                "Description": "ZEROSSL",
                "Price": 10,
                "TotalPrice": 80.03
            },
            {
                "_source": "03APR\n02APR\nBROWSERSTACK. COM\nLEWES\nUS\nUSD\n10.00\n80.03\n* EXCHANGE RATE: 8.00300",
                "Description": "BROWSERSTACK. COM",
                "Price": 10,
                "TotalPrice": 80.03
            },
            {
                "_source": "03APR\n02APR\nTYPECAST AI\nWEST HOLLYWOO\nUS\nUSD\n31.00\n248.11\n*EXCHANGE RATE: 8.00355",
                "Description": "TYPECAST AI",
                "Price": 31,
                "TotalPrice": 248.11
            },
            {
                "_source": "03APR\n03APR\nNRI*NEW RELIC\n888-643-8776\nUS\nUSD\n314.95\n2,520.69\n*EXCHANGE RATE: 8.00346",
                "Description": "NRI*NEW RELIC",
                "Price": 314.95,
                "TotalPrice": 2520.69
            },
            {
                "_source": "03APR\n01APR\nLINODE\nAKAMAI\n6093807100\nUS\nUSD\n4,803.93\n38,448.14\n*EXCHANGE RATE: 8.00348",
                "Description": "LINODE AKAMAI",
                "Price": 4803.93,
                "TotalPrice": 38448.14
            },
            {
                "_source": "03APR\n01APR\nOPEN SOURCE COLLECTIVE\nCOVINA\nUS\nUSD\n10.00\n80.03\n*EXCHANGE RATE: 8.00300",
                "Description": "OPEN SOURCE COLLECTIVE\nCOVINA",
                "Price": 10,
                "TotalPrice": 80.03
            },
            {
                "_source": "03APR\n01APR\nFoodpanda Hong Kong\nHong Kong\nHK\n179.00",
                "Description": "Foodpanda Hong",
                "TotalPrice": 179
            },
            {
                "_source": "03APR\n01APR\nMAILGUN TECHNOLOGIES,\nSAN ANTONIO\nUS\nUSD\n4.29\n34.34\n*EXCHANGE RATE: 8.00466",
                "Description": "MAILGUN TECHNOLOGIES,\nSAN",
                "Price": 4.29,
                "TotalPrice": 34.34
            },
            {
                "_source": "03APR\n02APR\nAmazon web services\naws\namazon.\nUS\nUSD\n181.72\n1,454.39\n*EXCHANGE RATE: 8.00347",
                "Description": "Amazon web services\naws",
                "Price": 181.72
            },
            {
                "_source": "04APR\n03APR\nAPPLE. COM/BILL\nITUNES . COM\nIE\n126.00",
                "Description": "APPLE. COM/BILL",
                "TotalPrice": 126
            },
            {
                "_source": "04APR\n02APR\nPAYPAL *AESCRIPTS\n4029357733\nUS\n81.69\n04APR\n03APR\nPLAY. HT\nBANGALORE\nDE\nUSD\n39.00\n312.14\n*EXCHANGE RATE: 8.00359",
                "Description": "PAYPAL *AESCRIPTS\nPLAY. HT",
                "Price": 39,
                "TotalPrice": 81.69
            },
            {
                "_source": "04APR\n02APR\nPAYPAL *AESCRIPTS\n4029357733\nUS\n654.09\n06APR\n04APR\nHUTCHISON TELECOM 3CC\nHONG KONG\nHK\n197.00",
                "Description": "PAYPAL *AESCRIPTS\nHUTCHISON TELECOM 3CC",
                "TotalPrice": 654.09
            },
            {
                "_source": "11APR\n08APR\nTwitter Dev Platform\nSan Francisco\nUS\nUSD\n100.00\n800.34\n*EXCHANGE RATE: 8.00340\n11APR\n06APR\nMPJ MOBILE APPS\nHK\n597.30",
                "Description": "Twitter Dev Platform\nSan\nMPJ MOBILE APPS",
                "Price": 100,
                "TotalPrice": 800.34
            },
            {
                "_source": "11APR\n06APR\nDNH*GODADDY. COM HKD\n480-505-8855\nUS\n961.56",
                "Description": "DNH*GODADDY. COM HKD",
                "TotalPrice": 961.56
            },
            {
                "_source": "12APR\n11APR\nWEB*REGISTERWEBSITE\n800-8999723\nUS\nUSD\n152.00\n1,216.53\n* EXCHANGE RATE: 8.00349",
                "Description": "WEB*REGISTERWEBSITE",
                "Price": 152
            },
            {
                "_source": "12APR\n11APR\nAPPLE. COM/BILL\nCORK\nIE\n78.00\n12APR",
                "Description": "APPLE. COM/BILL",
                "TotalPrice": 78
            },
            {
                "_source": "APPLE. COM/BILL\nITUNES. COM\nIE\n15.00\n14APR\n13APR\nPAYPAL *AESCRIPTS\n4029357733\nUS\n286.20",
                "Description": "APPLE. COM/BILL\nPAYPAL *AESCRIPTS",
                "ProductCode": "4029357733",
                "TotalPrice": 286.2
            },
            {
                "_source": "14APR\n13APR\n7-Eleven, HK (0824)\nMA ON SHAN\nHK\n3,825.00",
                "Description": "7-Eleven, HK (0824)",
                "TotalPrice": 3825
            },
            {
                "_source": "17APR\n15APR\nPAYPAL *TWITCHINTER\n4029357733\nUS\n31.99",
                "Description": "PAYPAL *TWITCHINTER",
                "ProductCode": "4029357733",
                "TotalPrice": 31.99
            },
            {
                "_source": "18APR\n17APR\nIFTTT PRO (LEGACY)\nSAN FRANCISCO\nUS\nUSD\n1.99\n15.92\n*EXCHANGE RATE: 8.00000",
                "Description": "IFTTT PRO (LEGACY)",
                "TotalPrice": 15.92
            },
            {
                "_source": "19APR\n18APR\nMIDJOURNEY INC.\nSOUTH SAN FRA\nUS\nUSD\n4.00\n32.01\n* EXCHANGE RATE: 8.00250",
                "Description": "MIDJOURNEY INC.",
                "TotalPrice": 32.01
            },
            {
                "_source": "20APR\n19APR\nNYTimes *NYTimes\n800-698-4637\nUS\nUSD\n12.00\n96.05\n*EXCHANGE RATE: 8.00417",
                "Description": "NYTimes *NYTimes",
                "ProductCode": "800-698-4637",
                "TotalPrice": 96.05
            },
            {
                "_source": "20APR\n19APR\nNetflix.com\nLos Gatos\nSG\n93.00\n22APR\n21APR\nTWITTER PAID FEATURES\nSAN FRANCISCO\nUS\nUSD\n8.00\n64.02\n*EXCHANGE RATE: 8.00250",
                "Description": "Netflix.com\nTWITTER PAID FEATURES",
                "TotalPrice": 64.02
            },
            {
                "_source": "22APR\n21APR\nMIDJOURNEY INC.\nSOUTH SAN FRA\nUS\nUSD\n20.00\n160.07\n* EXCHANGE RATE: 8.00350",
                "Description": "MIDJOURNEY INC.",
                "TotalPrice": 160.07
            },
            {
                "_source": "24APR\n23APR\nPAYPAL *WAKATIME\n4029357733\nHK\n73.59",
                "Description": "PAYPAL *WAKATIME",
                "ProductCode": "4029357733",
                "TotalPrice": 73.59
            },
            {
                "_source": "24APR\n23APR\nPAYPAL *GODADDY . COM\n4029357733\nUS\n180.80",
                "Description": "PAYPAL *GODADDY . COM",
                "ProductCode": "4029357733",
                "TotalPrice": 180.8
            },
            {
                "_source": "24APR\n21APR\nPAYPAL *GITHUB INC\n4029357733\nUS\n32.71",
                "Description": "PAYPAL *GITHUB INC",
                "ProductCode": "4029357733",
                "TotalPrice": 32.71
            },
            {
                "_source": "24APR\n21APR\nTYPECAST AI\nWEST HOLLYWOO\nUS\nUSD\n39.99\n320.06\n* EXCHANGE RATE: 8.00350\n24APR\n16APR\nMPJ MOBILE APPS THE DA\nQuarry Bay\nHK\n654.10",
                "Description": "TYPECAST AI\nMPJ MOBILE APPS THE DA\nQuarry Bay",
                "TotalPrice": 654.1
            },
            {
                "_source": "24APR\n22APR\nMIDJOURNEY INC.\nSOUTH SAN FRA\nUS\nUSD\n20.00\n160.07\n* EXCHANGE RATE: 8.00350",
                "Description": "MIDJOURNEY INC.",
                "TotalPrice": 160.07
            },
            {
                "_source": "27APR\n25APR\nPAYPAL *AESCRIPTS\n4029357733\nUS\n326.99",
                "Description": "PAYPAL *AESCRIPTS",
                "ProductCode": "4029357733",
                "TotalPrice": 326.99
            },
            {
                "_source": "27APR\n26APR\nPAYPAL *HAYU\n35314369001\nGB\n40.00",
                "Description": "PAYPAL *HAYU",
                "ProductCode": "35314369001",
                "TotalPrice": 40
            },
            {
                "_source": "27APR\n27APR\nCREDIT REWARD CASH REBATE\n228.00CR",
                "Description": "CREDIT REWARD CASH REBATE",
                "TotalPrice": 228
            }
        ],
        "MerchantAddress": {
            "_source": "PO BOX NO. 73730, KOWLOON CENTRAL",
            "poBox": "PO BOX NO. 73730",
            "city": "KOWLOON",
            "state": "CENTRAL",
            "streetAddress": "PO BOX NO. 73730"
        },
        "MerchantName": "HSBC\n滙豐",
        "MerchantPhoneNumber": "+88627488288",
        "Total": 99,
        "TransactionDate": "2023-04-27T00:00:00.000Z",
        "__raw__": {
            "content": "HSBC\n滙豐\nThe Hongkong and Shanghai Banking Corporation Limited\n香港上海滙豐銀行有限公司\nSTATEMENT OF BUSINESS CARD ACCOUNT 公司卡戶口結單\nPage\n1/4\nMR LEE SEE MING\nM\nAccount number 戶口號碼\nC/O SML UNIVERSE LIMITED\n00898\n5199 3100 0018 7511\nFLAT F 27/F BLK 10 VISTA PARADISO\nCard type 信用卡類別\nCredit limit 信用限額\n2 HANG MING ST\nPlatinum Business MC\nHKD150,000.00\nNEW TERRITORIES\nStatement date 結單日\nStatement balance 結單結欠/結餘\n27 APR 2023\nHKD9, 833.31\nPost date\nTrans date\nDescription of transaction\nAmount\n(HKD)\n記賬日期\n交易日期\n交易說明\n金額\nPREVIOUS BALANCE\n上月結欠/結餘\n16,865.87\n11APR\n11APR\nIFS PAYMENT - THANK YOU\n63,906.92CR\n5199 3100 0018 7511\nSEE-MING LEE\nSML UNIVERSE LTD\n31MAR\n30MAR\nTwitter Dev Platform\nSan Francisco US USD\n26.89\n215.21\n*EXCHANGE RATE: 8.00335\n31MAR\n30MAR\nADOBE CREATIVE CLOUD\nDublin\nIE\n408.00\n31MAR\n30MAR\nFoodpanda Hong Kong\nHong Kong\nHK\n179.00\n31MAR\n30MAR\nDATYLON\nANTWERPEN\nBE\nUSD\n19.95\n159.67\n*EXCHANGE RATE: 8.00351\n01APR\n31MAR\nMIDJOURNEY INC.\nSOUTH SAN FRA\nUS\nUSD\n60.00\n480.20\n*EXCHANGE RATE: 8.00333\n03APR\n01APR\nPAYPAL *PATREON\nMEMBE\n4029357733\nUS\n16.35\n03APR\n02APR\nREDIS LABS\n140-852-4291\nUS\nUSD\n127.00\n1,016.44\n* EXCHANGE RATE: 8.00346\n03APR\n01APR\nGOOGLE*GSUITE SMLUNIVE\nSG\n70.50\n03APR\nSingapore\n01APR\nZEROSSL* ZEROSSL\nVIENNA\nAT\nUSD\n10.00\n80.03\n*EXCHANGE RATE: 8.00300\n03APR\n02APR\nBROWSERSTACK. COM\nLEWES\nUS\nUSD\n10.00\n80.03\n* EXCHANGE RATE: 8.00300\n03APR\n02APR\nTYPECAST AI\nWEST HOLLYWOO\nUS\nUSD\n31.00\n248.11\n*EXCHANGE RATE: 8.00355\n03APR\n03APR\nNRI*NEW RELIC\n888-643-8776\nUS\nUSD\n314.95\n2,520.69\n*EXCHANGE RATE: 8.00346\n03APR\n01APR\nLINODE . AKAMAI\n6093807100\nUS\nUSD\n4,803.93\n38,448.14\n*EXCHANGE RATE: 8.00348\n03APR\n01APR\nOPEN SOURCE COLLECTIVE\nCOVINA\nUS\nUSD\n10.00\n80.03\n*EXCHANGE RATE: 8.00300\nFor important information such as payment methods, fees and charges, lost\nMinimum payment summary 最低付款摘要\ncard reporting, and change of correspondence address / telephone number,\nHKD\nplease visit www.hsbc.com.hk or call our Customer Service Hotline on\nCurrent minimum payment due 目前最低付款額\n99.00\n(852) 2748 8288.\nPlease pay by 須於此付款到期日或之前繳交\n23 MAY 2023\n有關您戶口的重要資料包括付款方式,利息與收費,報失信用卡,以及更改\nOverdue / overlimit due now\n通訊地址/電話號碼,請瀏覽網址www.hsbc.com.hk或聯絡我們的客戶服務熱\n須立即繳交的過期款項/超額款項\n0.00\n線(852) 2748 8288°\nTotal minimum payment due\n最低付款總額\n99.00\nHSBC\n滙豐\nPayment Slip 付款存根\nAccount number 戶口號碼\nCard type 信用卡類別\nIf you are paying by mail, please detach this payment slip and return it with a\n5199 3100 0018 7511\nPlatinum Business MC\ncrossed cheque made payable to \"The Hongkong and Shanghai Banking\nCorporation Limited\" or \"HSBC\" at least three working days before the\nStatement date 結單日\nStatement balance 結單結欠/結餘\npayment due date to our Centre, PO BOX NO. 73730, KOWLOON CENTRAL\n27 APR 2023\nHKD9, 833.31\nPOST OFFICE HK. Please write your account number on the back of the\nCheque number 支票號碼\nAmount enclosed\n夾附金額\n如欲以郵寄方式付款,請撕下此付款存根,於付款到期日三個工作天前,連同以\ncheque.\n「香港上海滙豐銀行有限公司」或「滙豐」為抬頭的劃線支票,寄回 PO BOX\nNO. 73730, KOWLOON CENTRAL POST OFFICE HK. 信用卡中心收,請於支\n票背面寫上您的戶口號碼。\nThank you for choosing HSBC.多謝選用滙豐服務。\nHSBC\n滙豐\nThe Hongkong and Shanghai Banking Corporation Limited\n香港上海滙豐銀行有限公司\nSTATEMENT OF BUSINESS CARD ACCOUNT 公司卡戶口結單\nPage\n2/4\nCardholder's name 持卡人姓名\nAccount number 戶口號碼\nStatement date 結單日\nSEE-MING LEE\n5199 3100 0018 7511\n27 APR 2023\nPost date\nTrans date\nDescription of transaction\nAmount\n( HKD)\n記賬日期\n交易日期\n交易說明\n金額\n03APR\n01APR\nFoodpanda Hong Kong\nHong Kong\nHK\n179.00\n03APR\n01APR\nMAILGUN TECHNOLOGIES,\nSAN ANTONIO\nUS\nUSD\n4.29\n34.34\n*EXCHANGE RATE: 8.00466\n03APR\n02APR\nAmazon web services\naws . amazon. co\nUS\nUSD\n181.72\n1,454.39\n*EXCHANGE RATE: 8.00347\n04APR\n03APR\nAPPLE. COM/BILL\nITUNES . COM\nIE\n126.00\n04APR\n02APR\nPAYPAL *AESCRIPTS\n4029357733\nUS\n81.69\n04APR\n03APR\nPLAY. HT\nBANGALORE\nDE\nUSD\n39.00\n312.14\n*EXCHANGE RATE: 8.00359\n04APR\n02APR\nPAYPAL *AESCRIPTS\n4029357733\nUS\n654.09\n06APR\n04APR\nHUTCHISON TELECOM 3CC\nHONG KONG\nHK\n197.00\n11APR\n08APR\nTwitter Dev Platform\nSan Francisco\nUS\nUSD\n100.00\n800.34\n*EXCHANGE RATE: 8.00340\n11APR\n06APR\nMPJ MOBILE APPS THE DA\nQuarry Bay\nHK\n597.30\n11APR\n06APR\nDNH*GODADDY. COM HKD\n480-505-8855\nUS\n961.56\n12APR\n11APR\nWEB*REGISTERWEBSITE\n800-8999723\nUS\nUSD\n152.00\n1,216.53\n* EXCHANGE RATE: 8.00349\n12APR\n11APR\nAPPLE. COM/BILL\nCORK\nIE\n78.00\n12APR\n11APR\nAPPLE. COM/BILL\nITUNES. COM\nIE\n15.00\n14APR\n13APR\nPAYPAL *AESCRIPTS\n4029357733\nUS\n286.20\n14APR\n13APR\n7-Eleven, HK (0824)\nMA ON SHAN\nHK\n3,825.00\n17APR\n15APR\nPAYPAL *TWITCHINTER\n4029357733\nUS\n31.99\n18APR\n17APR\nIFTTT PRO (LEGACY)\nSAN FRANCISCO\nUS\nUSD\n1.99\n15.92\n*EXCHANGE RATE: 8.00000\n19APR\n18APR\nMIDJOURNEY INC.\nSOUTH SAN FRA\nUS\nUSD\n4.00\n32.01\n* EXCHANGE RATE: 8.00250\n20APR\n19APR\nNYTimes *NYTimes\n800-698-4637\nUS\nUSD\n12.00\n96.05\n*EXCHANGE RATE: 8.00417\n20APR\n19APR\nNetflix.com\nLos Gatos\nSG\n93.00\n22APR\n21APR\nTWITTER PAID FEATURES\nSAN FRANCISCO\nUS\nUSD\n8.00\n64.02\n*EXCHANGE RATE: 8.00250\n22APR\n21APR\nMIDJOURNEY INC.\nSOUTH SAN FRA\nUS\nUSD\n20.00\n160.07\n* EXCHANGE RATE: 8.00350\n24APR\n23APR\nPAYPAL *WAKATIME\n4029357733\nHK\n73.59\n24APR\n23APR\nPAYPAL *GODADDY . COM\n4029357733\nUS\n180.80\n24APR\n21APR\nPAYPAL *GITHUB INC\n4029357733\nUS\n32.71\n24APR\n21APR\nTYPECAST AI\nWEST HOLLYWOO\nUS\nUSD\n39.99\n320.06\n* EXCHANGE RATE: 8.00350\n24APR\n16APR\nMPJ MOBILE APPS THE DA\nQuarry Bay\nHK\n654.10\n24APR\n22APR\nMIDJOURNEY INC.\nSOUTH SAN FRA\nUS\nUSD\n20.00\n160.07\n* EXCHANGE RATE: 8.00350\n27APR\n25APR\nPAYPAL *AESCRIPTS\n4029357733\nUS\n326.99\n27APR\n26APR\nPAYPAL *HAYU\n35314369001\nGB\n40.00\n27APR\n27APR\nCREDIT REWARD CASH REBATE\n228.00CR\n*For credit card transactions effected in currencies other\nthan Hong Kong dollars, the exchange rate applied includes a\nhandling fee equivalent to 1.95% of each transaction. The\nfee relating to foreign currency transaction is not\napplicable to RMB Business Card.\n就每項以非港元進行的信用卡交易,所用外幣匯率已包括交易金\n額1.95%的手續費。外幣交易有關費用不適用於人民幣公司卡。\nNote: \"CR\" means Credit transaction / balance\n註:「CR」為入賬交易/結餘\n**** REWARDCASH SUMMARY FOR CARD NUMBER 5199 3100 0018 7511\nREWARDCASH EARNED\n228\n..\nREWARDCASH ADJUSTED\n0\n..\nREWARDCASH REDEEMED\n..\n0\nCONVERTED TO CASH REBATE\n228\n..\nHSBC\n滙豐\nThe Hongkong and Shanghai Banking Corporation Limited\n香港上海滙豐銀行有限公司\nSTATEMENT OF BUSINESS CARD ACCOUNT 公司卡戶口結單\nPage\n3/4\nCardholder's name 持卡人姓名\nAccount number 戶口號碼\nStatement date 結單日\nSEE-MING LEE\n5199 3100 0018 7511\n27 APR 2023\nPost date\nTrans date\nDescription of transaction\nAmount\n(HKD)\n記賬日期\n交易日期\n交易說明\n金額\nSTATEMENT BALANCE\n結單結欠/結餘\n9,833.31\n*:\n** TRANSACTION SUMMARY\n**\nCREDIT/PAYMENT\n63,906.92CR\n..\nPURCHASES AND INSTALMENTS\n:\n57,102.36\nCREDIT ADJUSTMENT\n228.00CR\n..\nTOTAL ACCOUNT BALANCE\n9,833.31\n..\nFEES AND CHARGES SUMMARY\nFEE/CHARGE TYPE\nAMOUNT\nTOTAL FEES/CHARGES ( EXCLUDING FINANCE CHARGE)\n0.00\n* :\n*** FINANCE CHARGE SUMMARY\nBALANCE TYPE\nANNUALISED PERCENTAGE RATE (APR)\nFINANCE CHARGE\nCASH ADVANCE\n35.61%\n0.00\nPURCHASE\n34.46%\n0.00\nTOTAL FINANCE CHARGE\n0.00\n**\n*INFORMATION REGARDING MAKING MINIMUM PAYMENT*\nThe below examples are for illustration only. You may visit our Bank\nwebsite at www.hsbc. com.hk for an online credit card repayment\ncalculator for customized information.\nIf you make no additional\ncharges, purchases and\nYou will pay off the\nand you will end up\noutstanding balance*\ncash advances on this card\n| paying an estimated\nof HKD20, 000 in\ntotal of ...\nand each month you pay. ..\nabout . . .\n|\n|\n|\nOnly Minimum Payment Due\n|\n26 years **\n|\nHKD67,536 ***\n|\n|\nHKD849\n|\n3 years **\n|\nHKD30,565 ***\n|\n(Savings=HKD36, 971)\n* The outstanding balance of HKD20, 000 is accrued from purchase only.\n** Assume repayment is made on or before the payment due date of each\nstatement month.\n*** Include the outstanding balance of HKD20, 000 and the total finance\ncharge which is accrued daily and calculated at an interest rate of\n2.5% per month (equivalent to an annualised percentage rate of 34.46%\non purchase and 35.61% on cash advance) on the outstanding balance\nuntil it is fully paid.\nThe statement is for your reference only. Payment to be\narranged by your corporation.\nPlease note that your credit limit has been revised to\nHKD 150,000.00.\nThe RewardCash earned by the company have been\ntransferred to your Business Card account.\nIf the statement balance for your credit card account\nHSBC\n滙豐\nThe Hongkong and Shanghai Banking Corporation Limited\n香港上海滙豐銀行有限公司\nSTATEMENT OF BUSINESS CARD ACCOUNT 公司卡戶口結單\nPage 4 /4\nCardholder's name 持卡人姓名\nAccount number 戶口號碼\nStatement date 結單日\nSEE-MING LEE\n5199 3100 0018 7511\n27 APR 2023\nPost date\nTrans date\nDescription of transaction\nAmount\n(HKD)\n記賬日期\n交易日期\n交易說明\n金額\nexceeds the credit limit on the statement date, an overlimit\nhandling fee will be debited to the account. If you wish to\nopt out of the over-the-limit facility, you may fill out\nthe form on the back of the statement. For enquiries,\nplease contact us on 2748 8288.\n若您的結單結欠超出該信用卡戶口截至結單日的信用限額,\n本行會徵收超出信用限額手續費。如您欲拒絕接受超出信用限額\n信貸安排,請填妥結單背頁之表格作出指示。如有任何\n查詢,請致電2748 8288。",
            "paragraphs": []
        },
        "created_at": "2024-01-12T21:40:58.986Z"
    },
    {
        "doc1_Currency": "JPY",
        "doc1_Items": [
            {
                "_source": "31MAY\n30MAY\nDATYLON\nANTWERPEN\nBE\nUSD\n19.95\n159.65\n*EXCHANGE",
                "Date": "31MAY",
                "Description": "DATYLON"
            },
            {
                "_source": "31MAY\n30MAY\nADOBE CREATIVE CLOUD\nDublin\nIE\n408.00",
                "Date": "31MAY",
                "Description": "ADOBE CREATIVE CLOUD"
            },
            {
                "_source": "31MAY\n30MAY\nAPPLE. COM/BILL\n85221120099\nIE\n83.00",
                "Date": "31MAY",
                "Description": "APPLE. COM/BILL",
                "TotalPrice": 83
            },
            {
                "_source": "02JUN\n01JUN\nBLS*REDIS LABS14085242\nLONDON\nGB\nUSD\n248.00\n1,984.65\n*EXCHANGE RATE: 8.00262",
                "Category": "Credit",
                "Date": "2002-06-01T00:00:00.000Z",
                "Description": "BLS*REDIS LABS14085242"
            },
            {
                "_source": "02JUN\n01JUN\nOPEN SOURCE COLLECTIVE\nWALNUT\nUS\nUSD\n5.00\n40.02\n*EXCHANGE RATE: 8.00400",
                "Description": "OPEN",
                "TotalPrice": 40.02
            },
            {
                "_source": "02JUN\n01JUN\nCLOUDFLARE\nSAN FRANCISCO\nUS\nUSD\n62.70\n501.77\n*EXCHANGE RATE: 8.00271",
                "Date": "02JUN",
                "Description": "CLOUDFLARE"
            },
            {
                "_source": "02JUN\n01JUN\nMAILGUN TECHNOLOGIES,\nSAN ANTONIO\nUS\nUSD\n2.94\n23.52\n*EXCHANGE RATE: 8.00000",
                "Date": "2002-06-01T00:00:00.000Z",
                "Description": "MAILGUN TECHNOLOGIES,\nSAN ANTONIO",
                "TotalPrice": 23.52
            },
            {
                "_source": "02JUN\n01JUN\nLINODE\n8554546633\nUS\nUSD\n4,641.58\n37,144.74\n*EXCHANGE RATE: 8.00261",
                "Category": "Meals",
                "Date": "2002-06-01T00:00:00.000Z",
                "Description": "LINODE"
            },
            {
                "_source": "04JUN\n02JUN\nAPPLE. COM/BILL\n85221120099\nIE\n788.00",
                "Category": "Meals",
                "Date": "2004-06-02T00:00:00.000Z",
                "Description": "APPLE. COM/BILL",
                "TotalPrice": 788
            },
            {
                "_source": "04JUN\n01JUN\nSTACK* ZEROSSL\nWIEN\nAT\nUSD\n10.00\n80.01\n*EXCHANGE RATE: 8.00100",
                "Category": "Meals",
                "Date": "2004-06-01T00:00:00.000Z",
                "Description": "STACK* ZEROSSL",
                "TotalPrice": 80.01
            },
            {
                "_source": "04JUN\n03JUN\nNRI*NEW RELIC\n888-643-8776\nUS\nUSD\n248.25\n1,985.84\n*EXCHANGE RATE: 7.99936",
                "Category": "Meals",
                "Date": "04JUN",
                "Description": "NRI*NEW RELIC"
            },
            {
                "_source": "04JUN\n01JUN\nPAYPAL *PATREON\nMEMBE\n4029357733\nUS\n16.35",
                "Category": "Credit",
                "Date": "04JUN",
                "Description": "PAYPAL *PATREON\nMEMBE",
                "TotalPrice": 16.35
            },
            {
                "_source": "04JUN\n02JUN\nBROWSERSTACK. COM\nLEWES\nUS\nUSD\n19.00\n152.02\n*EXCHANGE RATE: 8.00105",
                "Category": "Meals",
                "Date": "04JUN",
                "Description": "BROWSERSTACK. COM",
                "TotalPrice": 152.02
            },
            {
                "_source": "04JUN\n03JUN\nAPPLE. COM/BILL\n85221120099\nIE\n78.00",
                "Date": "2004-06-03T00:00:00.000Z",
                "Description": "APPLE. COM/BILL",
                "TotalPrice": 78
            }
        ],
        "doc1_MerchantAddress": {
            "_source": "PO BOX\nNO. 73730, KOWLOON CENTRAL POST OFFICE HK.",
            "poBox": "PO BOX\nNO. 73730",
            "streetAddress": "PO BOX\nNO. 73730",
            "house": "KOWLOON CENTRAL POST OFFICE HK."
        },
        "doc1_MerchantAliases": [
            "HSBC.",
            "The Hongkong and Shanghai Corporation Limited",
            "HSBC\n滙豐"
        ],
        "doc1_MerchantName": "香港上海滙豐銀行有限公司",
        "doc1_MerchantPhoneNumber": "+81852274882880",
        "doc2_Currency": "USD",
        "doc2_Items": [
            {
                "_source": "04JUN\n03JUN\nAmazon web services\naws . amazon. co\nUS\nUSD\n208.41\n1,667.60\n*EXCHANGE RATE: 8.00154",
                "Category": "Credit",
                "Date": "04JUN",
                "Description": "Amazon web services\naws"
            },
            {
                "_source": "04JUN\n03JUN\nAPPLE. COM/BILL\n85221120099\nIE\n158.00",
                "Category": "Other",
                "Date": "2003-06-04T00:00:00.000Z",
                "Description": "APPLE. COM/BILL",
                "TotalPrice": 158
            },
            {
                "_source": "04JUN\n01JUN\nASSOCIATED STDNT AGENC\n203-4321886\nUS\nUSD\n150.00\n1,200.39\n*EXCHANGE RATE: 8.00260",
                "Date": "2001-06-04T00:00:00.000Z",
                "Description": "ASSOCIATED STDNT AGENC"
            },
            {
                "_source": "06JUN\n04JUN\nHUTCHISON TELECOM 3CC\nHONG KONG\nHK\n136.00",
                "Category": "Other",
                "Date": "2004-06-06T00:00:00.000Z",
                "Description": "HUTCHISON TELECOM 3CC",
                "TotalPrice": 136
            },
            {
                "_source": "08JUN\n07JUN\nPAYPAL *OREILLYMEDI\n4029357733\nUS\n318.74",
                "Date": "2007-06-08T00:00:00.000Z",
                "Description": "PAYPAL *OREILLYMEDI",
                "TotalPrice": 318.74
            },
            {
                "_source": "09JUN\n08JUN\nAPPLE. COM/BILL\nITUNES . COM\nIE\n53.00",
                "Category": "Other",
                "Date": "2008-06-09T00:00:00.000Z",
                "Description": "APPLE. COM/BILL",
                "TotalPrice": 53
            },
            {
                "_source": "10JUN\n08JUN\nAPPLE. COM/HK\nHONG KONG\nHK\n729.00",
                "Category": "Other",
                "Date": "2008-06-10T00:00:00.000Z",
                "Description": "APPLE. COM/HK",
                "TotalPrice": 729
            },
            {
                "_source": "10JUN\n10JUN\nAPPLE. COM/BILL\n85221120099\nIE\n198.00",
                "Category": "Other",
                "Date": "10JUN",
                "Description": "APPLE. COM/BILL",
                "TotalPrice": 198
            },
            {
                "_source": "11JUN\n10JUN\nAPPLE. COM/BILL\n85221120099\nIE\n78.00",
                "Category": "Other",
                "Date": "11JUN",
                "Description": "APPLE. COM/BILL",
                "TotalPrice": 78
            },
            {
                "_source": "11JUN\n10JUN\nHM PASSPORT OFFICE\nDURHAM\nGB\nGBP\n105.86\n1,064.54\n*EXCHANGE RATE: 10.05611",
                "Category": "Other",
                "Date": "11JUN",
                "Description": "HM PASSPORT OFFICE"
            },
            {
                "_source": "11JUN\n10JUN\nIMMD E-SERVICES-210600\nHONG KONG\nHK\n370.00",
                "Category": "Other",
                "Date": "11JUN",
                "Description": "IMMD E-SERVICES-210600",
                "TotalPrice": 370
            },
            {
                "_source": "11JUN\n10JUN\nFOTOMAX - MOSTOWN29027\nHONG KONG\nHK\n240.00",
                "Category": "Other",
                "Date": "11JUN",
                "Description": "FOTOMAX MOSTOWN29027",
                "TotalPrice": 240
            },
            {
                "_source": "13JUN\n12JUN\nPAYPAL *TIDAL HIFI\n35314369001\nSE\n96.00",
                "Category": "Credit",
                "Date": "2012-06-13T00:00:00.000Z",
                "Description": "PAYPAL *TIDAL HIFI",
                "TotalPrice": 96
            },
            {
                "_source": "13JUN\n11JUN\nAPPLE. COM/BILL\nITUNES . COM\nIE\n78.00",
                "Category": "Other",
                "Date": "2011-06-13T00:00:00.000Z",
                "Description": "APPLE. COM/BILL"
            },
            {
                "_source": "14JUN\n13JUN\nPAYPAL *FASTSPRING\n4029357733\nUS\n292.00",
                "Date": "14JUN",
                "Description": "PAYPAL *FASTSPRING",
                "TotalPrice": 292
            },
            {
                "_source": "16JUN\n15JUN\nNYTimes *NYTimes\n800-698-4637\nUS\nUSD\n12.00\n96.05\n*EXCHANGE RATE: 8.00417",
                "Category": "Credit",
                "Date": "2015-06-16T00:00:00.000Z",
                "Description": "NYTimes *NYTimes",
                "TotalPrice": 96.05
            },
            {
                "_source": "17JUN\n16JUN\nAPPLE. COM/BILL\nITUNES. COM\nIE\n46.00",
                "Date": "17JUN",
                "Description": "APPLE. COM/BILL",
                "TotalPrice": 46
            },
            {
                "_source": "18JUN\n17JUN\nAPPLE. COM/BILL\n85221120099\nIE\n78.00",
                "Date": "2017-06-18T00:00:00.000Z",
                "Description": "APPLE. COM/BILL",
                "TotalPrice": 78
            },
            {
                "_source": "18JUN\n17JUN\nIFTTT PRO (LEGACY)\nSAN FRANCISCO\nUS\nUSD\n1.99\n15.92\n*EXCHANGE RATE: 8.00000",
                "Category": "Tax",
                "Date": "18JUN",
                "Description": "IFTTT PRO (LEGACY)",
                "TotalPrice": 15.92
            },
            {
                "_source": "18JUN\n17JUN\nAPPLE. COM/BILL\n85221120099\nIE\n788.00",
                "Date": "18JUN",
                "Description": "APPLE. COM/BILL",
                "TotalPrice": 788
            },
            {
                "_source": "18JUN\n17JUN\nPAYPAL *OUTPUT\n4029357733\nUS\n81.77",
                "Category": "Credit",
                "Date": "18JUN",
                "Description": "PAYPAL *OUTPUT",
                "TotalPrice": 81.77
            },
            {
                "_source": "20JUN\n19JUN\nPAYPAL *TWENTYEIGHT TW\n4029357733\nHK\n599.00CR",
                "Date": "2019-06-20T00:00:00.000Z",
                "Description": "PAYPAL *TWENTYEIGHT TW",
                "TotalPrice": 599
            },
            {
                "_source": "20JUN\n19JUN\nPAYPAL *TWENTYEIGHT TW\n4029357733\nHK\n599.00",
                "Category": "Other",
                "Date": "2019-06-20T00:00:00.000Z",
                "Description": "PAYPAL *TWENTYEIGHT TW",
                "TotalPrice": 599
            },
            {
                "_source": "20JUN\n19JUN\nNetflix.com\nLos Gatos\nSG\n78.00",
                "Date": "2019-06-20T00:00:00.000Z",
                "Description": "Netflix.com",
                "TotalPrice": 78
            },
            {
                "_source": "21JUN\n20JUN\nLUFTHAN2201878954695\nVANTAA\nFI\nEUR\n30.00\n254.53\n*EXCHANGE RATE: 8.48433",
                "Date": "21JUN",
                "Description": "LUFTHAN2201878954695"
            },
            {
                "_source": "22JUN\n21JUN\nGUM. CO/CC* ALEXANDER S\nSAN FRANCISCO\nUS\nUSD\n49.00\n392.17\n*EXCHANGE RATE: 8.00347",
                "Date": "22JUN",
                "Description": "GUM. CO/CC* ALEXANDER"
            },
            {
                "_source": "23JUN\n21JUN\nPAYPAL *GITHUB INC\n4029357733\nUS\n73.59",
                "Category": "Credit",
                "Date": "2021-06-23T00:00:00.000Z",
                "Description": "PAYPAL *GITHUB INC",
                "TotalPrice": 73.59
            },
            {
                "_source": "23JUN\n22JUN\nAMZN Mktp US*MV0WY5F53\nAmzn. com/bill\nUS\n556.61",
                "Category": "Credit",
                "Date": "2022-06-23T00:00:00.000Z",
                "Description": "AMZN Mktp US*MV0WY5F53",
                "TotalPrice": 556.61
            },
            {
                "_source": "24JUN\n23JUN\nPAYPAL *DRAGONSTACK\n4029357733\nHK\n327.01",
                "Category": "Meals",
                "Date": "2023-06-24T00:00:00.000Z",
                "Description": "PAYPAL *DRAGONSTACK",
                "TotalPrice": 327.01
            },
            {
                "_source": "24JUN\n23JUN\nPAYPAL *WAKATIME\n4029357733\nHK\n73.60",
                "Category": "Other",
                "Date": "2023-06-24T00:00:00.000Z",
                "Description": "PAYPAL *WAKATIME",
                "TotalPrice": 73.6
            },
            {
                "_source": "24JUN\n23JUN\nSINO STATE HONG KONG L\nMONGKOK\nHK\n6,900.00",
                "Date": "2023-06-24T00:00:00.000Z",
                "Description": "SINO STATE HONG KONG",
                "TotalPrice": 6900
            },
            {
                "_source": "25JUN\n24JUN\nAPPLE. COM/BILL\n85221120099\nIE\n114.00",
                "Category": "Other",
                "Date": "25JUN",
                "Description": "24JUN\nAPPLE. COM/BILL",
                "TotalPrice": 114
            },
            {
                "_source": "25JUN\n24JUN\nPAYPAL *SIA WEBY\n35314369001\nLV\n98.04",
                "Category": "Other",
                "Date": "1924-06-25T00:00:00.000Z",
                "Description": "PAYPAL *SIA WEBY",
                "TotalPrice": 98.04
            },
            {
                "_source": "25JUN\n24JUN\nAPPLE. COM/BILL\n85221120099\nIE\n158.00",
                "Category": "Other",
                "Date": "25JUN",
                "Description": "24JUN\nAPPLE. COM/BILL",
                "TotalPrice": 158
            },
            {
                "_source": "25JUN\n24JUN\nAPPLE. COM/BILL\n85221120099\nIE\n78.00",
                "Category": "Other",
                "Date": "25JUN",
                "Description": "24JUN\nAPPLE. COM/BILL",
                "TotalPrice": 78
            },
            {
                "_source": "27JUN\n26JUN\nPAYPAL *HAYU\n35314369001\nGB\n40.00",
                "Category": "Other",
                "Date": "1926-06-27T00:00:00.000Z",
                "Description": "PAYPAL *HAYU",
                "TotalPrice": 40
            },
            {
                "_source": "27JUN\n25JUN\nPAYPAL *SIA WEBY\n35314369001\nLV\n98.04",
                "Category": "Other",
                "Date": "1925-06-27T00:00:00.000Z",
                "Description": "PAYPAL *SIA WEBY",
                "TotalPrice": 98.04
            },
            {
                "_source": "28JUN\n27JUN\nPAYPAL *TWITCHINTER\n4029357733\nUS\n31.99",
                "Category": "Other",
                "Date": "28JUN",
                "Description": "PAYPAL *TWITCHINTER",
                "TotalPrice": 31.99
            },
            {
                "_source": "29JUN\n28JUN\nPAYPAL *CBOTTONE75\n4029357733\nHK\n81.77",
                "Category": "Meals",
                "Date": "1928-06-29T00:00:00.000Z",
                "Description": "PAYPAL *CBOTTONE75",
                "TotalPrice": 81.77
            },
            {
                "_source": "29JUN\n28JUN\nPAYPAL *IP ANNA VIDEOL\n4029357733\nHK\n122.65",
                "Date": "1928-06-29T00:00:00.000Z",
                "Description": "PAYPAL *IP ANNA VIDEOL",
                "TotalPrice": 122.65
            },
            {
                "_source": "29JUN\n29JUN\nCREDIT REWARD CASH REBATE\n252.00CR",
                "Category": "Credit",
                "Date": "1929-06-29T00:00:00.000Z",
                "Description": "CREDIT",
                "TotalPrice": 252
            }
        ],
        "doc2_MerchantAliases": [
            "The Hongkong and Shanghai Corporation Limited",
            "HSBC\n滙豐"
        ],
        "doc2_MerchantName": "香港上海滙豐銀行有限公司",
        "doc3_MerchantName": "香港上海滙豐銀行有限公司",
        "doc3_TransactionDate": "2022-06-29T00:00:00.000Z",
        "doc4_MerchantName": "香港上海滙豐銀行有限公司\nHongkong and Shanghai Corporation Limited",
        "doc4_MerchantPhoneNumber": "+88627488288",
        "doc4_TransactionDate": "2022-06-29T00:00:00.000Z",
        "__raw__": {
            "content": "HSBC\n滙豐\nThe Hongkong and Shanghai Banking Corporation Limited\n香港上海滙豐銀行有限公司\nSTATEMENT OF BUSINESS CARD ACCOUNT 公司卡戶口結單\nPage\n1/4\nMR LEE SEE MING\nM\nAccount number 戶口號碼\nC/O SML UNIVERSE LIMITED\n00929\n5199 3100 0018 7511\nFLAT F 27/F BLK 10 VISTA PARADISO\nCard type 信用卡類別\nCredit limit 信用限額\n2 HANG MING ST\nPlatinum Business MC\nHKD75,000.00\nNEW TERRITORIES\nStatement date 結單日\nStatement balance 結單結欠/結餘\n29 JUN 2022\nHKD22,248.42\nPost date\nTrans date\nDescription of transaction\nAmount\n(HKD )\n記賬日期\n交易日期\n交易說明\n金額\nPREVIOUS BALANCE\n上月結欠/結餘\n15,683.46\n31MAY\n31MAY\nIFS PAYMENT - THANK YOU\n15,683.46CR\n04JUN\n03JUN\nIFS PAYMENT - THANK YOU\n40,345.35CR\n5199 3100 0018 7511\nSEE-MING LEE\nSML UNIVERSE LTD\n31MAY\n30MAY\nDATYLON\nANTWERPEN\nBE\nUSD\n19.95\n159.65\n*EXCHANGE RATE: 8.00251\n31MAY\n30MAY\nADOBE CREATIVE CLOUD\nDublin\nIE\n408.00\n31MAY\n30MAY\nAPPLE. COM/BILL\n85221120099\nIE\n83.00\n02JUN\n01JUN\nBLS*REDIS LABS14085242\nLONDON\nGB\nUSD\n248.00\n1,984.65\n*EXCHANGE RATE: 8.00262\n02JUN\n01JUN\nOPEN SOURCE COLLECTIVE\nWALNUT\nUS\nUSD\n5.00\n40.02\n*EXCHANGE RATE: 8.00400\n02JUN\n01JUN\nCLOUDFLARE\nSAN FRANCISCO\nUS\nUSD\n62.70\n501.77\n*EXCHANGE RATE: 8.00271\n02JUN\n01JUN\nMAILGUN TECHNOLOGIES,\nSAN ANTONIO\nUS\nUSD\n2.94\n23.52\n*EXCHANGE RATE: 8.00000\n02JUN\n01JUN\nLINODE\n8554546633\nUS\nUSD\n4,641.58\n37,144.74\n*EXCHANGE RATE: 8.00261\n04JUN\n02JUN\nAPPLE. COM/BILL\n85221120099\nIE\n788.00\n04JUN\n01JUN\nSTACK* ZEROSSL\nWIEN\nAT\nUSD\n10.00\n80.01\n*EXCHANGE RATE: 8.00100\n04JUN\n03JUN\nNRI*NEW RELIC\n888-643-8776\nUS\nUSD\n248.25\n1,985.84\n*EXCHANGE RATE: 7.99936\n04JUN\n01JUN\nPAYPAL *PATREON\nMEMBE\n4029357733\nUS\n16.35\n04JUN\n02JUN\nBROWSERSTACK. COM\nLEWES\nUS\nUSD\n19.00\n152.02\n*EXCHANGE RATE: 8.00105\n04JUN\n03JUN\nAPPLE. COM/BILL\n85221120099\nIE\n78.00\nFor important information such as payment methods, fees and charges, lost\ncard reporting, and change of correspondence address / telephone number,\nMinimum payment summary 最低付款摘要\nHKD\nplease visit www.hsbc.com.hk or call our Customer Service Hotline on\nCurrent minimum payment due 目前最低付款額\n223.00\n(852) 2748 8288.\nPlease pay by 須於此付款到期日或之前繳交\n26 JUL 2022\n有關您戶口的重要資料包括付款方式,利息與收費,報失信用卡,以及更改\nOverdue / overlimit due now\n通訊地址/電話號碼,請瀏覽網址www.hsbc.com.hk或聯絡我們的客戶服務熱\n須立即繳交的過期款項/超額款項\n0.00\n線(852) 2748 82880\nTotal minimum payment due\n最低付款總額\n223.00\nHSBC\n滙豐 Payment Slip 付款存根\nAccount number 戶口號碼\nCard type 信用卡類別\nIf you are paying by mail, please detach this payment slip and return it with a\n5199 3100 0018 7511\nPlatinum Business MC\ncrossed cheque made payable to \"The Hongkong and Shanghai Banking\nCorporation Limited\" or \"HSBC\" at least three working days before the\nStatement date 結單日\nStatement balance 結單結欠/結餘\npayment due date to our Centre, PO BOX NO. 73730, KOWLOON CENTRAL\n29 JUN 2022\nHKD22, 248.42\nPOST OFFICE HK. Please write your account number on the back of the\nCheque number 支票號碼\nAmount enclosed\n夾附金額\ncheque.\n如欲以郵寄方式付款,請撕下此付款存根,於付款到期日三個工作天前,連同以\n「香港上海滙豐銀行有限公司」或「滙豐」為抬頭的劃線支票,寄回 PO BOX\nNO. 73730, KOWLOON CENTRAL POST OFFICE HK. 信用卡中心收,請於支\n票背面寫上您的戶口號碼。\nThank you for choosing HSBC.多謝選用滙豐服務。\nHSBC\n滙豐\nThe Hongkong and Shanghai Banking Corporation Limited\n香港上海滙豐銀行有限公司\nSTATEMENT OF BUSINESS CARD ACCOUNT 公司卡戶口結單\nPage 2 / 4\nCardholder's name 持卡人姓名\nAccount number 戶口號碼\nStatement date 結單日\nSEE-MING LEE\n5199 3100 0018 7511\n29 JUN 2022\nPost date\nTrans date\nDescription of transaction\nAmount\n(HKD)\n記賬日期\n交易日期\n交易說明\n金額\n04JUN\n03JUN\nAmazon web services\naws . amazon. co\nUS\nUSD\n208.41\n1,667.60\n*EXCHANGE RATE: 8.00154\n04JUN\n03JUN\nAPPLE. COM/BILL\n85221120099\nIE\n158.00\n04JUN\n01JUN\nASSOCIATED STDNT AGENC\n203-4321886\nUS\nUSD\n150.00\n1,200.39\n*EXCHANGE RATE: 8.00260\n06JUN\n04JUN\nHUTCHISON TELECOM 3CC\nHONG KONG\nHK\n136.00\n08JUN\n07JUN\nPAYPAL *OREILLYMEDI\n4029357733\nUS\n318.74\n09JUN\n08JUN\nAPPLE. COM/BILL\nITUNES . COM\nIE\n53.00\n10JUN\n08JUN\nAPPLE. COM/HK\nHONG KONG\nHK\n729.00\n10JUN\n10JUN\nAPPLE. COM/BILL\n85221120099\nIE\n198.00\n11JUN\n10JUN\nAPPLE. COM/BILL\n85221120099\nIE\n78.00\n11JUN\n10JUN\nHM PASSPORT OFFICE\nDURHAM\nGB\nGBP\n105.86\n1,064.54\n*EXCHANGE RATE: 10.05611\n11JUN\n10JUN\nIMMD E-SERVICES-210600\nHONG KONG\nHK\n370.00\n11JUN\n10JUN\nFOTOMAX - MOSTOWN29027\nHONG KONG\nHK\n240.00\n13JUN\n12JUN\nPAYPAL *TIDAL HIFI\n35314369001\nSE\n96.00\n13JUN\n11JUN\nAPPLE. COM/BILL\nITUNES . COM\nIE\n78.00\n14JUN\n13JUN\nPAYPAL *FASTSPRING\n4029357733\nUS\n292.00\n16JUN\n15JUN\nNYTimes *NYTimes\n800-698-4637\nUS\nUSD\n12.00\n96.05\n*EXCHANGE RATE: 8.00417\n17JUN\n16JUN\nAPPLE. COM/BILL\nITUNES. COM\nIE\n46.00\n18JUN\n17JUN\nAPPLE. COM/BILL\n85221120099\nIE\n78.00\n18JUN\n17JUN\nIFTTT PRO (LEGACY)\nSAN FRANCISCO\nUS\nUSD\n1.99\n15.92\n*EXCHANGE RATE: 8.00000\n18JUN\n17JUN\nAPPLE. COM/BILL\n85221120099\nIE\n788.00\n18JUN\n17JUN\nPAYPAL *OUTPUT\n4029357733\nUS\n81.77\n20JUN\n19JUN\nPAYPAL *TWENTYEIGHT TW\n4029357733\nHK\n599.00CR\n20JUN\n19JUN\nPAYPAL *TWENTYEIGHT TW\n4029357733\nHK\n599.00\n20JUN\n19JUN\nNetflix.com\nLos Gatos\nSG\n78.00\n21JUN\n20JUN\nLUFTHAN2201878954695\nVANTAA\nFI\nEUR\n30.00\n254.53\n*EXCHANGE RATE: 8.48433\n21JUN\n20JUN\nLUFTHAN2201878954698\nVANTAA\nFI\nEUR\n30.00\n254.53\n*EXCHANGE RATE: 8. 48433\n21JUN\n20JUN\nAMZN Mktp US*UI8H74UF3\nAmzn. com/bill\nUS\n765.52\n21JUN\n20JUN\nLUFTHAN2201878954696\nVANTAA\nFI\nEUR\n55.00\n466.64\n*EXCHANGE RATE: 8.48436\n21JUN\n20JUN\nLUFTHAN2201878954697\nVANTAA\nFI\nEUR\n55.00\n466.64\n*EXCHANGE RATE: 8.48436\n22JUN\n21JUN\nGUM. CO/CC* ALEXANDER S\nSAN FRANCISCO\nUS\nUSD\n49.00\n392.17\n*EXCHANGE RATE: 8.00347\n22JUN\n21JUN\nAMZN Mktp US*RL5631NE3\nAmzn. com/bill\nUS\n183.86\n23JUN\n21JUN\nPAYPAL *GITHUB INC\n4029357733\nUS\n73.59\n23JUN\n22JUN\nAMZN Mktp US*MV0WY5F53\nAmzn. com/bill\nUS\n556.61\n24JUN\n23JUN\nPAYPAL *DRAGONSTACK\n4029357733\nHK\n327.01\n24JUN\n23JUN\nPAYPAL *WAKATIME\n4029357733\nHK\n73.60\n24JUN\n23JUN\nSINO STATE HONG KONG L\nMONGKOK\nHK\n6,900.00\n25JUN\n24JUN\nAPPLE. COM/BILL\n85221120099\nIE\n114.00\n25JUN\n24JUN\nPAYPAL *SIA WEBY\n35314369001\nLV\n98.04\n25JUN\n24JUN\nAPPLE. COM/BILL\n85221120099\nIE\n158.00\n25JUN\n24JUN\nAPPLE. COM/BILL\n85221120099\nIE\n78.00\n27JUN\n26JUN\nPAYPAL *HAYU\n35314369001\nGB\n40.00\n27JUN\n25JUN\nPAYPAL *SIA WEBY\n35314369001\nLV\n98.04\n28JUN\n27JUN\nPAYPAL *TWITCHINTER\n4029357733\nUS\n31.99\n29JUN\n28JUN\nPAYPAL *CBOTTONE75\n4029357733\nHK\n81.77\n29JUN\n28JUN\nPAYPAL *IP ANNA VIDEOL\n4029357733\nHK\n122.65\n29JUN\n29JUN\nCREDIT REWARD CASH REBATE\n252.00CR\n*For credit card transactions effected in currencies other\nthan Hong Kong dollars, the exchange rate applied includes a\nhandling fee equivalent to 1.95% of each transaction. The\nfee relating to foreign currency transaction is not\napplicable to RMB Business Card.\n就每項以非港元進行的信用卡交易,所用外幣匯率已包括交易金\n額1.95%的手續費。外幣交易有關費用不適用於人民幣公司卡。\nHSBC\n滙豐\nThe Hongkong and Shanghai Banking Corporation Limited\n香港上海滙豐銀行有限公司\nSTATEMENT OF BUSINESS CARD ACCOUNT 公司卡戶口結單\nPage 3 / 4\nCardholder's name 持卡人姓名\nAccount number 戶口號碼\nStatement date 結單日\nSEE-MING LEE\n5199 3100 0018 7511\n29 JUN 2022\nPost date\nTrans date\nDescription of transaction\nAmount\n( HKD)\n記賬日期\n交易日期\n交易說明\n金額\nNote: \"CR\" means Credit transaction / balance\n註:「CR」為入賬交易/結餘\n**** REWARDCASH SUMMARY FOR CARD NUMBER 5199 3100 0018 7511\nREWARDCASH EARNED\n252\n..\nREWARDCASH ADJUSTED\n0\n..\nREWARDCASH REDEEMED\n0\n..\nCONVERTED TO CASH REBATE\n:\n252\nSTATEMENT BALANCE\n結單結欠/結餘\n22,248.42\nTRANSACTION SUMMARY\nCREDIT/PAYMENT\n56,627.81CR\n..\nPURCHASES AND INSTALMENTS\n63,444.77\n..\nCREDIT ADJUSTMENT\n252.00CR\n..\nTOTAL ACCOUNT BALANCE\n22,248.42\n..\n**\n** FEES AND CHARGES SUMMARY\nFEE/CHARGE TYPE\nAMOUNT\nTOTAL FEES/CHARGES ( EXCLUDING FINANCE CHARGE)\n0.00\n***** FINANCE CHARGE SUMMARY **\nBALANCE TYPE\nANNUALISED PERCENTAGE RATE (APR)\nFINANCE CHARGE\nCASH ADVANCE\n35.61%\n0.00\nPURCHASE\n34. 46%\n0.00\nTOTAL FINANCE CHARGE\n0.00\n* * ****\n*INFORMATION REGARDING MAKING MINIMUM PAYMENT*\nThe below examples are for illustration only. You may visit our Bank\nwebsite at www.hsbc. com.hk for an online credit card repayment\ncalculator for customized information.\nIf you make no additional\nYou will pay off the\n|and you will end up\ncharges, purchases and\noutstanding balance*\ncash advances on this card\nand each month you pay. . .\nof HKD20,000 in\npaying an estimated\ntotal of ...\nabout .. .\n|\n|\n|\nOnly Minimum Payment Due\n|\n26 years **\n|\nHKD67,536 ***\n|\n|\nHKD849\n|\n3 years **\n|\nHKD30,565 ***\n|\n(Savings=HKD36, 971)\n* The outstanding balance of HKD20, 000 is accrued from purchase only.\n** Assume repayment is made on or before the payment due date of each\nstatement month.\n*** Include the outstanding balance of HKD20, 000 and the total finance\ncharge which is accrued daily and calculated at an interest rate of\n2.5% per month (equivalent to an annualised percentage rate of 34.46%\non purchase and 35.61% on cash advance) on the outstanding balance\nuntil it is fully paid.\nThe statement is for your reference only.\nPayment to be\narranged by your corporation.\nThe RewardCash earned by the company have been\nHSBC\n滙豐\nThe Hongkong and Shanghai Banking Corporation Limited\n香港上海滙豐銀行有限公司\nSTATEMENT OF BUSINESS CARD ACCOUNT 公司卡戶口結單\nPage 4 /4\nCardholder's name 持卡人姓名\nAccount number 戶口號碼\nStatement date 結單日\nSEE-MING LEE\n5199 3100 0018 7511\n29 JUN 2022\nPost date\nTrans date\nDescription of transaction\nAmount\n(HKD)\n記賬日期\n交易日期\n交易說明\n金額\ntransferred to your Business Card account.\nIf the statement balance for your credit card account\nexceeds the credit limit on the statement date, an overlimit\nhandling fee will be debited to the account. If you wish to\nopt out of the over-the-limit facility, you may fill out\nthe form on the back of the statement. For enquiries,\nplease contact us on 2748 8288.\n若您的結單結欠超出該信用卡戶口截至結單日的信用限額,\n本行會徵收超出信用限額手續費。如您欲拒絕接受超出信用限額\n信貸安排,請填妥結單背頁之表格作出指示。如有任何\n查詢,請致電2748 8288。",
            "paragraphs": []
        },
        "created_at": "2024-01-12T21:40:59.013Z"
    },
    {
        "Currency": "JPY",
        "Items": [
            {
                "_source": "31OCT\n29OCT\nAPPLE. COM/BILL\n85221120099",
                "Date": "31OCT",
                "Description": "APPLE. COM/BILL"
            },
            {
                "_source": "31OCT\n30OCT\nDATYLON\nANTWERPEN\nBE\nUSD\n19.95\n159.66\n*EXCHANGE RATE: 8.00301",
                "Date": "1931-10-30T00:00:00.000Z",
                "Description": "DATYLON",
                "TotalPrice": 159.66
            },
            {
                "_source": "31OCT\n29OCT\nAPPLE. COM/BILL\nITUNES. COM\nIE\n238.00",
                "Date": "31OCT",
                "Description": "APPLE. COM/BILL",
                "TotalPrice": 238
            },
            {
                "_source": "31OCT\n30OCT\nPAYPAL *TOPAZ LABS\n4029357733\nUS\n1,300.11",
                "Category": "Credit",
                "Date": "31OCT",
                "Description": "PAYPAL *TOPAZ LABS",
                "TotalPrice": 1300.11
            },
            {
                "_source": "02NOV\n01NOV\nOPEN SOURCE COLLECTIVE\nWALNUT\nUS\nUSD\n5.00\n40.02\n*EXCHANGE RATE: 8.00400",
                "Date": "02NOV",
                "Description": "OPEN",
                "TotalPrice": 40.02
            },
            {
                "_source": "02NOV\n01NOV\nLINODE . AKAMAI\n6093807100\nUS\nUSD\n4,971.11\n39,785.07\n*EXCHANGE RATE: 8.00326",
                "Category": "Credit",
                "Date": "02NOV",
                "Description": "LINODE AKAMAI"
            },
            {
                "_source": "02NOV\n01NOV\nCLOUDFLARE\nSAN FRANCISCO\nUS\nUSD\n62.35\n499.00\n*EXCHANGE RATE: 8.00321",
                "Category": "Other",
                "Date": "2002-11-01T00:00:00.000Z",
                "Description": "CLOUDFLARE",
                "TotalPrice": 499
            },
            {
                "_source": "02NOV\n01NOV\nGOOGLE*GSUITE SMLUNIVE\nSINGAPORE\nSG\n56.86",
                "Category": "Meals",
                "Date": "2002-11-01T00:00:00.000Z",
                "Description": "GOOGLE*GSUITE SMLUNIVE",
                "TotalPrice": 56.86
            },
            {
                "_source": "02NOV\n01NOV\nMAILGUN TECHNOLOGIES,\nSAN ANTONIO\nUS\nUSD\n3.40\n27.21\n*EXCHANGE RATE: 8.00294",
                "Date": "2002-11-01T00:00:00.000Z",
                "Description": "MAILGUN TECHNOLOGIES,",
                "TotalPrice": 27.21
            },
            {
                "_source": "02NOV\n01NOV\nSTACK* ZEROSSL\nWIEN\nAT\nUSD\n10.00\n80.03\n*EXCHANGE RATE: 8.00300",
                "Category": "Meals",
                "Date": "2002-11-01T00:00:00.000Z",
                "Description": "STACK* ZEROSSL",
                "TotalPrice": 80.03
            },
            {
                "_source": "03NOV\n01NOV\nBLS*REDIS LABS14085242\nLONDON\nGB\nUSD\n248.00\n1,984.80\n*EXCHANGE RATE: 8.00323",
                "Category": "Credit",
                "Date": "03NOV",
                "Description": "BLS*REDIS LABS14085242"
            },
            {
                "_source": "03NOV\n02NOV\nAPPLE. COM/BILL\nITUNES . COM\nIE\n78.00",
                "Date": "03NOV",
                "Description": "APPLE. COM/BILL",
                "TotalPrice": 78
            },
            {
                "_source": "03NOV\n02NOV\nBROWSERSTACK. COM\nLEWES\nUS\nUSD\n10.00\n80.03\n*EXCHANGE RATE: 8.00300",
                "Date": "2003-11-02T00:00:00.000Z",
                "Description": "BROWSERSTACK. COM",
                "TotalPrice": 80.03
            },
            {
                "_source": "03NOV\n02NOV\nNYTimes *NYTimes\nUS\nUSD\n12.00\n96.04\n*EXCHANGE RATE: 8.00333",
                "Description": "NYTimes *NYTimes",
                "Price": 12,
                "TotalPrice": 96.04
            },
            {
                "_source": "03NOV\n01NOV\nPAYPAL *PATREON\nMEMBE\n4029357733\nUS\n16.35",
                "Description": "01NOV\nPAYPAL *PATREON\nMEMBE",
                "ProductCode": "4029357733",
                "TotalPrice": 16.35
            },
            {
                "_source": "*",
                "Description": "*"
            },
            {
                "_source": "juuso914",
                "Description": "juuso914"
            },
            {
                "_source": "04NOV\n03NOV\nNRI*NEW RELIC\n888-643-8776\nUS\nUSD\n441.00\n3,529.49\n*EXCHANGE RATE: 8.00338\n05NOV\n03NOV\nPAYPAL\n4029357733\nHK\n457.81\n05NOV\n03NOV\nAPPLE. COM/HK\nHONG KONG\nHK\n788.00\n10NOV",
                "Description": "NRI*NEW RELIC\nPAYPAL\nAPPLE. COM/HK",
                "Price": 441,
                "ProductCode": "4029357733",
                "TotalPrice": 788
            },
            {
                "_source": "12NOV\n11NOV\n*DAZ 3D\n4029357733\nUS\n113.12",
                "Description": "*DAZ 3D",
                "TotalPrice": 113.12
            },
            {
                "_source": "375.69\n14NOV\n12NOV\nPAYPAL *VUE MASTERY\n4029357733\nUS\n204.33",
                "Description": "PAYPAL *VUE MASTERY",
                "TotalPrice": 204.33
            },
            {
                "_source": "14NOV\n13NOV\nMIDJOURNEY INC.\nSAN FRANCISCO\nUS\nUSD\n42.98\n343.83\n*EXCHANGE RATE: 7.99977",
                "Description": "MIDJOURNEY INC.",
                "Price": 42.98,
                "TotalPrice": 343.83
            },
            {
                "_source": "APPLE.",
                "Description": "APPLE."
            },
            {
                "_source": "14NOV\n13NOV\n23.00",
                "TotalPrice": 23
            },
            {
                "_source": "COM/BILL",
                "Description": "COM/BILL"
            },
            {
                "_source": "15NOV\n*DISCORD",
                "Description": "*DISCORD"
            },
            {
                "_source": "16NOV\n15NOV\n18NOV\n18NOV\n17NOV\nIFTTT PRO (LEGACY)\nUS\nUSD\n1.99\n15.88\n*EXCHANGE RATE:",
                "Description": "IFTTT PRO (LEGACY)",
                "TotalPrice": 15.88
            },
            {
                "_source": "22NOV\n21NOV\nEXTENSIS\n503-274-2020\nUS\nUSD\n86.00\n686.37\n*EXCHANGE RATE: 7.98105\n22NOV",
                "Description": "EXTENSIS",
                "Price": 86,
                "TotalPrice": 686.37
            },
            {
                "_source": "24NOV\n23NOV\nPAYPAL *WAKATIME\n4029357733\nHK\n73.29",
                "Description": "PAYPAL *WAKATIME",
                "TotalPrice": 73.29
            },
            {
                "_source": "28NOV\n26NOV\nPAYPAL *MEDIUM. COM\n4029357733\nUS\n407.19\n26NOV",
                "Description": "PAYPAL *MEDIUM. COM",
                "TotalPrice": 407.19
            },
            {
                "_source": "PAYPAL *HAYU\n35314369001\nGB\n40.00",
                "Description": "PAYPAL",
                "TotalPrice": 40
            }
        ],
        "MerchantAddress": {
            "_source": "PO BOX\nNO. 73730, KOWLOON CENTRAL POST OFFICE HK.",
            "poBox": "PO BOX\nNO. 73730",
            "streetAddress": "PO BOX\nNO. 73730",
            "house": "KOWLOON CENTRAL POST OFFICE HK."
        },
        "MerchantAliases": [
            "HSBC.",
            "The Hongkong and Shanghai Corporation Limited",
            "HSBC\n滙豐"
        ],
        "MerchantName": "香港上海滙豐銀行有限公司",
        "MerchantPhoneNumber": "+88627488288",
        "Total": 253,
        "TaxDetails": [
            {
                "_source": "28NOV"
            }
        ],
        "Tip": 562.66,
        "TransactionDate": "2022-11-28T00:00:00.000Z",
        "__raw__": {
            "content": "HSBC\n滙豐\nThe Hongkong and Shanghai Banking Corporation Limited\n香港上海滙豐銀行有限公司\nSTATEMENT OF BUSINESS CARD ACCOUNT 公司卡戶口結單\nPage\n1/4\nMR LEE SEE MING\nM\nAccount number 戶口號碼\nC/O SML UNIVERSE LIMITED\n00909\n5199 3100 0018 7511\nFLAT F 27/F BLK 10 VISTA PARADISO\nCard type 信用卡類別\nCredit limit 信用限額\n2 HANG MING ST\nPlatinum Business MC\nHKD75,000.00\nNEW TERRITORIES\nStatement date 結單日\nStatement balance 結單結欠/結餘\n28 NOV 2022\nHKD9,551.97\nPost date\nTrans date\nDescription of transaction\nAmount\n(HKD)\n記賬日期\n交易日期\n交易說明\n金額\nPREVIOUS BALANCE\n上月結欠/結餘\n6,253.96\n29OCT\n29OCT\nIFS PAYMENT - THANK YOU\n6,253.96CR\n08NOV\n07NOV\nIFS PAYMENT - THANK YOU\n53,571.65CR\n5199 3100 0018 7511\nSEE-MING LEE\nSML UNIVERSE LTD\n29OCT\n28OCT\nAPPLE. COM/BILL\nITUNES. COM\nIE\n78.00\n31OCT\n29OCT\nAPPLE. COM/BILL\n85221120099\nIE\n78.00\n31OCT\n30OCT\nDATYLON\nANTWERPEN\nBE\nUSD\n19.95\n159.66\n*EXCHANGE RATE: 8.00301\n31OCT\n30OCT\nADOBE CREATIVE CLOUD\nDublin\nIE\n408.00\n31OCT\n29OCT\nAPPLE. COM/BILL\nITUNES. COM\nIE\n238.00\n31OCT\n30OCT\nPAYPAL *TOPAZ LABS\n4029357733\nUS\n1,300.11\n02NOV\n01NOV\nOPEN SOURCE COLLECTIVE\nWALNUT\nUS\nUSD\n5.00\n40.02\n*EXCHANGE RATE: 8.00400\n02NOV\n01NOV\nLINODE . AKAMAI\n6093807100\nUS\nUSD\n4,971.11\n39,785.07\n*EXCHANGE RATE: 8.00326\n02NOV\n01NOV\nCLOUDFLARE\nSAN FRANCISCO\nUS\nUSD\n62.35\n499.00\n*EXCHANGE RATE: 8.00321\n02NOV\n01NOV\nGOOGLE*GSUITE SMLUNIVE\nSINGAPORE\nSG\n56.86\n02NOV\n01NOV\nMAILGUN TECHNOLOGIES,\nSAN ANTONIO\nUS\nUSD\n3.40\n27.21\n*EXCHANGE RATE: 8.00294\n02NOV\n01NOV\nSTACK* ZEROSSL\nWIEN\nAT\nUSD\n10.00\n80.03\n*EXCHANGE RATE: 8.00300\n03NOV\n01NOV\nBLS*REDIS LABS14085242\nLONDON\nGB\nUSD\n248.00\n1,984.80\n*EXCHANGE RATE: 8.00323\n03NOV\n02NOV\nAPPLE. COM/BILL\nITUNES . COM\nIE\n78.00\n03NOV\n02NOV\nBROWSERSTACK. COM\nLEWES\nUS\nUSD\n10.00\n80.03\n*EXCHANGE RATE: 8.00300\nFor important information such as payment methods, fees and charges, lost\nMinimum payment summary 最低付款摘要\ncard reporting, and change of correspondence address / telephone number,\nHKD\nplease visit www.hsbc.com.hk or call our Customer Service Hotline on\nCurrent minimum payment due 目前最低付款額\n96.00\n(852) 2748 8288.\nPlease pay by 須於此付款到期日或之前繳交\n23 DEC 2022\n有關您戶口的重要資料包括付款方式,利息與收費,報失信用卡,以及更改\nOverdue / overlimit due now\n通訊地址/電話號碼,請瀏覽網址www.hsbc.com.hk或聯絡我們的客戶服務熱\n須立即繳交的過期款項/超額款項\n0.00\n線(852) 2748 8288°\nTotal minimum payment due\n最低付款總額\n96.00\nHSBC\n滙豐\nPayment Slip 付款存根\nAccount number 戶口號碼\nCard type 信用卡類別\nIf you are paying by mail, please detach this payment slip and return it with a\n5199 3100 0018 7511\nPlatinum Business MC\ncrossed cheque made payable to \"The Hongkong and Shanghai Banking\nCorporation Limited\" or \"HSBC\" at least three working days before the\nStatement date 結單日\nStatement balance\n結單結欠/結餘\npayment due date to our Centre, PO BOX NO. 73730, KOWLOON CENTRAL\n28 NOV 2022\nHKD9,551.97\nPOST OFFICE HK. Please write your account number on the back of the\nCheque number 支票號碼\nAmount enclosed\n夾附金額\n如欲以郵寄方式付款,請撕下此付款存根,於付款到期日三個工作天前,連同以\ncheque.\n「香港上海滙豐銀行有限公司」或「滙豐」為抬頭的劃線支票,寄回 PO BOX\nNO. 73730, KOWLOON CENTRAL POST OFFICE HK. 信用卡中心收,請於支\n票背面寫上您的戶口號碼。\nThank you for choosing HSBC.多謝選用滙豐服務。\nHSBC\n滙豐\nThe Hongkong and Shanghai Banking Corporation Limited\n香港上海滙豐銀行有限公司\nSTATEMENT OF BUSINESS CARD ACCOUNT 公司卡戶口結單\nPage 2 / 4\nCardholder's name 持卡人姓名\nAccount number 戶口號碼\nStatement date 結單日\nSEE-MING LEE\n5199 3100 0018 7511\n28 NOV 2022\nPost date\nTrans date\nDescription of transaction\nAmount\n( HKD)\n記賬日期\n交易日期\n交易說明\n金額\n03NOV\n02NOV\nNYTimes *NYTimes\n800-698-4637\nUS\nUSD\n12.00\n96.04\n*EXCHANGE RATE: 8.00333\n03NOV\n01NOV\nPAYPAL *PATREON\nMEMBE\n4029357733\nUS\n16.35\n03NOV\n03NOV\nAmazon web services\naws . amazon. co\nUS\nUSD\n302.02\n2,417.17\n*EXCHANGE RATE: 8.00334\n04NOV\n03NOV\nNRI*NEW RELIC\n888-643-8776\nUS\nUSD\n441.00\n3,529.49\n*EXCHANGE RATE: 8.00338\n05NOV\n03NOV\nPAYPAL * juuso914\n4029357733\nHK\n457.81\n05NOV\n03NOV\nAPPLE. COM/HK\nHONG KONG\nHK\n788.00\n05NOV\n04NOV\nHUTCHISON TELECOM 3CC\nHONG KONG\nHK\n1,374.00\n10NOV\n09NOV\nAPPLE. COM/BILL\n85221120099\nIE\n66.00\n10NOV\n09NOV\nPAYPAL *TIDAL HIFI\n35314369001\nSE\n96.00\n10NOV\n09NOV\nPAYPAL *PROTOIO INC\n4029357733\nUS\n1,177.50\n11NOV\n10NOV\nAMZN Mktp US*HB1416JF1\nAmzn. com/bill\nUS\n311.79\n12NOV\n11NOV\nPAYPAL *DAZ 3D\n4029357733\nUS\n367.39\n12NOV\n11NOV\nAPPLE. COM/BILL\nITUNES . COM\nIE\n78.00\n12NOV\n11NOV\nPAYPAL *DAZ 3D\n4029357733\nUS\n113.12\n14NOV\n13NOV\nAMZN Mktp US*HB0MX8N62\nAmzn. com/bill\nUS\n375.69\n14NOV\n12NOV\nPAYPAL *VUE MASTERY\n4029357733\nUS\n204.33\n14NOV\n13NOV\nMIDJOURNEY INC.\nSAN FRANCISCO\nUS\nUSD\n42.98\n343.83\n*EXCHANGE RATE: 7.99977\n14NOV\n13NOV\nAPPLE. COM/BILL\nITUNES . COM\nIE\n23.00\n16NOV\n15NOV\nPAYPAL *DISCORD\n4029357733\nUS\n816.76\n16NOV\n15NOV\nPAYPAL *TWITCHINTER\n4029357733\nUS\n31.99\n18NOV\n17NOV\nAPPLE. COM/BILL\nITUNES . COM\nIE\n28.00\n18NOV\n17NOV\nIFTTT PRO (LEGACY)\nSAN FRANCISCO\nUS\nUSD\n1.99\n15.88\n*EXCHANGE RATE: 7.97990\n21NOV\n18NOV\nPAYPAL *AESCRIPTS\n4029357733\nUS\n815.37\n21NOV\n18NOV\nPAYPAL *ENVATO\n4029357733\nAU\n1,614.88\n21NOV\n19NOV\nPAYPAL *AESCRIPTS\n4029357733\nUS\n562.66\n21NOV\n19NOV\nDELIVEROO\nCENTRAL\nHK\n210.50\n21NOV\n19NOV\nNetflix.com\nLos Gatos\nSG\n78.00\n22NOV\n21NOV\nAPPLE. COM/BILL\nITUNES . COM\nIE\n23.00\n22NOV\n21NOV\nEXTENSIS\n503-274-2020\nUS\nUSD\n86.00\n686.37\n*EXCHANGE RATE: 7.98105\n22NOV\n21NOV\nGOOGLE*CLOUD P3Z46B\nSINGAPORE\nSG\n100.00\n23NOV\n22NOV\nAPPLE. COM/BILL\n85221120099\nIE\n66.00\n23NOV\n21NOV\nPAYPAL *GITHUB INC\n4029357733\nUS\n73.39\n24NOV\n23NOV\nPAYPAL *WAKATIME\n4029357733\nHK\n73.29\n25NOV\n25NOV\nDELIVEROO\nCENTRAL\nHK\n245.00\n26NOV\n25NOV\nAPPLE. COM/BILL\nITUNES . COM\nIE\n146.00\n26NOV\n25NOV\nDELIVEROO\nCENTRAL\nHK\n215.00\n28NOV\n26NOV\nPAYPAL *AESCRIPTS\n4029357733\nUS\n399.04\n28NOV\n26NOV\nPAYPAL *MEDIUM. COM\n4029357733\nUS\n407.19\n28NOV\n26NOV\nPAYPAL *HAYU\n35314369001\nGB\n40.00\n28NOV\n28NOV\nCREDIT REWARD CASH REBATE\n253.00CR\n*For credit card transactions effected in currencies other\nthan Hong Kong dollars, the exchange rate applied includes a\nhandling fee equivalent to 1.95% of each transaction. The\nfee relating to foreign currency transaction is not\napplicable to RMB Business Card.\n就每項以非港元進行的信用卡交易,所用外幣匯率已包括交易金\n額1.95%的手續費。外幣交易有關費用不適用於人民幣公司卡。\nNote: \"CR\" means Credit transaction / balance\n註:「CR」為入賬交易/結餘\n****\nREWARDCASH SUMMARY FOR CARD NUMBER 5199 3100 0018 7511\n**\n**\nREWARDCASH EARNED\n253\n..\nREWARDCASH ADJUSTED\n:\n0\nREWARDCASH REDEEMED\n0\n..\nCONVERTED TO CASH REBATE\n:\n253\nHSBC\n滙豐\nThe Hongkong and Shanghai Banking Corporation Limited\n香港上海滙豐銀行有限公司\nSTATEMENT OF BUSINESS CARD ACCOUNT 公司卡戶口結單\nPage 3 / 4\nCardholder's name 持卡人姓名\nAccount number 戶口號碼\nStatement date 結單日\nSEE-MING LEE\n5199 3100 0018 7511\n28 NOV 2022\nPost date\nTrans date\nDescription of transaction\nAmount\n(HKD)\n記賬日期\n交易日期\n交易說明\n金額\nSTATEMENT BALANCE\n結單結欠/結餘\n9,551.97\nTRANSACTION SUMMARY **\n***\nCREDIT/PAYMENT\n59,825.61CR\n..\nPURCHASES AND INSTALMENTS\n63,376.62\n..\nCREDIT ADJUSTMENT\n253.00CR\n..\nTOTAL ACCOUNT BALANCE\n9,551.97\n..\n**\nFEES AND CHARGES SUMMARY\nFEE/CHARGE TYPE\nAMOUNT\nTOTAL FEES/CHARGES ( EXCLUDING FINANCE CHARGE)\n0.00\n***** FINANCE CHARGE SUMMARY\n**\nBALANCE TYPE\nANNUALISED PERCENTAGE RATE (APR)\nFINANCE CHARGE\nCASH ADVANCE\n35.61%\n0.00\nPURCHASE\n34.46%\n0.00\nTOTAL FINANCE CHARGE\n0.00\n***\n******\n*INFORMATION REGARDING MAKING MINIMUM PAYMENT*\nThe below examples are for illustration only. You may visit our Bank\nwebsite at www.hsbc. com.hk for an online credit card repayment\ncalculator for customized information.\nIf you make no additional\nYou will pay off the\n|and you will end up\ncharges, purchases and\noutstanding balance*\ncash advances on this card\nof HKD20, 000 in\npaying an estimated\ntotal of ...\nand each month you pay. ..\nabout . . .\n|\n|\n|\nOnly Minimum Payment Due\n|\n26 years **\n|\nHKD67,536 ***\n|\n|\nHKD849\n|\n3 years **\n|\nHKD30,565 ***\n|\n(Savings=HKD36, 971)\n* The outstanding balance of HKD20, 000 is accrued from purchase only.\n** Assume repayment is made on or before the payment due date of each\nstatement month.\n*** Include the outstanding balance of HKD20, 000 and the total finance\ncharge which is accrued daily and calculated at an interest rate of\n2.5% per month (equivalent to an annualised percentage rate of 34.46%\non purchase and 35.61% on cash advance) on the outstanding balance\nuntil it is fully paid.\nThe statement is for your reference only.\nPayment to be\narranged by your corporation.\nThe RewardCash earned by the company have been\ntransferred to your Business Card account.\nIf the statement balance for your credit card account\nHSBC\n滙豐\nThe Hongkong and Shanghai Banking Corporation Limited\n香港上海滙豐銀行有限公司\nSTATEMENT OF BUSINESS CARD ACCOUNT 公司卡戶口結單\nPage 4 /4\nCardholder's name 持卡人姓名\nAccount number 戶口號碼\nStatement date 結單日\nSEE-MING LEE\n5199 3100 0018 7511\n28 NOV 2022\nPost date\nTrans date\nDescription of transaction\nAmount\n( HKD)\n記賬日期\n交易日期\n交易說明\n金額\nexceeds the credit limit on the statement date, an overlimit\nhandling fee will be debited to the account. If you wish to\nopt out of the over-the-limit facility, you may fill out\nthe form on the back of the statement. For enquiries,\nplease contact us on 2748 8288.\n若您的結單結欠超出該信用卡戶口截至結單日的信用限額,\n本行會徵收超出信用限額手續費。如您欲拒絕接受超出信用限額\n信貸安排,請填妥結單背頁之表格作出指示。如有任何\n查詢,請致電2748 8288。",
            "paragraphs": []
        },
        "created_at": "2024-01-12T21:40:59.581Z"
    },
    {
        "doc1_Items": [
            {
                "_source": "31JAN\n30JAN\nDATYLON\nANTWERPEN\nBE\nUSD\n19.95\n159.41\n*EXCHANGE RATE: 7.99048",
                "Description": "DATYLON",
                "Price": 19.95,
                "TotalPrice": 159.41
            },
            {
                "_source": "01FEB\n31JAN\nPAYPAL *TOPAZ LABS\n4029357733\nUS\n804.14",
                "Description": "PAYPAL *TOPAZ LABS",
                "TotalPrice": 804.14
            },
            {
                "_source": "02FEB\n01FEB\nOPEN SOURCE COLLECTIVE\nCOVINA\nUS\nUSD\n5.00\n39.96\n*EXCHANGE RATE: 7.99200",
                "Description": "OPEN SOURCE COLLECTIVE\nCOVINA",
                "Price": 5,
                "TotalPrice": 39.96
            },
            {
                "_source": "02FEB\n01FEB\nBLS*REDIS LABS14085242\nLONDON\nGB\nUSD\n127.00\n1,015.09\n*EXCHANGE RATE: 7.99283",
                "Description": "BLS*REDIS LABS14085242\nLONDON",
                "Price": 127,
                "TotalPrice": 1015.09
            },
            {
                "_source": "01FEB\nGOOGLE*GSUITE SMLUNIVE\n70.50",
                "Description": "GOOGLE*GSUITE SMLUNIVE",
                "TotalPrice": 70.5
            },
            {
                "_source": "02FEB\n01FEB\nZEROSSL* ZEROSSL\nVIENNA\nAT\nUSD\n10.00\n79.97",
                "Description": "ZEROSSL* ZEROSSL",
                "TotalPrice": 79.97
            },
            {
                "_source": "02FEB\n01FEB\nLINODE . AKAMAI\n6093807100\nUS\nUSD\n4,724.99\n37,765.92\n*EXCHANGE RATE: 7.99280",
                "Description": "LINODE . AKAMAI",
                "Price": 4724.99,
                "TotalPrice": 37765.92
            },
            {
                "_source": "02FEB\n01FEB\nMAILGUN TECHNOLOGIES,\nSAN ANTONIO\nUS\nUSD\n4.10\n32.79\n*EXCHANGE RATE: 7.99756",
                "Description": "MAILGUN TECHNOLOGIES,\nSAN ANTONIO",
                "Price": 4.1,
                "TotalPrice": 32.79
            },
            {
                "_source": "03FEB\n02FEB\nBROWSERSTACK. COM\nLEWES\nUS\nUSD\n10.00\n79.97\n* EXCHANGE RATE: 7.99700",
                "Description": "BROWSERSTACK. COM",
                "Price": 10,
                "TotalPrice": 79.97
            },
            {
                "_source": "03FEB\n03FEB\nAmazon web services\naws\namazon. co\nUS\nUSD\n146.95\n1,175.32\n*EXCHANGE RATE: 7.99809",
                "Description": "Amazon web services\naws amazon. co",
                "Price": 146.95,
                "TotalPrice": 1175.32
            },
            {
                "_source": "03FEB\n02FEB\nNRI*NEW RELIC\n888-643-8776\nUS\nUSD\n313.50\n2,506.90\n*EXCHANGE RATE: 7.99649\n04FEB\n02FEB\nAPPLE. COM/HK\nHONG KONG\nHK\n52,798.00",
                "Description": "NRI*NEW RELIC\nAPPLE. COM/HK",
                "Price": 313.5,
                "TotalPrice": 2506.9
            },
            {
                "_source": "04FEB\n03FEB\nFoodpanda Hong Kong\nHong Kong\nHK\n337.00",
                "Description": "Foodpanda",
                "TotalPrice": 337
            }
        ],
        "doc1_MerchantAddress": {
            "_source": "PO BOX\nNO. 73730, KOWLOON CENTRAL POST OFFICE HK.",
            "poBox": "PO BOX\nNO. 73730",
            "streetAddress": "PO BOX\nNO. 73730",
            "house": "KOWLOON CENTRAL POST OFFICE HK."
        },
        "doc1_MerchantName": "香港上海滙豐銀行有限公司",
        "doc1_MerchantPhoneNumber": "+8185227488288",
        "doc1_TransactionDate": "2023",
        "doc2_Currency": "USD",
        "doc2_Items": [
            {
                "_source": "06FEB\n04FEB\nPAYPAL *SUBLIMEHQPT\n4029357733\nAU\n653.99",
                "Category": "Credit",
                "Date": "06FEB",
                "Description": "PAYPAL *SUBLIMEHQPT",
                "TotalPrice": 653.99
            },
            {
                "_source": "06FEB\n04FEB\nHUTCHISON TELECOM 3CC\nHONG KONG\nHK\n197.00",
                "Category": "Other",
                "Date": "2004-02-06T00:00:00.000Z",
                "Description": "HUTCHISON TELECOM 3CC",
                "TotalPrice": 197
            },
            {
                "_source": "06FEB\n05FEB\nDNH*GODADDY. COM HKD\n480-5058855\nUS\n480.78",
                "Category": "Room",
                "Date": "2005-02-06T00:00:00.000Z",
                "Description": "DNH*GODADDY. COM HKD",
                "TotalPrice": 480.78
            },
            {
                "_source": "07FEB\n06FEB\nAPPLE. COM/BILL\nITUNES . COM\nIE\n38.00",
                "Date": "2006-02-07T00:00:00.000Z",
                "Description": "APPLE. COM/BILL",
                "TotalPrice": 38
            },
            {
                "_source": "07FEB\n06FEB\nPAYPAL *FASTSPRING SUR\n4029357733\nUS\n129.96",
                "Category": "Credit",
                "Date": "2006-02-07T00:00:00.000Z",
                "Description": "PAYPAL *FASTSPRING SUR",
                "TotalPrice": 129.96
            },
            {
                "_source": "08FEB\n06FEB\nDNH*GODADDY. COM HKD\n4805058855\nUS\n627.32",
                "Date": "2006-02-08T00:00:00.000Z",
                "Description": "DNH*GODADDY. COM HKD",
                "TotalPrice": 627.32
            },
            {
                "_source": "09FEB\n08FEB\nDNH*GODADDY. COM HKD\n480-505-8855\nUS\n473.43",
                "Date": "09FEB",
                "Description": "DNH*GODADDY. COM",
                "TotalPrice": 473.43
            },
            {
                "_source": "09FEB\n08FEB\nDROPBOX*PSZ93VJ41L4R\nD02FD79\nIE\nUSD\n258.88\n2,071.63\n*EXCHANGE RATE: 8.00228",
                "Category": "Credit",
                "Date": "09FEB",
                "Description": "DROPBOX*PSZ93VJ41L4R"
            },
            {
                "_source": "11FEB\n10FEB\nAPPLE. COM/BILL\nITUNES . COM\nIE\n8.00",
                "Category": "Other",
                "Date": "11FEB",
                "Description": "APPLE. COM/BILL",
                "TotalPrice": 8
            },
            {
                "_source": "13FEB\n11FEB\nAPPLE. COM/BILL\nITUNES . COM\nIE\n78.00",
                "Category": "Other",
                "Date": "13FEB",
                "Description": "APPLE. COM/BILL",
                "TotalPrice": 78
            },
            {
                "_source": "13FEB\n11FEB\n7-Eleven, HK (0824)\nMA ON SHAN\nHK\n2,622.00",
                "Category": "Credit",
                "Date": "13FEB",
                "Description": "7-Eleven, HK (0824)\nMA ON",
                "TotalPrice": 2622
            },
            {
                "_source": "13FEB\n10FEB\nDNH*GODADDY. COM HKD\n4805058855\nUS\n473.43",
                "Category": "Credit",
                "Date": "13FEB",
                "Description": "DNH*GODADDY. COM",
                "TotalPrice": 473.43
            },
            {
                "_source": "13FEB\n12FEB\nDropbox Cashback\nRebate\nUS\nUSD\n40.00\n320.09CR\n*EXCHANGE RATE: 8.00225",
                "Category": "Credit",
                "Date": "2012-02-13T00:00:00.000Z",
                "Description": "Dropbox Cashback",
                "TotalPrice": 320.09
            },
            {
                "_source": "14FEB\n13FEB\nMIDJOURNEY INC.\nSOUTH SAN FRA\nUS\nUSD\n30.00\n240.10\n* EXCHANGE RATE: 8.00333",
                "Category": "Credit",
                "Date": "2013-02-14T00:00:00.000Z",
                "Description": "MIDJOURNEY INC.",
                "TotalPrice": 240.1
            },
            {
                "_source": "17FEB\n14FEB\nPAYPAL *PADDLE.NET\n35314369001\nGB\n779.00",
                "Category": "Credit",
                "Date": "17FEB",
                "Description": "PAYPAL *PADDLE.NET",
                "TotalPrice": 779
            },
            {
                "_source": "18FEB\n17FEB\nIFTTT PRO (LEGACY)\nSAN FRANCISCO\nUS\nUSD\n1.99\n15.92\n*EXCHANGE RATE: 8.00000",
                "Date": "2017-02-18T00:00:00.000Z",
                "Description": "IFTTT PRO (LEGACY)",
                "TotalPrice": 15.92
            },
            {
                "_source": "20FEB\n17FEB\nHKTV MALL\nHONG KONG\nHK\n1,588.00",
                "Date": "20FEB",
                "Description": "HKTV MALL",
                "TotalPrice": 1588
            },
            {
                "_source": "20FEB\n19FEB\nNetflix.com\nLos Gatos\nSG\n93.00",
                "Category": "Tax",
                "Date": "20FEB",
                "Description": "Netflix.com",
                "TotalPrice": 93
            },
            {
                "_source": "20FEB\n19FEB\nHKTVMALL\nHONG KONG\nHK\n805.30",
                "Date": "20FEB",
                "Description": "HKTVMALL"
            },
            {
                "_source": "22FEB\n21FEB\nFLICKR. COM\nMOUNTAIN VIEW\nUS\nUSD\n79.99\n639.81\n*EXCHANGE RATE: 7.99862",
                "Category": "Credit",
                "Date": "22FEB",
                "Description": "FLICKR. COM",
                "TotalPrice": 639.81
            },
            {
                "_source": "23FEB\n22FEB\nNYTimes*NYTimes\n800-698-4637\nUS\nUSD\n12.00\n96.01\n*EXCHANGE RATE: 8.00083",
                "Category": "Credit",
                "Description": "NYTimes*NYTimes",
                "TotalPrice": 96.01
            },
            {
                "_source": "25FEB\n25FEB\nCREDIT REWARD CASH REBATE\n437.00CR",
                "Category": "Credit",
                "Date": "25FEB",
                "Description": "CREDIT REWARD CASH REBATE",
                "TotalPrice": 437
            }
        ],
        "doc2_MerchantAliases": [
            "The Hongkong and Shanghai Banking Corporation Limited",
            "HSBC\n滙豐"
        ],
        "doc2_MerchantName": "香港上海滙豐銀行有限公司",
        "doc3_Items": [
            {
                "_source": "PURCHASE\n34.46%\n0.00",
                "Description": "PURCHASE",
                "TotalPrice": "0.00"
            }
        ],
        "doc3_MerchantName": "香港上海滙豐銀行有限公司",
        "doc3_MerchantPhoneNumber": "+88627488288",
        "doc3_TransactionDate": "2023-02-25T00:00:00.000Z",
        "__raw__": {
            "content": "HSBC\n滙豐\nThe Hongkong and Shanghai Banking Corporation Limited\n香港上海滙豐銀行有限公司\nSTATEMENT OF BUSINESS CARD ACCOUNT 公司卡戶口結單\nPage\n1/3\nMR LEE SEE MING\nM\nAccount number 戶口號碼\nC/O SML UNIVERSE LIMITED\n01552\n5199 3100 0018 7511\nFLAT F 27/F BLK 10 VISTA PARADISO\nCard type 信用卡類別\nCredit limit 信用限額\n2 HANG MING ST\nPlatinum Business MC\nHKD150,000.00\nNEW TERRITORIES\nStatement date 結單日\nStatement balance 結單結欠/結餘\n25 FEB 2023\nHKD11, 353.59\nPost date\nTrans date\nDescription of transaction\nAmount\n( HKD)\n記賬日期\n交易日期\n交易說明\n金額\nPREVIOUS BALANCE\n上月結欠/結餘\n3,049.22\n04FEB\n04FEB\nIFS PAYMENT - THANK YOU\n47,187.19CR\n06FEB\n05FEB\nIFS PAYMENT - THANK YOU\n53,135.00CR\n5199 3100 0018 7511\nSEE-MING LEE\nSML UNIVERSE LTD\n31JAN\n30JAN\nADOBE CREATIVE CLOUD\nDublin\nIE\n408.00\n31JAN\n30JAN\nDATYLON\nANTWERPEN\nBE\nUSD\n19.95\n159.41\n*EXCHANGE RATE: 7.99048\n01FEB\n31JAN\nPAYPAL *TOPAZ LABS\n4029357733\nUS\n804.14\n02FEB\n01FEB\nOPEN SOURCE COLLECTIVE\nCOVINA\nUS\nUSD\n5.00\n39.96\n*EXCHANGE RATE: 7.99200\n02FEB\n01FEB\nBLS*REDIS LABS14085242\nLONDON\nGB\nUSD\n127.00\n1,015.09\n*EXCHANGE RATE: 7.99283\n02FEB\n01FEB\nGOOGLE*GSUITE SMLUNIVE\nSingapore\nSG\n70.50\n02FEB\n01FEB\nZEROSSL* ZEROSSL\nVIENNA\nAT\nUSD\n10.00\n79.97\n*EXCHANGE RATE: 7.99700\n02FEB\n01FEB\nLINODE . AKAMAI\n6093807100\nUS\nUSD\n4,724.99\n37,765.92\n*EXCHANGE RATE: 7.99280\n02FEB\n01FEB\nMAILGUN TECHNOLOGIES,\nSAN ANTONIO\nUS\nUSD\n4.10\n32.79\n*EXCHANGE RATE: 7.99756\n03FEB\n02FEB\nBROWSERSTACK. COM\nLEWES\nUS\nUSD\n10.00\n79.97\n* EXCHANGE RATE: 7.99700\n03FEB\n03FEB\nAmazon web services\naws . amazon. co\nUS\nUSD\n146.95\n1,175.32\n*EXCHANGE RATE: 7.99809\n03FEB\n02FEB\nNRI*NEW RELIC\n888-643-8776\nUS\nUSD\n313.50\n2,506.90\n*EXCHANGE RATE: 7.99649\n04FEB\n02FEB\nAPPLE. COM/HK\nHONG KONG\nHK\n52,798.00\n04FEB\n03FEB\nFoodpanda Hong Kong\nHong Kong\nHK\n337.00\nFor important information such as payment methods, fees and charges, lost\nMinimum payment summary 最低付款摘要\ncard reporting, and change of correspondence address / telephone number,\nHKD\nplease visit www.hsbc.com.hk or call our Customer Service Hotline on\nCurrent minimum payment due 目前最低付款額\n114.00\n(852) 2748 8288.\nPlease pay by 須於此付款到期日或之前繳交\n27 MAR 2023\n有關您戶口的重要資料包括付款方式,利息與收費,報失信用卡,以及更改\nOverdue / overlimit due now\n通訊地址/電話號碼,請瀏覽網址www.hsbc.com.hk或聯絡我們的客戶服務熱\n須立即繳交的過期款項/超額款項\n0.00\n線(852) 2748 8288°\nTotal minimum payment due\n最低付款總額\n114.00\nHSBC\n滙豐\nPayment Slip 付款存根\nAccount number 戶口號碼\nCard type 信用卡類別\nIf you are paying by mail, please detach this payment slip and return it with a\n5199 3100 0018 7511\nPlatinum Business MC\ncrossed cheque made payable to \"The Hongkong and Shanghai Banking\nCorporation Limited\" or \"HSBC\" at least three working days before the\nStatement date 結單日\nStatement balance 結單結欠/結餘\npayment due date to our Centre, PO BOX NO. 73730, KOWLOON CENTRAL\n25 FEB 2023\nHKD11, 353.59\nPOST OFFICE HK. Please write your account number on the back of the\nCheque number 支票號碼\nAmount enclosed\n夾附金額\n如欲以郵寄方式付款,請撕下此付款存根,於付款到期日三個工作天前,連同以\ncheque.\n「香港上海滙豐銀行有限公司」或「滙豐」為抬頭的劃線支票,寄回 PO BOX\nNO. 73730, KOWLOON CENTRAL POST OFFICE HK. 信用卡中心收,請於支\n票背面寫上您的戶口號碼。\nThank you for choosing HSBC.多謝選用滙豐服務。\nHSBC\n滙豐\nThe Hongkong and Shanghai Banking Corporation Limited\n香港上海滙豐銀行有限公司\nSTATEMENT OF BUSINESS CARD ACCOUNT 公司卡戶口結單\nPage\n2/3\nCardholder's name 持卡人姓名\nAccount number 戶口號碼\nStatement date 結單日\nSEE-MING LEE\n5199 3100 0018 7511\n25 FEB 2023\nPost date\nTrans date\nDescription of transaction\nAmount\n(HKD)\n記賬日期\n交易日期\n交易說明\n金額\n06FEB\n04FEB\nPAYPAL *SUBLIMEHQPT\n4029357733\nAU\n653.99\n06FEB\n04FEB\nHUTCHISON TELECOM 3CC\nHONG KONG\nHK\n197.00\n06FEB\n05FEB\nDNH*GODADDY. COM HKD\n480-5058855\nUS\n480.78\n07FEB\n06FEB\nAPPLE. COM/BILL\nITUNES . COM\nIE\n38.00\n07FEB\n06FEB\nPAYPAL *FASTSPRING SUR\n4029357733\nUS\n129.96\n08FEB\n06FEB\nDNH*GODADDY. COM HKD\n4805058855\nUS\n627.32\n09FEB\n08FEB\nDNH*GODADDY. COM HKD\n480-505-8855\nUS\n473.43\n09FEB\n08FEB\nDROPBOX*PSZ93VJ41L4R\nD02FD79\nIE\nUSD\n258.88\n2,071.63\n*EXCHANGE RATE: 8.00228\n11FEB\n10FEB\nAPPLE. COM/BILL\nITUNES . COM\nIE\n8.00\n13FEB\n11FEB\nAPPLE. COM/BILL\nITUNES . COM\nIE\n78.00\n13FEB\n11FEB\n7-Eleven, HK (0824)\nMA ON SHAN\nHK\n2,622.00\n13FEB\n10FEB\nDNH*GODADDY. COM HKD\n4805058855\nUS\n473.43\n13FEB\n12FEB\nDropbox Cashback\nRebate\nUS\nUSD\n40.00\n320.09CR\n*EXCHANGE RATE: 8.00225\n14FEB\n13FEB\nMIDJOURNEY INC.\nSOUTH SAN FRA\nUS\nUSD\n30.00\n240.10\n* EXCHANGE RATE: 8.00333\n17FEB\n14FEB\nPAYPAL *PADDLE.NET\n35314369001\nGB\n779.00\n18FEB\n17FEB\nIFTTT PRO (LEGACY)\nSAN FRANCISCO\nUS\nUSD\n1.99\n15.92\n*EXCHANGE RATE: 8.00000\n20FEB\n17FEB\nHKTV MALL\nHONG KONG\nHK\n1,588.00\n20FEB\n19FEB\nNetflix.com\nLos Gatos\nSG\n93.00\n20FEB\n19FEB\nHKTVMALL\nHONG KONG\nHK\n805.30\n22FEB\n21FEB\nFLICKR. COM\nMOUNTAIN VIEW\nUS\nUSD\n79.99\n639.81\n*EXCHANGE RATE: 7.99862\n23FEB\n22FEB\nNYTimes*NYTimes\n800-698-4637\nUS\nUSD\n12.00\n96.01\n*EXCHANGE RATE: 8.00083\n25FEB\n25FEB\nCREDIT REWARD CASH REBATE\n437.00CR\n*For credit card transactions effected in currencies other\nthan Hong Kong dollars, the exchange rate applied includes a\nhandling fee equivalent to 1.95% of each transaction. The\nfee relating to foreign currency transaction is not\napplicable to RMB Business Card.\n就每項以非港元進行的信用卡交易,所用外幣匯率已包括交易金\n額1.95%的手續費。外幣交易有關費用不適用於人民幣公司卡。\nNote: \"CR\" means Credit transaction / balance\n註:「CR」為入賬交易/結餘\n**** REWARDCASH SUMMARY FOR CARD NUMBER 5199 3100 0018 7511\nREWARDCASH EARNED\n437\n..\nREWARDCASH ADJUSTED\n0\n..\nREWARDCASH REDEEMED\n0\n..\nCONVERTED TO CASH REBATE\n437\n..\nSTATEMENT BALANCE\n結單結欠/結餘\n11,353.59\n***\n* TRANSACTION SUMMARY\n***\n**\nCREDIT/PAYMENT\n100,642.28CR\n..\nPURCHASES AND INSTALMENTS\n:\n109,383.65\nCREDIT ADJUSTMENT\n:\n437.00CR\nTOTAL ACCOUNT BALANCE\n:\n11,353.59\nFEES AND CHARGES SUMMARY\nFEE/CHARGE TYPE\nAMOUNT\nTOTAL FEES/CHARGES ( EXCLUDING FINANCE CHARGE)\n0.00\n** FINANCE CHARGE SUMMARY\nBALANCE TYPE\nANNUALISED PERCENTAGE RATE (APR)\nFINANCE CHARGE\nCASH ADVANCE\n35.61%\n0.00\nHSBC\n滙豐\nThe Hongkong and Shanghai Banking Corporation Limited\n香港上海滙豐銀行有限公司\nSTATEMENT OF BUSINESS CARD ACCOUNT 公司卡戶口結單\nPage\n3/3\nCardholder's name 持卡人姓名\nAccount number 戶口號碼\nStatement date 結單日\nSEE-MING LEE\n5199 3100 0018 7511\n25 FEB 2023\nPost date\nTrans date\nDescription of transaction\nAmount\n( HKD)\n記賬日期\n交易日期\n交易說明\n金額\nPURCHASE\n34.46%\n0.00\nTOTAL FINANCE CHARGE\n0.00\n**\n*INFORMATION REGARDING MAKING MINIMUM PAYMENT\nThe below examples are for illustration only. You may visit our Bank\nwebsite at www.hsbc. com.hk for an online credit card repayment\ncalculator for customized information.\nIf you make no additional\nYou will pay off the\nand you will end up\ncharges, purchases and\noutstanding balance*\ncash advances on this card\nof HKD20,000 in\npaying an estimated\nand each month you pay. ..\n|total of ...\nabout ...\n|\nOnly Minimum Payment Due\n|\n|\n|\n26 years **\n|\nHKD67,536 ***\n|\n|\nHKD849\n|\n3 years **\n|\nHKD30,565 ***\n|\n( Savings=HKD36, 971 )\n* The outstanding balance of HKD20, 000 is accrued from purchase only.\n** Assume repayment is made on or before the payment due date of each\nstatement month.\n*** Include the outstanding balance of HKD20, 000 and the total finance\ncharge which is accrued daily and calculated at an interest rate of\n2.5% per month (equivalent to an annualised percentage rate of 34.46%\non purchase and 35.61% on cash advance) on the outstanding balance\nuntil it is fully paid.\nThe statement is for your reference only.\nPayment to be\narranged by your corporation.\nPlease note that your credit limit has been revised to\nHKD 150,000.00.\nThe RewardCash earned by the company have been\ntransferred to your Business Card account.\nIf the statement balance for your credit card account\nexceeds the credit limit on the statement date, an overlimit\nhandling fee will be debited to the account. If you wish to\nopt out of the over-the-limit facility, you may fill out\nthe form on the back of the statement. For enquiries,\nplease contact us on 2748 8288.\n若您的結單結欠超出該信用卡戶口截至結單日的信用限額,\n本行會徵收超出信用限額手續費。如您欲拒絕接受超出信用限額\n信貸安排,請填妥結單背頁之表格作出指示。如有任何\n查詢,請致電2748 8288。\nUpdate of Airport Lounge Access Benefit\nStarting 1 Apr 2023, complimentary access to Plaza Premium\nLounge for cardholders of HSBC Business and Corporate cards\nwill be subject to a maximum of 4 visits per calendar year.\nVisit hsbc. com.hk for details.\n有關機場貴賓室服務之更改\n由2023年4月1日起,匯豐公司卡及商務卡提供之\n免費環亞機場貴賓室服務將限於每曆年最多享用4次。\n有關詳情,請瀏覽hsbc.com.hk。",
            "paragraphs": []
        },
        "created_at": "2024-01-12T21:40:59.606Z"
    },
    {
        "doc1_Currency": "JPY",
        "doc1_Items": [
            {
                "_source": "29MAY\n26MAY\nPAYPAL *AESCRIPTS\n4029357733",
                "Date": "1926-05-29T00:00:00.000Z",
                "Description": "PAYPAL *AESCRIPTS"
            },
            {
                "_source": "30MAY\n29MAY\nMIDJOURNEY INC.\nSOUTH SAN FRA\nUS\nUSD\n20.00\n159.78\n*EXCHANGE RATE: 7.98900",
                "Date": "1929-05-30T00:00:00.000Z",
                "Description": "MIDJOURNEY INC.",
                "TotalPrice": 159.78
            },
            {
                "_source": "31MAY\n30MAY\nADOBE CREATIVE CLOUD\nDublin\nIE\n408.00",
                "Category": "Meals",
                "Date": "31MAY",
                "Description": "ADOBE CREATIVE CLOUD\nDublin",
                "TotalPrice": 408
            },
            {
                "_source": "31MAY\n30MAY\nMISTERHORSE . COM\nBRATISLAVA\nSK\nUSD\n19.90\n158.97\n*EXCHANGE RATE: 7.98844",
                "Category": "Credit",
                "Date": "31MAY",
                "Description": "MISTERHORSE . COM",
                "TotalPrice": 158.97
            },
            {
                "_source": "31MAY\n30MAY\nDATYLON\nANTWERPEN\nBE\nUSD\n19.95\n159.36\n*EXCHANGE RATE: 7.98797",
                "Date": "31MAY",
                "Description": "DATYLON",
                "TotalPrice": 159.36
            },
            {
                "_source": "31MAY\n29MAY\nPAYPAL *iopzxz\n4029357733\nHK\n294.65",
                "Date": "1929-05-31T00:00:00.000Z",
                "Description": "PAYPAL *iopzxz",
                "TotalPrice": 294.65
            },
            {
                "_source": "31MAY\n31MAY\nFoodpandaHK Pandapro\nSHEUNG WAN\nHK\n89.00",
                "Date": "1931-05-31T00:00:00.000Z",
                "Description": "FoodpandaHK Pandapro",
                "TotalPrice": 89
            },
            {
                "_source": "31MAY\n30MAY\nFINNAIR 1054050001938\nVANTAA\nFI\n833.00",
                "Date": "1930-05-31T00:00:00.000Z",
                "Description": "FINNAIR",
                "TotalPrice": 833
            },
            {
                "_source": "01JUN\n31MAY\nMIDJOURNEY INC.\nSOUTH SAN FRA\nUS\nUSD\n60.00\n479.29\n*EXCHANGE RATE: 7.98817",
                "Category": "Other",
                "Date": "01JUN",
                "Description": "31MAY\nMIDJOURNEY INC.",
                "TotalPrice": 479.29
            },
            {
                "_source": "01JUN\n31MAY\nPAYPAL *AESCRIPTS\n4029357733\nUS\n734.43",
                "Category": "Meals",
                "Date": "1931-06-01T00:00:00.000Z",
                "Description": "PAYPAL *AESCRIPTS",
                "TotalPrice": 734.43
            },
            {
                "_source": "02JUN\n01JUN\nPAYPAL *PATREON\nMEMBE\n4029357733\nUS\n16.33",
                "Category": "Meals",
                "Date": "2002-06-01T00:00:00.000Z",
                "Description": "PAYPAL *PATREON\nMEMBE",
                "TotalPrice": 16.33
            },
            {
                "_source": "02JUN\n01JUN\nGOOGLE*GSUITE SMLUNIVE\nCC GOOGLE. COM\nSG\n70.50",
                "Category": "Meals",
                "Date": "2002-06-01T00:00:00.000Z",
                "Description": "GOOGLE*GSUITE SMLUNIVE\nCC GOOGLE. COM",
                "TotalPrice": 70.5
            },
            {
                "_source": "02JUN\n01JUN\nLINODE . AKAMAI\n6093807100\nUS\nUSD\n5,482.67\n43,811.89\n*EXCHANGE RATE: 7.99098",
                "Category": "Meals",
                "Date": "02JUN",
                "Description": "LINODE AKAMAI"
            },
            {
                "_source": "02JUN\n01JUN\nAPPLE. COM/BILL\nITUNES. COM\nIE\n38.00",
                "Category": "Credit",
                "Date": "02JUN",
                "Description": "APPLE. COM/BILL",
                "TotalPrice": 38
            },
            {
                "_source": "02JUN\n01JUN\nSEMATEXT GROUP\nBROOKLYN\nUS\nUSD\n5.17\n41.31\n*EXCHANGE RATE: 7.99033",
                "Date": "02JUN",
                "Description": "SEMATEXT GROUP",
                "TotalPrice": 41.31
            },
            {
                "_source": "02JUN\n01JUN\nOPEN SOURCE COLLECTIVE\nCOVINA\nUS\nUSD\n10.00\n79.91\n*EXCHANGE RATE: 7.99100",
                "Date": "02JUN",
                "Description": "OPEN SOURCE COLLECTIVE",
                "TotalPrice": 79.91
            }
        ],
        "doc1_MerchantAddress": {
            "_source": "PO BOX\nNO. 73730, KOWLOON CENTRAL POST OFFICE HK.",
            "poBox": "PO BOX\nNO. 73730",
            "streetAddress": "PO BOX\nNO. 73730",
            "house": "KOWLOON CENTRAL POST OFFICE HK."
        },
        "doc1_MerchantAliases": [
            "HSBC.",
            "滙豐",
            "The Hongkong and Shanghai Limited",
            "海滙銀行",
            "HSBC\n滙豐"
        ],
        "doc1_MerchantName": "香港上海滙豐銀行有限公司",
        "doc1_MerchantPhoneNumber": "+8185227488288",
        "doc2_Currency": "USD",
        "doc2_Items": [
            {
                "_source": "02JUN\n01JUN\nMAILGUN TECHNOLOGIES,\nSAN ANTONIO\nUS\nUSD\n3.34\n26.68\n*EXCHANGE RATE: 7.98802",
                "Category": "Credit",
                "Date": "02JUN",
                "Description": "MAILGUN TECHNOLOGIES,\nSAN ANTONIO",
                "TotalPrice": 26.68
            },
            {
                "_source": "03JUN\n02JUN\nAmazon web services\naws . amazon . co\nUS\nUSD\n212.98\n1,701.06\n*EXCHANGE RATE: 7.98695",
                "Category": "Credit",
                "Date": "2002-06-03T00:00:00.000Z",
                "Description": "Amazon web services\naws . amazon co"
            },
            {
                "_source": "03JUN\n02JUN\nBROWSERSTACK. COM\nLEWES\nUS\nUSD\n10.00\n79.87\n*EXCHANGE RATE: 7.98700",
                "Category": "Meals",
                "Date": "03JUN",
                "Description": "BROWSERSTACK. COM",
                "TotalPrice": 79.87
            },
            {
                "_source": "03JUN\n01JUN\nZEROSSL* ZEROSSL\nVIENNA\nAT\nUSD\n10.00\n79.87\n*EXCHANGE RATE: 7.98700",
                "Category": "Meals",
                "Date": "03JUN",
                "Description": "ZEROSSL* ZEROSSL",
                "TotalPrice": 79.87
            },
            {
                "_source": "03JUN\n02JUN\nFINNAIR 1054050025664\nVANTAA\nFI\n209.00",
                "Category": "Meals",
                "Date": "03JUN",
                "Description": "FINNAIR",
                "TotalPrice": 209
            },
            {
                "_source": "05JUN\n04JUN\nK-market Jatkasaari\nHELSINKI\nFI\nEUR\n12.34\n106.29\n* EXCHANGE RATE: 8.61345",
                "Category": "Meals",
                "Date": "05JUN",
                "Description": "K-market Jatkasaari",
                "TotalPrice": 106.29
            },
            {
                "_source": "05JUN\n03JUN\nFINNAIR - INFLI\nVANTAA\nFI\nEUR\n6.00\n51.68\n* EXCHANGE RATE: 8.61333",
                "Category": "Meals",
                "Date": "05JUN",
                "Description": "FINNAIR INFLI"
            },
            {
                "_source": "05JUN\n04JUN\nK-market Jatkasaari\nHELSINKI\nFI\nEUR\n36.84\n317.33\n*EXCHANGE RATE: 8.61374",
                "Category": "Meals",
                "Date": "05JUN",
                "Description": "K-market Jatkasaari"
            },
            {
                "_source": "05JUN\n03JUN\nFINNAIR 1054050024485\nVANTAA\nFI",
                "Category": "Meals",
                "Description": "FINNAIR"
            },
            {
                "_source": "05JUN\n04JUN\nAPPLE. COM/BILL\nITUNES . COM\nIE\n32.00",
                "Description": "APPLE. COM/BILL",
                "TotalPrice": 32
            },
            {
                "_source": "05JUN\n04JUN\nALEPA HKI-VANTAA LENTO\nVANTAA\nFI\nEUR\n10.95\n94.32\n*EXCHANGE RATE: 8.61370",
                "Date": "05JUN",
                "Description": "ALEPA HKI-VANTAA"
            },
            {
                "_source": "05JUN\n03JUN\nNRI*NEW RELIC\n888-643-8776\nUS\nUSD\n269.70\n2,155.14\n* EXCHANGE RATE: 7.99088",
                "Date": "2003-06-05T00:00:00.000Z",
                "Description": "NRI*NEW RELIC"
            },
            {
                "_source": "05JUN\n04JUN\nBBMSL*GO TRAVEL\nHong Kong\nHK\n108.00",
                "Category": "Credit",
                "Date": "05JUN",
                "Description": "BBMSL*GO TRAVEL",
                "TotalPrice": 108
            },
            {
                "_source": "05JUN\n04JUN\nHUTCHISON TELECOM 3CC\nHONG KONG\nHK\n197.00",
                "Date": "05JUN",
                "Description": "HUTCHISON TELECOM 3CC",
                "TotalPrice": 197
            },
            {
                "_source": "05JUN\n03JUN\nPLAY. HT\nBANGALORE\nDE\nUSD\n39.00\n311.64\n*EXCHANGE RATE: 7.99077",
                "Category": "Other",
                "Date": "2003-06-05T00:00:00.000Z",
                "Description": "PLAY. HT",
                "TotalPrice": 311.64
            },
            {
                "_source": "05JUN\n02JUN\nREDIS LABS\n140-852-4291\nUS\nUSD\n127.00\n1,014.34\n*EXCHANGE RATE: 7.98693",
                "Date": "2002-06-05T00:00:00.000Z",
                "Description": "REDIS LABS",
                "TotalPrice": 1014.34
            },
            {
                "_source": "05JUN\n04JUN\nWolt\nHelsinki\nFI\nEUR\n22.89\n197.17\n*EXCHANGE RATE: 8.61381",
                "Date": "05JUN",
                "Description": "Wolt",
                "TotalPrice": 197.17
            },
            {
                "_source": "06JUN\n04JUN\nC HOTEL HELSINK\nHELSINKI\nFI\nEUR\n25.00\n215.34\n*EXCHANGE RATE: 8.61360",
                "Category": "Meals",
                "Date": "2004-06-06T00:00:00.000Z",
                "Description": "C HOTEL HELSINK",
                "TotalPrice": 215.34
            },
            {
                "_source": "06JUN\n05JUN\nAPPLE. COM/BILL\nITUNES . COM\nIE\n313.00",
                "Category": "Other",
                "Date": "06JUN",
                "Description": "APPLE. COM/BILL",
                "TotalPrice": 313
            },
            {
                "_source": "06JUN\n03JUN\nEFTPAY*JARDIN DE JADE\nHONG KONG\nHK\n215.60",
                "Date": "06JUN",
                "Description": "EFTPAY*JARDIN DE JADE",
                "TotalPrice": 215.6
            },
            {
                "_source": "07JUN\n06JUN\nAPPLE. COM/BILL\n85221120099\nIE\n88.00",
                "Category": "Other",
                "Date": "07JUN",
                "Description": "APPLE. COM/BILL",
                "TotalPrice": 88
            },
            {
                "_source": "07JUN\n05JUN\nC HOTEL HELSINK\nHELSINKI\nFI\nEUR\n49.00\n422.07\n*EXCHANGE RATE: 8.61367",
                "Category": "Meals",
                "Date": "07JUN",
                "Description": "C HOTEL HELSINK",
                "TotalPrice": 422.07
            },
            {
                "_source": "08JUN\n08JUN\nTwitter Dev Platform\nSan Francisco\nUS\nUSD\n100.00\n799.75\n*EXCHANGE RATE: 7.99750",
                "Date": "08JUN",
                "Description": "Twitter Dev Platform"
            },
            {
                "_source": "08JUN\n07JUN\nK-market Jatkasaari\nHELSINKI\nFI\nEUR\n6.58\n56.48\n*EXCHANGE RATE: 8.58359",
                "Category": "Meals",
                "Description": "K-market",
                "TotalPrice": 56.48
            },
            {
                "_source": "09JUN\n08JUN\nMicrosoft*Skype\nLuxembourg\nLU\n30.00",
                "TotalPrice": 30
            },
            {
                "_source": "09JUN\n08JUN\nMIDJOURNEY INC.\nSOUTH SAN FRA\nUS\nUSD\n4.00\n31.98\n*EXCHANGE RATE: 7.99500",
                "Date": "09JUN",
                "Description": "MIDJOURNEY INC.",
                "TotalPrice": 31.98
            },
            {
                "_source": "09JUN\n07JUN\nFINNAIR\nVANTAA\nFI\nEUR\n24.95\n214.25\n* EXCHANGE RATE: 8.58717",
                "Date": "09JUN",
                "Description": "FINNAIR",
                "TotalPrice": 214.25
            },
            {
                "_source": "09JUN\n08JUN\nMP PALVELUT - TAXI\nESPOO\nFI\nEUR\n18.90\n162.82\n*EXCHANGE RATE: 8.61481",
                "Date": "2008-06-09T00:00:00.000Z",
                "Description": "MP PALVELUT - TAXI",
                "TotalPrice": 162.82
            },
            {
                "_source": "10JUN\n09JUN\nCLOUDFLARE\nSAN FRANCISCO\nUS\nUSD\n117.70\n941.12\n*EXCHANGE RATE: 7.99592",
                "Date": "10JUN",
                "Description": "CLOUDFLARE",
                "TotalPrice": 941.12
            },
            {
                "_source": "10JUN\n09JUN\nZettle _* Dream Victoria\nHELSINKI\nFI\nEUR\n13.00\n111.99\n*EXCHANGE RATE: 8.61462",
                "Date": "2009-06-10T00:00:00.000Z"
            },
            {
                "_source": "12JUN\n09JUN\nC HOTEL HELSINK\nHELSINKI\nFI\nEUR\n32.00\n275.68\n*EXCHANGE RATE: 8.61500",
                "Date": "12JUN"
            }
        ],
        "doc2_MerchantAliases": [
            "HSBC"
        ],
        "doc2_MerchantName": "香港上海滙豐銀行有限公司",
        "doc3_Items": [
            {
                "_source": "13JUN\n12JUN\nVAST.AI* IVC1UNG\nLOS ANGELES\nUS\nUSD\n10.00\n79.94\n*EXCHANGE RATE: 7.99400",
                "Description": "VAST.AI* IVC1UNG",
                "TotalPrice": 79.94
            },
            {
                "_source": "15JUN\n14JUN\nDNH*GODADDY. COM HKD\nTEMPE\nUS\n500.78",
                "Description": "DNH*GODADDY. COM HKD",
                "TotalPrice": 500.78
            },
            {
                "_source": "15JUN\n14JUN\nVAST.AI* 9O59OTP\nLOS ANGELES\nUS\nUSD\n10.00\n79.90\n*EXCHANGE RATE: 7.99000",
                "Description": "VAST.AI* 9O59OTP",
                "TotalPrice": 79.9
            },
            {
                "_source": "15JUN\n14JUN\nNYTimes *NYTimes\nUS\nUSD\n12.00\n95.87\n*EXCHANGE RATE: 7.98917\n16JUN\n15JUN\n7-Eleven, HK (0824)\nMA ON SHAN\nHK",
                "Description": "NYTimes *NYTimes\n7-Eleven, HK (0824)\nMA ON SHAN",
                "TotalPrice": 95.87
            },
            {
                "_source": "19JUN\n17JUN\nIFTTT PRO (LEGACY)\nSAN FRANCISCO\nUS\nUSD\n1.99\n15.88\n*EXCHANGE RATE: 7.97990\n20JUN",
                "Description": "IFTTT PRO (LEGACY)",
                "TotalPrice": 15.88
            },
            {
                "_source": "20JUN\n19JUN\nAPPLE. COM/BILL\n8.00",
                "Description": "APPLE. COM/BILL",
                "TotalPrice": 8
            },
            {
                "_source": "10.00\n79.79\n7.97900",
                "TotalPrice": 79.79
            },
            {
                "_source": "TWITTER PAID FEATURES\nUSD\n8.00\n63.86",
                "Description": "TWITTER PAID FEATURES",
                "TotalPrice": 63.86
            }
        ],
        "doc3_MerchantName": "香港上海滙豐銀行有限公司\nLimited",
        "doc3_Total": 1091,
        "doc3_TransactionDate": "2023-06-27T00:00:00.000Z",
        "doc4_MerchantName": "HSBC\n滙豐",
        "doc4_MerchantPhoneNumber": "+88627488288",
        "doc4_TransactionDate": "2023-06-27T00:00:00.000Z",
        "__raw__": {
            "content": "HSBC\n滙豐\nThe Hongkong and Shanghai Banking Corporation Limited\n香港上海滙豐銀行有限公司\nSTATEMENT OF BUSINESS CARD ACCOUNT 公司卡戶口結單\nPage\n1/4\nMR LEE SEE MING\nM\nAccount number 戶口號碼\nC/O SML UNIVERSE LIMITED\n00923\n5199 3100 0018 7511\nFLAT F 27/F BLK 10 VISTA PARADISO\nCard type 信用卡類別\nCredit limit 信用限額\n2 HANG MING ST\nPlatinum Business MC\nHKD150,000.00\nNEW TERRITORIES\nStatement date 結單日\nStatement balance 結單結欠/結餘\n27 JUN 2023\nHKD23, 605.96\nPost date\nTrans date\nDescription of transaction\nAmount\n(HKD )\n記賬日期\n交易日期\n交易說明\n金額\nPREVIOUS BALANCE\n上月結欠/結餘\n10,510.18\n03JUN\n03JUN\nIFS PAYMENT - THANK YOU\n58,381.53CR\n5199 3100 0018 7511\nSEE-MING LEE\nSML UNIVERSE LTD\n29MAY\n27MAY\nTWITTER PAID FEATURES\nSAN FRANCISCO\nUS\n63.00\n29MAY\n26MAY\nPAYPAL *AESCRIPTS\n4029357733\nUS\n407.29\n30MAY\n29MAY\nMIDJOURNEY INC.\nSOUTH SAN FRA\nUS\nUSD\n20.00\n159.78\n*EXCHANGE RATE: 7.98900\n31MAY\n30MAY\nADOBE CREATIVE CLOUD\nDublin\nIE\n408.00\n31MAY\n30MAY\nMISTERHORSE . COM\nBRATISLAVA\nSK\nUSD\n19.90\n158.97\n*EXCHANGE RATE: 7.98844\n31MAY\n30MAY\nDATYLON\nANTWERPEN\nBE\nUSD\n19.95\n159.36\n*EXCHANGE RATE: 7.98797\n31MAY\n29MAY\nPAYPAL *iopzxz\n4029357733\nHK\n294.65\n31MAY\n31MAY\nFoodpandaHK Pandapro\nSHEUNG WAN\nHK\n89.00\n31MAY\n30MAY\nFINNAIR 1054050001938\nVANTAA\nFI\n833.00\n01JUN\n31MAY\nMIDJOURNEY INC.\nSOUTH SAN FRA\nUS\nUSD\n60.00\n479.29\n*EXCHANGE RATE: 7.98817\n01JUN\n31MAY\nPAYPAL *AESCRIPTS\n4029357733\nUS\n734.43\n02JUN\n01JUN\nPAYPAL *PATREON\nMEMBE\n4029357733\nUS\n16.33\n02JUN\n01JUN\nGOOGLE*GSUITE SMLUNIVE\nCC GOOGLE. COM\nSG\n70.50\n02JUN\n01JUN\nLINODE . AKAMAI\n6093807100\nUS\nUSD\n5,482.67\n43,811.89\n*EXCHANGE RATE: 7.99098\n02JUN\n01JUN\nAPPLE. COM/BILL\nITUNES. COM\nIE\n38.00\n02JUN\n01JUN\nSEMATEXT GROUP\nBROOKLYN\nUS\nUSD\n5.17\n41.31\n*EXCHANGE RATE: 7.99033\n02JUN\n01JUN\nOPEN SOURCE COLLECTIVE\nCOVINA\nUS\nUSD\n10.00\n79.91\n*EXCHANGE RATE: 7.99100\nFor important information such as payment methods, fees and charges, lost\ncard reporting, and change of correspondence address / telephone number,\nMinimum payment summary 最低付款摘要\nHKD\nplease visit www.hsbc.com.hk or call our Customer Service Hotline on\nCurrent minimum payment due 目前最低付款額\n237.00\n(852) 2748 8288.\nPlease pay by 須於此付款到期日或之前繳交\n24 JUL 2023\n有關您戶口的重要資料包括付款方式,利息與收費,報失信用卡,以及更改\nOverdue / overlimit due now\n通訊地址/電話號碼,請瀏覽網址www.hsbc.com.hk或聯絡我們的客戶服務熱\n須立即繳交的過期款項/超額款項\n0.00\n線(852) 2748 8288°\nTotal minimum payment due\n最低付款總額\n237.00\nHSBC\n滙豐\nPayment Slip 付款存根\nAccount number 戶口號碼\nCard type 信用卡類別\nIf you are paying by mail, please detach this payment slip and return it with a\n5199 3100 0018 7511\nPlatinum Business MC\ncrossed cheque made payable to \"The Hongkong and Shanghai Banking\nCorporation Limited\" or \"HSBC\" at least three working days before the\nStatement date 結單日\nStatement balance 結單結欠/結餘\npayment due date to our Centre, PO BOX NO. 73730, KOWLOON CENTRAL\n27 JUN 2023\nHKD23, 605.96\nPOST OFFICE HK. Please write your account number on the back of the\nCheque number 支票號碼\nAmount enclosed\n夾附金額\n如欲以郵寄方式付款,請撕下此付款存根,於付款到期日三個工作天前,連同以\ncheque.\n「香港上海滙豐銀行有限公司」或「滙豐」為抬頭的劃線支票,寄回 PO BOX\nNO. 73730, KOWLOON CENTRAL POST OFFICE HK. 信用卡中心收,請於支\n票背面寫上您的戶口號碼。\nThank you for choosing HSBC.多謝選用滙豐服務。\nHSBC\n滙豐\nThe Hongkong and Shanghai Banking Corporation Limited\n香港上海滙豐銀行有限公司\nSTATEMENT OF BUSINESS CARD ACCOUNT 公司卡戶口結單\nPage\n2/4\nCardholder's name 持卡人姓名\nAccount number 戶口號碼\nStatement date 結單日\nSEE-MING LEE\n5199 3100 0018 7511\n27 JUN 2023\nPost date\nTrans date\nDescription of transaction\nAmount\n( HKD)\n記賬日期\n交易日期\n交易說明\n金額\n02JUN\n01JUN\nMAILGUN TECHNOLOGIES,\nSAN ANTONIO\nUS\nUSD\n3.34\n26.68\n*EXCHANGE RATE: 7.98802\n03JUN\n02JUN\nAmazon web services\naws . amazon . co\nUS\nUSD\n212.98\n1,701.06\n*EXCHANGE RATE: 7.98695\n03JUN\n02JUN\nBROWSERSTACK. COM\nLEWES\nUS\nUSD\n10.00\n79.87\n*EXCHANGE RATE: 7.98700\n03JUN\n01JUN\nZEROSSL* ZEROSSL\nVIENNA\nAT\nUSD\n10.00\n79.87\n*EXCHANGE RATE: 7.98700\n03JUN\n02JUN\nFINNAIR 1054050025664\nVANTAA\nFI\n209.00\n05JUN\n04JUN\nK-market Jatkasaari\nHELSINKI\nFI\nEUR\n12.34\n106.29\n* EXCHANGE RATE: 8.61345\n05JUN\n03JUN\nFINNAIR - INFLI\nVANTAA\nFI\nEUR\n6.00\n51.68\n* EXCHANGE RATE: 8.61333\n05JUN\n04JUN\nK-market Jatkasaari\nHELSINKI\nFI\nEUR\n36.84\n317.33\n*EXCHANGE RATE: 8.61374\n05JUN\n03JUN\nFINNAIR 1054050024485\nVANTAA\nFI\n3,325.00\n05JUN\n04JUN\nAPPLE. COM/BILL\nITUNES . COM\nIE\n32.00\n05JUN\n04JUN\nALEPA HKI-VANTAA LENTO\nVANTAA\nFI\nEUR\n10.95\n94.32\n*EXCHANGE RATE: 8.61370\n05JUN\n03JUN\nNRI*NEW RELIC\n888-643-8776\nUS\nUSD\n269.70\n2,155.14\n* EXCHANGE RATE: 7.99088\n05JUN\n04JUN\nBBMSL*GO TRAVEL\nHong Kong\nHK\n108.00\n05JUN\n04JUN\nHUTCHISON TELECOM 3CC\nHONG KONG\nHK\n197.00\n05JUN\n03JUN\nPLAY. HT\nBANGALORE\nDE\nUSD\n39.00\n311.64\n*EXCHANGE RATE: 7.99077\n05JUN\n02JUN\nREDIS LABS\n140-852-4291\nUS\nUSD\n127.00\n1,014.34\n*EXCHANGE RATE: 7.98693\n05JUN\n04JUN\nWolt\nHelsinki\nFI\nEUR\n22.89\n197.17\n*EXCHANGE RATE: 8.61381\n06JUN\n04JUN\nC HOTEL HELSINK\nHELSINKI\nFI\nEUR\n25.00\n215.34\n*EXCHANGE RATE: 8.61360\n06JUN\n05JUN\nAPPLE. COM/BILL\nITUNES . COM\nIE\n313.00\n06JUN\n03JUN\nEFTPAY*JARDIN DE JADE\nHONG KONG\nHK\n215.60\n07JUN\n06JUN\nAPPLE. COM/BILL\n85221120099\nIE\n88.00\n07JUN\n05JUN\nC HOTEL HELSINK\nHELSINKI\nFI\nEUR\n49.00\n422.07\n*EXCHANGE RATE: 8.61367\n08JUN\n08JUN\nTwitter Dev Platform\nSan Francisco\nUS\nUSD\n100.00\n799.75\n*EXCHANGE RATE: 7.99750\n08JUN\n07JUN\nK-market Jatkasaari\nHELSINKI\nFI\nEUR\n6.58\n56.48\n*EXCHANGE RATE: 8.58359\n09JUN\n08JUN\nMicrosoft*Skype\nLuxembourg\nLU\n30.00\n09JUN\n08JUN\nMIDJOURNEY INC.\nSOUTH SAN FRA\nUS\nUSD\n4.00\n31.98\n*EXCHANGE RATE: 7.99500\n09JUN\n07JUN\nFINNAIR\nVANTAA\nFI\nEUR\n24.95\n214.25\n* EXCHANGE RATE: 8.58717\n09JUN\n08JUN\nMP PALVELUT - TAXI\nESPOO\nFI\nEUR\n18.90\n162.82\n*EXCHANGE RATE: 8.61481\n10JUN\n09JUN\nCLOUDFLARE\nSAN FRANCISCO\nUS\nUSD\n117.70\n941.12\n*EXCHANGE RATE: 7.99592\n10JUN\n09JUN\nZettle _* Dream Victoria\nHELSINKI\nFI\nEUR\n13.00\n111.99\n*EXCHANGE RATE: 8.61462\n10JUN\n09JUN\nHMSHost Helsinki Airpo\nHelsinki\nFI\nEUR\n24.60\n212.03\n*EXCHANGE RATE: 8.61911\n10JUN\n09JUN\nCLOUDFLARE\nSAN FRANCISCO\nUS\nUSD\n3.67\n29.34\n*EXCHANGE RATE: 7.99455\n12JUN\n09JUN\nC HOTEL HELSINK\nHELSINKI\nFI\nEUR\n32.00\n275.68\n*EXCHANGE RATE: 8.61500\n12JUN\n11JUN\nAPPLE. COM/BILL\nITUNES . COM\nIE\n78.00\n12JUN\n09JUN\nFINNAIR\nVANTAA\nFI\nEUR\n396.00\n3,411.55\n*EXCHANGE RATE: 8.61503\n12JUN\n09JUN\nFINNAIR\nVANTAA\nFI\nEUR\n119.00\n1,025.19\n*EXCHANGE RATE: 8.61504\n12JUN\n10JUN\nAPPLE. COM/BILL\n85221120099\nIE\n198.00\nHSBC\n滙豐\nThe Hongkong and Shanghai Banking Corporation Limited\n香港上海滙豐銀行有限公司\nSTATEMENT OF BUSINESS CARD ACCOUNT 公司卡戶口結單\nPage\n3/4\nCardholder's name 持卡人姓名\nAccount number 戶口號碼\nStatement date 結單日\nSEE-MING LEE\n5199 3100 0018 7511\n27 JUN 2023\nPost date\nTrans date\nDescription of transaction\nAmount\n(HKD)\n記賬日期\n交易日期\n交易說明\n金額\n13JUN\n12JUN\nVAST.AI* IVC1UNG\nLOS ANGELES\nUS\nUSD\n10.00\n79.94\n*EXCHANGE RATE: 7.99400\n15JUN\n14JUN\nDNH*GODADDY. COM HKD\nTEMPE\nUS\n500.78\n15JUN\n14JUN\nVAST.AI* 9O59OTP\nLOS ANGELES\nUS\nUSD\n10.00\n79.90\n*EXCHANGE RATE: 7.99000\n15JUN\n14JUN\nNYTimes *NYTimes\n800-698-4637\nUS\nUSD\n12.00\n95.87\n*EXCHANGE RATE: 7.98917\n16JUN\n15JUN\n7-Eleven, HK (0824)\nMA ON SHAN\nHK\n4,080.00\n19JUN\n17JUN\nIFTTT PRO (LEGACY)\nSAN FRANCISCO\nUS\nUSD\n1.99\n15.88\n*EXCHANGE RATE: 7.97990\n20JUN\n19JUN\nAPPLE. COM/BILL\nITUNES . COM\nIE\n788.00\n20JUN\n19JUN\nAPPLE. COM/BILL\n85221120099\nIE\n8.00\n20JUN\n20JUN\nVAST. AI* 7YS9UMV\nLOS ANGELES\nUS\nUSD\n10.00\n79.79\n*EXCHANGE RATE: 7.97900\n20JUN\n19JUN\nNetflix. com\nLos Gatos\nSG\n93.00\n23JUN\n21JUN\nTWITTER PAID FEATURES\nSAN FRANCISCO\nUS\nUSD\n8.00\n63.86\n*EXCHANGE RATE: 7.98250\n27JUN\n27JUN\nCREDIT REWARD CASH REBATE\n1,091.00CR\n*For credit card transactions effected in currencies other\nthan Hong Kong dollars, the exchange rate applied includes a\nhandling fee equivalent to 1.95% of each transaction. The\nfee relating to foreign currency transaction is not\napplicable to RMB Business Card.\n就每項以非港元進行的信用卡交易,所用外幣匯率已包括交易金\n額1.95%的手續費。外幣交易有關費用不適用於人民幣公司卡。\nNote: \"CR\" means Credit transaction / balance\n註:「CR」為入賬交易/結餘\n**** REWARDCASH SUMMARY FOR CARD NUMBER 5199 3100 0018 7511\nREWARDCASH EARNED\n:\n291\nREWARDCASH ADJUSTED\n:\n800\nREWARDCASH REDEEMED\n:\n0\nCONVERTED TO CASH REBATE\n1,091\n..\n**** REWARDCASH EARNINGS FROM PROMOTIONS FOR 5199 3100 0018 7511 ****\nMARKETING PROGRAMME\nREWARDCASH ADJUSTED\nADJUSTMENT DATE\n2H22 BCARD USAGE CAMPAIGN\n+800\n29-MAY-23\nREWARDCASH ADJUSTMENT\nSTATEMENT BALANCE\n結單結欠/結餘\n23,605.96\nTRANSACTION SUMMARY\nCREDIT/PAYMENT\n58,381.53CR\n..\nPURCHASES AND INSTALMENTS\n72,568.31\n..\nCREDIT ADJUSTMENT\n1,091.00CR\n..\nTOTAL ACCOUNT BALANCE\n23,605.96\n..\n**\n** FEES AND CHARGES SUMMARY\nFEE/CHARGE TYPE\nAMOUNT\nTOTAL FEES/CHARGES ( EXCLUDING FINANCE CHARGE )\n0.00\n***** FINANCE CHARGE SUMMARY **\nBALANCE TYPE\nANNUALISED PERCENTAGE RATE (APR)\nFINANCE CHARGE\nCASH ADVANCE\n35.61%\n0.00\nPURCHASE\n34.46%\n0.00\nTOTAL FINANCE CHARGE\n0.00\n*********** INFORMATION REGARDING MAKING MINIMUM PAYMENT*\nHSBC\n滙豐\nThe Hongkong and Shanghai Banking Corporation Limited\n香港上海滙豐銀行有限公司\nSTATEMENT OF BUSINESS CARD ACCOUNT 公司卡戶口結單\nPage 4 /4\nCardholder's name 持卡人姓名\nAccount number\n1號碼\nStatement date 結單日\nSEE-MING LEE\n5199 3100 0018 7511\n27 JUN 2023\nPost date\nTrans date\nDescription of transaction\nAmount\n( HKD)\n記賬日期\n交易日期\n交易說明\n金額\nThe below examples are for illustration only. You may visit our Bank\nwebsite at www.hsbc. com.hk for an online credit card repayment\ncalculator for customized information.\nIf you make no additional\ncharges, purchases and\nYou will pay off the\nand you will end up\ncash advances on this card|\noutstanding balance*\npaying an estimated\nof HKD20,000 in\ntotal of ...\nand each month you pay. ..\nabout .. .\n|\n|\n|\nOnly Minimum Payment Due\n|\n26 years **\n|\nHKD67,536 ***\n|\n|\nHKD849\n|\n3 years **\n|\nHKD30,565 ***\n|\n(Savings=HKD36, 971)\n* The outstanding balance of HKD20, 000 is accrued from purchase only.\n** Assume repayment is made on or before the payment due date of each\nstatement month.\n*** Include the outstanding balance of HKD20, 000 and the total finance\ncharge which is accrued daily and calculated at an interest rate of\n2.5% per month (equivalent to an annualised percentage rate of 34.46%\non purchase and 35.61% on cash advance) on the outstanding balance\nuntil it is fully paid.\nThe statement is for your reference only. Payment to be\narranged by your corporation.\nThe following card(s) will expire soon. Renewal card(s)\nwill be sent to you shortly.\n下列信用卡即將到期。續發新卡將稍後寄給閣下。\n5199 3100 0018 7511\nThe RewardCash earned by the company have been\ntransferred to your Business Card account.\nIf the statement balance for your credit card account\nexceeds the credit limit on the statement date, an overlimit\nhandling fee will be debited to the account. If you wish to\nopt out of the over-the-limit facility, you may fill out\nthe form on the back of the statement. For enquiries,\nplease contact us on 2748 8288.\n若您的結單結欠超出該信用卡戶口截至結單日的信用限額,\n本行會徵收超出信用限額手續費。如您欲拒絕接受超出信用限額\n信貸安排,請填妥結單背頁之表格作出指示。如有任何\n查詢,請致電2748 8288。",
            "paragraphs": []
        },
        "created_at": "2024-01-12T21:40:59.673Z"
    },
    {
        "Currency": "JPY",
        "Items": [
            {
                "_source": "28APR\n27APR\nMIDJOURNEY INC.\nSOUTH SAN FRA\nUS\nUSD\n20.00\n160.07\n*EXCHANGE RATE: 8.00350",
                "Date": "1928-04-27T00:00:00.000Z",
                "Description": "MIDJOURNEY INC.",
                "TotalPrice": 160.07
            },
            {
                "_source": "29APR\n28APR\nBEANS TF LIMITED\nHONG KONG\nHK\n192.00",
                "Date": "1929-04-28T00:00:00.000Z",
                "Description": "BEANS TF LIMITED",
                "TotalPrice": 192
            },
            {
                "_source": "02MAY\n30APR\nDATYLON\nANTWERPEN\nBE\nUSD\n19.95\n159.67\n*EXCHANGE RATE: 8.00351",
                "Date": "02MAY",
                "Description": "DATYLON",
                "TotalPrice": 159.67
            },
            {
                "_source": "02MAY\n01MAY\nMAILGUN TECHNOLOGIES,\nSAN ANTONIO\nUS\nUSD\n3.81\n30.49\n*EXCHANGE RATE: 8.00262",
                "Category": "Credit",
                "Date": "02MAY",
                "Description": "MAILGUN TECHNOLOGIES,\nSAN ANTONIO",
                "TotalPrice": 30.49
            },
            {
                "_source": "02MAY\n01MAY\nAPPLE. COM/BILL\nITUNES . COM\nIE\n88.00",
                "Category": "Credit",
                "Description": "APPLE. COM/BILL",
                "TotalPrice": 88
            },
            {
                "_source": "02MAY\n01MAY\nSEMATEXT GROUP\nBROOKLYN\nUS\nUSD\n4.00\n32.01\n*EXCHANGE RATE: 8.00250",
                "Date": "02MAY",
                "Description": "SEMATEXT GROUP",
                "TotalPrice": 32.01
            },
            {
                "_source": "02MAY\n01MAY\nOPEN SOURCE COLLECTIVE\nCOVINA\nUS\nUSD\n10.00\n80.04\n*EXCHANGE RATE: 8.00400",
                "Date": "2001-05-02T00:00:00.000Z",
                "Description": "OPEN SOURCE COLLECTIVE\nCOVINA",
                "TotalPrice": 80.04
            },
            {
                "_source": "02MAY\n01MAY\nGOOGLE*GSUITE SMLUNIVE\nCC GOOGLE. COM\nSG\n70.50",
                "Date": "02MAY",
                "Description": "GOOGLE*GSUITE SMLUNIVE\nCC GOOGLE. COM",
                "TotalPrice": 70.5
            },
            {
                "_source": "02MAY\n01MAY\nPAYPAL *PATREON\nMEMBE\n4029357733\nUS\n16.35",
                "Date": "02MAY",
                "Description": "PAYPAL *PATREON\nMEMBE",
                "TotalPrice": 16.35
            },
            {
                "_source": "02MAY\n29APR\nFoodpanda Hong Kong\nHong Kong\nHK\n179.00",
                "Date": "2002-05-29T00:00:00.000Z",
                "Description": "Foodpanda Hong Kong",
                "TotalPrice": 179
            },
            {
                "_source": "02MAY\n01MAY\nREDIS LABS\n140-852-4291\nUS\nUSD\n127.00\n1,016.47\n*EXCHANGE RATE: 8.00370\n85221120099\nIE\n15.00",
                "Category": "Tax",
                "Date": "02MAY",
                "Description": "REDIS LABS",
                "TotalPrice": 15
            },
            {
                "_source": "02MAY\n01MAY\nAPPLE. COM/BILL",
                "Category": "Meals",
                "Date": "2001-05-02T00:00:00.000Z",
                "Description": "APPLE. COM/BILL"
            },
            {
                "_source": "02MAY\n29APR\nMIDJOURNEY INC.\nSOUTH SAN FRA\nUS\nUSD\n20.00\n160.07\n*EXCHANGE RATE: 8.00350",
                "Category": "Credit",
                "Date": "02MAY",
                "Description": "MIDJOURNEY INC.",
                "TotalPrice": 160.07
            },
            {
                "_source": "02MAY\n01MAY\nDELIVEROO\nCENTRAL\nHK\n184.50",
                "Description": "DELIVEROO",
                "TotalPrice": 184.5
            },
            {
                "_source": "02MAY\n01MAY\nLINODE . AKAMAI\n6093807100\nUS\nUSD\n5,670.50\n45,384.87\n*EXCHANGE RATE: 8.00368",
                "Date": "02MAY",
                "Description": "LINODE AKAMAI"
            },
            {
                "_source": "02MAY\n29APR\nADOBE CREATIVE CLOUD\nDublin\nIE\n408.00",
                "Date": "2002-05-29T00:00:00.000Z",
                "Description": "ADOBE CREATIVE CLOUD"
            },
            {
                "_source": "02MAY\n30APR\nFoodpanda Hong Kong\nHong Kong\nHK\n153.50",
                "Description": "Foodpanda Hong Kong",
                "TotalPrice": 153.5
            },
            {
                "_source": "02MAY\n30APR\nMIDJOURNEY INC.\nSOUTH SAN FRA\nUS\nUSD\n60.00\n480.23\n*EXCHANGE RATE: 8.00383",
                "Description": "MIDJOURNEY INC.",
                "Price": 60,
                "TotalPrice": 480.23
            },
            {
                "_source": "02MAY\n01MAY\nFoodpandaHK Pandapro\nSHEUNG WAN\nHK\n89.00",
                "Description": "FoodpandaHK Pandapro\nSHEUNG",
                "ProductCode": "01MAY",
                "TotalPrice": 89
            },
            {
                "_source": "03MAY\n02MAY\nBROWSERSTACK. COM\nLEWES\nUS\nUSD\n10.00\n80.04\n*EXCHANGE RATE: 8.00400",
                "Description": "BROWSERSTACK. COM",
                "TotalPrice": 80.04
            },
            {
                "_source": "03MAY\n02MAY\nAmazon web services\nUS\nUSD\n200.34\n1,603.46\n*EXCHANGE RATE: 8.00369",
                "Description": "Amazon web services"
            },
            {
                "_source": "03MAY\n02MAY\n7-Eleven, HK (0824)\nMA ON SHAN\nHK\n3,595.00",
                "Description": "7-Eleven, HK (0824)\nMA ON SHAN",
                "TotalPrice": 3595
            },
            {
                "_source": "03MAY\n02MAY\nWATSON'S MOS/ 635\nHONG KONG\nHK\n1,324.50",
                "Description": "WATSON'S MOS/ 635",
                "TotalPrice": 1324.5
            },
            {
                "_source": "03MAY\n01MAY\nZEROSSL* ZEROSSL\nVIENNA\nAT\nUSD\n10.00\n80.04\n*EXCHANGE RATE: 8.00400\n03MAY\n02MAY\nFoodpanda Hong Kong\nHong Kong\nHK\n319.00",
                "Description": "ZEROSSL* ZEROSSL\nFoodpanda Hong Kong",
                "ProductCode": "02MAY",
                "TotalPrice": 319
            },
            {
                "_source": "03MAY\n03MAY\nNRI*NEW RELIC\n888-643-8776\nUS\nUSD\n256.80\n2,055.34\n*EXCHANGE RATE: 8.00366\n04MAY\n03MAY\nAPPLE. COM/BILL\nITUNES\nCOM\nIE\n15.00",
                "Description": "NRI*NEW RELIC\nAPPLE. COM/BILL",
                "ProductCode": "03MAY",
                "TotalPrice": 15
            },
            {
                "_source": "04MAY\n03MAY\nPLAY. HT\nBANGALORE\nDE\nUSD\n39.00\n312.14\n*EXCHANGE RATE: 8.00359",
                "Description": "PLAY. HT",
                "TotalPrice": 312.14
            },
            {
                "_source": "04MAY\n03MAY\nFoodpanda Hong Kong\nHong Kong\nHK\n164.00",
                "Description": "Foodpanda Hong Kong",
                "TotalPrice": 164
            },
            {
                "_source": "06MAY\n05MAY\nFoodpanda Hong Kong",
                "Description": "Foodpanda Hong Kong"
            },
            {
                "_source": "Hong Kong\nHK\n164.00",
                "Description": "Hong",
                "TotalPrice": 164
            },
            {
                "_source": "06MAY\n05MAY\nHUTCHISON TELECOM 3CC\nHONG KONG\nHK\n197.00",
                "Description": "HUTCHISON TELECOM 3CC\nHONG KONG",
                "TotalPrice": 197
            },
            {
                "_source": "08MAY\n08MAY\nTwitter Dev Platform\nSan Francisco\nUS\nUSD\n100.00\n800.29\n*EXCHANGE RATE: 8.00290",
                "Description": "Twitter Dev Platform\nSan",
                "Price": 100,
                "TotalPrice": 800.29
            },
            {
                "_source": "08MAY\n07MAY\nUNDERCONSIDERATION\nBLOOMINGTON\nUS\nUSD\n20.00\n160.06\n*EXCHANGE RATE: 8.00300\n09MAY\n08MAY\nPAYPAL *TIDAL HIFI\n35314369001\nSE\n96.00\n10MAY\n09MAY\nAPPLE. COM/BILL\nITUNES . COM\nIE\n238.00",
                "Description": "UNDERCONSIDERATION\nBLOOMINGTON\n*TIDAL HIFI\nAPPLE. COM/BILL\nITUNES . COM",
                "Price": 20,
                "ProductCode": "35314369001",
                "TotalPrice": 160.06
            },
            {
                "_source": "12MAY\n11MAY\nAPPLE. COM/BILL\nITUNES . COM\nIE\n78.00",
                "Description": "APPLE. COM/BILL",
                "TotalPrice": 78
            },
            {
                "_source": "12MAY\n11MAY\nPAYPAL *PADDLE. NET\n35314369001\nGB\n69.00",
                "Description": "PAYPAL *PADDLE. NET",
                "ProductCode": "35314369001",
                "TotalPrice": 69
            },
            {
                "_source": "13MAY\n12MAY\nDOCKER : INV-14AE9AE4-8A\nPALO ALTO\nUS\nUSD\n60.00\n479.57\n*EXCHANGE RATE: 7.99283",
                "Description": "12MAY\nDOCKER : INV-14AE9AE4-8A",
                "TotalPrice": 479.57
            },
            {
                "_source": "16MAY\n15MAY\nPAYPAL *FASTSPRING LUM\n8773278914\nUS\n988.00",
                "Description": "PAYPAL *FASTSPRING LUM",
                "ProductCode": "8773278914",
                "TotalPrice": 988
            },
            {
                "_source": "17MAY\n16MAY\nPAYPAL *GODADDY. COM\n4029357733\nUS\n274.28",
                "Description": "PAYPAL *GODADDY. COM",
                "ProductCode": "4029357733",
                "TotalPrice": 274.28
            },
            {
                "_source": "18MAY\n17MAY\nIFTTT PRO (LEGACY)\nSAN FRANCISCO\nUS\nUSD\n1.99\n15.90\n*EXCHANGE RATE: 7.98995",
                "Description": "IFTTT PRO (LEGACY)",
                "Price": 1.99,
                "TotalPrice": 15.9
            },
            {
                "_source": "18MAY\n17MAY\nNYTimes *NYTimes\n800-698-4637\nUS\nUSD\n12.00\n95.90\n*EXCHANGE RATE: 7.99167",
                "Description": "NYTimes *NYTimes",
                "ProductCode": "800-698-4637",
                "TotalPrice": 95.9
            },
            {
                "_source": "19MAY\n18MAY\nPAYPAL *VUE MASTERY\n4029357733\nUS\n204.13\n20MAY\n19MAY\nNetflix. com\nLos Gatos\nSG\n93.00",
                "Description": "*VUE MASTERY\nNetflix. com",
                "ProductCode": "4029357733",
                "TotalPrice": 93
            },
            {
                "_source": "22MAY\n20MAY\nPAYPAL *PADDLE. NET\n35314369001\nGB\n407.63\n22MAY\n21MAY\n7-Eleven, HK (0824)\nMA ON SHAN\nHK\n3,862.50",
                "Description": "PAYPAL *PADDLE. NET\n7-Eleven, HK (0824)\nMA ON SHAN",
                "ProductCode": "35314369001",
                "TotalPrice": 407.63
            },
            {
                "_source": "22MAY\n21MAY\nTWITTER PAID FEATURES\nSAN FRANCISCO\nUS\nUSD\n8.00\n63.85\n*EXCHANGE RATE: 7.98125",
                "Description": "TWITTER PAID FEATURES",
                "Price": 8,
                "TotalPrice": 63.85
            },
            {
                "_source": "23MAY\n21MAY\nPAYPAL *GODADDY. COM\n4029357733\nUS\n160.40",
                "Description": "PAYPAL *GODADDY. COM",
                "ProductCode": "4029357733",
                "TotalPrice": 160.4
            },
            {
                "_source": "23MAY\n21MAY\nPAYPAL *GITHUB INC\n4029357733\nUS\n32.61",
                "Description": "PAYPAL *GITHUB INC",
                "ProductCode": "4029357733",
                "TotalPrice": 32.61
            },
            {
                "_source": "23MAY\nPAYPAL *WAKATIME\n4029357733\nHK\n73.39",
                "Description": "23MAY\nPAYPAL *WAKATIME",
                "ProductCode": "4029357733",
                "TotalPrice": 73.39
            },
            {
                "_source": "25MAY\n23MAY\nPAYPAL *PADDLE. NET\n35314369001\nGB\n2,193.67",
                "Description": "PAYPAL *PADDLE. NET",
                "ProductCode": "35314369001",
                "TotalPrice": 2193.67
            },
            {
                "_source": "27MAY\n26MAY\nPAYPAL *HAYU\n35314369001\nGB\n40.00",
                "Description": "PAYPAL *HAYU",
                "ProductCode": "35314369001",
                "TotalPrice": 40
            }
        ],
        "MerchantAddress": {
            "_source": "PO BOX\nNO. 73730, KOWLOON CENTRAL POST OFFICE HK.",
            "poBox": "PO BOX\nNO. 73730",
            "streetAddress": "PO BOX\nNO. 73730",
            "house": "KOWLOON CENTRAL POST OFFICE HK."
        },
        "MerchantAliases": [
            "HSBC.",
            "海滙豐",
            "The Hongkong and Shanghai Limited",
            "HSBC\n滙豐"
        ],
        "MerchantName": "香港上海滙豐銀行有限公司",
        "MerchantPhoneNumber": "+88627488288",
        "TaxDetails": [
            {
                "_source": "24MAY"
            }
        ],
        "Total": 277,
        "TransactionDate": "2023-05-27T00:00:00.000Z",
        "__raw__": {
            "content": "HSBC\n滙豐\nThe Hongkong and Shanghai Banking Corporation Limited\n香港上海滙豐銀行有限公司\nSTATEMENT OF BUSINESS CARD ACCOUNT 公司卡戶口結單\nPage\n1/4\nMR LEE SEE MING\nM\nAccount number 戶口號碼\nC/O SML UNIVERSE LIMITED\n00900\n5199 3100 0018 7511\nFLAT F 27/F BLK 10 VISTA PARADISO\nCard type 信用卡類別\nCredit limit 信用限額\n2 HANG MING ST\nPlatinum Business MC\nHKD150,000.00\nNEW TERRITORIES\nStatement date 結單日\nStatement balance 結單結欠/結餘\n27 MAY 2023\nHKD10,510.18\nPost date\nTrans date\nDescription of transaction\nAmount\n(HKD)\n記賬日期\n交易日期\n交易說明\n金額\nPREVIOUS BALANCE\n上月結欠/結餘\n9,833.31\n05MAY\n05MAY\nIFS PAYMENT - THANK YOU\n68,281.60CR\n5199 3100 0018 7511\nSEE-MING LEE\nSML UNIVERSE LTD\n28APR\n27APR\nMIDJOURNEY INC.\nSOUTH SAN FRA\nUS\nUSD\n20.00\n160.07\n*EXCHANGE RATE: 8.00350\n29APR\n28APR\nBEANS TF LIMITED\nHONG KONG\nHK\n192.00\n02MAY\n30APR\nDATYLON\nANTWERPEN\nBE\nUSD\n19.95\n159.67\n*EXCHANGE RATE: 8.00351\n02MAY\n01MAY\nMAILGUN TECHNOLOGIES,\nSAN ANTONIO\nUS\nUSD\n3.81\n30.49\n*EXCHANGE RATE: 8.00262\n02MAY\n01MAY\nAPPLE. COM/BILL\nITUNES . COM\nIE\n88.00\n02MAY\n01MAY\nSEMATEXT GROUP\nBROOKLYN\nUS\nUSD\n4.00\n32.01\n*EXCHANGE RATE: 8.00250\n02MAY\n01MAY\nOPEN SOURCE COLLECTIVE\nCOVINA\nUS\nUSD\n10.00\n80.04\n*EXCHANGE RATE: 8.00400\n02MAY\n01MAY\nGOOGLE*GSUITE SMLUNIVE\nCC GOOGLE. COM\nSG\n70.50\n02MAY\n01MAY\nPAYPAL *PATREON\nMEMBE\n4029357733\nUS\n16.35\n02MAY\n29APR\nFoodpanda Hong Kong\nHong Kong\nHK\n179.00\n02MAY\n01MAY\nREDIS LABS\n140-852-4291\nUS\nUSD\n127.00\n1,016.47\n*EXCHANGE RATE: 8.00370\n02MAY\n01MAY\nAPPLE. COM/BILL\n85221120099\nIE\n15.00\n02MAY\n29APR\nMIDJOURNEY INC.\nSOUTH SAN FRA\nUS\nUSD\n20.00\n160.07\n*EXCHANGE RATE: 8.00350\n02MAY\n01MAY\nDELIVEROO\nCENTRAL\nHK\n184.50\n02MAY\n01MAY\nLINODE . AKAMAI\n6093807100\nUS\nUSD\n5,670.50\n45,384.87\n*EXCHANGE RATE: 8.00368\n02MAY\n29APR\nADOBE CREATIVE CLOUD\nDublin\nIE\n408.00\nFor important information such as payment methods, fees and charges, lost\nMinimum payment summary 最低付款摘要\ncard reporting, and change of correspondence address / telephone number,\nHKD\nplease visit www.hsbc.com.hk or call our Customer Service Hotline on\nCurrent minimum payment due 目前最低付款額\n106.00\n(852) 2748 8288.\nPlease pay by 須於此付款到期日或之前繳交\n23 JUN 2023\n有關您戶口的重要資料包括付款方式,利息與收費,報失信用卡,以及更改\nOverdue / overlimit due now\n通訊地址/電話號碼,請瀏覽網址www.hsbc.com.hk或聯絡我們的客戶服務熱\n須立即繳交的過期款項/超額款項\n0.00\n線(852) 2748 8288°\nTotal minimum payment due\n最低付款總額\n106.00\nHSBC\n滙豐\nPayment Slip 付款存根\nAccount number 戶口號碼\nCard type 信用卡類別\nIf you are paying by mail, please detach this payment slip and return it with a\n5199 3100 0018 7511\nPlatinum Business MC\ncrossed cheque made payable to \"The Hongkong and Shanghai Banking\nCorporation Limited\" or \"HSBC\" at least three working days before the\nStatement date 結單日\nStatement balance 結單結欠/結餘\npayment due date to our Centre, PO BOX NO. 73730, KOWLOON CENTRAL\n27 MAY 2023\nHKD10,510.18\nPOST OFFICE HK. Please write your account number on the back of the\nCheque number 支票號碼\nAmount enclosed\n夾附金額\n如欲以郵寄方式付款,請撕下此付款存根,於付款到期日三個工作天前,連同以\ncheque.\n「香港上海滙豐銀行有限公司」或「滙豐」為抬頭的劃線支票,寄回 PO BOX\nNO. 73730, KOWLOON CENTRAL POST OFFICE HK. 信用卡中心收,請於支\n票背面寫上您的戶口號碼。\nThank you for choosing HSBC.多謝選用滙豐服務。\nHSBC\n滙豐\nThe Hongkong and Shanghai Banking Corporation Limited\n香港上海滙豐銀行有限公司\nSTATEMENT OF BUSINESS CARD ACCOUNT 公司卡戶口結單\nPage\n2/4\nCardholder's name 持卡人姓名\nAccount number 戶口號碼\nStatement date 結單日\nSEE-MING LEE\n5199 3100 0018 7511\n27 MAY 2023\nPost date\nTrans date\nDescription of transaction\nAmount\n(HKD)\n記賬日期\n交易日期\n交易說明\n金額\n02MAY\n30APR\nFoodpanda Hong Kong\nHong Kong\nHK\n153.50\n02MAY\n30APR\nMIDJOURNEY INC.\nSOUTH SAN FRA\nUS\nUSD\n60.00\n480.23\n*EXCHANGE RATE: 8.00383\n02MAY\n01MAY\nFoodpandaHK Pandapro\nSHEUNG WAN\nHK\n89.00\n03MAY\n02MAY\nBROWSERSTACK. COM\nLEWES\nUS\nUSD\n10.00\n80.04\n*EXCHANGE RATE: 8.00400\n03MAY\n02MAY\nAmazon web services\naws . amazon. co\nUS\nUSD\n200.34\n1,603.46\n*EXCHANGE RATE: 8.00369\n03MAY\n02MAY\n7-Eleven, HK (0824)\nMA ON SHAN\nHK\n3,595.00\n03MAY\n02MAY\nWATSON'S MOS/ 635\nHONG KONG\nHK\n1,324.50\n03MAY\n01MAY\nZEROSSL* ZEROSSL\nVIENNA\nAT\nUSD\n10.00\n80.04\n*EXCHANGE RATE: 8.00400\n03MAY\n02MAY\nFoodpanda Hong Kong\nHong Kong\nHK\n319.00\n03MAY\n03MAY\nNRI*NEW RELIC\n888-643-8776\nUS\nUSD\n256.80\n2,055.34\n*EXCHANGE RATE: 8.00366\n04MAY\n03MAY\nAPPLE. COM/BILL\nITUNES . COM\nIE\n15.00\n04MAY\n03MAY\nPLAY. HT\nBANGALORE\nDE\nUSD\n39.00\n312.14\n*EXCHANGE RATE: 8.00359\n04MAY\n03MAY\nFoodpanda Hong Kong\nHong Kong\nHK\n164.00\n06MAY\n05MAY\nFoodpanda Hong Kong\nHong Kong\nHK\n164.00\n06MAY\n05MAY\nHUTCHISON TELECOM 3CC\nHONG KONG\nHK\n197.00\n08MAY\n08MAY\nTwitter Dev Platform\nSan Francisco\nUS\nUSD\n100.00\n800.29\n*EXCHANGE RATE: 8.00290\n08MAY\n07MAY\nUNDERCONSIDERATION\nBLOOMINGTON\nUS\nUSD\n20.00\n160.06\n*EXCHANGE RATE: 8.00300\n09MAY\n08MAY\nPAYPAL *TIDAL HIFI\n35314369001\nSE\n96.00\n10MAY\n09MAY\nAPPLE. COM/BILL\nITUNES . COM\nIE\n238.00\n12MAY\n11MAY\nAPPLE. COM/BILL\nITUNES . COM\nIE\n78.00\n12MAY\n11MAY\nPAYPAL *PADDLE. NET\n35314369001\nGB\n69.00\n13MAY\n12MAY\nDOCKER : INV-14AE9AE4-8A\nPALO ALTO\nUS\nUSD\n60.00\n479.57\n*EXCHANGE RATE: 7.99283\n16MAY\n15MAY\nPAYPAL *FASTSPRING LUM\n8773278914\nUS\n988.00\n17MAY\n16MAY\nPAYPAL *GODADDY. COM\n4029357733\nUS\n274.28\n18MAY\n17MAY\nIFTTT PRO (LEGACY)\nSAN FRANCISCO\nUS\nUSD\n1.99\n15.90\n*EXCHANGE RATE: 7.98995\n18MAY\n17MAY\nNYTimes *NYTimes\n800-698-4637\nUS\nUSD\n12.00\n95.90\n*EXCHANGE RATE: 7.99167\n19MAY\n18MAY\nPAYPAL *VUE MASTERY\n4029357733\nUS\n204.13\n20MAY\n19MAY\nNetflix. com\nLos Gatos\nSG\n93.00\n22MAY\n20MAY\nPAYPAL *PADDLE. NET\n35314369001\nGB\n407.63\n22MAY\n21MAY\n7-Eleven, HK (0824)\nMA ON SHAN\nHK\n3,862.50\n22MAY\n21MAY\nTWITTER PAID FEATURES\nSAN FRANCISCO\nUS\nUSD\n8.00\n63.85\n*EXCHANGE RATE: 7.98125\n23MAY\n21MAY\nPAYPAL *GODADDY. COM\n4029357733\nUS\n160.40\n23MAY\n21MAY\nPAYPAL *GITHUB INC\n4029357733\nUS\n32.61\n24MAY\n23MAY\nPAYPAL *WAKATIME\n4029357733\nHK\n73.39\n25MAY\n23MAY\nPAYPAL *PADDLE. NET\n35314369001\nGB\n2,193.67\n27MAY\n26MAY\nPAYPAL *HAYU\n35314369001\nGB\n40.00\n27MAY\n27MAY\nCREDIT REWARD CASH REBATE\n277.00CR\n*For credit card transactions effected in currencies other\nthan Hong Kong dollars, the exchange rate applied includes a\nhandling fee equivalent to 1.95% of each transaction. The\nfee relating to foreign currency transaction is not\napplicable to RMB Business Card.\n就每項以非港元進行的信用卡交易,所用外幣匯率已包括交易金\n額1.95%的手續費。外幣交易有關費用不適用於人民幣公司卡。\nNote: \"CR\" means Credit transaction / balance\n註:「CR」為入賬交易/結餘\n**** REWARDCASH SUMMARY FOR CARD NUMBER 5199 3100 0018 7511\nREWARDCASH EARNED\n277\n..\nREWARDCASH ADJUSTED\n0\n..\nHSBC\n滙豐\nThe Hongkong and Shanghai Banking Corporation Limited\n香港上海滙豐銀行有限公司\nSTATEMENT OF BUSINESS CARD ACCOUNT 公司卡戶口結單\nPage\n3/4\nCardholder's name 持卡人姓名\nAccount number 戶口號碼\nStatement date 結單日\nSEE-MING LEE\n5199 3100 0018 7511\n27 MAY 2023\nPost date\nTrans date\nDescription of transaction\nAmount\n( HKD)\n記賬日期\n交易日期\n交易說明\n金額\nREWARDCASH REDEEMED\n0\n..\nCONVERTED TO CASH REBATE\n277\n..\nSTATEMENT BALANCE\n結單結欠/結餘\n10,510.18\n**\nTRANSACTION SUMMARY\nCREDIT/PAYMENT\n68,281.60CR\n..\nPURCHASES AND INSTALMENTS\n69,235.47\n..\nCREDIT ADJUSTMENT\n277.00CR\n..\nTOTAL ACCOUNT BALANCE\n10,510.18\n..\nFEES AND CHARGES SUMMARY\nFEE/CHARGE TYPE\nAMOUNT\nTOTAL FEES/CHARGES ( EXCLUDING FINANCE CHARGE)\n0.00\n***** FINANCE CHARGE SUMMARY\nBALANCE TYPE\nANNUALISED PERCENTAGE RATE (APR)\nFINANCE CHARGE\nCASH ADVANCE\n35.61%\n0.00\nPURCHASE\n34.46%\n0.00\nTOTAL FINANCE CHARGE\n0.00\n*INFORMATION REGARDING MAKING MINIMUM PAYMENT\nThe below examples are for illustration only. You may visit our Bank\nwebsite at www.hsbc. com.hk for an online credit card repayment\ncalculator for customized information.\nIf you make no additional\nYou will pay off the\nand you will end up\ncharges, purchases and\noutstanding balance*\ncash advances on this card\npaying an estimated\nof HKD20, 000 in\ntotal of ...\nand each month you pay ...\nabout .. .\n|\n|\n|\nOnly Minimum Payment Due\n|\n26 years **\n|\nHKD67,536 ***\n|\n|\nHKD849\n|\n3 years **\n|\nHKD30,565 ***\n|\n( Savings=HKD36, 971 )\n* The outstanding balance of HKD20, 000 is accrued from purchase only.\n** Assume repayment is made on or before the payment due date of each\nstatement month.\n*** Include the outstanding balance of HKD20, 000 and the total finance\ncharge which is accrued daily and calculated at an interest rate of\n2.5% per month (equivalent to an annualised percentage rate of 34.46%\non purchase and 35.61% on cash advance) on the outstanding balance\nuntil it is fully paid.\nThe statement is for your reference only.\nPayment to be\narranged by your corporation.\nThe RewardCash earned by the company have been\ntransferred to your Business Card account.\nIf the statement balance for your credit card account\nHSBC\n滙豐\nThe Hongkong and Shanghai Banking Corporation Limited\n香港上海滙豐銀行有限公司\nSTATEMENT OF BUSINESS CARD ACCOUNT 公司卡戶口結單\nPage 4 / 4\nCardholder's name 持卡人姓名\nAccount number 戶口號碼\nStatement date 結單日\nSEE-MING LEE\n5199 3100 0018 7511\n27 MAY 2023\nPost date\nTrans date\nDescription of transaction\nAmount\n(HKD)\n記賬日期\n交易日期\n交易說明\n金額\nexceeds the credit limit on the statement date, an overlimit\nhandling fee will be debited to the account. If you wish to\nopt out of the over-the-limit facility, you may fill out\nthe form on the back of the statement. For enquiries,\nplease contact us on 2748 8288.\n若您的結單結欠超出該信用卡戶口截至結單日的信用限額,\n本行會徵收超出信用限額手續費。如您欲拒絕接受超出信用限額\n信貸安排,請填妥結單背頁之表格作出指示。如有任何\n查詢,請致電2748 8288。",
            "paragraphs": []
        },
        "created_at": "2024-01-12T21:40:59.682Z"
    },
    {
        "Currency": "JPY",
        "Items": [
            {
                "_source": "28JUL\n28JUL\nIFS PAYMENT - THANK YOU\n25,489.40CR",
                "Date": "1928-07-28T00:00:00.000Z"
            },
            {
                "_source": "29JUL\n29JUL\nA/C ANNUAL FEE\n550.00\n5199 3100 0018 7511\nSEE-MING LEE\nSML",
                "Category": "Other",
                "Date": "1929-07-29T00:00:00.000Z",
                "Description": "A/C ANNUAL FEE",
                "TotalPrice": 550
            },
            {
                "_source": "30JUN\n29JUN\nAPPLE. COM/BILL\nITUNES . COM\nIE\n30.00",
                "Date": "1930-06-29T00:00:00.000Z",
                "Description": "APPLE. COM/BILL",
                "TotalPrice": 30
            },
            {
                "_source": "30JUN\n29JUN\nADOBE CREATIVE CLOUD\nDublin\nIE\n408.00",
                "Description": "CREATIVE",
                "TotalPrice": 408
            },
            {
                "_source": "30JUN\n29JUN\nT-POST\nUMEA\nSE\nEUR\n5.00\n42.42\n*EXCHANGE RATE: 8.48400",
                "Date": "1930-06-29T00:00:00.000Z",
                "Description": "T-POST",
                "TotalPrice": 42.42
            },
            {
                "_source": "02JUL\n01JUL\nMAILGUN TECHNOLOGIES,\nSAN ANTONIO\nUS\nUSD\n2.94\n23.52\n*EXCHANGE RATE: 8.00000",
                "Category": "Credit",
                "Date": "2002-07-01T00:00:00.000Z",
                "Description": "MAILGUN TECHNOLOGIES,",
                "TotalPrice": 23.52
            },
            {
                "_source": "02JUL\n01JUL\nCLOUDFLARE\nSAN FRANCISCO\nUS\nUSD\n62.75\n502.10\n*EXCHANGE RATE: 8.00159\n02JUL\n01JUL\nAKAMAI TECHNOLOGIES, I\n6174443000\nUS\nUSD\n4,642.43\n37,147.33\n*EXCHANGE RATE: 8.00170",
                "Date": "02JUL",
                "Description": "CLOUDFLARE\nAKAMAI TECHNOLOGIES, I"
            },
            {
                "_source": "02JUL\n01JUL\nHKTV Shopping Net C Lt\nHong Kong\nHK\n799.00\nCRI: 65668640302369140",
                "Date": "2002-07-01T00:00:00.000Z",
                "Description": "HKTV Shopping Net C Lt\nHong Kong\nHK",
                "TotalPrice": 799
            },
            {
                "_source": "02JUL\n01JUL\nOPEN SOURCE COLLECTIVE\nWALNUT\nUS\nUSD\n5.00\n40.01\n*EXCHANGE RATE: 8.00200",
                "Category": "Meals",
                "Date": "2002-07-01T00:00:00.000Z",
                "Description": "OPEN SOURCE COLLECTIVE\nWALNUT",
                "TotalPrice": 40.01
            },
            {
                "_source": "02JUL\n01JUL\nPAYPAL *PATREON\nMEMBE\n4029357733\nUS\n16.35",
                "Category": "Meals",
                "Date": "02JUL",
                "Description": "PAYPAL *PATREON\nMEMBE",
                "TotalPrice": 16.35
            },
            {
                "_source": "02JUL\n30JUN\nDATYLON\nANTWERPEN\nBE\nUSD\n19.95\n159.63\n*EXCHANGE RATE: 8.00150",
                "Category": "Credit",
                "Date": "02JUL",
                "Description": "DATYLON",
                "TotalPrice": 159.63
            },
            {
                "_source": "04JUL\n03JUL\nNRI*NEW RELIC\n888-643-8776\nUS\nUSD\n236.00\n1,888.38\n*EXCHANGE RATE: 8.00161",
                "Category": "Credit",
                "Date": "04JUL",
                "Description": "NRI*NEW RELIC"
            },
            {
                "_source": "04JUL\n03JUL\nAPPLE. COM/BILL\nITUNES . COM\nIE\n8.00",
                "Category": "Credit",
                "Date": "2004-07-03T00:00:00.000Z",
                "Description": "APPLE. COM/BILL",
                "TotalPrice": 8
            },
            {
                "_source": "04JUL\n02JUL\nBROWSERSTACK. COM\nLEWES\nUS\nUSD\n19.00\n152.03\n*EXCHANGE RATE: 8.00158",
                "Description": "BROWSERSTACK. COM",
                "TotalPrice": 152.03
            },
            {
                "_source": "04JUL\n02JUL\nSTACK* ZEROSSL\nWIEN\nAT\nUSD\n10.00\n80.02\n*EXCHANGE RATE: 8.00200",
                "Description": "STACK* ZEROSSL",
                "Price": 10,
                "TotalPrice": 80.02
            },
            {
                "_source": "04JUL\n03JUL\nWEB*REGISTERWEBSITE\n800-8999723\nUS\nUSD\n14.00\n112.02\n*EXCHANGE RATE: 8.00143\n05JUL\n01JUL\nBLS*REDIS LABS14085242\nLONDON\nGB\nUSD\n248.00\n1,984.43\n*EXCHANGE RATE: 8.00173\n05JUL\n04JUL\nCITY SUPER LIMITED\nTSIM\nTSUI\nHK\n1,324.00",
                "Description": "WEB*REGISTERWEBSITE\nBLS*REDIS LABS14085242\nCITY SUPER LIMITED",
                "Price": 248,
                "TotalPrice": 112.02
            },
            {
                "_source": "05JUL\n04JUL\nAPPLE. COM/BILL\n85221120099\nIE\n803.00\n06JUL\n197.00",
                "Description": "APPLE. COM/BILL",
                "TotalPrice": 803
            },
            {
                "_source": "07JUL\n38.00",
                "TotalPrice": 38
            },
            {
                "_source": "11JUL\n10JUL\nROYALEAPI\nMA ON SHAN\nHK\nUSD\n1.00\n8.00\n* EXCHANGE RATE: 8.00000",
                "Description": "10JUL\nROYALEAPI",
                "Price": 1,
                "TotalPrice": 8
            },
            {
                "_source": "ITUNES. COM\nIE\n78.00",
                "TotalPrice": 78
            },
            {
                "_source": "11JUL\nAPPLE. COM/BILL",
                "Description": "APPLE. COM/BILL"
            },
            {
                "_source": "13JUL\n12JUL\nPAYPAL *TIDAL HIFI\n35314369001\nSE\n96.00",
                "Description": "*TIDAL HIFI",
                "ProductCode": "35314369001",
                "TotalPrice": 96
            },
            {
                "_source": "14JUL\n13JUL\nNYTimes *NYTimes\n800-698-4637\nUS\nUSD\n12.00\n96.05\n*EXCHANGE RATE: 8.00417",
                "Description": "NYTimes *NYTimes",
                "Price": 12,
                "TotalPrice": 96.05
            },
            {
                "_source": "15JUL\n14JUL\nCITY SUPER LIMITED\nTSIM SHA TSUI\nHK\n1,592.00",
                "Description": "CITY SUPER LIMITED\nTSIM SHA TSUI",
                "TotalPrice": 1592
            },
            {
                "_source": "16JUL\n15JUL\nAPPLE. COM/BILL\nITUNES. COM\nIE\n8.00",
                "Description": "ITUNES. COM",
                "TotalPrice": 8
            },
            {
                "_source": "16JUL\n15JUL\nPAYPAL *TWITCHINTER\n4029357733\nUS\n31.99",
                "Description": "15JUL\nPAYPAL *TWITCHINTER",
                "ProductCode": "4029357733",
                "TotalPrice": 31.99
            },
            {
                "_source": "18JUL\n17JUL\nIFTTT PRO (LEGACY)\nSAN FRANCISCO\nUS\nUSD\n1.99\n15.92\n*EXCHANGE RATE: 8.00000\n18JUL\n17JUL\nAPPLE. COM/BILL\nCOM\n38.00",
                "Description": "IFTTT PRO (LEGACY)\n17JUL\nAPPLE. COM/BILL",
                "TotalPrice": 15.92
            },
            {
                "_source": "18JUL\n17JUL\nPAYPAL *OUTPUT\n4029357733\nUS\n81.77",
                "Description": "PAYPAL *OUTPUT",
                "TotalPrice": 81.77
            },
            {
                "_source": "19JUL\n17JUL\nUniqlo Hong Kong Limit\nTsim Sha Tsui\nHK\n298.00",
                "Description": "Uniqlo Hong Kong Limit\nTsim Sha Tsui",
                "TotalPrice": 298
            },
            {
                "_source": "20JUL\n19JUL\nNetflix.com\nLos Gatos\nSG\n78.00\n22JUL\n20JUL\nUniqlo Hong Kong Limit\nTsim Sha Tsui\nHK\n298.00",
                "Description": "Netflix.com\nLos Gatos\nUniqlo Hong Kong Limit\nTsim Sha Tsui",
                "TotalPrice": 78
            },
            {
                "_source": "23JUL\n22JUL\nAPPLE. COM/BILL\nCORK\nIE\n36.00",
                "Description": "CORK",
                "TotalPrice": 36
            },
            {
                "_source": "23JUL\n21JUL\nPAYPAL *GITHUB INC\n4029357733\nUS\n73.59\n25JUL",
                "Description": "PAYPAL *GITHUB INC",
                "ProductCode": "4029357733",
                "TotalPrice": 73.59
            },
            {
                "_source": "25JUL\n23JUL\nCOM/BILL\n468.00",
                "Description": "COM/BILL",
                "TotalPrice": 468
            },
            {
                "_source": "25JUL\n24JUL\nPAYPAL *SIA WEBY\n35314369001\nLV\n98.04",
                "Description": "PAYPAL *SIA WEBY",
                "ProductCode": "35314369001",
                "TotalPrice": 98.04
            },
            {
                "_source": "25JUL\n23JUL\nPAYPAL *WAKATIME\n4029357733\nHK\n73.59",
                "Description": "23JUL\nPAYPAL *WAKATIME",
                "ProductCode": "4029357733",
                "TotalPrice": 73.59
            },
            {
                "_source": "25JUL\n22JUL\nPAYPAL *STEAM GAMES\n35314369001\nGB\n76.00",
                "Description": "PAYPAL *STEAM GAMES",
                "ProductCode": "35314369001",
                "TotalPrice": 76
            },
            {
                "_source": "26JUL\n25JUL\nT-POST\nUMEA\nSE\nEUR\n36.00\n295.48\n*EXCHANGE RATE: 8.20778",
                "Description": "25JUL\nT-POST",
                "TotalPrice": 295.48
            },
            {
                "_source": "25JUL\nAMZN Mktp",
                "Description": "AMZN Mktp"
            },
            {
                "_source": "27JUL\n25JUL\nPAYPAL *TWITCHINTER\n4029357733\nUS\n27JUL\nMktp\n27JUL\n26JUL\nAMZN Mktp US*F10Q54XG3\nAmzn. com/bill\nUS\n319.94",
                "Description": "PAYPAL *TWITCHINTER\nMktp\nAMZN Mktp US*F10Q54XG3",
                "TotalPrice": 319.94
            },
            {
                "_source": "27JUL\n26JUL\nPAYPAL *HAYU\n35314369001\nGB\n40.00\n28JUL\n27JUL\nPAYPAL *TWITCHINTER\n4029357733\nUS\n31.99",
                "Description": "PAYPAL *HAYU\nPAYPAL *TWITCHINTER",
                "ProductCode": "4029357733",
                "TotalPrice": 40
            }
        ],
        "MerchantAddress": {
            "_source": "PO BOX NO. 73730, KOWLOON CENTRAL",
            "poBox": "PO BOX NO. 73730",
            "city": "KOWLOON",
            "state": "CENTRAL",
            "streetAddress": "PO BOX NO. 73730"
        },
        "MerchantAliases": [
            "HSBC.",
            "The Hongkong and Shanghai Banking Corporation Limited",
            "HSBC\n滙豐"
        ],
        "MerchantName": "香港上海滙豐銀行有限公司",
        "MerchantPhoneNumber": "+88685227488288",
        "Total": 693,
        "TaxDetails": [
            {
                "_source": "26JUL"
            }
        ],
        "Tip": 503.85,
        "TransactionDate": "2022-07-29T00:00:00.000Z",
        "__raw__": {
            "content": "HSBC\n滙豐\nThe Hongkong and Shanghai Banking Corporation Limited\n香港上海滙豐銀行有限公司\nSTATEMENT OF BUSINESS CARD ACCOUNT 公司卡戶口結單\nPage\n1/4\nMR LEE SEE MING\nM\nAccount number 戶口號碼\nC/O SML UNIVERSE LIMITED\n00979\n5199 3100 0018 7511\nFLAT F 27/F BLK 10 VISTA PARADISO\nCard type 信用卡類別\nCredit limit 信用限額\n2 HANG MING ST\nPlatinum Business MC\nHKD75,000.00\nNEW TERRITORIES\nStatement date 結單日\nStatement balance 結單結欠/結餘\n29 JUL 2022\nHKD14,821.60\nPost date\nTrans date\nDescription of transaction\nAmount\n( HKD)\n記賬日期\n交易日期\n交易說明\n金額\nPREVIOUS BALANCE\n上月結欠/結餘\n22,248.42\n30JUN\n30JUN\nIFS PAYMENT - THANK YOU\n22,248.42CR\n05JUL\n05JUL\nIFS PAYMENT - THANK YOU\n43,174.13CR\n28JUL\n28JUL\nIFS PAYMENT - THANK YOU\n25,489.40CR\n29JUL\n29JUL\nA/C ANNUAL FEE\n550.00\n5199 3100 0018 7511\nSEE-MING LEE\nSML UNIVERSE LTD\n30JUN\n29JUN\nAPPLE. COM/BILL\nITUNES . COM\nIE\n30.00\n30JUN\n29JUN\nADOBE CREATIVE CLOUD\nDublin\nIE\n408.00\n30JUN\n29JUN\nT-POST\nUMEA\nSE\nEUR\n5.00\n42.42\n*EXCHANGE RATE: 8.48400\n02JUL\n01JUL\nMAILGUN TECHNOLOGIES,\nSAN ANTONIO\nUS\nUSD\n2.94\n23.52\n*EXCHANGE RATE: 8.00000\n02JUL\n01JUL\nCLOUDFLARE\nSAN FRANCISCO\nUS\nUSD\n62.75\n502.10\n*EXCHANGE RATE: 8.00159\n02JUL\n01JUL\nAKAMAI TECHNOLOGIES, I\n6174443000\nUS\nUSD\n4,642.43\n37,147.33\n*EXCHANGE RATE: 8.00170\n02JUL\n01JUL\nHKTV Shopping Net C Lt\nHong Kong\nHK\n799.00\nCRI: 65668640302369140\n02JUL\n01JUL\nOPEN SOURCE COLLECTIVE\nWALNUT\nUS\nUSD\n5.00\n40.01\n*EXCHANGE RATE: 8.00200\n02JUL\n01JUL\nPAYPAL *PATREON\nMEMBE\n4029357733\nUS\n16.35\n02JUL\n30JUN\nDATYLON\nANTWERPEN\nBE\nUSD\n19.95\n159.63\n*EXCHANGE RATE: 8.00150\n04JUL\n03JUL\nNRI*NEW RELIC\n888-643-8776\nUS\nUSD\n236.00\n1,888.38\n*EXCHANGE RATE: 8.00161\n04JUL\n03JUL\nAPPLE. COM/BILL\nITUNES . COM\nIE\n8.00\nFor important information such as payment methods, fees and charges, lost\nMinimum payment summary 最低付款摘要\nHKD\ncard reporting, and change of correspondence address / telephone number,\nplease visit www.hsbc.com.hk or call our Customer Service Hotline on\nCurrent minimum payment due 目前最低付款額\n693.00\n(852) 2748 8288.\nPlease pay by 須於此付款到期日或之前繳交\n26 AUG 2022\n有關您戶口的重要資料包括付款方式,利息與收費,報失信用卡,以及更改\nOverdue / overlimit due now\n通訊地址/電話號碼,請瀏覽網址www.hsbc.com.hk或聯絡我們的客戶服務熱\n須立即繳交的過期款項/超額款項\n0.00\n線(852) 2748 8288°\nTotal minimum payment due\n最低付款總額\n693.00\nHSBC\n滙豐\nPayment Slip 付款存根\nAccount number 戶口號碼\nCard type 信用卡類別\nIf you are paying by mail, please detach this payment slip and return it with a\n5199 3100 0018 7511\nPlatinum Business MC\ncrossed cheque made payable to \"The Hongkong and Shanghai Banking\nCorporation Limited\" or \"HSBC\" at least three working days before the\nStatement date 結單日\nStatement balance 結單結欠/結餘\npayment due date to our Centre, PO BOX NO. 73730, KOWLOON CENTRAL\n29 JUL 2022\nHKD14,821.60\nPOST OFFICE HK. Please write your account number on the back of the\nCheque number 支票號碼\nAmount enclosed\n夾附金額\n如欲以郵寄方式付款,請撕下此付款存根,於付款到期日三個工作天前,連同以\ncheque.\n「香港上海滙豐銀行有限公司」或「滙豐」為抬頭的劃線支票,寄回 PO BOX\nNO. 73730, KOWLOON CENTRAL POST OFFICE HK. 信用卡中心收,請於支\n票背面寫上您的戶口號碼。\nThank you for choosing HSBC.多謝選用滙豐服務。\nHSBC\n滙豐\nThe Hongkong and Shanghai Banking Corporation Limited\n香港上海滙豐銀行有限公司\nSTATEMENT OF BUSINESS CARD ACCOUNT 公司卡戶口結單\nPage\n2/4\nCardholder's name 持卡人姓名\nAccount number\n1號碼\nStatement date 結單日\nSEE-MING LEE\n5199 3100 0018 7511\n29 JUL 2022\nPost date\nTrans date\nDescription of transaction\nAmount\n(HKD)\n記賬日期\n交易日期\n交易說明\n金額\n04JUL\n02JUL\nBROWSERSTACK. COM\nLEWES\nUS\nUSD\n19.00\n152.03\n*EXCHANGE RATE: 8.00158\n04JUL\n02JUL\nSTACK* ZEROSSL\nWIEN\nAT\nUSD\n10.00\n80.02\n*EXCHANGE RATE: 8.00200\n04JUL\n03JUL\nAmazon web services\naws . amazon. co\nUS\nUSD\n220.62\n1,765.32\n* EXCHANGE RATE: 8.00163\n04JUL\n03JUL\nWEB*REGISTERWEBSITE\n800-8999723\nUS\nUSD\n14.00\n112.02\n*EXCHANGE RATE: 8.00143\n05JUL\n01JUL\nBLS*REDIS LABS14085242\nLONDON\nGB\nUSD\n248.00\n1,984.43\n*EXCHANGE RATE: 8.00173\n05JUL\n04JUL\nCITY SUPER LIMITED\nTSIM SHA TSUI\nHK\n1,324.00\n05JUL\n04JUL\nAPPLE. COM/BILL\n85221120099\nIE\n803.00\n06JUL\n05JUL\nHUTCHISON TELECOM 3CC\nHONG KONG\nHK\n197.00\n07JUL\n06JUL\nAPPLE. COM/BILL\nITUNES . COM\nIE\n38.00\n08JUL\n07JUL\nPAYPAL *OREILLYMEDI\n4029357733\nUS\n318.81\n11JUL\n10JUL\nROYALEAPI\nMA ON SHAN\nHK\nUSD\n1.00\n8.00\n* EXCHANGE RATE: 8.00000\n12JUL\n11JUL\nSINO STATE HONG KONG L\nMONGKOK\nHK\n6,420.00\n12JUL\n11JUL\nAPPLE. COM/BILL\nITUNES. COM\nIE\n78.00\n13JUL\n12JUL\nPAYPAL *TIDAL HIFI\n35314369001\nSE\n96.00\n14JUL\n13JUL\nNYTimes *NYTimes\n800-698-4637\nUS\nUSD\n12.00\n96.05\n*EXCHANGE RATE: 8.00417\n15JUL\n14JUL\nCITY SUPER LIMITED\nTSIM SHA TSUI\nHK\n1,592.00\n16JUL\n15JUL\nAPPLE. COM/BILL\nITUNES. COM\nIE\n8.00\n16JUL\n15JUL\nPAYPAL *TWITCHINTER\n4029357733\nUS\n31.99\n18JUL\n16JUL\nAMZN Mktp US*8L5BM1Y03\nAmzn. com/bill\nUS\n622.99\n18JUL\n17JUL\nIFTTT PRO (LEGACY)\nSAN FRANCISCO\nUS\nUSD\n1.99\n15.92\n*EXCHANGE RATE: 8.00000\n18JUL\n17JUL\nAPPLE. COM/BILL\nITUNES . COM\nIE\n38.00\n18JUL\n17JUL\nPAYPAL *OUTPUT\n4029357733\nUS\n81.77\n19JUL\n17JUL\nUniqlo Hong Kong Limit\nTsim Sha Tsui\nHK\n298.00\n20JUL\n19JUL\nNetflix.com\nLos Gatos\nSG\n78.00\n22JUL\n20JUL\nUniqlo Hong Kong Limit\nTsim Sha Tsui\nHK\n298.00\n23JUL\n22JUL\nAPPLE. COM/BILL\nCORK\nIE\n36.00\n23JUL\n21JUL\nPAYPAL *GITHUB INC\n4029357733\nUS\n73.59\n25JUL\n24JUL\nAMZN Mktp US*X73VF3ZO3\nAmzn. com/bill\nUS\n480.03\n25JUL\n24JUL\nCOURTYARD BY MARRIOTT\nNT\nHK\n6,930.00\n25JUL\n23JUL\nAPPLE. COM/BILL\nCORK\nIE\n468.00\n25JUL\n24JUL\nPAYPAL *SIA WEBY\n35314369001\nLV\n98.04\n25JUL\n23JUL\nPAYPAL *WAKATIME\n4029357733\nHK\n73.59\n25JUL\n22JUL\nPAYPAL *STEAM GAMES\n35314369001\nGB\n76.00\n26JUL\n25JUL\nT-POST\nUMEA\nSE\nEUR\n36.00\n295.48\n*EXCHANGE RATE: 8.20778\n26JUL\n25JUL\nAMZN Mktp US*LS15137S3\nAmzn. com/bill\nUS\n399.63\n27JUL\n25JUL\nPAYPAL *TWITCHINTER\n4029357733\nUS\n503.85\n27JUL\n26JUL\nAMZN Mktp US*1G8ZD1MH2\nAmzn. com/bill\nUS\n1,267.29\n27JUL\n26JUL\nAMZN Mktp US*F10Q54XG3\nAmzn. com/bill\nUS\n319.94\n27JUL\n26JUL\nPAYPAL *HAYU\n35314369001\nGB\n40.00\n28JUL\n27JUL\nPAYPAL *TWITCHINTER\n4029357733\nUS\n31.99\n29JUL\n28JUL\nLUFTHAN2201879665002\nVANTAA\nFI\nEUR\n880.00\n7,164.19\n*EXCHANGE RATE: 8.14113\n29JUL\n28JUL\nLUFTHAN2201879665001\nVANTAA\nFI\nEUR\n910.00\n7,408.42\n*EXCHANGE RATE: 8.14112\n29JUL\n29JUL\nCREDIT REWARD CASH REBATE\n333.00CR\n*For credit card transactions effected in currencies other\nthan Hong Kong dollars, the exchange rate applied includes a\nhandling fee equivalent to 1.95% of each transaction. The\nfee relating to foreign currency transaction is not\napplicable to RMB Business Card.\n就每項以非港元進行的信用卡交易,所用外幣匯率已包括交易金\n額1.95%的手續費。外幣交易有關費用不適用於人民幣公司卡。\nHSBC\n滙豐\nThe Hongkong and Shanghai Banking Corporation Limited\n香港上海滙豐銀行有限公司\nSTATEMENT OF BUSINESS CARD ACCOUNT 公司卡戶口結單\nPage 3 / 4\nCardholder's name 持卡人姓名\nAccount number 戶口號碼\nStatement date 結單日\nSEE-MING LEE\n5199 3100 0018 7511\n29 JUL 2022\nPost date\nTrans date\nDescription of transaction\nAmount\n( HKD)\n記賬日期\n交易日期\n交易說明\n金額\nNote: \"CR\" means Credit transaction / balance\n註:「CR」為入賬交易/結餘\n**** REWARDCASH SUMMARY FOR CARD NUMBER 5199 3100 0018 7511\nREWARDCASH EARNED\n333\n..\nREWARDCASH ADJUSTED\n0\n..\nREWARDCASH REDEEMED\n0\n..\nCONVERTED TO CASH REBATE\n:\n333\nSTATEMENT BALANCE\n結單結欠/結餘\n14,821.60\nTRANSACTION SUMMARY\nCREDIT/PAYMENT\n90,911.95CR\n..\nPURCHASES AND INSTALMENTS\n83,268.13\n..\nALL FEES AND CHARGES\n550.00\n..\nCREDIT ADJUSTMENT\n333.00CR\n..\nTOTAL ACCOUNT BALANCE\n:\n14,821.60\nFEES AND CHARGES SUMMARY\nFEE/CHARGE TYPE\nAMOUNT\nANNUAL FEE\n550.00\nTOTAL FEES/CHARGES ( EXCLUDING FINANCE CHARGE)\n550.00\n* * * **\nFINANCE CHARGE SUMMARY\nBALANCE TYPE\nANNUALISED PERCENTAGE RATE (APR)\nFINANCE CHARGE\nCASH ADVANCE\n35.61%\n0.00\nPURCHASE\n34.46%\n0.00\nTOTAL FINANCE CHARGE\n0.00\n**\n*INFORMATION REGARDING MAKING MINIMUM PAYMENT*\nThe below examples are for illustration only. You may visit our Bank\nwebsite at www.hsbc. com.hk for an online credit card repayment\ncalculator for customized information.\nIf you make no additional\nYou will pay off the\nand you will end up\ncharges, purchases and\noutstanding balance*\npaying an estimated\ncash advances on this card\nof HKD20, 000 in\ntotal of ...\nand each month you pay ...\nabout .. .\n|\nOnly Minimum Payment Due\n|\n|\n|\n26 years **\n|\nHKD67,536 ***\n|\n|\nHKD849\n|\n3 years **\n|\nHKD30,565 ***\n|\n( Savings=HKD36, 971)\n* The outstanding balance of HKD20, 000 is accrued from purchase only.\n** Assume repayment is made on or before the payment due date of each\nstatement month.\n*** Include the outstanding balance of HKD20, 000 and the total finance\ncharge which is accrued daily and calculated at an interest rate of\n2.5% per month (equivalent to an annualised percentage rate of 34.46%\non purchase and 35.61% on cash advance) on the outstanding balance\nuntil it is fully paid.\nThe statement is for your reference only. Payment to be\narranged by your corporation.\nThe RewardCash earned by the company have been\nHSBC\n滙豐\nThe Hongkong and Shanghai Banking Corporation Limited\n香港上海滙豐銀行有限公司\nSTATEMENT OF BUSINESS CARD ACCOUNT 公司卡戶口結單\nPage 4 / 4\nCardholder's name 持卡人姓名\nAccount number 戶口號碼\nStatement date 結單日\nSEE-MING LEE\n5199 3100 0018 7511\n29 JUL 2022\nPost date\nTrans date\nDescription of transaction\nAmount\n( HKD)\n記賬日期\n交易日期\n交易說明\n金額\ntransferred to your Business Card account.\nIf the statement balance for your credit card account\nexceeds the credit limit on the statement date, an overlimit\nhandling fee will be debited to the account. If you wish to\nopt out of the over-the-limit facility, you may fill out\nthe form on the back of the statement. For enquiries,\nplease contact us on 2748 8288.\n若您的結單結欠超出該信用卡戶口截至結單日的信用限額,\n本行會徵收超出信用限額手續費。如您欲拒絕接受超出信用限額\n信貸安排,請填妥結單背頁之表格作出指示。如有任何\n查詢,請致電2748 8288。",
            "paragraphs": []
        },
        "created_at": "2024-01-12T21:40:59.710Z"
    }
]